+	+	plus sign
=	=	equal to
 °ซ  °ฟ 	° c ° f	เซลเซียส ฟาเรนไฮต์
 ซม	cm	cm.
 −°ซ  °ฟ	- ° c ° f	thai letters
×	×	letter x
γ	γ	y
π	π	pi
กกกก	kg	a thai letter repeated 4 times
กกกข	khor khor	4 thai alphabets - jibberish
กขขข	abc b	4 of thai letters
กขขขขขขข	a b a b b b a	abbbbbbb
กฎ	szabály	law, rule
กฎของโคไซน์	koszinó törvény	law of cosines
กฎแห่งกรรม	karma	bad karma
กติกา	szabályok	rule
กทม	bangkok	agency
กนู	lovag	gnu - computer related acronym
กบ	béka	frog
กบฏทหารนอกราชการ	katonai felkelés	coup de lat
กมล	liliom	kamon
กมลรัตน์	kamonrat	kamolrat - a surname
กรณีที่	az ügy	case
กรมขุนอิศเรศรังสรรค์	krom khun iset rangsan	the convention of angels
กรมขุนเพ็ชรบูรณ์อินทราชัย	kromkhunpetchaboon-indachai	department of....
กรมข่าวทหารอากาศ	a légierő hírek osztálya	communication department of the thai air force
กรมควบคุมโรค	betegségkezelő osztály	department of disease control
กรมทหารราบที่	gyalogezred	infantry regiment
กรมรบพิเศษที่	különleges erők osztálya	special force group
กรมศิลปากร	képzőművészeti osztály	fine arts department
กรมหลวงนราธิวาสราชนครินทร์	krom luang narathiwatratchanakharin	krom ma loung naratifatrachanakarin - the name of a royal family member
กรมหลวงสงขลานครินทร์	krom luang songkhla nakarin	prince of songkla
กรมอุตุนิยมวิทยา	meteorológiai osztály	the meteorology department
กรรชัย	kanchai	kanchai
กรอง	szűrő	screen
กระดูกค้อน	kalapács csont	malleus, hammer bone
กระดูกต้นแขน	felkarcsont	humerus
กระดูกฝ่ามือ	palms	metacapus
กระดูกสะบัก	lapocka	scapula
กระดูกสะบ้า	térdkalács	kneecap
กระทรวงกลาโหม	védelmi minisztérium	defense ministry
กระทรวงการคลัง	pénzügyminisztérium	ministry of finance
กระทรวงการต่างประเทศ	külügyminisztérium	ministry of foreign affairs
กระทรวงวัฒนธรรม	kulturális minisztérium	ministry of culture
กระทรวงศึกษาธิการ	oktatási minisztérium	ministry of education
กระทรวงสาธารณสุข	közegészségügyi minisztérium	ministry of public health
กระทรวงอุตสาหกรรม	ipari minisztérium	ministry of industry
กระทรวงเกษตรและสหกรณ์	mezőgazdasági és szövetkezeti minisztérium	ministry of agriculture and cooperatives
กระทรวงเศรษฐการ	gazdasági minisztérium	ministry of commerce
กระทุ่มแบน	kis kosár	krathum baen district, samut songkram province
กระนวน	hangmagasság	granuan - location in knon kan province
กระนั้น	ennek ellenére	however
กระบวนการสร้าง	építési folyamat	anabolism
กระบวนการสร้างและสลาย	a létrehozás és a szétesés folyamata	metabolism
กระบอง	blackjack	club
กระบะทราย	homokozó	litter box or sand box
กระบี่กระบอง	verseny kardokkal	krabi krabong (swordplay)
กระรอก	mókus	squirrel
กระวนกระวาย	aggódó	nervous
กระหม่อม	fej	fontanelle
กระเพาะอาหาร	gyomor	stomach
กระแต	észak-amerikai mókus	wasp
กรับ	felvenni	wooden rhythm clappers
กรับพวง	válassz egy csomót	krap phuang
กรับเสภา	krapao	wooden rhythm clappers
กรัม	gramm	gram
กรัยวิเชียร	kraiwichian	krivician - a surname
กรานาดา	granada	granada
กริม	grimm	grim
กรี	szürke	karee
กรุง	főváros	city
กรุงธนบุรี	thon buri	thonburi city
กรุงลอนดอน	london	london
กรุงศรีอยุธยา	ayutthaya	sri ayuttaya city - former capital of thailand
กรุงเทพ	bangkok	bangkok
กรุงเทพเชียงใหม่กรุงเทพ	bangkok, chiang mai, bangkok	bangkok changmai bangkok
กรุงเทพโพลล์	bangkok poll	bangkok poll
กรุ๊ป	csoport	group
กลอง	dob	drum
กลองมโหระทึก	nagy dob	big drum
กลองยาว	dob	tom-tom
กลองสองหน้า	két arcú dob	glong songna
กลอน	vers	poem
กลอบูลิน	fényes	globulin
กลาง	középső	in the middle
กลิ่น	szag	odor
กลุ่มดาวกล้องจุลทรรศน์	mikroszkópok csillagképei	microscopium
กลุ่มดาวนกทูแคน	tukánmadár	tucana
กลุ่มดาวสิ่ว	véső	siu star
กลุ่มดาวเข็มทิศ	csillagkép iránytű	pyxis constellation
กลุ่มดาวเตาหลอม	nagyolvasztó kemence	fornax
กลุ่มดาวแมงป่อง	skorpió	scorpion constellation
กลุ่มดาวแมลงวัน	legyek	musca
กลุ่มที่	a csoport	group
กลุ่มแสงอุษา	usa könnyű csoport	light at dawn
กลูคากอน	glucon	glucagon
กล่าวคือ	vagyis	that is
กล้วยไม้ดาว	csillag orchidea	type of orchid that have slim petal like star
กล้องถ่ายภาพ	kamera	camera
กล้ามเนื้อ	izom	muscle
กวม	guam	obscure
กวาง	szarvas	deer
กวิน	kawin	gwen - a name
กวี	költő	poet
กว่า	mint	than
กองกลาง	középpályás	headquarter
กองการบินทหารเรือ	tengeri repülési osztály	the flying section of the navy
กองการศึกษา	oktatási osztály	education group
กองการเจ้าหน้าที่	személyzeti osztály	division of personnel
กองกำลังกึ่งทหาร	félkatonai erők	armforces
กองคลัง	pénzügyi részleg	division of finance
กองทัพ	a hadsereg	arm forces
กองทัพบกไทย	thai hadsereg	thai army
กองทัพภาคที่	a régió hadserege	army area
กองทัพเรือ	haditengerészet	navy
กองทัพเรือไทย	thai haditengerészet	the royal thai navy
กองทัพแห่งความชอบธรรม	az igazság hadserege	army of the righteous
กองทัพไทย	thai hadsereg	thai military forces
กองบิน	légierő	air force
กองบินปีกหมุนที่	wing spinning wing	flight corp number __________
กองพลทหารม้าที่	a lovasság brigádja	cavalry division
กองพันทหารช่างที่	a mérnök brigád	troop unit number ___________`
กอด	ölelés	kord
กอนซาเลซ	gonzalez	gonzales - a name
กอร์ดอน	gordon	gordon
กอลมเบต์	göreme	glombet - a catholic priest
กอล์ฟ	golf	golf
กอล์ฟไมค์	golf mikrofon	golf-mike
กะเหรี่ยง	karen	karen
กะโหลก	koponya	skull
กะโหลกศีรษะ	koponya	skull; cranium
กังหันชัยพัฒนา	chaipattana turbina	chaipattana's windmill
กันดั้ม	gundam	gundam - a cartoon
กันตัง	kantang	kuntun in trung state
กันทรลักษ์	kantharalak	kuntaraluk - an area in thailand
กันฟอร์ม	forma	gun form
กันอริ	kanori	gan-ari
กันเอง	barátságosan	casual
กับนางสุจาริณี	mrs. sucharinee-vel	with mrs. sujarinee
กัมปูเชีย	campucia	kampuchea
กัมพูชา	kambodzsa	cambodia
กัมพูชาประชาธิปไตย	demokratikus kambodzsa	democratic kampuchea
กัมพูชาเป็นประเทศที่มีป่าไม้อุดมสมบูรณ์มากที่สุดหากเปรียบเทียบกับประเทศเพื่อนบ้าน	kambodzsa az az ország, ahol a legszélesebb erdők vannak a szomszédos országokkal összehasonlítva.	cambodia is the country with nice, healthy forests
กัมพูชาเป็นอดีตประเทศอาณานิคมของฝรั่งเศสในภูมิภาคเอเชียตะวันออกเฉียงใต้เพียงแค่ประเทศเดียวเท่านั้นที่มีการปกครองด้วยระบอบราชาธิปไตยภายใต้รัฐธรรมนูญ	kambodzsa az egyetlen volt francia gyarmati ország délkelet-ázsiában, amely az alkotmány értelmében monarchia.	cambodia was a former french colony
กัมพูชาเป็นอาณานิคมของฝรั่งเศสมาตั้งแต่พศ	kambodzsa azóta francia kolónia.	cambodia was a france colony from year
กัวเตมาลา	guatemala	guatemala
กานซู	gansu	honshu in china
กานต์	kan	kan
กานา	ghána	ghana
กานามัยซิน	kanamicint	kanamycin
กาบอง	gabon	baton
กาพย์ฉบัง	epikus vers	poem
กาพย์สุรางคนางค์	vers	gabsuranknang
กาม	buja	lust
กาย	test	body
การ	a	project
การกีฬา	sport	sport
การขัดเกลาทางสังคม	szocializálás	socialization
การขับถ่าย	kiválasztás	excretion
การขับไล่	kiutasítás	discharge
การคมนาคม	szállítás	transportation department
การคลัง	pénzügy	public finance
การค้นพบ	a felfedezés	discover
การค้า	a kereskedelem	marketing
การจัดการ	a vezetőség	project
การจัดการคุณภาพ	minőség ellenőrzés	quality control
การจัดอันดับ	rangsor	ranking
การจัดให้มี	ellátás	putting together something
การจูบ	egy csók	kissing
การชัก	elkobzás	the act of pulling the flag wiht string up the pole
การดำเนินการ	egy művelet	progression
การตอบรับ	visszacsatolás	welcoming
การตั้งถิ่นฐาน	település	start a project
การต่างประเทศ	külügyek	foreign affairs
การทำงานของ	munkája	function
การทำป่าไม้	erdészet	forestry
การท่องเที่ยว	idegenforgalom	tourism
การท่าเรือ	kikötői hatóság	port authority
การบริการ	szolgáltatás	customer service
การบริหารการพัฒนา	fejlesztési menedzsment	development
การบริหารการศึกษา	oktatási adminisztráció	educational administration
การบริหารจัดการ	vezetés	management
การบริหารราชการแผ่นดิน	kormányhivatal	administration
การบินไทย	thai airways	thai airways
การปกครองท้องถิ่น	önkormányzat	local administration
การปกครองส่วนท้องถิ่น	önkormányzat	local government
การปกครองแบ่งออกเป็น	a szabály fel van osztva	administration
การปฏิรูประบบจัดเก็บภาษีเงินได้	a jövedelemadó-beszedési rendszer reformja	taxation reform
การปฏิรูปศาสนา	megújulás	religious reformation
การปฏิวัติฝรั่งเศส	francia forradalom	french revolution
การปฏิวัติอุตสาหกรรม	ipari forradalom	industrial revolution
การปฏิสนธิ	termékenyítés	fertilisation
การประมง	halászat	fishery
การพัฒนา	a fejlesztés	development
การพัฒนาประชาธิปไตย	demokratikus fejlődés	democratic development
การพูด	beszélő	speaking
การยึดครองมะละกาของโปรตุเกสในปี	melaka portugál megszállása abban az évben	portugal took over malaga
การระบาดของไข้หวัดใหญ่สายพันธุ์ใหม่	az influenza új törzse	flu pandemic
การรักษาพยาบาล	orvosi kezelés	nursing care
การร่วมเพศทางทวารหนัก	anális kibaszott	sodomy
การลดรูป	deformáló	reduction
การละเล่นพื้นบ้าน	népi játékok	local game
การวิจัย	kutatás	researching
การวิเคราะห์	az elemzés	analysis
การศึกษา	az oktatás	study of, education
การสังคายนาครั้งที่	az utolsó rend	the event of convention of monks
การสั่นพ้อง	resonance	resonance
การสำเร็จความใคร่ด้วยตนเอง	maszturbáció	masturbation
การสืบพันธุ์	reprodukció	reproduction
การสื่อสาร	közlés	communications
การาจ	garázs	garage
การุณ	karun	karoon
การเต้นรำ	a tánc	dance
การเพิ่มสิทธิประโยชน์แก่นักลงทุนต่างประเทศ	növekvő kiváltságok a külföldi befektetők számára	increase benefits for foreign investors
การเล่น	játszani	play
การแข่งขัน	a verseny	competition
การแบ่งพื้นที่	feloszt	land division
การใช้คำ	szóhasználat	terminology
การไฟฟ้าส่วนภูมิภาค	tartományi villamossági hatóság	distribution electric transformer
การไหว้	tisztelet	thai greeting
การ์ด	kártya	guard
กาฬสินธุ์	kalasin	katsin - a thai surname
กาเวน	gawain	gawain
กาเหว่าที่บางเพลง	néhány dal hollója	the cuckoo's song.
กำกับการแสดงโดย	rendezte	produced by (movie)
กำกับโดยอภิชาติพงศ์	rendező: aphichat pong	produced by apichartpong - a famous thai movie producer
กำมะถัน	kénkő	sulfur
กำลังจะปรับเปลี่ยนเป็น	megy átváltani	is changing to
กำหนดตามสภาพภูมิศาสตร์	a földrajz határozza meg	geography estimation
กำแพงเพชร	kamphaeng phet	kamphaeng phet
กำแพงเมืองจีน	a nagy fal	the great wall of china
กำแพงแสน	kamphaengsaen	kampangsaen (name of district)
กิจผลิต	termelés	kitpalit (last name)
กิมป์	gimb	gimp - gnu image manipulation program
กิโลกรัม	kg	kilogram
กิโลไบต์	kb	kilobyte
กิ่งแก้ว	kingkaew	kingkaeo
กิ้งกือ	százlábú	millipedes
กิ๊ก	kik	gig
กีฏวิทยา	rovartan	entomology
กีฬา	sport	sports
กีฬาทางน้ำ	vízi sportok	water sports
กีฬาแหลมทอง	laem thong sport	seap games
กุดจับ	öntőforma	good jub - a place
กุลดิลก	kuldilok	kuldilok
กุลละวณิชย์	kulalawanit	kullawanich
กุหลาบ	rózsa	kularb (first name)
กุ้ง	garnélarák	shrimp
กุ้งต้ม	főtt garnélarák	boiled shrimp
กูเกิล	google	google
ก็คือ	van	which is
ก็ใช้เป็น	használva, mint	utilize
ก่อตั้ง	alapított	founded
ก่อตั้งโดย	által alapított	make by
ก่อนที่	előtt	before
ก่อนที่จะตกเป็นของฝรั่งเศสในเวลาต่อมา	mielőtt később franciaország lett	belonging to france, under the control of france
ก่อนหน้านั้น	azelőtt	before
ก้อย	rózsaszínű	koi
ก้าน	szár	thorn
ก้านกล้วย	banán szár	kankluai
ก๊าซธรรมชาติ	földgáz	natural gas
ก๎ล	ajándék	magic
ขขขขขขขขขข	b b b b b b b	repeated letter from thai alphabet
ขณะทรงพระเยาว์	amíg fiatal volt	having to do with the young prince or princess
ขณะที่	míg	while
ขนม	cukorka	dessert
ขนมกล้วย	banán	banana dessert
ขนมครก	knmcrk	kind of thai sweetmeat
ขนมปัง	kenyér	bread
ขนมปังขิง	mézeskalács	gingerbread
ขนมเปียกปูน	rombusz	a type of thai dessert with flour and sugar
ขนมไทย	thai desszert	thai dessert
ขนสัตว์	gyapjú	fur, animal hair
ขนอม	khanom	kanom - location in thailand
ขนาดหน้าตัก	lapméret	length between both knees of buddha statue in posture of meditation
ขนาดใหญ่	nagy méret	l
ขบวนการอ๊บอ๊บป่วนโลก	a föld mozgása	original name is keroro gunso
ขบวนรถสินค้า	vonat	caravan of trucks
ขม	keserű	bitter taste
ขรรค์ชัย	khan chai	kanchai - a male's name
ขลุ่ยหลิบ	fuvola	khlui lib
ขวด	üveg	bottle
ขวัญ	hangulat	morale
ขวัญใจช่างภาพ	szeretett fotós	miss photogenic
ขสมก	tömeg	an acronym consists of four thai letters
ของ	nak,-nek	of
ของทุกปี	minden évben	every year
ของประเทศจีน	kínából	owned by china
ของมหาวิทยาลัย	az egyetemen	of university
ของมัน	a	their
ของร่างกาย	a testből	of the body
ของสมเด็จฮุน	somdej hun	houssaine of cambodia
ของสิ่งมีชีวิต	az élő dolgokból	living things
ของสุนทรภู่	a sunthorn phu-tól	belong to soon thong pu (a thai legend)
ของเหลว	folyékony	liquid
ของโลก	a világból	of world
ขอนแก่น	khon kaen	khon kan - an area in thailand
ขอบคุณที่รักกัน	köszönöm, hogy szeretsz	thank you for loving each other
ขอเช็ดน้ำตา	töröljük le a könnyeket	wipe the tears
ขอให้เด็กสมัยปฏิวัติของข้าพเจ้า	május forradalmi gyermekeim	i hope that the children in my lifetime will ____________
ขั้นที่	lépés	level
ขา	láb	leg
ขาย	elad	sell
ขิง	gyömbér	ginger
ขิม	cimbalom	kim - a thai musical instrument
ขีดเส้นใต้	aláhúzás	underline
ขี้ผึ้ง	viasz	wax
ขึ้นเป็น	legfeljebb	to
ขึ้นไป	fel	next one up
ขุขันธิน	khan tin	kukuntin
ขุนหาญ	han	koonhan - a location in thailand
ข้อมูลทั่วไป	általános információ	general information
ข้อมูลประเทศเดนมาร์ก	dánia információ	information on denmark
ข้อมูลปรากฏการณ์โลกร้อน	globális felmelegedés jelenség	global climate change
ข้อมูลปี	év adatai	information from the year ________
ข้อมูลอื่นๆ	egyéb információk	other information
ข้อมูลโดย	adatok:	information from
ข้อวิพากษ์วิจารณ์	kritika	critique reports
ข้ามฉาก	a színpadon	sin(a)
ข้าวสาลี	búza	wheat
ข้าวหลาม	khao lam	bamboo rice
ข้าวเกรียบปากหม้อ	rizs sós keksz	a thai snack
ข้าวเจ้า	hántolatlan rizs	white rice
ข้าวโพด	kukorica	corn
ข้าหลวงกำกับราชการเมืองขุขันธ์คนที่	khukhan város kormányzója, kormányzója	government worker for ku khan city
ฃ	ฃ	a letter from thai alphabet
คงยิ่ง	nagyon valószínű	kongying
คงเจริญ	valószínűleg prosper	khongcharoen
คณะครุศาสตร์	pedagógiai kar	education department
คณะครุศาสตร์อุตสาหกรรม	ipari oktatás kar	faculty of industrial education
คณะที่	kar a	the current administration
คณะบัญชี	számviteli kar	accounting department (major)
คณะปฏิรูปการปกครองแผ่นดิน	forradalmi bizottság	national administrative reform council
คณะประมง	halászati kar	fishery division of the college of farming and agriculture
คณะพยาบาลศาสตร์	ápolási kar	nursing department
คณะมนุษย์ศาสตร์และสังคมศาสตร์	humán és társadalomtudományi kar	humanity department
คณะรัฐมนตรีคณะที่	szekrény	council of ministers
คณะวิทยาการจัดการ	menedzsmenttudományi kar	management department
คณะวิศวกรรมศาสตร์	mérnöki kar	engineering department
คณะศิลปกรรมศาสตร์	szépművészeti kar	faculty of fine arts
คณะสถาปัตยกรรมศาสตร์	építészmérnöki kar	faculty of architecture
คณะสหเวชศาสตร์	szövetséges egészségtudományi kar	อังกฤษ   faculty of allied health science
คณะสาธารณสุขศาสตร์	közegészségügyi kar	faculty of public health
คณะเกษตร	mezőgazdasági kar	faculty of agriculture
คณะแพทยศาสตร์ศิริราชพยาบาล	orvosi kar siriraj kórház	faculty of medicine siriraj hospital
คณะแพทยศาสตร์โรงพยาบาลรามาธิบดี	ramathibodi kórház orvostudományi kar	the staff of ramatippadee hospital
คณารศ	kanara	kanaros - a surname
คนที่	a személy, aki	person number __________________________
คนที่ไปช่วยรุ่นที่	az emberek, akik segítették a generációt	volunteer group number __________
คนแคระ	törpe	dwarf
คนแรก	első személyű	first
คปค	év	3 thai letters
คม	éles	sharp
ครอคโคไดล์	krokodil	crocodile
ครอบครัว	család	family
ครั้งหนึ่ง	egyszer	once upon a time
คราประยูร	prayun	karaprayoon - a thai surname
คราม	indigó	indigo
คริส	chris	christ
คริสตี	christi	christie - a female name
คริสต์ศาสนา	kereszténység	christainity
ครุฑ	garuda	garuda
ครู	tanár	teacher
ครูพิเศษจอมป่วน	troll tanár	kru pisat jom poun  - name of a story
คลอง	csatorna	canal
คลองสาน	khlong san	klongsan
คลองเตย	khlong toei	klongtoei
คลับ	klub	club
คลาวิคอร์ด	osztály	clavichord
คลิก	kettyenés	click
คลินิก	klinika	clinic
คลิป	csipesz	clip
คลื่นสึนามิ	tsunami	tsunami wave
ควอน	kwon	kwon - a surname of a korean singer
ควอร์เตอร์	negyed	quarter
ความกว้าง	szélesség	width
ความงาม	a szépség	beauty
ความจำ	az emlék	memory
ความต่างศักย์	lehetséges különbség	potential difference in physics
ความถี่	frekvencia	frequencies
ความนิยม	népszerűség	popular
ความบริสุทธิ์	tisztaság	purity
ความฝันอันสูงสุด	a végső álom	the impossible dream
ความพอประมาณ	szerénység	estimate
ความยากจน	szegénység	poverty
ความยาว	a hosszúság	length
ความยาวคลื่น	hullámhossz	frequencies
ความยาวช่วงคลื่น	hullámhossz	wave length
ความยาวเพลง	dal hossza	the length of the song
ความรัก	szerelem	love
ความรู้	a tudás	knowledge
ความสว่าง	fényerősség	illumination
ความสัมพันธ์กับประเทศไทย	kapcsolatok thaifölddel	relationship with thailand
ความสัมพันธ์ระหว่างจีนกับอเมริกา	kína és amerika közötti kapcsolatok	relationship with china and the usa
ความสูง	a magasság	height
ความส่องสว่าง	fényerősség	luminance
ความหนาแน่นของประชากร	nép sűrűség	population density
