+	+	plus sign
รักษาสิ่งแวดล้อม	védd a környezeted	protect the environment
รักแห่งสยาม	szerelem siam	love thailand
รังสิตคลอง	rangsit khlong	rangsit canal
รังสี	sugár	radiation
รังสีเอกซ์	röntgen	xray
รังสีแกมมา	gamma sugár	gamma ray
รัชกาลที่	uralkodik	rama
รัชกาลสมเด็จพระจุลจอมเกล้าเจ้าอยู่หัว	chulalongkorn király uralma	king chula chomklao's reign
รัชดาภิเษก	ratchadaphisek	rajada pisek - a location in thailand
รัฐธรรมนูญแห่งราชอาณาจักรไทย	a thaiföldi királyság alkotmánya	constitution of the kingdom of thailand
รัฐบาลไทย	thai kormány	thai government
รัฐบุรุษ	államférfi	statesman
รัฐประหาร	coup	coup d'état
รัฐประหารในประเทศไทย	puccs thaiföldön	thailand's coup d'état
รัฐมนตรีว่าการกระทรวงคมนาคม	közlekedési miniszter	transportation secretary of thailand
รัฐวิสาหกิจ	állami vállalkozás	financial situation of the country
รัฐวิสาหกิจไทย	thai állami vállalkozások	thai state enterprise
รัฐสภา	parlament	parliament
รัฐสีมาคุณากรปิยชาติ	ratthasima kunakornpiyachat	ratthasimakhunakonpiyachat
รัฐอิลลินอยส์	illinois	state of illinois
รัฐเทกซัส	texas	state of texas
รัตนบุรี	rattanaburi	ratanaburi district - a location in thailand
รัตนาธิเบศร์	rattanathibet	ratana thibet
รับบทโดย	játssza	played by
รับพระราชทาน	elfogad	receive
รัศมี	sugár	radius
รัสเซล	russell	russell
รากแก่น	alapvető gyökér	rakkan
รางวัลนักร้องยอดเยี่ยม	a legjobb énekes díja	best singer award
รางวัลนักร้องไทยสากลชายยอดนิยม	népszerű férfi thai nemzetközi énekesdíj	best thai male singer award
รางวัลนาฏราช	royal dancer awards	naktarath prize
รางวัลโนเบล	nóbel díj	nobel prize
รางวัลไนน์เอ็นเตอร์เทน	kilenc szórakoztató díj	nine entertain awards
ราชตระกูล	királyi család	royal family
ราชนาวี	haditengerészet	royal navy
ราชมังคลากีฬาสถาน	rajamangala stadion	rajamangala national stadium
ราชวงศ์จิ้นตะวันออก	kelet jin-dinasztia	east jin dynasty
ราชวงศ์ชิง	csing dinasztia	ching dynasty
ราชวงศ์ถัง	tang dinasztia	tang dynasty
ราชวงศ์ทิพย์จักราธิวงศ์	a királyi család, chakrathiwong	thipjaklatiwong dynasty
ราชวงศ์บ้านพลูหลวง	plu luang királyi háza	ban phlu luang dynasty
ราชวงศ์พระร่วง	phra ruang-dinasztia	pra roung dynasty
ราชวงศ์หยวน	yuan-dinasztia	yuan dynasty
ราชวงศ์อู่ทอง	u-thong-dinasztia	utong empire in ancient thailand
ราชสกุล	tokenek	royal family members
ราชสีมา	ratchasima	ratchasima
ราชินิกุล	a királynő rokonai	relatives of the queen
ราบเป็นหน้ากลอง	legyen egyszerű	flattened like a drum (meaning to be defeated)
รามอินทรา	ramintra	ram inthra
รายการ	lista	show
รายการวันสำคัญทางพุทธศาสนา	a fontos buddhista dátumok listája	important days in buddhism
รายชื่อ	lista	list of the names
รายชื่อคำในภาษาไทยที่มักเขียนผิด	a gyakran helytelenül írt thai szavak listája	common misspelled thai words
รายชื่อภาพยนตร์ไทย	thai filmek listája	a list of thai movies
รายชื่อหุ่นยนต์ใน	a robotok listája a	name of robots
รายชื่ออธิการบดี	csillárok listája	list of presidents
รายชื่อเพลง	dalok listája	songs list
รายนามรองอธิการประจำวิทยาเขต	a campus rektor névjegyzéke	llist of deputy directors of the college
รายนามอธิการบดี	az elnök listája	chancellor list
รายพระนามพระมหากษัตริย์ไทย	a thai királyok listája	list of thai monarchs
รายะนาค	raya nak	rayanak
รายได้อื่น	egyéb bevételek	other wages, incomes
ราวพุทธศตวรรษที่	a század körül	about buddhist era
ราศีธนู	nyilas	sagittarius
รำพันพิลาป	sikoly	poem called rum pan pi lab
ริน	önt	rin
ริมแม่น้ำเจ้าพระยา	folyóparti chao phraya folyó	near chao praya river
ริวซากิ	ryuzaki	riusaki - from japanese story
ริเอะ	rie	rie tanaga - a japanese singer
รีสอร์ท	üdülőhely	resort
รีเนียม	rénium	rhenium
รุจิพรรณ	rujipan	pan - a name
รุ่ง	hajnal	dawn
รุ่งสว่าง	hajnal	rungsawang
รุ่งเพชร	rung petch	roongpetch - a female's name
รูดอล์ฟ	rudolph	rudolf
รูทีเนียม	ruténium	ruthenium
รูปภาพ	kép	picture
รูปร่าง	alak	body
รูปวรรณยุกต์	tonális forma	tones
รูปสามเหลี่ยมมุมป้าน	rossz háromszög	obtuse
รูปสี่เหลี่ยมด้านขนาน	paralelogramma	a paralellogram
รูสเวลต์	roosevelt	roosevelt
ร็อดฟอร์ม	rúd forma	rock form
ร่วมแสดงกับ	végezzen a	costarring
ร้องคู่กับ	énekelj együtt	sing a duet with
ร้องร่วมกับ	énekelj	featuring
ร้องโดย	énekelte	sung by
ร้อยตรี	másodtiszt	second lieutenant
ร้านอาหาร	egy étterem	restaurants
ฤดูกาล	az évszak	season
ฤดูฝน	esős évszak	rainy season
ฤดูร้อน	forró évszak	summer
ล	a	a thai alphabet with an l sound
ลงวันที่	keltezett	on this date
ลพบุรี	lop buri	lopburi
ลอนดอน	london	london
ลอยกระทง	loy kratong fesztivál	loy kratong festival
ลอร์ด	az úr	lord
ละคร	dráma	play
ละครชาตรี	chatri dráma	lakorn-chatri
ละครวิทยุ	rádiós dráma	soap opera broadcasted on the radio
ละครสั้น	rövid dráma	short drama
ละครเพลง	zenei	stage musical theatre
ละครโทรทัศน์	szappanopera	television drama
ละติจูด	szélességi kör	latitude
ลักษณะ	néz	characteristic
ลักษณะทั่วไป	általános tulajdonságok	common characteristic
ลักษณะทางกายภาพ	fizikai tulajdonságok	physical characteristics
ลักษณะภูมิอากาศ	éghajlat	the type of climate
ลักษณะสำคัญ	fontos jellemzők	main characteristics
ลักเซมเบิร์ก	luxemburg	luxembourg
ลัคนา	növekvő	ascendant
ลา	la	goodbye
ลานจาตุรงคสันนิบาต	négyszög	lan jaturonsunnibat - an ancient place in india
ลามิวูดีน	lamiwooden	lamivudine
ลายน้ำ	vízjel	watetmark
ลาว	laosz	lao
ลาออก	lemond	resign
ลำดับ	rendelés	order, sequence
ลำดับพระปฐมวงศ์ในพระบรมราชวงศ์จักรี	a genesis rendje a chakri-dinasztiaban	order of the kings
ลำดับพระมหากษัตริย์ไทย	a thai király rendje	the order of the kings of thailand
ลำตัว	törzs	body
ลำลูกกา	lam luk ka	lumlookka - a location in thailand
ลำลูกกาคลอง	lam luk ka-csatorna	lum luk kak klong
ลำไส้เล็ก	vékonybél	small intestine
ลิง	majom	monkey
ลิซท์	liszt	(franz) liszt
ลิปปี	ajak éve	rippi - a surname
ลิพิด	lipid	lipid
ลิฟวิ่งมอลล์	living mall	living mall
ลิเก	zenei népi dráma	like
ลิเทียม	lítium	lithium
ลีกคัพ	liga kupa	league cup
ลีซอ	lisu	lisu
ลีเมอร์	makimajom	lemur
ลี้	li	lee, a district in lumpoon province.
ลี้สุวรรณ	li suwan	lisuwan
ลุงบุญมีระลึกชาติ	boonmee bácsi visszahívta a nemzetet	uncle boonmee who can recall his past lives
ลูกปัด	üveggyöngy	beads
ลูกสาว	lánya	daughter
ลูกอม	cukorka	candies
ลูกอัณฑะ	herék	testis
ลูซิเฟอร์	lucifer	lucifer
ลูน่า	luna	luna
ล่าทา	vadászat	lata
ล่ำซำ	csomó	lumsum
ล้อม	körül	lom
ล้อแม็กซ์อัลลอยขนาด	összekötött kerekek, méret	alloy wheel
วง	hurok	band
วงจรไฟฟ้า	elektromos áramkör	electrical circuit
วงดนตรี	zenekar	band
วงศ์กำแหง	család	wongkumhang - surname of a famous singer
วงศ์ถั่ว	dió család	fabaceae
วงศ์ปลากดทะเล	halcsalád	ariidae
วงศ์ปลากะรัง	fűrészes sügér	serranidae family
วงศ์ปลายอดม่วง	wong pla yot muang	tonguefish
วงศ์ปลาหลังเขียว	zöld hal	clupeidae - a type of fish
วงศ์ปลาเนื้ออ่อน	puha hal	siluridae
วงศ์ปลาเสือตอ	tigris hal család	datnioididae
วงศ์พัวพันธ์	wongpua phan	wongpourpan
วงศ์วิริยะ	wiriya	vongsiriya - a surname
วงศ์เทวัญ	család	wongthewan
วงศ์แคหางค่าง	wong khae hang kong	plants in kae-hang-kang family
วงษ์คำเหลา	wong kham lao	wongkamlao
วงเงิน	határ	budget
วงเวียน	körforgalom	circle
วงแหวน	gyűrű	ring form, circle form
วชิรบรรจง	wachirabunjong	wachibanjong
วทบ	dd	bachelor of science
วนอุทยานถ้ำจัน	tham chan erdőpark	tham chan forest park
วนิดา	wanida	wanida - the name of a drama
วร	wor	won
วรรณกรรม	irodalom	literature
วรรณสุทธิ์	wannasut	wannasut - surname of an actress
วรรธนพิสิฐกุล	watthon phisitkun	wanthanaphisitkun
วรัทยา	warutya	varattaya (first name)
วว	dd	office of ____________
วอก	majom	wok
วองโกเล่แฟมิลี	vongola család	vongola family
วอชิงตัน	washington	washington
วอลท์	walt	walt
วอล์ค	séta	walk
วะสี	voltam én	wasee
วัง	palota	palace
วังจันทร์	wang chan	wang-chan
วังสระปทุม	sra pathum palota	srapathum palace
วังสะพุง	wang saphung	wang saphung
วังหลัง	palota	wang lang
วังหิน	kő palota	rock castle
วัชรพล	watcharapol	watcharapol supermarket
วัฒนชัย	watthanachai	wattanachai - a surname
วัฒนธรรม	kultúra	culture
วัฒนวิทูกูร	wattanawitkun	watthanawithukun
วัฒนา	wattana	wattana
วัดกลาง	közepes templom	wat klang
วัดป่าเลไลยก์วรวิหาร	wat pa lelai worawihan	wat palaylay
วัดพระธาตุดอยสุเทพราชวรวิหาร	wat phra that doi suthep, ratchaworawihan	wat pratatdoisuthep rachavoravihan - the temple erected on top of doi suthep in northern thailand
วัดพระฝางสวางคบุรีมุนีนาถ	wat phra fang sangkhaburi muninat	prhafangsawangkaburimuninat temple
วัดพระมหาธาตุวรมหาวิหาร	wat phra mahathat woramahaviharn	wat phramahathat woramahawihan
วัดพระยืนพุทธบาทยุคล	wat phra yuen phutthayakhon	the standing buddha temple of puttabatyukol
วัดพระลอย	phra loi templom	wat phra loi
วัดพระศรีรัตนมหาธาตุ	wat phra si rattana mahathat	wat phra si rattana mahathat
วัดพระเชตุพนวิมลมังคลารามราชวรมหาวิหาร	wat phra chetuphon vimolmangklararam ratchaworamahawihan	wat pra chetpnvimolmungklaramrajavoramahavihan
วัดระฆังโฆสิตาราม	rakhangkosaram temple	wat rakang kositaram (name of temple)
วัดสองพี่น้อง	song phi nong temple	two siblings temple
วัดสุทัศนเทพวรารามราชวรมหาวิหาร	suthasan thep wararam templom	wat sutatthepvararamrajavorimahavihan - a temple in thailand
วัดหนองเพียร	nong phian-templom	wat nong pien - a temple in thailand
วัดหน้าพระธาตุ	na phra az a templom	wat na pra tat - a buddhist temple
วัดเจดีย์หลวง	chedi luang templom	wat pagoda
วัดโพธิ์	wat pho	wat po - a thai temple
วัตต์	watt	watt
วัตสัน	watson	watson
วัน	nap	day
วันชัย	wanchai	wanchai - a male's name
วันที่ขึ้นเครื่องหมาย	aláírás dátuma	excluding dividend day
วันที่ออกอากาศชื่อตอนแขกรับเชิญ	a sugárzás dátuma, az epizód neve, a vendég megjelenése	when the invitation comes out
วันที่เข้าฉาย	kiadási dátum	release date
วันนี้ที่รอคอย	várakozás ma	the day that one has been waiting for
วันพฤหัสบดี	csütörtök	thursday
วันพุธ	szerda	wednesday
วันมหาสงกรานต์	maha songkran nap	songkran day
วันละ	egy nap	per day
วันศุกร์	péntek	friday
วันสงกรานต์	songkran nap	songkran day
วันสำคัญ	fontos nap	important day
วันสำคัญทางพุทธศาสนา	fontos buddhista nap	buddhist holidays
วันหยุดราชการ	nemzeti ünnep	national holiday
วันอังคาร	kedd	tuesday
วันอาทิตย์	vasárnap	sunday
วันอาสาฬหบูชา	asanha bucha	asalha puja
วันเกิด	születésnap	birthday
วันเสาร์	szombat	saturday
วันแรม	nap	the phase of the moon
วัย	idős	age
วัลลิโภดม	walliphodom	wanliphodom
วัสดุฟิสไซล์	hasadó anyag	fissile material
วานูอาตู	vanuatu	vanuatu, australia
วารินชำราบ	warin chamrap	warinchamrap
วาลคิรี	valkyrie	valkyrie - angel that helped in valhalla war
วาลีน	valin	valine - a type of protein
วาเรีย	varia	varia
วาเลนไทน์	valentin	valentine
วาไรตี้	fajta	variety
วิกตอร์	győztes	victor
วิคตอเรีย	victoria	victoria
วิจัย	kutatás	investigate, study
วิจิตรศิลป์	képzőművészet	fine art
วิชาการ	akadémiai	academic
วิชาการคอม	tudományos számítógép	vcharkarn.com
วิชิต	wichit	wichit - a male's name
วิญญาณ	szellem	soul
วิฑูรย์	lazurit	witoon
วิดีโอเกม	videojáték	video game
วิตามินอี	e-vitamin	vitamin e
วิทยาการคอมพิวเตอร์	számítástechnika	computer courses
วิทยาการระบาด	járványtan	epidemiology
วิทยาลัยการจัดการเพื่อการพัฒนา	fejlesztési menedzsment főiskola	management for development college
วิทยาลัยการบริหารรัฐกิจ	közigazgatási főiskola	management college
วิทยาลัยครูสวนสุนันทา	suan sunandha tanár főiskola	soun sunanta teachers college
วิทยาลัยดุริยางคศิลป์	zene főiskola	college of music
วิทยาลัยนวัตกรรมและการจัดการ	innovációs és menedzsment főiskola	the college specialized in arts
วิทยาลัยพยาบาลกองทัพเรือ	tengerészeti ápolóiskola	royal thai navy college of nursing
วิทยาลัยพยาบาลบรมราชชนนี	boromarajonani ápolási főiskola	nursing university of barom raj chonnani
วิทยาลัยพาณิชยศาสตร์	kereskedelmi főiskola	panitsat university
วิทยาลัยวิชาการศึกษา	oktatási főiskola	college of education
วิทยาลัยเทคนิคธนบุรี	thonburi műszaki főiskola	king mongkut's university of technology thonburi
วิทยาลัยแพทยศาสตร์พระมงกุฎเกล้า	phramongkutklao orvostudományi főiskola	phramongkutklao college of medicine
วิทยาศาสตรมหาบัณฑิต	tudomány mestere	master of science
วิทยาศาสตร์สุขภาพ	egészség tudomány	health science
วิทยาศาสตร์และเทคโนโลยี	tudomány és technológia	science and technology
วิทยาเขต	egyetem	campus
วิทยาเขตกาญจนบุรี	kanchanaburi campus	kanchanaburi college
วิทยาเขตนครศรีธรรมราช	nakhon si thammarat campus	nakhon si thammarat campus
วิทยาเขตพิษณุโลก	phitsanulok campus	pissanulok college
วิทยาเขตสารสนเทศเพชรบุรี	phetchaburi informatikai campus	information technology college of petchaburi
วิทยาเขตสุพรรณบุรี	suphanburi campus	suphanburi campus
วิทยาเขตสุรินทร์	surin campus	surin university
วิทยาเขตหนองคาย	nong khai campus	nong kai university
วิทยาเขตเฉลิมพระเกียรติ	chaloem phrakiat campus	vittaya kat chalerm pra kiet - a location at kasetsat university in thailand
วิทยุ	rádió	radio
วิธีการหาความสัมพันธ์	hogyan lehet kapcsolatokat találni?	formula for the correlation coefficient
วินชี	vinci	vinci
วินัย	fegyelem	manners
วินเนอร์	győztes	winner
วิบูลย์	viszontlátásra	wibul - a male's name
วิมเบิลดัน	wimbledon	wimbledon
วิลลี่	willy	willy
วิลเลจ	falu	village
วิลเลียม	vilmos	williams
วิลเลี่ยม	vilmos	william
วิวัฒนาการ	evolúció	evolution
วิวัฒน์	fejlődik	produce, making up, invent
วิวัฒน์เกียรติ	wiwat kiat	wiwatkiat
วิศว	mérnöki	engineering
วิศวกร	mérnök	engineer
วิศวกรรมวัสดุ	anyagmérnöki munka	material engineering
วิศวกรรมสิ่งแวดล้อม	környezetvédelmi mérnöki	environmental engineering
วิศวกรรมเครื่องกล	gépészet	engineering
วิศวกรรมไฟฟ้า	villamosmérnök	electrical engineering
วิสา	wisisa	wisa
วิสูตร	diagnosztikai	wisut
วิหาร	szentély	vihara
วิเศษ	varázslat	wiset
วิเศษแก้ว	mágikus üveg	visetkeaw - surname of a singer
วิโนทัย	vinothai	winothai
วีดีโอ	videó-	video
วีดีโอเกม	videojáték	video game
วีรบุรุษ	hős	hero
วีระ	veera	veera
วีระยุทธ	wirayut	werayut - a male's name
วีออส	vios	vios
วุฒิสภา	szenátus	senate
วุฒิเมธี	wuttimethi	wuttimethi - a surname
ว้าวุ่น	zaklatott	wawun
ศ	prof	a thai alphabet
ศร	nyíl	arrow
ศรชัย	sornchai	sornchai - a male's name
ศรายุทธ	sarayuth	sarayut - a male's name
ศรีนครินทร์	srinakarin	srinakarin
ศรีนวล	srinual	sinuan
ศรีบุญเรือง	sri bunrueang	si bun rueang
ศรีประจวบ	si prachuap	siprachuap
ศรีปาน	sri pan	sri pan - a surname
ศรีมะฆะ	sri makha	sirimaka - a thai name
ศรียาภัย	sriyapai	siyaphai
ศรีสวัสดิ์	srisawat	srisawat -  a surname
ศรีสำโรง	si samrong	si samrong
ศรีเมือง	sri mueang	srimuang
ศรีไพร	sri phrai	sri prai - a name
ศรเพชร	gyémánt nyíl	sonpet
ศศิธร	sasithorn	sasitorn - a females name
ศักดิ์ศรี	presztízs	dignity
ศักย์ไฟฟ้า	elektromos potenciál	electric potential
ศัพท์	terminológia	vocabulary
ศาลชั้นต้น	polgári bíróság	curcuit court
ศาลหลักเมือง	városi oszlop szentély	the old court house
ศาลเจ้าพ่อหลักเมือง	városi oszlop szentély	the city's god
ศาสตราจารย์	egyetemi tanár	professor
ศาสนา	vallás	religion
ศาสนาพราหมณ์ฮินดู	hinduizmus	hindu religion
ศาสนาฮินดู	hinduizmus	hinduism
ศาสนาโซโรอัสเตอร์	zoroasztrizmus	zoroastrianism
ศิริวรรณ	siriwan	siriwan - a female's name
ศิลปอาชา	art archa	silpa-archa
ศิลปะ	művészet	arts
ศิลปะการแสดง	előadó művészet	performing arts
ศิลปะลพบุรี	art lopburi	lopburi art
ศิลปะศรีวิชัย	srivijaya art	arts from sri vi chai province
ศิลปะเขมร	khmer művészet	cambodian arts
ศิลปะเครื่องปั้นดินเผา	kerámia művészet	pottery art
ศิลปะเชียงแสน	chiang saen art	chaingsan art
ศิลปินแห่งชาติ	nemzeti művész	national artist
ศิลป์	művészet	silpa
ศิษย์เก่าคณะมนุษยศาสตร์	bölcsészettudományi kar öregdiákjai	former humanity student
ศิษย์เก่าคณะรัฐศาสตร์	politikatudományi kar alumni	faculty of political science alumni
ศิษย์เก่าคณะเศรษฐศาสตร์	gazdaságtudományi kar öregdiákjai	economics alumni
ศีรษะ	fej	head
ศึกนันทบุเรง	nanthabureng csata	suknuntabureng -  a war in thailand
ศึกษาศาสตร์	oktatás	field of education
ศุกลวัฒน์	sukonwat	sukolawat (a person's name)
ศุภกิจ	supakit	supphakit
ศุภณัฐ	suphanat	supanat (first name)
ศูนย์	központ	center
ศูนย์การค้า	bevásárló központ	shopping center
ศูนย์การบินทหารบก	hadsereg repülési központ	marine forces
ศูนย์การศึกษาแม่ฮ่องสอน	mae hong son oktatási központ	maehongsorn learning center
ศูนย์คอมพิวเตอร์	számítógépes központ	computer center
ศูนย์ค้าส่ง	nagykereskedelmi központ	wholesale center
ศูนย์บริการวิชาการ	tudományos szolgáltató központ	academic service center
ศูนย์ภาษา	nyelvi központ	language center
ศูนย์รังสิต	rangsit center	rangsit university center
ศูนย์ลำปาง	lampang center	lampang center
ศูนย์แพทยศาสตรศึกษาชั้นคลินิก	klinikai orvostudományi oktatási központ	medical education center
สก	csavar	abbreviation of two letters
สกว	trf	trf
สกอ	skócia	office of higher education commission
สกอตแลนด์	skócia	scotland
สกาย	ég	sky
สกุล	család	sakun
สกุลหยาดน้ำค้าง	harmatfű	d. etrythrorhiza - a type of plant
สกุลเพชรหึง	petcheng	grammatophyllum
สควอโล่	squalo	squalo
สงคราม	háború	war
สงครามครูเสด	keresztes hadjárat	crusades war
สงครามมหาเอเชียบูรพา	a nagy-kelet-ázsia háborúja	world war two
สงครามอวกาศ	űrháború	space war
สงครามเกาหลี	koreai háború	korean war
สงครามเย็น	hidegháború	cold war
สง่าพล	elegáns	sangapol - a thai surname
สด	friss	fresh
สตรอเบอรี่	eper	strawberry
สตรีวิทยา	radiológia	satriwithaya
