+	+	plus sign
อุณหภูมิ	temperatur	temperature
อุณหเคมี	termokemi	using energy and heat in chemical study
อุดม	bördig	udom
อุดรธานี	udon thani	udon thani
อุตตมะโยธิน	uppharat yothin	uttamayothin
อุตรดิตถ์	uttaradit	uttaradit
อุทยาน	parkera	park
อุทยานประวัติศาสตร์พนมรุ้ง	phanom rung historical park	phanom rung historical park
อุทยานประวัติศาสตร์พิมาย	phimai historical park	phimai historical park
อุทยานแห่งชาติคลองตรอน	khlong tron nationalpark	khlong tron national park
อุทยานแห่งชาติดอยภูคา	doi phu kha nationalpark	doi phu kha national park
อุทยานแห่งชาติดอยอินทนนท์	doi inthanon nationalpark	national park doi inthanon in northern thailand
อุทยานแห่งชาติทุ่งแสลงหลวง	thung salaeng luang nationalpark	thung salaeng luang national park
อุทยานแห่งชาติธารโบกขรณี	ännu bok khorani nationalpark	tarabokorani national preserve area
อุทยานแห่งชาติน้ำตกสี่ขีด	si khit waterfall national park	namtoksekeed national park
อุทยานแห่งชาติน้ำพอง	nam phong national park	nam phong national park
อุทยานแห่งชาติภูผาเหล็ก	iron mountain national park	phupalek national park
อุทยานแห่งชาติภูพาน	phu phan nationalpark	phu phan national park
อุทยานแห่งชาติภูสวนทราย	phu suan sai nationalpark	pusuansai national preserve
อุทยานแห่งชาติภูสอยดาว	phu soi dao nationalpark	soi dao mountain preserve
อุทยานแห่งชาติภูเรือ	phu ruea nationalpark	national park pu reau
อุทยานแห่งชาติภูเวียง	phu wiang nationalpark	phu wiang national park
อุทยานแห่งชาติภูแลนคา	phulanca nationalpark	phu laenkha national park
อุทยานแห่งชาติหาดนพรัตน์ธาราหมู่เกาะพีพี	noppharat thara beach national park, phi phi islands	hat nopparatthara-mu ko phi phi national park
อุทยานแห่งชาติเขาหลวง	khao luang nationalpark	khao luang national park
อุทยานแห่งชาติไทรทอง	sai thong national park	sai thong national preserve area
อุทุมพรพิสัย	uthumphon phisai	utompisai - an area in thai province
อุบล	ubon	ubol - a place in thailand
อุปกรณ์	utrustning	instrument
อุปกรณ์คอมพิวเตอร์	datortillbehör	computer hardware
อุปนิสัย	karaktär	manners
อุภัยราศี	förlåt zodiaken	ambivert zodiac
อุรุกวัย	uruguay	urookwai - a location
อุเทน	uthen	utain - a male's name
อู	ou	u (a vowel)
อู๋	wu	auu (first name)
อเมริกัน	american	american
อเมริกา	amerika	america, usa
อเมริกาเหนือ	nordamerika	north america
อเล็กซานเดอร์	alexander	alexander
อเล็กซ์	alex	alex
อโลหะ	icke-metall	nonmetal
อ่อนเพลีย	trött	fatigue
อ่าน	läsa	read
อ่าวลึก	ao luek	ao luek
อ้างว่า	påstå det	claim
อ้างว้าง	ödslig	loneliness
ฮอกกี้	hockey	hockey
ฮอท	varm	hot
ฮอฟมัน	hoffman	hoofman - a name
ฮอยเกนส์	hogens	huygens
ฮอร์โมน	hormon	hormone
ฮอลแลนด์	holland	holland
ฮอลโลว์	ihålig	hollow (as in dead soul)
ฮอว์ค	seahawks	hawk
ฮักบี้	adjö	hugby - an album that received many awards
ฮันกึล	hangul	hangeul
ฮัมบูร์ก	hamburg	hamburg
ฮาจิ	hachi	haji
ฮาตาเกะ	hatake	hatake
ฮานอย	hanoi	hanoi
ฮายาโตะ	hayato	hayada - a japanese surname
ฮารุกะ	haruka	haruka - a japanese name
ฮาวาย	hawaii	hawaii
ฮิซาชิ	hisashi	hitachi
ฮิซานะ	hisana	hisana
ฮิตเลอร์	hitler	hitler
ฮินาตะ	hinata	hinada - a japanese story
ฮิมาวาริ	himawari	himawari - a japanese surname
ฮิราโกะ	hirako	hirako (japanese name)
ฮิวงะ	hyuga	hewnga - a japanese name from a story
ฮิโซกะ	hisoka	hisoka
ฮิโรชิ	hiroshi	hiroshi
ฮีชอล	heechul	heechul
ฮุก	krok	hook
ฮโยยอน	hyoyeon	hyoon - a dancer from japan
ฯพณฯ	hans excellens	two thai alphabets.  abbreviation that means many things
เกตส์	gates	gates
เกตุทัต	ketthat	kettut - a surname
เกมที่	spelet	game number _________
เกมบุค	spel	game book
เกรย์	grå	gray
เกษตรกรรม	lantbruk	farming
เกษตรวิสัย	kaset wisai	kasetvisai (name of thai district)
เกษมศรี	kasemsri	kasemsri surname
เกอริง	gering	the name 'gerring'
เกอไทต์	goethe	goethite mineral
เกาหลีใต้	sydkorea	south korea
เกาะ	ö	island
เกาะคา	kauai	ko kha
เกาะลูซอน	luzon ö	luzon island
เกาะสุมาตรา	sumatra	sumatra
เกิด	föddes	born
เกิดขึ้นหลังจากมหาวิทยาลัยศรีนครินทรวิโรฒวิทยาเขตต่างๆ	uppstod efter srinakharinwirot universitet	happened after srinakarinviroj university started
เกิดขึ้นเมื่อวันที่	uppstod den	birthdate
เกิดจากการรวมชิ้นส่วนที่	orsakas av att kombinera delar som	put together to form something
เกิดจากการรวมตัวของ	orsakat av införlivandet av	combination of
เกิดจากเชื้อไวรัส	orsakat av virus	occur from the viral agent
เกิดนิมิตร	skapa en vision	caused a vision/realization
เกียรติ	ära	honour
เกียรติประวัติ	ära	biography
เกียรติศักดิ์	ära	reputation.  kietisak can be a male's name
เกียวโตะ	kyoto	kyoto
เก็กโค	checco	gecko
เขตคลองสาน	khlong san district	klongsan district
เขตจอมทอง	chom thong district	jomthong area
เขตดุสิต	dusit	khet dusit
เขตที่	distrikt	district number _______
เขตบางกอกใหญ่	bangkok yai district	bangkok yai district in thailand
เขตบางซื่อ	bang sue district	bang sue district
เขตบางแค	bang khae	bang khae district
เขตปทุมวัน	pathumwan	pathum wan district
เขตภาษีเจริญ	phasi charoen district	phasi charoen district
เขตมีนบุรี	min buri district	min buri district
เขตรักษาพันธุ์สัตว์ป่า	naturreservat	national wildlife preserve
เขตรักษาพันธุ์สัตว์ป่าภูหลวง	phu luang wildlife sanctuary	wildlife preserve
เขตลาดกระบัง	lat krabang	lad krabang district
เขตวังทองหลาง	wang thonglang district	wang thonglang district
เขตวัฒนา	wattana district	watana district
เขตสวนหลวง	suan luang district	suan luang district
เขตสาทร	sathon	sathorn area
เขตห้วยขวาง	huai khwang	huai khwang district
เขตเลือกตั้งที่	stad	election area number
เขมนิจ	befallande	khemanit
เขากล่าวว่า	han sa	he said
เขาทราย	khao sai	sand dunes
เขียนว่า	skrev det	wrote
เขียนโดย	skriven av	written by
เขี้ยวพิษ	giftiga tänder	vemon fangs
เขื่อนกิ่วลม	kio wind dam	kio lom dam
เขื่อนป่าสักชลสิทธิ์	pasak chonlasit dam	parsakchonlasit dam
เขื่อนลำปาว	lampao dam	lum pao dam
เขื่อนแม่งัดสมบูรณ์ชล	mae ngad somboon chon dam	mae ngud som bul chol dam in chiangmai
เข็มศิลปวิทยา	nålkonst	khem sinlapawitthaya
เข็มอัปสร	nål	kem uppasorn - a thai drama
เข่า	knä	knee
เข้าฉาย	visa	release date
เข้าชิงไนน์เอ็นเตอร์เทนอวอร์ดส	nominerad till nine entertainment awards.	compete in entertaining world
เข้ารอบ	finalist	made it to the next round, selected from the initial round
เข้าเฝ้า	ha en publik	visit (word for the king)
เคน	ken	ken
เคนยา	kenya	kenya
เคมีไฟฟ้า	elektro	electrochemistry
เคยสู้กับโกคุเทระ	används för att slåss med gokudera	fought with gokudera
เครือข่าย	nätverket	network
เครื่องขัตติยราชอิสริยาภรณ์อันมีเกียรติคุณรุ่งเรืองยิ่งมหาจักรีบรมราชวงศ์	jubileum för chakri-dynastinens stora ära	something used in a thai ceremony - too obscure
เครื่องดีด	klinka	thai string musical instruments
เครื่องตี	slå maskinen	musical intrument
เครื่องบิน	flygplan	airplane
เครื่องปั้นดินเผาและเซรามิค	keramik och keramik	pottery and ceramic
เครื่องยนต์	motor	engine
เครื่องราชอิสริยาภรณ์	insignier	the king's accessories for ceremonies
เครื่องราชอิสริยาภรณ์อันเป็นที่เชิดชูยิ่งช้างเผือก	insignierna som förhärligar den vita elefanten	order of the white elephant
เครื่องราชอิสริยาภรณ์อันเป็นสิริยิ่งรามกีรติ	insignierna till kiratis stora ära	king's accessories
เครื่องราชอิสริยาภรณ์อันเป็นโบราณมงคลนพรัตนราชวราภรณ์	forntida insignier	the ancient and auspicious order of the nine gems
เครื่องสาย	stränginstrument	string instrument
เครื่องแต่งกาย	kostym	clothes
เคลลี่	kelly	kelly
เคอาร์วาย	kryy	k.r.y
เค้ก	kaka	cake
เงิน	pengar	money
เงินทุน	finansiering	fund
เงินในบัญชีธนาคาร	pengar på bankkonto	balance
เงี้ยว	slingrig	shan tribe in northern part of thailand
เจ	j	j.
เจนี่	janie	jenny
เจมินี่	gemini	gemini
เจริญ	växa	charoen
เจสเปอร์	jesper	jasper
เจียะแจ	jae jae	nine emperor gods festival
เจี๊ยบ	brud	jeab (thai name)
เจเน็ต	janet	janet
เจ็ดเทพโจรสลัด	shichibukai	seven warlords of the sea
เจ็บ	öm	pain
เจ้าของจุกนม	nippelägaren	the owner of the baby's bottle
เจ้าจอม	bemästra	king's concubine
เจ้าฟ้ากรมพระยานริศรานุวัดติวงศ์	prins krom phraya naris ranu, ti wong-templet	refer to a title of a royal family member - jao fa krom pra ya rissanuwattiwong
เจ้าฟ้ากรมพระยานริศรานุวัติวงศ์	prins krom phraya narisara nuwatwong	prince narisara nuvativongse
เจ้าฟ้าจิตรเจริญ	prins jitcharoen	prince chitcharoen
เจ้าฟ้าภาณุรังษีสว่างวงศ์	prins phanurangseesawangwong	prince panuragui bright chestnut.
เจ้าฟ้ามหาวชิราลงกรณ	prins maha vajiralongkorn	thailand's crown prince
เจ้าฟ้ามหาวชิรุณหิศ	prins mahawajirunhit	crown prince maha vajirunhis
เจ้าฟ้ามหิดลอดุลยเดช	prins mahidol adulyadej	prince mahidol adulyadej
เจ้าฟ้ามหิดลอดุลเดช	prins mahidol adulyadej	a member of thai royalties
เจ้าฟ้าหญิง	prinsessa	princes
เจ้าฟ้าอุบลรัตนราชกัญญา	prins ubonrattanarajakanya	princess ubon ratana graz's' contract.
เจ้าหนี้การค้า	betalningar	trade account payable
เจ้าเมือง	guvernör	mayor
เจ้าเมืองขุขันธ์	guvernör i khukhan	a name of the head of the state
เจ้าโลก	hegemoni	world conqueror
เฉพาะด้านตะวันออกเฉียงใต้เท่านั้นที่เป็นที่ราบลุ่มแม่น้ำโขง	endast sydöstra sidan är mekongflodbassängen.	only south-east area that is in mekhong plateau
เฉลิม	chalerm	chalerm - a male's name
เฉลิมชัย	chalermchai	chalermchai
เฉลิมชัยเจริญกิจ	chalermchai charoenkit	chalermchaichareonkij
เฉลิมพระเกียรติ	ära	chaloem phra kiat
เฉลิมพล	chalermpol	shalermpol - a surname
เฉลิมแสน	chalermsaen	chaloemsaen
เฉลียว	perceptiv	chaleuw - a male's name
เชส	jaga	(jp morgan) chase
เชอร์รี่	körsbär	cherry
เชา	käk	chow -  a chinese name
เชาวน์	intelligens	chow - a name
เชาวราษฎร์	chaowarat	chowarat - the surname of a famous actress
เชิญยิ้ม	leende	smile
เชิดชัย	erövra	"name ""churd-chai"""
เชียงกลาง	chiang klang	chiang klang
เชียงของ	chiangkhong	chiang khong
เชียงดาว	chiang dao	chiang dao
เชียงปุม	chiang pum	chiang poom - area in thailand
เชียงยืน	chiang yuen	chiang yuen
เชียงราย	chiang rai	chiang rai
เชียงใหม่	chiang mai	chiang mai
เชี่ยววงศ์กุล	chiewwongkun	chiaowongkul
เชื่อมต่อกับรถไฟฟ้ามหานคร	ansluten till mrt	connect with skytrain
เชื่อมแม่น้ำท่าจีน	anslut tha chin-floden.	confluence to the ta jean river
เชื้อชาติ	lopp	helping the country
เชื้อรา	svampen	fungus
เช็ค	kontrollera	check
เช่นกัน	också	as well
เช่นเดียวกัน	likaså	similar to
เช้ามืดวันที่	dagens daggry	in dawn of
เช้าวันรุ่งขึ้น	nästa morgon	next morning
เซกิ	seki	seki
เซน	zen	saint
เซนทอร์	centaur	centaur
เซบาสเตียน	sebastian	sebastian
เซฟ	spara	save
เซลล์	cell	cell
เซสติโม	seto	settimo
เซอร์	herr	sir
เซอร์วิส	service	service
เซอร์เบีย	serbien	serbia
เซอวิวาสแตติน	cervivastin	cerivastatin - drug
เซโรกัชเชอร์	sero kutcher	sero gusher - a type of weapon
เซโรนอส	seronos	zeronos
เซโรไลเนอร์	seroliner	seroliner
เซ็กส์	sex	sex
เซ็นทรัล	central	central - department stores in thailand
เซ็นทารา	centara	centara
เซ็นเซอร์	sensorn	sensor
เณร	nyomvänd	samanera
เดคลิเนชัน	decloration	declination
เดชา	dacha	decha
เดธโน้ต	death note	death note - a mysterious japanese cartoon
เดนกัชเชอร์	denkucher	den gusher - a weapon in japanese movies
เดนโอ	den o	den-o
เดนโอเบลท์	denobelt	den-o belt
เดย์	dag	day
เดอะซิมส์	simarna	the sims
เดอะฮาเดส	the hades	the hades
เดอะฮาเดสแชปเตอร์	hades-kapitlet	the hades chapter
เดิม	gammal	at first
เดิมชื่อ	förr	former name
เดิมที	ursprungligen	at first
เดิมเรียกว่า	tidigare känd som	formerly known as
เดียวกัน	samma	same
เดือดทะลุจุดศูนย์	kokning genom nollpunkten	zero point breakthrough
เดือนกุมภาพันธ์	februari	february
เดือนตุลาคม	oktober	october
เดือนตุลาคมมีฝนตกชุกที่สุด	oktober är den regnigaste.	highest amount of rainfall in october
เดือนธันวาคม	december	december
เดือนมกราคม	januari	january
เดือนมิถุนายน	juni	june
เดือนอ้าย	månvarv	first lunar month
เด็กหญิงอายุ	gammal tjej	the girl's age
เด็กและเยาวชน	barn och ungdom	children and youth
เต่า	sköldpadda	tao (first name)
เต๋อ	till	ter
เถรวาท	lära	buddha's teaching
เทคนิคอิลลูชั่น	illusionsteknik	technique illusion
เทควันโด้	taekwondo	tai kwon do
เทคโนโลยี	teknologin	technology
เทคโนโลยีสารสนเทศ	informationsteknologi	san son tej techonology
เทนนิส	tennis	tennis
เทนโจอิน	tenjo-in	tenjoin - a character in a japanese story
เทพพิทักษ์	theppitak	theppitak
เทพมรณะ	död	bleach
เทพหัสดิน	himmelens gud	tephussadin (a surname)
เทพอานูบิส	anubis	anubis
เทพอาเตน	athen	aten
เทพีเธมิส	gudinna	themis
เทริโอ	therio	terio - surname of a singer
เทวดา	ängel	angel
เทวรูป	idol	graven image
เทศบาล	kommunen	municipality
เทศบาลนครขอนแก่น	khon kaen kommun	khon khan public works
เทศบาลนครนครราชสีมา	nakhon ratchasima	nakorn rachasrima province public work
เทศบาลนครนครศรีธรรมราช	nakhon si thammarat	nakorn sri thamarat city public works
เทศบาลนครเชียงราย	chiang rai	chiang rai province public works
เทศบาลนครเชียงใหม่	chiang mai kommun	chiang mai municipality
เทศบาลเมืองชัยภูมิ	chaiyaphum kommun	mueang chaiyaphum
เทศบาลเมืองบุรีรัมย์	buriram	bureerum public works
เทศบาลเมืองมหาสารคาม	maha sarakham kommun	thesaban mueang maha sarakham
เทศบาลเมืองมุกดาหาร	mukdahan kommun	mookdahan public works
เทศบาลเมืองสกลนคร	sakon nakhon kommun	municipality of sakonnakon
เทศบาลเมืองหนองคาย	nong khai kommun	nong khai municipality
เทศบาลเมืองหนองบัวลำภู	nong bua lamphu town kommun	nong bua lam phu town municipality
เทศวิศาล	expansiv	tasavisakal - a surname
เทิดศักดิ์	ära	therdsak
เทียนทอง	guldljus	tientong - a male's name
เทียนเงิน	silverljus	tienngern
เทียนโพธิ์สุวรรณ	thian pho suwan	tianphosuwan (thai last name)
เทเบิลเทนนิส	bordtennis	table tennis
เทโรศาสน	tero sasana	terosat football club
เท็ดดี้	teddy	teddy
เท็นเท็น	tio tio	tin-tin
เท่ง	teng	teng (first name)
เท่านั้น	endast	only
เธคุนุ	stöd	dhekunu
เธรซ	trakien	thrace - an area in greece
เธอกับฉัน	du och jag	you and i
เธอจะอยู่กับฉันตลอดไป	du kommer att stanna hos mig för alltid	you will be with me forever
เธอยัง	du fortfarande	tur yung
เธอเป็นเพื่อนอาบาราอิ	hon är en vän till abarai.	she is a friend of arbarae
เนกิ	negi	negi
เนย	smör	butter
เนรมิต	uppfinna	casting a spell
เนะ	rätt	ney
เนื่องจาก	eftersom	because
เนื่องจากประเทศเหล่านั้นอยู่ในตำแหน่งบนโลกที่ต่างไปจากประเทศไทย	eftersom de är i en position på jorden som skiljer sig från thailand	because those countries are in the group of...
เนื้อที่	område	area
เนื้อที่ประมาณ	ungefärligt område	approximate area
เนื้อร้อง	text	lyrics
เนื้อเรื่องย่อ	sammanfattning	summary
เนเธอร์แลนด์	nederländerna	netherlands
เนโกะ	neko	neko
เน็น	nen	nen
เบจิต้า	bechita	vegeta
เบธเลเฮม	bethlehem	bethleham
เบนจามิน	benjamin	benjamin
เบรกมา	ha sönder	bregma
เบริธ	berith	berith
เบลเฟกอล	bellegal	belphegor- a demon in a legend
เบส	bas	bass
เบอร์ลิน	berlin	berlin
เบา	ljus	soft (voice)
เบาท์	baut	(dieric) bouts
เบาหวาน	diabetes	diabetes
เบื่ออาหาร	uttråkad av mat	not appetite, eating disorder.
เบื้องหลัง	bakgrund	behind the sence
เบโทเฟิน	beethoven	beethoven
เบ็นเท็น	ben 10	ben 10
เปรม	nöjd	pream
เปรี้ยว	sur	sour
เปรู	peru	peru
เปลวไฟ	flamma	flame
เปลี่ยนชื่อเป็น	byt namn till	changed the name to
เปลื้อง	frånta	nude
เปล่งพานิช	plengpanich	plengpanich
เปอร์เซีย	persia	persia
เปอร์โตริโก้	puerto rico	puerto rico
เปิดสอนระดับปริญญาตรี	öppet för grundutbildning	offer bachelor degree curriculum
เปียงยาง	pyongyang	piang yang - in north korea
เปียโตร	pietro	pietro
เปียโน	piano	piano
เปโซ	peso	peso
เป็ด	anka	duck
เป็น	är	is
เป็นขนมของชาวไทยมุสลิม	är en efterrätt av thailändska muslimer	is a thai-muslim dessert
เป็นครั้งแรก	första gången	first
เป็นงานเขียนในชุด	är ett verk skrivet i en uppsättning	in the edition of...
เป็นต่อ	mot	pen to
เป็นต้น	etc.	for example
เป็นต้นมา	eftersom	onward
เป็นต้นไม้ประจำมหาวิทยาลัย	är ett universitetsträd	tree of university
เป็นบัวในสกุล	är en lotus i släktet	is a lotus in the family
เป็นประธาน	bli president	principal of
เป็นปลาตู้สวยงาม	är en vacker akvariefisk	is an ornamental fish
เป็นพระราชโอรสพระองค์เดียวในพระบาทสมเด็จพระปรมินทรมหาภูมิพลอดุลยเดช	är den enda sonen till kung bhumibol adulyadej	is the only son of
เป็นพ่อของ	är far till	is the father of
เป็นวิญญาณเทียมเพศชาย	är en manlig konstgjord ande	the spirit who is a male
เป็นสีประจำ	vanlig färg	official color
เป็นหนึ่งใน	är en av	is one of
เป็นหัวหน้าพรรค	partiledare	party leader
เป็นอดีตหัวหน้าหน่วยที่	är en tidigare ledare för enheten	is the former leader of the unit
เป็นอาวุธ	som ett vapen	as a weapon
เป็นเครื่องหมายแสดงว่า	det är ett tecken på att	indicates that
เป็นเจ้าเมืองปกครอง	guvernör	governor
เป็นเมืองหลวง	är huvudstaden	capital
เป็นเวลา	för	utilized time
เป็นโฮโมโลกัสกับ	är en homolog med	homologous
เป๊ปซี่	pepsi	pepsi
เพกาซัส	pegasus	pegasus
เพชร	diamant	diamond
เพชรบุรี	phetchaburi	petchaburi province
เพชรบูรณ์	phetchabun	prechabun
เพชรพระอุมา	diamond phra uma	ancient diamond
เพชรา	gammal man	petchara - name of a famous actress
เพชรเกษม	petchkasem	petchakasem area in bangkok
เพดานอ่อน	mjukt tak	gill
เพทาย	zirkon	zircon
เพพซิน	pepsin	pepsin
เพราะ	därför att	because
เพราะว่า	därför att	because
เพรียะ	piriya	preah - cambodia
เพลงประกอบภาพยนตร์	filmljudspår	soundtrack
