+	+	plus sign
อำเภอเมืองพิจิตร	mueang phichit körzet	mueang phichit district
อำเภอเมืองพิษณุโลก	mueang phitsanulok	ampore maung pisanulok
อำเภอเมืองลพบุรี	mueang lop buri kerület	lopburi province
อำเภอเมืองสุรินทร์	mueang surin körzet	surin province
อำเภอเมืองอุตรดิตถ์	mueang uttaradit kerület	mueang uttaradit district
อำเภอเมืองเชียงใหม่	mueang chiang mai kerület	mung chiang mai district
อำเภอเมืองเพชรบุรี	mueang phetchaburi kerület	pechaburi province
อำเภอเวียงชัย	wiang chai körzet	wiang chai district
อำเภอเวียงแก่น	wiang kaen körzet	wiang kaen district
อำเภอเสริมงาม	soem ngam körzet	soem ngam district
อำเภอแจ้ห่ม	chae hom kerület	chae hom district
อำเภอแม่ทะ	mae tha kerület	mahta district
อำเภอแม่แจ่ม	mae chaem körzet	mae jam province
อำเภอแม่แตง	mae taeng körzet	mae taeng district
อำเภอโนนดินแดง	nem din daeng kerület	din dang sub district
อำเภอโนนสุวรรณ	nem suwan kerület	none su wan province
อิงค์	inc.	inc.
อิงลิช	angol	english
อิทธิพล	befolyás	power
อิน	ban ben	in
อินทิรา	indira	intira
อินฟราเรด	infravörös	infared
อินฮิบิเตอร์	inhibitor	inhibitors
อินุยาฉะ	inuyasha	inuyacha - a japanese cartoon
อินเซคทิวอรา	inseqtura	insectivora
อินเดียน	indián	indian
อินเด็กซ์	index	index
อินโดนีเซีย	indonézia	indonesia
อิม	imm	im
อิมาจิน	imajin	imagine
อิมแพ็ค	hatás	impact
อิรัก	irak	iraq
อิริโทรมัยซิน	elektrolízis	erythromycin
อิสตันบูล	isztambul	istanbul
อิหร่าน	irán	iran
อิเควทอเรียลกินี	egyenlítői-guinea	equitorial
อิโนะ	én nem	ino
อีก	több	more
อีกครั้ง	még egyszer	again
อีกด้วย	is	also
อึ	szar	poop
อึ๊งภากรณ์	ungphakorn	ungpakorn - a famous surname
อือ	igen!	uu - a thai vowel
อื่น	egy másik	other
อุ	o	ou
อุซึมากิ	uzumaki	uzumaki naruto
อุณหภูมิ	hőfok	temperature
อุณหเคมี	termokémia	using energy and heat in chemical study
อุดม	termékeny	udom
อุดรธานี	udon thani	udon thani
อุตตมะโยธิน	uppharat yothin	uttamayothin
อุตรดิตถ์	uttaradit	uttaradit
อุทยาน	park	park
อุทยานประวัติศาสตร์พนมรุ้ง	phanom rung történelmi park	phanom rung historical park
อุทยานประวัติศาสตร์พิมาย	phimai történelmi park	phimai historical park
อุทยานแห่งชาติคลองตรอน	khlong tron nemzeti park	khlong tron national park
อุทยานแห่งชาติดอยภูคา	doi phu kha nemzeti park	doi phu kha national park
อุทยานแห่งชาติดอยอินทนนท์	doi inthanon nemzeti park	national park doi inthanon in northern thailand
อุทยานแห่งชาติทุ่งแสลงหลวง	thung salaeng luang nemzeti park	thung salaeng luang national park
อุทยานแห่งชาติธารโบกขรณี	mint bok khorani nemzeti park	tarabokorani national preserve area
อุทยานแห่งชาติน้ำตกสี่ขีด	si khit vízesés nemzeti park	namtoksekeed national park
อุทยานแห่งชาติน้ำพอง	nam phong nemzeti park	nam phong national park
อุทยานแห่งชาติภูผาเหล็ก	iron mountain nemzeti park	phupalek national park
อุทยานแห่งชาติภูพาน	phu phan nemzeti park	phu phan national park
อุทยานแห่งชาติภูสวนทราย	phu suan sai nemzeti park	pusuansai national preserve
อุทยานแห่งชาติภูสอยดาว	phu soi dao nemzeti park	soi dao mountain preserve
อุทยานแห่งชาติภูเรือ	phu ruea nemzeti park	national park pu reau
อุทยานแห่งชาติภูเวียง	phu wiang nemzeti park	phu wiang national park
อุทยานแห่งชาติภูแลนคา	phulanca nemzeti park	phu laenkha national park
อุทยานแห่งชาติหาดนพรัตน์ธาราหมู่เกาะพีพี	noppharat thara beach nemzeti park, phi phi-szigetek	hat nopparatthara-mu ko phi phi national park
อุทยานแห่งชาติเขาหลวง	khao luang nemzeti park	khao luang national park
อุทยานแห่งชาติไทรทอง	sai thong nemzeti park	sai thong national preserve area
อุทุมพรพิสัย	uthumphon phisai	utompisai - an area in thai province
อุบล	ubon	ubol - a place in thailand
อุปกรณ์	felszerelés	instrument
อุปกรณ์คอมพิวเตอร์	számítógép tartozékok	computer hardware
อุปนิสัย	karakter	manners
อุภัยราศี	bocsáss meg az állatöv	ambivert zodiac
อุรุกวัย	uruguay	urookwai - a location
อุเทน	uthen	utain - a male's name
อู	ou	u (a vowel)
อู๋	wu	auu (first name)
อเมริกัน	amerikai	american
อเมริกา	amerika	america, usa
อเมริกาเหนือ	észak amerika	north america
อเล็กซานเดอร์	sándor	alexander
อเล็กซ์	alex	alex
อโลหะ	félfém	nonmetal
อ่อนเพลีย	fáradt	fatigue
อ่าน	olvas	read
อ่าวลึก	ao luek	ao luek
อ้างว่า	azt állítják, hogy	claim
อ้างว้าง	elhagyatott	loneliness
ฮอกกี้	jégkorong	hockey
ฮอท	forró	hot
ฮอฟมัน	hoffman	hoofman - a name
ฮอยเกนส์	hogens	huygens
ฮอร์โมน	hormon	hormone
ฮอลแลนด์	hollandia	holland
ฮอลโลว์	üreges	hollow (as in dead soul)
ฮอว์ค	seahawks	hawk
ฮักบี้	viszontlátásra	hugby - an album that received many awards
ฮันกึล	hangul	hangeul
ฮัมบูร์ก	hamburg	hamburg
ฮาจิ	hachi	haji
ฮาตาเกะ	hatake	hatake
ฮานอย	hanoi	hanoi
ฮายาโตะ	hayato	hayada - a japanese surname
ฮารุกะ	haruka	haruka - a japanese name
ฮาวาย	hawaii	hawaii
ฮิซาชิ	hisashi	hitachi
ฮิซานะ	hisana	hisana
ฮิตเลอร์	hitler	hitler
ฮินาตะ	hinata	hinada - a japanese story
ฮิมาวาริ	himawari	himawari - a japanese surname
ฮิราโกะ	hirako	hirako (japanese name)
ฮิวงะ	hyuuga	hewnga - a japanese name from a story
ฮิโซกะ	hisoka	hisoka
ฮิโรชิ	hiroshi	hiroshi
ฮีชอล	heechul	heechul
ฮุก	horog	hook
ฮโยยอน	hyoyeon	hyoon - a dancer from japan
ฯพณฯ	őkegyelmessége	two thai alphabets.  abbreviation that means many things
เกตส์	gates	gates
เกตุทัต	ketthat	kettut - a surname
เกมที่	a játék	game number _________
เกมบุค	játszma, meccs	game book
เกรย์	szürke	gray
เกษตรกรรม	mezőgazdaság	farming
เกษตรวิสัย	kaset wisai	kasetvisai (name of thai district)
เกษมศรี	kasemsri	kasemsri surname
เกอริง	gering	the name 'gerring'
เกอไทต์	goethe	goethite mineral
เกาหลีใต้	dél-korea	south korea
เกาะ	sziget	island
เกาะคา	kauai	ko kha
เกาะลูซอน	luzon-sziget	luzon island
เกาะสุมาตรา	sumatra	sumatra
เกิด	született	born
เกิดขึ้นหลังจากมหาวิทยาลัยศรีนครินทรวิโรฒวิทยาเขตต่างๆ	a srinakharinwirot egyetem után jött létre	happened after srinakarinviroj university started
เกิดขึ้นเมื่อวันที่	megtörtént	birthdate
เกิดจากการรวมชิ้นส่วนที่	azokat az alkatrészeket kombinálva, amelyek	put together to form something
เกิดจากการรวมตัวของ	beépítése okozta	combination of
เกิดจากเชื้อไวรัส	a vírus okozta	occur from the viral agent
เกิดนิมิตร	készítsen jövőképet	caused a vision/realization
เกียรติ	becsület	honour
เกียรติประวัติ	becsület	biography
เกียรติศักดิ์	dicsőség	reputation.  kietisak can be a male's name
เกียวโตะ	kyoto	kyoto
เก็กโค	chegoe	gecko
เขตคลองสาน	khlong san kerület	klongsan district
เขตจอมทอง	chom thong körzet	jomthong area
เขตดุสิต	dusit	khet dusit
เขตที่	kerület	district number _______
เขตบางกอกใหญ่	bangkok yai kerület	bangkok yai district in thailand
เขตบางซื่อ	bang sue kerület	bang sue district
เขตบางแค	bang khae	bang khae district
เขตปทุมวัน	pathumwan	pathum wan district
เขตภาษีเจริญ	phasi charoen körzet	phasi charoen district
เขตมีนบุรี	min buri kerület	min buri district
เขตรักษาพันธุ์สัตว์ป่า	vadon élő állatok szentélye	national wildlife preserve
เขตรักษาพันธุ์สัตว์ป่าภูหลวง	phu luang vadvédelmi szentély	wildlife preserve
เขตลาดกระบัง	lat krabang	lad krabang district
เขตวังทองหลาง	wang thonglang körzet	wang thonglang district
เขตวัฒนา	wattana körzet	watana district
เขตสวนหลวง	suan luang körzet	suan luang district
เขตสาทร	sathon	sathorn area
เขตห้วยขวาง	huai khwang	huai khwang district
เขตเลือกตั้งที่	kerület	election area number
เขมนิจ	parancsoló	khemanit
เขากล่าวว่า	ő mondta	he said
เขาทราย	khao sai	sand dunes
เขียนว่า	írja ezt	wrote
เขียนโดย	írta	written by
เขี้ยวพิษ	mérgező agyarak	vemon fangs
เขื่อนกิ่วลม	kio szélgát	kio lom dam
เขื่อนป่าสักชลสิทธิ์	pasak chonlasit dam	parsakchonlasit dam
เขื่อนลำปาว	lampao dam	lum pao dam
เขื่อนแม่งัดสมบูรณ์ชล	mae ngad somboon chon dam	mae ngud som bul chol dam in chiangmai
เข็มศิลปวิทยา	needle arts	khem sinlapawitthaya
เข็มอัปสร	tű	kem uppasorn - a thai drama
เข่า	térd	knee
เข้าฉาย	előadás	release date
เข้าชิงไนน์เอ็นเตอร์เทนอวอร์ดส	kilenc szórakoztató díjra jelölték.	compete in entertaining world
เข้ารอบ	döntős	made it to the next round, selected from the initial round
เข้าเฝ้า	van közönsége	visit (word for the king)
เคน	ken	ken
เคนยา	kenya	kenya
เคมีไฟฟ้า	elektrokémia	electrochemistry
เคยสู้กับโกคุเทระ	harcoltak a gokudera-val	fought with gokudera
เครือข่าย	a hálózat	network
เครื่องขัตติยราชอิสริยาภรณ์อันมีเกียรติคุณรุ่งเรืองยิ่งมหาจักรีบรมราชวงศ์	a chakri-dinasztia nagy becsületének megemlékezése	something used in a thai ceremony - too obscure
เครื่องดีด	veri a zongorát	thai string musical instruments
เครื่องตี	beat gép	musical intrument
เครื่องบิน	repülőgép	airplane
เครื่องปั้นดินเผาและเซรามิค	kerámia és kerámia	pottery and ceramic
เครื่องยนต์	motor	engine
เครื่องราชอิสริยาภรณ์	jelvény	the king's accessories for ceremonies
เครื่องราชอิสริยาภรณ์อันเป็นที่เชิดชูยิ่งช้างเผือก	a jelvény, amely dicsőíti a fehér elefántot	order of the white elephant
เครื่องราชอิสริยาภรณ์อันเป็นสิริยิ่งรามกีรติ	kirati nagy dicsőségének jelképe	king's accessories
เครื่องราชอิสริยาภรณ์อันเป็นโบราณมงคลนพรัตนราชวราภรณ์	ősi jelvények	the ancient and auspicious order of the nine gems
เครื่องสาย	húros hangszerek	string instrument
เครื่องแต่งกาย	kosztüm	clothes
เคลลี่	kelly	kelly
เคอาร์วาย	kryy	k.r.y
เค้ก	torta	cake
เงิน	pénz	money
เงินทุน	finanszírozás	fund
เงินในบัญชีธนาคาร	pénz a bankszámlán	balance
เงี้ยว	kanyargós	shan tribe in northern part of thailand
เจ	j	j.
เจนี่	janie	jenny
เจมินี่	ikrek	gemini
เจริญ	nő	charoen
เจสเปอร์	jesper	jasper
เจียะแจ	jae jae	nine emperor gods festival
เจี๊ยบ	csaj	jeab (thai name)
เจเน็ต	janet	janet
เจ็ดเทพโจรสลัด	shichibukai	seven warlords of the sea
เจ็บ	fájó	pain
เจ้าของจุกนม	mellbimbó tulajdonos	the owner of the baby's bottle
เจ้าจอม	fő	king's concubine
เจ้าฟ้ากรมพระยานริศรานุวัดติวงศ์	krom herceg phraya narisaranu, tiwong-templom	refer to a title of a royal family member - jao fa krom pra ya rissanuwattiwong
เจ้าฟ้ากรมพระยานริศรานุวัติวงศ์	krom prince phraya narisara nuwatwong	prince narisara nuvativongse
เจ้าฟ้าจิตรเจริญ	jitcharoen herceg	prince chitcharoen
เจ้าฟ้าภาณุรังษีสว่างวงศ์	phanurangseesawangwong herceg	prince panuragui bright chestnut.
เจ้าฟ้ามหาวชิราลงกรณ	maha herceg vajiralongkorn	thailand's crown prince
เจ้าฟ้ามหาวชิรุณหิศ	mahawajirunhit herceg	crown prince maha vajirunhis
เจ้าฟ้ามหิดลอดุลยเดช	mahidol adulyadej herceg	prince mahidol adulyadej
เจ้าฟ้ามหิดลอดุลเดช	mahidol adulyadej herceg	a member of thai royalties
เจ้าฟ้าหญิง	hercegnő	princes
เจ้าฟ้าอุบลรัตนราชกัญญา	ubonrattanarajakanya herceg	princess ubon ratana graz's' contract.
เจ้าหนี้การค้า	kötelező követelések	trade account payable
เจ้าเมือง	kormányzó	mayor
เจ้าเมืองขุขันธ์	khukhan kormányzója	a name of the head of the state
เจ้าโลก	uralom	world conqueror
เฉพาะด้านตะวันออกเฉียงใต้เท่านั้นที่เป็นที่ราบลุ่มแม่น้ำโขง	csak a délkeleti oldalán található a mekong-folyó medence.	only south-east area that is in mekhong plateau
เฉลิม	chalerm	chalerm - a male's name
เฉลิมชัย	chalermchai	chalermchai
เฉลิมชัยเจริญกิจ	chalermchai charoenkit	chalermchaichareonkij
เฉลิมพระเกียรติ	becsület	chaloem phra kiat
เฉลิมพล	chalermpol	shalermpol - a surname
เฉลิมแสน	chalermsaen	chaloemsaen
เฉลียว	figyelmes	chaleuw - a male's name
เชส	üldözés	(jp morgan) chase
เชอร์รี่	cseresznye	cherry
เชา	ebéd	chow -  a chinese name
เชาวน์	intelligencia	chow - a name
เชาวราษฎร์	chaowarat	chowarat - the surname of a famous actress
เชิญยิ้ม	mosoly	smile
เชิดชัย	conquer	"name ""churd-chai"""
เชียงกลาง	chiang klang	chiang klang
เชียงของ	chiangkhong	chiang khong
เชียงดาว	chiang dao	chiang dao
เชียงปุม	chiang pum	chiang poom - area in thailand
เชียงยืน	chiang yuen	chiang yuen
เชียงราย	chiang rai	chiang rai
เชียงใหม่	chiang mai	chiang mai
เชี่ยววงศ์กุล	chiewwongkun	chiaowongkul
เชื่อมต่อกับรถไฟฟ้ามหานคร	csatlakoztatva az mrt-hez	connect with skytrain
เชื่อมแม่น้ำท่าจีน	csatlakoztassa a tha chin folyót.	confluence to the ta jean river
เชื้อชาติ	verseny	helping the country
เชื้อรา	a gomba	fungus
เช็ค	jelölje be	check
เช่นกัน	is	as well
เช่นเดียวกัน	hasonlóképpen	similar to
เช้ามืดวันที่	a nap hajnala	in dawn of
เช้าวันรุ่งขึ้น	a következő reggel	next morning
เซกิ	seki	seki
เซน	zen	saint
เซนทอร์	kentaur	centaur
เซบาสเตียน	sebastian	sebastian
เซฟ	mentés	save
เซลล์	sejt	cell
เซสติโม	seto	settimo
เซอร์	úr	sir
เซอร์วิส	szolgáltatás	service
เซอร์เบีย	szerbia	serbia
เซอวิวาสแตติน	cervivastin	cerivastatin - drug
เซโรกัชเชอร์	sero kutcher	sero gusher - a type of weapon
เซโรนอส	seronos	zeronos
เซโรไลเนอร์	seroliner	seroliner
เซ็กส์	szex	sex
เซ็นทรัล	központi	central - department stores in thailand
เซ็นทารา	centara	centara
เซ็นเซอร์	az érzékelő	sensor
เณร	neofita	samanera
เดคลิเนชัน	decloration	declination
เดชา	dacsa	decha
เดธโน้ต	halállista	death note - a mysterious japanese cartoon
เดนกัชเชอร์	denkucher	den gusher - a weapon in japanese movies
เดนโอ	den o	den-o
เดนโอเบลท์	denobelt	den-o belt
เดย์	nap	day
เดอะซิมส์	the sims	the sims
เดอะฮาเดส	a hádák	the hades
เดอะฮาเดสแชปเตอร์	a hades fejezet	the hades chapter
เดิม	régi	at first
เดิมชื่อ	korábban	former name
เดิมที	eredetileg	at first
เดิมเรียกว่า	korábban:	formerly known as
เดียวกัน	azonos	same
เดือดทะลุจุดศูนย์	forrás a közepén	zero point breakthrough
เดือนกุมภาพันธ์	február	february
เดือนตุลาคม	október	october
เดือนตุลาคมมีฝนตกชุกที่สุด	október a legészségesebb.	highest amount of rainfall in october
เดือนธันวาคม	december	december
เดือนมกราคม	január	january
เดือนมิถุนายน	június	june
เดือนอ้าย	holdhónap	first lunar month
เด็กหญิงอายุ	öreglány	the girl's age
เด็กและเยาวชน	gyerekek és fiatalok	children and youth
เต่า	teknősbéka	tao (first name)
เต๋อ	nak nek	ter
เถรวาท	elmélet	buddha's teaching
เทคนิคอิลลูชั่น	illúziós technika	technique illusion
เทควันโด้	taekwondo	tai kwon do
เทคโนโลยี	a technológia	technology
เทคโนโลยีสารสนเทศ	információs technológia	san son tej techonology
เทนนิส	tenisz	tennis
เทนโจอิน	tenjo-ben	tenjoin - a character in a japanese story
เทพพิทักษ์	theppitak	theppitak
เทพมรณะ	halal isten	bleach
เทพหัสดิน	mennyei isten	tephussadin (a surname)
เทพอานูบิส	anubis	anubis
เทพอาเตน	athen	aten
เทพีเธมิส	istennő	themis
เทริโอ	therio	terio - surname of a singer
เทวดา	angyal	angel
เทวรูป	bálvány	graven image
เทศบาล	az önkormányzat	municipality
เทศบาลนครขอนแก่น	khon kaen önkormányzat	khon khan public works
เทศบาลนครนครราชสีมา	nakhon ratchasima	nakorn rachasrima province public work
เทศบาลนครนครศรีธรรมราช	nakhon si thammarat	nakorn sri thamarat city public works
เทศบาลนครเชียงราย	chiang rai	chiang rai province public works
เทศบาลนครเชียงใหม่	chiang mai önkormányzat	chiang mai municipality
เทศบาลเมืองชัยภูมิ	chaiyaphum önkormányzat	mueang chaiyaphum
เทศบาลเมืองบุรีรัมย์	buriram	bureerum public works
เทศบาลเมืองมหาสารคาม	maha sarakham municipality	thesaban mueang maha sarakham
เทศบาลเมืองมุกดาหาร	mukdahan önkormányzat	mookdahan public works
เทศบาลเมืองสกลนคร	sakon nakhon önkormányzat	municipality of sakonnakon
เทศบาลเมืองหนองคาย	nong khai önkormányzat	nong khai municipality
เทศบาลเมืองหนองบัวลำภู	nong bua lamphu városi önkormányzat	nong bua lam phu town municipality
เทศวิศาล	kiterjedt	tasavisakal - a surname
เทิดศักดิ์	becsület	therdsak
เทียนทอง	arany gyertyák	tientong - a male's name
เทียนเงิน	ezüst gyertya	tienngern
เทียนโพธิ์สุวรรณ	thian pho suwan	tianphosuwan (thai last name)
เทเบิลเทนนิส	asztali tenisz	table tennis
เทโรศาสน	tero sasana	terosat football club
เท็ดดี้	teddy	teddy
เท็นเท็น	tíz tíz	tin-tin
เท่ง	teng	teng (first name)
เท่านั้น	csak	only
เธคุนุ	támogatás	dhekunu
เธรซ	trákia	thrace - an area in greece
เธอกับฉัน	te és én	you and i
เธอจะอยู่กับฉันตลอดไป	mindig örökre velem maradsz	you will be with me forever
เธอยัง	még mindig	tur yung
เธอเป็นเพื่อนอาบาราอิ	abarai barátja.	she is a friend of arbarae
เนกิ	negi	negi
เนย	vaj	butter
เนรมิต	feltalál	casting a spell
เนะ	jobb	ney
เนื่องจาก	mivel	because
เนื่องจากประเทศเหล่านั้นอยู่ในตำแหน่งบนโลกที่ต่างไปจากประเทศไทย	mivel a földön olyan helyzetben vannak, amely eltér thaiföldtől	because those countries are in the group of...
เนื้อที่	terület	area
เนื้อที่ประมาณ	hozzávetőleges terület	approximate area
เนื้อร้อง	dalszöveg	lyrics
เนื้อเรื่องย่อ	összefoglalás	summary
เนเธอร์แลนด์	hollandia	netherlands
เนโกะ	neko	neko
เน็น	nen	nen
เบจิต้า	bechita	vegeta
เบธเลเฮม	betlehem	bethleham
เบนจามิน	benjámin	benjamin
เบรกมา	szünet	bregma
เบริธ	berith	berith
เบลเฟกอล	bellegal	belphegor- a demon in a legend
เบส	basszus	bass
เบอร์ลิน	berlin	berlin
เบา	fény	soft (voice)
เบาท์	baut	(dieric) bouts
เบาหวาน	cukorbetegség	diabetes
เบื่ออาหาร	unatkozik az étel	not appetite, eating disorder.
เบื้องหลัง	háttér	behind the sence
เบโทเฟิน	beethoven	beethoven
เบ็นเท็น	ben 10	ben 10
เปรม	elégedett	pream
เปรี้ยว	savanyú	sour
เปรู	peru	peru
เปลวไฟ	láng	flame
เปลี่ยนชื่อเป็น	átnevezve	changed the name to
เปลื้อง	megfoszt	nude
เปล่งพานิช	plengpanich	plengpanich
เปอร์เซีย	persia	persia
เปอร์โตริโก้	puerto rico	puerto rico
