+	+	plus sign
=	=	equal to
 °ซ  °ฟ 	° c	เซลเซียส ฟาเรนไฮต์
 ซม	centimeter	cm.
 −°ซ  °ฟ	- ° c	thai letters
×	×	letter x
γ	γ	y
π	π	pi
กกกก	kg	a thai letter repeated 4 times
กกกข	khor khor	4 thai alphabets - jibberish
กขขข	abc b	4 of thai letters
กขขขขขขข	a b a b b b a	abbbbbbb
กฎ	regel	law, rule
กฎของโคไซน์	kosmetallag	law of cosines
กฎแห่งกรรม	karma	bad karma
กติกา	regler	rule
กทม	bangkok	agency
กนู	riddare	gnu - computer related acronym
กบ	groda	frog
กบฏทหารนอกราชการ	militär uppror	coup de lat
กมล	lilja	kamon
กมลรัตน์	kamonrat	kamolrat - a surname
กรณีที่	fallet	case
กรมขุนอิศเรศรังสรรค์	krom khun iset rangsan	the convention of angels
กรมขุนเพ็ชรบูรณ์อินทราชัย	kromkhunpetchaboon-indachai	department of....
กรมข่าวทหารอากาศ	avdelningen för flygvapen news	communication department of the thai air force
กรมควบคุมโรค	institutionen för sjukdomskontroll	department of disease control
กรมทหารราบที่	infanteriregiment	infantry regiment
กรมรบพิเศษที่	avdelningen för specialstyrkor	special force group
กรมศิลปากร	konst för avdelning	fine arts department
กรมหลวงนราธิวาสราชนครินทร์	krom luang narathiwatratchanakharin	krom ma loung naratifatrachanakarin - the name of a royal family member
กรมหลวงสงขลานครินทร์	krom luang songkhla nakarin	prince of songkla
กรมอุตุนิยมวิทยา	meteorologisk avdelning	the meteorology department
กรรชัย	kanchai	kanchai
กรอง	filtrera	screen
กระดูกค้อน	hammerben	malleus, hammer bone
กระดูกต้นแขน	humerus	humerus
กระดูกฝ่ามือ	palms	metacapus
กระดูกสะบัก	skulderblad	scapula
กระดูกสะบ้า	patella	kneecap
กระทรวงกลาโหม	försvarsministeriet	defense ministry
กระทรวงการคลัง	finansdepartementet	ministry of finance
กระทรวงการต่างประเทศ	utrikesministeriet	ministry of foreign affairs
กระทรวงวัฒนธรรม	kulturministeriet	ministry of culture
กระทรวงศึกษาธิการ	undervisningsministeriet	ministry of education
กระทรวงสาธารณสุข	ministeriet för folkhälsa	ministry of public health
กระทรวงอุตสาหกรรม	industriministeriet	ministry of industry
กระทรวงเกษตรและสหกรณ์	ministeriet för jordbruk och kooperativ	ministry of agriculture and cooperatives
กระทรวงเศรษฐการ	ministeriet för ekonomi	ministry of commerce
กระทุ่มแบน	liten korg	krathum baen district, samut songkram province
กระนวน	tonhöjd	granuan - location in knon kan province
กระนั้น	ändå	however
กระบวนการสร้าง	byggnadsprocess	anabolism
กระบวนการสร้างและสลาย	process för att skapa och desintegrera	metabolism
กระบอง	blackjack	club
กระบะทราย	sandlåda	litter box or sand box
กระบี่กระบอง	tävling med svärd	krabi krabong (swordplay)
กระรอก	ekorre	squirrel
กระวนกระวาย	angelägen	nervous
กระหม่อม	huvud	fontanelle
กระเพาะอาหาร	mage	stomach
กระแต	chipmunk	wasp
กรับ	plocka upp	wooden rhythm clappers
กรับพวง	välj ett gäng	krap phuang
กรับเสภา	krapao	wooden rhythm clappers
กรัม	gram	gram
กรัยวิเชียร	kraiwichian	krivician - a surname
กรานาดา	granada	granada
กริม	grimm	grim
กรี	grå	karee
กรุง	huvudstad	city
กรุงธนบุรี	thon buri	thonburi city
กรุงลอนดอน	london	london
กรุงศรีอยุธยา	ayutthaya	sri ayuttaya city - former capital of thailand
กรุงเทพ	bangkok	bangkok
กรุงเทพเชียงใหม่กรุงเทพ	bangkok, chiang mai, bangkok	bangkok changmai bangkok
กรุงเทพโพลล์	bangkok poll	bangkok poll
กรุ๊ป	grupp	group
กลอง	trumma	drum
กลองมโหระทึก	stor trumma	big drum
กลองยาว	trumma	tom-tom
กลองสองหน้า	tvåfasad trumma	glong songna
กลอน	vers	poem
กลอบูลิน	glansig	globulin
กลาง	mitten	in the middle
กลิ่น	lukt	odor
กลุ่มดาวกล้องจุลทรรศน์	konstellationer av mikroskop	microscopium
กลุ่มดาวนกทูแคน	toucan	tucana
กลุ่มดาวสิ่ว	mejsel	siu star
กลุ่มดาวเข็มทิศ	konstellationskompass	pyxis constellation
กลุ่มดาวเตาหลอม	smältugn	fornax
กลุ่มดาวแมงป่อง	scorpion	scorpion constellation
กลุ่มดาวแมลงวัน	flugor	musca
กลุ่มที่	gruppen	group
กลุ่มแสงอุษา	usa light group	light at dawn
กลูคากอน	glucon	glucagon
กล่าวคือ	det vill säga	that is
กล้วยไม้ดาว	stjärnorkidé	type of orchid that have slim petal like star
กล้องถ่ายภาพ	kamera	camera
กล้ามเนื้อ	muskel	muscle
กวม	guam	obscure
กวาง	rådjur	deer
กวิน	kawin	gwen - a name
กวี	poet	poet
กว่า	än	than
กองกลาง	mittfältare	headquarter
กองการบินทหารเรือ	naval aviation division	the flying section of the navy
กองการศึกษา	utbildningsavdelningen	education group
กองการเจ้าหน้าที่	personalavdelningen	division of personnel
กองกำลังกึ่งทหาร	semi-militära styrkor	armforces
กองคลัง	finansavdelningen	division of finance
กองทัพ	armén	arm forces
กองทัพบกไทย	thailändska armén	thai army
กองทัพภาคที่	army of the region	army area
กองทัพเรือ	marin	navy
กองทัพเรือไทย	thailändsk marin	the royal thai navy
กองทัพแห่งความชอบธรรม	rättfärdighetens armé	army of the righteous
กองทัพไทย	thailändsk armé	thai military forces
กองบิน	flygande grupp	air force
กองบินปีกหมุนที่	wing spinning wing	flight corp number __________
กองพลทหารม้าที่	kavalleribrigaden	cavalry division
กองพันทหารช่างที่	ingenjörsbrigaden	troop unit number ___________`
กอด	kram	kord
กอนซาเลซ	gonzalez	gonzales - a name
กอร์ดอน	gordon	gordon
กอลมเบต์	goreme	glombet - a catholic priest
กอล์ฟ	golf	golf
กอล์ฟไมค์	golf mic	golf-mike
กะเหรี่ยง	karen	karen
กะโหลก	skalle	skull
กะโหลกศีรษะ	skalle	skull; cranium
กังหันชัยพัฒนา	chaipattana turbin	chaipattana's windmill
กันดั้ม	gundam	gundam - a cartoon
กันตัง	kantang	kuntun in trung state
กันทรลักษ์	kantharalak	kuntaraluk - an area in thailand
กันฟอร์ม	form	gun form
กันอริ	kanori	gan-ari
กันเอง	i godo	casual
กับนางสุจาริณี	med fru sucharinee	with mrs. sujarinee
กัมปูเชีย	kampuchia	kampuchea
กัมพูชา	kambodja	cambodia
กัมพูชาประชาธิปไตย	demokratisk kambodja	democratic kampuchea
กัมพูชาเป็นประเทศที่มีป่าไม้อุดมสมบูรณ์มากที่สุดหากเปรียบเทียบกับประเทศเพื่อนบ้าน	kambodja är det land med de mest rikliga skogarna när man jämför med grannländerna.	cambodia is the country with nice, healthy forests
กัมพูชาเป็นอดีตประเทศอาณานิคมของฝรั่งเศสในภูมิภาคเอเชียตะวันออกเฉียงใต้เพียงแค่ประเทศเดียวเท่านั้นที่มีการปกครองด้วยระบอบราชาธิปไตยภายใต้รัฐธรรมนูญ	kambodja är det enda före detta franska koloniallandet i sydostasien som har monarki under konstitutionen.	cambodia was a former french colony
กัมพูชาเป็นอาณานิคมของฝรั่งเศสมาตั้งแต่พศ	kambodja har varit en fransk koloni sedan dess.	cambodia was a france colony from year
กัวเตมาลา	guatemala	guatemala
กานซู	gansu	honshu in china
กานต์	kan	kan
กานา	ghana	ghana
กานามัยซิน	kanamycin	kanamycin
กาบอง	gabon	baton
กาพย์ฉบัง	episk dikt	poem
กาพย์สุรางคนางค์	dikt	gabsuranknang
กาม	hänsynslös	lust
กาย	kropp	body
การ	de	project
การกีฬา	sporter	sport
การขัดเกลาทางสังคม	socialisering	socialization
การขับถ่าย	exkretion	excretion
การขับไล่	vräkning	discharge
การคมนาคม	transport	transportation department
การคลัง	finansiera	public finance
การค้นพบ	upptäckten	discover
การค้า	bytet	marketing
การจัดการ	styrelsen	project
การจัดการคุณภาพ	kvalitetshantering	quality control
การจัดอันดับ	rankning	ranking
การจัดให้มี	tillhandahållande	putting together something
การจูบ	en kyss	kissing
การชัก	beslag	the act of pulling the flag wiht string up the pole
การดำเนินการ	en insats	progression
การตอบรับ	respons	welcoming
การตั้งถิ่นฐาน	lösning	start a project
การต่างประเทศ	utrikesfrågor	foreign affairs
การทำงานของ	arbetet med	function
การทำป่าไม้	skogsbruk	forestry
การท่องเที่ยว	turism	tourism
การท่าเรือ	hamnmyndighet	port authority
การบริการ	service	customer service
การบริหารการพัฒนา	utvecklingshantering	development
การบริหารการศึกษา	utbildningsadministration	educational administration
การบริหารจัดการ	förvaltning	management
การบริหารราชการแผ่นดิน	statsförvaltningen	administration
การบินไทย	thai airways	thai airways
การปกครองท้องถิ่น	kommunerna	local administration
การปกครองส่วนท้องถิ่น	kommunerna	local government
การปกครองแบ่งออกเป็น	regeln är indelad i	administration
การปฏิรูประบบจัดเก็บภาษีเงินได้	reform av systemet för inkomstskatt	taxation reform
การปฏิรูปศาสนา	reformation	religious reformation
การปฏิวัติฝรั่งเศส	franska revolutionen	french revolution
การปฏิวัติอุตสาหกรรม	industriell revolution	industrial revolution
การปฏิสนธิ	befruktning	fertilisation
การประมง	fiske	fishery
การพัฒนา	utvecklingen	development
การพัฒนาประชาธิปไตย	demokratisk utveckling	democratic development
การพูด	tala	speaking
การยึดครองมะละกาของโปรตุเกสในปี	portugisiska ockupationen av melaka under året	portugal took over malaga
การระบาดของไข้หวัดใหญ่สายพันธุ์ใหม่	den nya influensastammen	flu pandemic
การรักษาพยาบาล	medicinsk vård	nursing care
การร่วมเพศทางทวารหนัก	anal jävla	sodomy
การลดรูป	deformerande	reduction
การละเล่นพื้นบ้าน	folkspel	local game
การวิจัย	forskning	researching
การวิเคราะห์	analysen	analysis
การศึกษา	utbildningen	study of, education
การสังคายนาครั้งที่	den sista beställningen	the event of convention of monks
การสั่นพ้อง	resonans	resonance
การสำเร็จความใคร่ด้วยตนเอง	onani	masturbation
การสืบพันธุ์	fortplantning	reproduction
การสื่อสาร	kommunikation	communications
การาจ	garage	garage
การุณ	karun	karoon
การเต้นรำ	dansen	dance
การเพิ่มสิทธิประโยชน์แก่นักลงทุนต่างประเทศ	ökande privilegier för utländska investerare	increase benefits for foreign investors
การเล่น	att spela	play
การแข่งขัน	tävlingen	competition
การแบ่งพื้นที่	dela	land division
การใช้คำ	ordanvändning	terminology
การไฟฟ้าส่วนภูมิภาค	provinsial elmyndighet	distribution electric transformer
การไหว้	respekt	thai greeting
การ์ด	kort	guard
กาฬสินธุ์	kalasin	katsin - a thai surname
กาเวน	gawain	gawain
กาเหว่าที่บางเพลง	the raven of some songs	the cuckoo's song.
กำกับการแสดงโดย	regisserad av	produced by (movie)
กำกับโดยอภิชาติพงศ์	regisserad av aphichat pong	produced by apichartpong - a famous thai movie producer
กำมะถัน	svavel	sulfur
กำลังจะปรับเปลี่ยนเป็น	kommer att byta till	is changing to
กำหนดตามสภาพภูมิศาสตร์	bestäms av geografi	geography estimation
กำแพงเพชร	kamphaeng phet	kamphaeng phet
กำแพงเมืองจีน	den kinesiska muren	the great wall of china
กำแพงแสน	kamphaengsaen	kampangsaen (name of district)
กิจผลิต	produktion	kitpalit (last name)
กิมป์	gimb	gimp - gnu image manipulation program
กิโลกรัม	kg	kilogram
กิโลไบต์	kb	kilobyte
กิ่งแก้ว	kingkaew	kingkaeo
กิ้งกือ	tusenfoting	millipedes
กิ๊ก	kik	gig
กีฏวิทยา	entomologi	entomology
กีฬา	sport	sports
กีฬาทางน้ำ	vattensporter	water sports
กีฬาแหลมทอง	laem thong sport	seap games
กุดจับ	forma	good jub - a place
กุลดิลก	kuldilok	kuldilok
กุลละวณิชย์	kulalawanit	kullawanich
กุหลาบ	reste sig	kularb (first name)
กุ้ง	räka	shrimp
กุ้งต้ม	kokt räka	boiled shrimp
กูเกิล	google	google
ก็คือ	är	which is
ก็ใช้เป็น	används som	utilize
ก่อตั้ง	grundad	founded
ก่อตั้งโดย	grundad av	make by
ก่อนที่	innan	before
ก่อนที่จะตกเป็นของฝรั่งเศสในเวลาต่อมา	innan han blev frankrike senare	belonging to france, under the control of france
ก่อนหน้านั้น	före det	before
ก้อย	pinky	koi
ก้าน	stjälk	thorn
ก้านกล้วย	bananstjälk	kankluai
ก๊าซธรรมชาติ	naturgas	natural gas
ก๎ล	gåva	magic
ขขขขขขขขขข	b b b b b b b	repeated letter from thai alphabet
ขณะทรงพระเยาว์	medan han var ung	having to do with the young prince or princess
ขณะที่	medan	while
ขนม	godis	dessert
ขนมกล้วย	banan	banana dessert
ขนมครก	knmcrk	kind of thai sweetmeat
ขนมปัง	bröd	bread
ขนมปังขิง	pepparkaka	gingerbread
ขนมเปียกปูน	romb	a type of thai dessert with flour and sugar
ขนมไทย	thailändsk efterrätt	thai dessert
ขนสัตว์	ull	fur, animal hair
ขนอม	khanom	kanom - location in thailand
ขนาดหน้าตัก	varvstorlek	length between both knees of buddha statue in posture of meditation
ขนาดใหญ่	stor storlek	l
ขบวนการอ๊บอ๊บป่วนโลก	jordens rörelse	original name is keroro gunso
ขบวนรถสินค้า	tåg	caravan of trucks
ขม	bitter	bitter taste
ขรรค์ชัย	khan chai	kanchai - a male's name
ขลุ่ยหลิบ	flöjt	khlui lib
ขวด	flaska	bottle
ขวัญ	moral	morale
ขวัญใจช่างภาพ	älskad fotograf	miss photogenic
ขสมก	massa	an acronym consists of four thai letters
ของ	av	of
ของทุกปี	varje år	every year
ของประเทศจีน	av porslin	owned by china
ของมหาวิทยาลัย	av universitetet	of university
ของมัน	dess	their
ของร่างกาย	av kroppen	of the body
ของสมเด็จฮุน	av somdej hun	houssaine of cambodia
ของสิ่งมีชีวิต	av levande saker	living things
ของสุนทรภู่	av sunthorn phu	belong to soon thong pu (a thai legend)
ของเหลว	flytande	liquid
ของโลก	av världen	of world
ขอนแก่น	khon kaen	khon kan - an area in thailand
ขอบคุณที่รักกัน	tack för att du älskar mig	thank you for loving each other
ขอเช็ดน้ำตา	låt oss torka bort tårarna	wipe the tears
ขอให้เด็กสมัยปฏิวัติของข้าพเจ้า	må min revolutionära barn	i hope that the children in my lifetime will ____________
ขั้นที่	steg	level
ขา	ben	leg
ขาย	sälja	sell
ขิง	ingefära	ginger
ขิม	cymbal	kim - a thai musical instrument
ขีดเส้นใต้	understrykning	underline
ขี้ผึ้ง	vax	wax
ขึ้นเป็น	upp till	to
ขึ้นไป	upp	next one up
ขุขันธิน	khan tin	kukuntin
ขุนหาญ	han	koonhan - a location in thailand
ข้อมูลทั่วไป	allmän information	general information
ข้อมูลประเทศเดนมาร์ก	danmark information	information on denmark
ข้อมูลปรากฏการณ์โลกร้อน	global uppvärmningsfenomen	global climate change
ข้อมูลปี	årsdata	information from the year ________
ข้อมูลอื่นๆ	annan information	other information
ข้อมูลโดย	data av	information from
ข้อวิพากษ์วิจารณ์	kritik	critique reports
ข้ามฉาก	över hela scenen	sin(a)
ข้าวสาลี	vete	wheat
ข้าวหลาม	khao lam	bamboo rice
ข้าวเกรียบปากหม้อ	risknäckare	a thai snack
ข้าวเจ้า	irländare	white rice
ข้าวโพด	majs	corn
ข้าหลวงกำกับราชการเมืองขุขันธ์คนที่	guvernör, guvernör i khukhan stad	government worker for ku khan city
ฃ	ฃ	a letter from thai alphabet
คงยิ่ง	väldigt troligt	kongying
คงเจริญ	förmodligen blomstrar	khongcharoen
คณะครุศาสตร์	utbildningsfakulteten	education department
คณะครุศาสตร์อุตสาหกรรม	fakulteten för industriell utbildning	faculty of industrial education
คณะที่	fakulteten kl	the current administration
คณะบัญชี	fakulteten för bokföring	accounting department (major)
คณะปฏิรูปการปกครองแผ่นดิน	revolutionerande kommitté	national administrative reform council
คณะประมง	fiskeriska fakulteten	fishery division of the college of farming and agriculture
คณะพยาบาลศาสตร์	sjuksköterskefakulteten	nursing department
คณะมนุษย์ศาสตร์และสังคมศาสตร์	fakulteten för humaniora och samhällsvetenskap	humanity department
คณะรัฐมนตรีคณะที่	skåp	council of ministers
คณะวิทยาการจัดการ	fakulteten för ledningsvetenskap	management department
คณะวิศวกรรมศาสตร์	ingengörsfacilitet	engineering department
คณะศิลปกรรมศาสตร์	fakulteten för konst	faculty of fine arts
คณะสถาปัตยกรรมศาสตร์	arkitekturfakulteten	faculty of architecture
คณะสหเวชศาสตร์	fakulteten för allierade hälsovetenskaper	อังกฤษ   faculty of allied health science
คณะสาธารณสุขศาสตร์	fakulteten för folkhälsa	faculty of public health
คณะเกษตร	jordbruksuniversitetet	faculty of agriculture
คณะแพทยศาสตร์ศิริราชพยาบาล	medicinska fakulteten siriraj sjukhus	faculty of medicine siriraj hospital
คณะแพทยศาสตร์โรงพยาบาลรามาธิบดี	medicinska fakulteten, ramathibodi hospital	the staff of ramatippadee hospital
คณารศ	kanara	kanaros - a surname
คนที่	personen som	person number __________________________
คนที่ไปช่วยรุ่นที่	de människor som gick för att hjälpa generationen	volunteer group number __________
คนแคระ	dvärg	dwarf
คนแรก	första person	first
คปค	år	3 thai letters
คม	skarp	sharp
ครอคโคไดล์	krokodil	crocodile
ครอบครัว	familj	family
ครั้งหนึ่ง	en gång	once upon a time
คราประยูร	prayun	karaprayoon - a thai surname
คราม	indigo	indigo
คริส	chris	christ
คริสตี	christi	christie - a female name
คริสต์ศาสนา	kristendom	christainity
ครุฑ	garuda	garuda
ครู	lärare	teacher
ครูพิเศษจอมป่วน	trolllärare	kru pisat jom poun  - name of a story
คลอง	kanal	canal
คลองสาน	khlong san	klongsan
คลองเตย	khlong toei	klongtoei
คลับ	klubb	club
คลาวิคอร์ด	klass	clavichord
คลิก	klick	click
คลินิก	klinik	clinic
คลิป	klämma	clip
คลื่นสึนามิ	tsunami	tsunami wave
ควอน	kwon	kwon - a surname of a korean singer
ควอร์เตอร์	fjärdedel	quarter
ความกว้าง	bredd	width
ความงาม	skönheten	beauty
ความจำ	minnet	memory
ความต่างศักย์	möjlig skillnad	potential difference in physics
ความถี่	frekvens	frequencies
ความนิยม	popularitet	popular
ความบริสุทธิ์	renhet	purity
ความฝันอันสูงสุด	den ultimata drömmen	the impossible dream
ความพอประมาณ	anspråkslöshet	estimate
ความยากจน	fattigdom	poverty
ความยาว	längden	length
ความยาวคลื่น	våglängd	frequencies
ความยาวช่วงคลื่น	våglängd	wave length
ความยาวเพลง	sånglängd	the length of the song
ความรัก	kärlek	love
ความรู้	kunskapen	knowledge
ความสว่าง	ljusstyrka	illumination
ความสัมพันธ์กับประเทศไทย	förbindelser med thailand	relationship with thailand
ความสัมพันธ์ระหว่างจีนกับอเมริกา	förhållandena mellan kina och amerika	relationship with china and the usa
ความสูง	höjden	height
ความส่องสว่าง	ljusstyrka	luminance
ความหนาแน่นของประชากร	befolkningstäthet	population density
ความหมาย	meningen	meaning
ความหมายโดยพยัญชนะ	konsonant betydelse	definition that derived from translation from another language
ความเข้มของการส่องสว่าง	ljusintensitet	luminous intensity
