+	+	plus sign
รัฐอิลลินอยส์	illinois	state of illinois
รัฐเทกซัส	texas	state of texas
รัตนบุรี	rattanaburi	ratanaburi district - a location in thailand
รัตนาธิเบศร์	rattanathibet	ratana thibet
รับบทโดย	spelad av	played by
รับพระราชทาน	acceptera	receive
รัศมี	radie	radius
รัสเซล	russell	russell
รากแก่น	kärnrot	rakkan
รางวัลนักร้องยอดเยี่ยม	bästa sångerspris	best singer award
รางวัลนักร้องไทยสากลชายยอดนิยม	populära thai thai international singer award	best thai male singer award
รางวัลนาฏราช	royal dancer awards	naktarath prize
รางวัลโนเบล	nobelpriset	nobel prize
รางวัลไนน์เอ็นเตอร์เทน	nine entertainment award	nine entertain awards
ราชตระกูล	kungliga familjen	royal family
ราชนาวี	marin	royal navy
ราชมังคลากีฬาสถาน	rajamangala stadium	rajamangala national stadium
ราชวงศ์จิ้นตะวันออก	östra jin-dynastin	east jin dynasty
ราชวงศ์ชิง	qing dynastin	ching dynasty
ราชวงศ์ถัง	tang dynastin	tang dynasty
ราชวงศ์ทิพย์จักราธิวงศ์	ratchawongthip chakrathiwong	thipjaklatiwong dynasty
ราชวงศ์บ้านพลูหลวง	kungliga huset av plu luang	ban phlu luang dynasty
ราชวงศ์พระร่วง	phra ruang-dynastin	pra roung dynasty
ราชวงศ์หยวน	yuan-dynastin	yuan dynasty
ราชวงศ์อู่ทอง	u-thong-dynastin	utong empire in ancient thailand
ราชสกุล	tokens	royal family members
ราชสีมา	ratchasima	ratchasima
ราชินิกุล	släktingar till drottningen	relatives of the queen
ราบเป็นหน้ากลอง	var vanlig	flattened like a drum (meaning to be defeated)
รามอินทรา	ramintra	ram inthra
รายการ	lista	show
รายการวันสำคัญทางพุทธศาสนา	lista över viktiga buddhistiska datum	important days in buddhism
รายชื่อ	lista	list of the names
รายชื่อคำในภาษาไทยที่มักเขียนผิด	lista med thailändska ord som ofta skrivs fel	common misspelled thai words
รายชื่อภาพยนตร์ไทย	lista med thailändska filmer	a list of thai movies
รายชื่อหุ่นยนต์ใน	lista över robotar i	name of robots
รายชื่ออธิการบดี	lista med kanslar	list of presidents
รายชื่อเพลง	lista med låtar	songs list
รายนามรองอธิการประจำวิทยาเขต	namnlista på rektor på campus	llist of deputy directors of the college
รายนามอธิการบดี	lista över presidenten	chancellor list
รายพระนามพระมหากษัตริย์ไทย	lista över thailändska kungar	list of thai monarchs
รายะนาค	raya nak	rayanak
รายได้อื่น	annan inkomst	other wages, incomes
ราวพุทธศตวรรษที่	runt århundradet	about buddhist era
ราศีธนู	skytten	sagittarius
รำพันพิลาป	skrika	poem called rum pan pi lab
ริน	häll i	rin
ริมแม่น้ำเจ้าพระยา	chao phraya river vid floden	near chao praya river
ริวซากิ	ryuzaki	riusaki - from japanese story
ริเอะ	rie	rie tanaga - a japanese singer
รีสอร์ท	en utväg	resort
รีเนียม	renium	rhenium
รุจิพรรณ	rujipan	pan - a name
รุ่ง	gryning	dawn
รุ่งสว่าง	gryning	rungsawang
รุ่งเพชร	rung petch	roongpetch - a female's name
รูดอล์ฟ	rudolph	rudolf
รูทีเนียม	rutenium	ruthenium
รูปภาพ	bild	picture
รูปร่าง	form	body
รูปวรรณยุกต์	tonalform	tones
รูปสามเหลี่ยมมุมป้าน	stöt triangel	obtuse
รูปสี่เหลี่ยมด้านขนาน	parallellogram	a paralellogram
รูสเวลต์	roosevelt	roosevelt
ร็อดฟอร์ม	rod form	rock form
ร่วมแสดงกับ	utför med	costarring
ร้องคู่กับ	sjung med	sing a duet with
ร้องร่วมกับ	sjung med	featuring
ร้องโดย	sjungen av	sung by
ร้อยตรี	fänrik	second lieutenant
ร้านอาหาร	en restaurang	restaurants
ฤดูกาล	säsongen	season
ฤดูฝน	regnperiod	rainy season
ฤดูร้อน	varm säsong	summer
ล	de	a thai alphabet with an l sound
ลงวันที่	daterad	on this date
ลพบุรี	lop buri	lopburi
ลอนดอน	london	london
ลอยกระทง	loy kratong festival	loy kratong festival
ลอร์ด	herren	lord
ละคร	drama	play
ละครชาตรี	chatri drama	lakorn-chatri
ละครวิทยุ	radiodrama	soap opera broadcasted on the radio
ละครสั้น	kort drama	short drama
ละครเพลง	musikalisk	stage musical theatre
ละครโทรทัศน์	såpopera	television drama
ละติจูด	latitud	latitude
ลักษณะ	se	characteristic
ลักษณะทั่วไป	generella egenskaper	common characteristic
ลักษณะทางกายภาพ	fysiska egenskaper	physical characteristics
ลักษณะภูมิอากาศ	klimat	the type of climate
ลักษณะสำคัญ	viktiga egenskaper	main characteristics
ลักเซมเบิร์ก	luxemburg	luxembourg
ลัคนา	uppstigande	ascendant
ลา	la	goodbye
ลานจาตุรงคสันนิบาต	fyrhörning	lan jaturonsunnibat - an ancient place in india
ลามิวูดีน	lamiwoodine	lamivudine
ลายน้ำ	vattenmärke	watetmark
ลาว	laos	lao
ลาออก	avgå	resign
ลำดับ	ordning	order, sequence
ลำดับพระปฐมวงศ์ในพระบรมราชวงศ์จักรี	genesis order i chakri-dynastin	order of the kings
ลำดับพระมหากษัตริย์ไทย	thailändska kungens ordning	the order of the kings of thailand
ลำตัว	trunk	body
ลำลูกกา	lam luk ka	lumlookka - a location in thailand
ลำลูกกาคลอง	lam luk ka canal	lum luk kak klong
ลำไส้เล็ก	tunntarm	small intestine
ลิง	apa	monkey
ลิซท์	liszt	(franz) liszt
ลิปปี	läppår	rippi - a surname
ลิพิด	lipid	lipid
ลิฟวิ่งมอลล์	living mall	living mall
ลิเก	musikaliskt folkdrama	like
ลิเทียม	litium	lithium
ลีกคัพ	league cup	league cup
ลีซอ	lisu	lisu
ลีเมอร์	lemur	lemur
ลี้	li	lee, a district in lumpoon province.
ลี้สุวรรณ	li suwan	lisuwan
ลุงบุญมีระลึกชาติ	farbror boonmee recalling nation	uncle boonmee who can recall his past lives
ลูกปัด	pärla	beads
ลูกสาว	dotter	daughter
ลูกอม	godis	candies
ลูกอัณฑะ	testiklar	testis
ลูซิเฟอร์	djävulen	lucifer
ลูน่า	luna	luna
ล่าทา	jakt	lata
ล่ำซำ	klump	lumsum
ล้อม	runt om	lom
ล้อแม็กซ์อัลลอยขนาด	legeringshjul, storlek	alloy wheel
วง	slinga	band
วงจรไฟฟ้า	elektrisk krets	electrical circuit
วงดนตรี	band	band
วงศ์กำแหง	familj	wongkumhang - surname of a famous singer
วงศ์ถั่ว	mutterfamilj	fabaceae
วงศ์ปลากดทะเล	fiskfamilj	ariidae
วงศ์ปลากะรัง	grupperare	serranidae family
วงศ์ปลายอดม่วง	wong pla yot muang	tonguefish
วงศ์ปลาหลังเขียว	grön fisk	clupeidae - a type of fish
วงศ์ปลาเนื้ออ่อน	mjuk fisk	siluridae
วงศ์ปลาเสือตอ	tiger fish family	datnioididae
วงศ์พัวพันธ์	wongpua phan	wongpourpan
วงศ์วิริยะ	wiriya	vongsiriya - a surname
วงศ์เทวัญ	familj	wongthewan
วงศ์แคหางค่าง	wong khae hang kong	plants in kae-hang-kang family
วงษ์คำเหลา	wong kham lao	wongkamlao
วงเงิน	begränsa	budget
วงเวียน	rondell	circle
วงแหวน	ringa	ring form, circle form
วชิรบรรจง	wachirabanjong	wachibanjong
วทบ	dd	bachelor of science
วนอุทยานถ้ำจัน	tham chan forest park	tham chan forest park
วนิดา	wanida	wanida - the name of a drama
วร	wor	won
วรรณกรรม	litteratur	literature
วรรณสุทธิ์	wansut	wannasut - surname of an actress
วรรธนพิสิฐกุล	watthon phisitkun	wanthanaphisitkun
วรัทยา	warutya	varattaya (first name)
วว	dd	office of ____________
วอก	apa	wok
วองโกเล่แฟมิลี	vongola-familjen	vongola family
วอชิงตัน	washington	washington
วอลท์	walt	walt
วอล์ค	promenad	walk
วะสี	var jag	wasee
วัง	palats	palace
วังจันทร์	wang chan	wang-chan
วังสระปทุม	sra pathum palace	srapathum palace
วังสะพุง	wang saphung	wang saphung
วังหลัง	palats	wang lang
วังหิน	sten palats	rock castle
วัชรพล	watcharapol	watcharapol supermarket
วัฒนชัย	watthanachai	wattanachai - a surname
วัฒนธรรม	kultur	culture
วัฒนวิทูกูร	wattanawitkun	watthanawithukun
วัฒนา	wattana	wattana
วัดกลาง	medium tempel	wat klang
วัดป่าเลไลยก์วรวิหาร	wat pa lelai worawihan	wat palaylay
วัดพระธาตุดอยสุเทพราชวรวิหาร	wat phra that doi suthep, ratchaworawihan	wat pratatdoisuthep rachavoravihan - the temple erected on top of doi suthep in northern thailand
วัดพระฝางสวางคบุรีมุนีนาถ	wat phra fang sangkhaburi muninat	prhafangsawangkaburimuninat temple
วัดพระมหาธาตุวรมหาวิหาร	wat phra mahathat woramahaviharn	wat phramahathat woramahawihan
วัดพระยืนพุทธบาทยุคล	wat phra yuen phutthayakhon	the standing buddha temple of puttabatyukol
วัดพระลอย	phra loi-templet	wat phra loi
วัดพระศรีรัตนมหาธาตุ	wat phra si rattana mahathat	wat phra si rattana mahathat
วัดพระเชตุพนวิมลมังคลารามราชวรมหาวิหาร	wat phra chetuphon vimolmangklararam ratchaworamahawihan	wat pra chetpnvimolmungklaramrajavoramahavihan
วัดระฆังโฆสิตาราม	rakhangkosaram tempel	wat rakang kositaram (name of temple)
วัดสองพี่น้อง	song phi nong temple	two siblings temple
วัดสุทัศนเทพวรารามราชวรมหาวิหาร	suthasan thep wararam tempel	wat sutatthepvararamrajavorimahavihan - a temple in thailand
วัดหนองเพียร	nong phian-templet	wat nong pien - a temple in thailand
วัดหน้าพระธาตุ	na phra det templet	wat na pra tat - a buddhist temple
วัดเจดีย์หลวง	chedi luang-templet	wat pagoda
วัดโพธิ์	wat pho	wat po - a thai temple
วัตต์	watt	watt
วัตสัน	watson	watson
วัน	dag	day
วันชัย	wanchai	wanchai - a male's name
วันที่ขึ้นเครื่องหมาย	underteckningsdatum	excluding dividend day
วันที่ออกอากาศชื่อตอนแขกรับเชิญ	sändningsdatum, avsnittets namn, gästutseende	when the invitation comes out
วันที่เข้าฉาย	utgivningsdatum	release date
วันนี้ที่รอคอย	väntar idag	the day that one has been waiting for
วันพฤหัสบดี	torsdag	thursday
วันพุธ	onsdag	wednesday
วันมหาสงกรานต์	maha songkran day	songkran day
วันละ	en dag	per day
วันศุกร์	fredag	friday
วันสงกรานต์	songkran day	songkran day
วันสำคัญ	viktig dag	important day
วันสำคัญทางพุทธศาสนา	viktig buddhistisk dag	buddhist holidays
วันหยุดราชการ	helgdag	national holiday
วันอังคาร	tisdag	tuesday
วันอาทิตย์	söndag	sunday
วันอาสาฬหบูชา	asanha bucha day	asalha puja
วันเกิด	födelsedag	birthday
วันเสาร์	lördag	saturday
วันแรม	dag	the phase of the moon
วัย	åldrig	age
วัลลิโภดม	walliphodom	wanliphodom
วัสดุฟิสไซล์	fissilt material	fissile material
วานูอาตู	vanuatu	vanuatu, australia
วารินชำราบ	warinchamrap	warinchamrap
วาลคิรี	valkyrie	valkyrie - angel that helped in valhalla war
วาลีน	valin	valine - a type of protein
วาเรีย	varia	varia
วาเลนไทน์	valentine	valentine
วาไรตี้	mängd	variety
วิกตอร์	segrare	victor
วิคตอเรีย	victoria	victoria
วิจัย	forskning	investigate, study
วิจิตรศิลป์	bild och form	fine art
วิชาการ	akademisk	academic
วิชาการคอม	akademisk dator	vcharkarn.com
วิชิต	wichit	wichit - a male's name
วิญญาณ	anda	soul
วิฑูรย์	lapis lazuli	witoon
วิดีโอเกม	tv-spel	video game
วิตามินอี	e-vitamin	vitamin e
วิทยาการคอมพิวเตอร์	datavetenskap	computer courses
วิทยาการระบาด	epidemiologi	epidemiology
วิทยาลัยการจัดการเพื่อการพัฒนา	college of management for development	management for development college
วิทยาลัยการบริหารรัฐกิจ	college of public administration	management college
วิทยาลัยครูสวนสุนันทา	suan sunandha teacher college	soun sunanta teachers college
วิทยาลัยดุริยางคศิลป์	college of music	college of music
วิทยาลัยนวัตกรรมและการจัดการ	college of innovation and management	the college specialized in arts
วิทยาลัยพยาบาลกองทัพเรือ	naval nursing college	royal thai navy college of nursing
วิทยาลัยพยาบาลบรมราชชนนี	boromarajonani sjuksköterskehögskola	nursing university of barom raj chonnani
วิทยาลัยพาณิชยศาสตร์	handelshögskolan	panitsat university
วิทยาลัยวิชาการศึกษา	college of education	college of education
วิทยาลัยเทคนิคธนบุรี	thonburi technical college	king mongkut's university of technology thonburi
วิทยาลัยแพทยศาสตร์พระมงกุฎเกล้า	phramongkutklao college of medicine	phramongkutklao college of medicine
วิทยาศาสตรมหาบัณฑิต	civilingenjör	master of science
วิทยาศาสตร์สุขภาพ	hälsovetenskap	health science
วิทยาศาสตร์และเทคโนโลยี	vetenskap och teknologi	science and technology
วิทยาเขต	campus	campus
วิทยาเขตกาญจนบุรี	kanchanaburi campus	kanchanaburi college
วิทยาเขตนครศรีธรรมราช	nakhon si thammarat campus	nakhon si thammarat campus
วิทยาเขตพิษณุโลก	phitsanulok campus	pissanulok college
วิทยาเขตสารสนเทศเพชรบุรี	phetchaburi campus för informationsteknologi	information technology college of petchaburi
วิทยาเขตสุพรรณบุรี	suphanburi campus	suphanburi campus
วิทยาเขตสุรินทร์	surin campus	surin university
วิทยาเขตหนองคาย	nong khai-campus	nong kai university
วิทยาเขตเฉลิมพระเกียรติ	chaloem phrakiat campus	vittaya kat chalerm pra kiet - a location at kasetsat university in thailand
วิทยุ	radio	radio
วิธีการหาความสัมพันธ์	hur man hittar relationer	formula for the correlation coefficient
วินชี	vinci	vinci
วินัย	disciplin	manners
วินเนอร์	vinnare	winner
วิบูลย์	adjö	wibul - a male's name
วิมเบิลดัน	wimbledon	wimbledon
วิลลี่	snopp	willy
วิลเลจ	by	village
วิลเลียม	william	williams
วิลเลี่ยม	william	william
วิวัฒนาการ	evolution	evolution
วิวัฒน์	utveckla	produce, making up, invent
วิวัฒน์เกียรติ	wiwat kiat	wiwatkiat
วิศว	teknik	engineering
วิศวกร	ingenjör	engineer
วิศวกรรมวัสดุ	materialteknik	material engineering
วิศวกรรมสิ่งแวดล้อม	miljöteknik	environmental engineering
วิศวกรรมเครื่องกล	maskinteknik	engineering
วิศวกรรมไฟฟ้า	ellära	electrical engineering
วิสา	wisisa	wisa
วิสูตร	diagnostisk	wisut
วิหาร	fristad	vihara
วิเศษ	magi	wiset
วิเศษแก้ว	magiska glas	visetkeaw - surname of a singer
วิโนทัย	vinothai	winothai
วีดีโอ	video	video
วีดีโอเกม	tv-spel	video game
วีรบุรุษ	hjälte	hero
วีระ	veera	veera
วีระยุทธ	wirayut	werayut - a male's name
วีออส	vios	vios
วุฒิสภา	senat	senate
วุฒิเมธี	wuttimethi	wuttimethi - a surname
ว้าวุ่น	förvirrad	wawun
ศ	prof	a thai alphabet
ศร	pil	arrow
ศรชัย	sornchai	sornchai - a male's name
ศรายุทธ	sarayuth	sarayut - a male's name
ศรีนครินทร์	srinakarin	srinakarin
ศรีนวล	srinual	sinuan
ศรีบุญเรือง	sri bunrueang	si bun rueang
ศรีประจวบ	si prachuap	siprachuap
ศรีปาน	sri pan	sri pan - a surname
ศรีมะฆะ	sri makha	sirimaka - a thai name
ศรียาภัย	sriyapai	siyaphai
ศรีสวัสดิ์	srisawat	srisawat -  a surname
ศรีสำโรง	si samrong	si samrong
ศรีเมือง	sri mueang	srimuang
ศรีไพร	sri phrai	sri prai - a name
ศรเพชร	diamantpilen	sonpet
ศศิธร	sasithorn	sasitorn - a females name
ศักดิ์ศรี	prestige	dignity
ศักย์ไฟฟ้า	elektrisk potential	electric potential
ศัพท์	terminologi	vocabulary
ศาลชั้นต้น	civil domstol	curcuit court
ศาลหลักเมือง	city pillar shrine	the old court house
ศาลเจ้าพ่อหลักเมือง	city pillar shrine	the city's god
ศาสตราจารย์	professor	professor
ศาสนา	religion	religion
ศาสนาพราหมณ์ฮินดู	hinduism	hindu religion
ศาสนาฮินดู	hinduism	hinduism
ศาสนาโซโรอัสเตอร์	zoroastrianism	zoroastrianism
ศิริวรรณ	siriwan	siriwan - a female's name
ศิลปอาชา	art archa	silpa-archa
ศิลปะ	konst	arts
ศิลปะการแสดง	performance art	performing arts
ศิลปะลพบุรี	art lopburi	lopburi art
ศิลปะศรีวิชัย	srivijaya art	arts from sri vi chai province
ศิลปะเขมร	khmer konst	cambodian arts
ศิลปะเครื่องปั้นดินเผา	krukmakeri	pottery art
ศิลปะเชียงแสน	chiang saen art	chaingsan art
ศิลปินแห่งชาติ	nationell konstnär	national artist
ศิลป์	konst	silpa
ศิษย์เก่าคณะมนุษยศาสตร์	fakulteten för humaniora fakultet	former humanity student
ศิษย์เก่าคณะรัฐศาสตร์	fakulteten för statsvetenskapliga alumner	faculty of political science alumni
ศิษย์เก่าคณะเศรษฐศาสตร์	fakulteten för ekonomi-studenter	economics alumni
ศีรษะ	huvud	head
ศึกนันทบุเรง	nanthabureng strid	suknuntabureng -  a war in thailand
ศึกษาศาสตร์	utbildning	field of education
ศุกลวัฒน์	sukonwat	sukolawat (a person's name)
ศุภกิจ	supakit	supphakit
ศุภณัฐ	suphanat	supanat (first name)
ศูนย์	centrum	center
ศูนย์การค้า	köpcentrum	shopping center
ศูนย์การบินทหารบก	army aviation center	marine forces
ศูนย์การศึกษาแม่ฮ่องสอน	mae hong son education center	maehongsorn learning center
ศูนย์คอมพิวเตอร์	datorcenter	computer center
ศูนย์ค้าส่ง	partihandel center	wholesale center
ศูนย์บริการวิชาการ	academic service center	academic service center
ศูนย์ภาษา	språkcentrum	language center
ศูนย์รังสิต	rangsit center	rangsit university center
ศูนย์ลำปาง	lampang center	lampang center
ศูนย์แพทยศาสตรศึกษาชั้นคลินิก	utbildningscentrum för klinisk medicin	medical education center
สก	skruva	abbreviation of two letters
สกว	trf	trf
สกอ	skottland	office of higher education commission
สกอตแลนด์	skottland	scotland
สกาย	himmel	sky
สกุล	familj	sakun
สกุลหยาดน้ำค้าง	sileshår	d. etrythrorhiza - a type of plant
สกุลเพชรหึง	petcheng	grammatophyllum
สควอโล่	squalo	squalo
สงคราม	krig	war
สงครามครูเสด	korståg	crusades war
สงครามมหาเอเชียบูรพา	det stora östasienkriget	world war two
สงครามอวกาศ	rymdkrig	space war
สงครามเกาหลี	koreakrig	korean war
สงครามเย็น	kalla kriget	cold war
สง่าพล	elegant	sangapol - a thai surname
สด	färsk	fresh
สตรอเบอรี่	strawberry	strawberry
สตรีวิทยา	radiologi	satriwithaya
สติปัญญา	intelligens	intelligence
สตึก	satun	satuek (name of district)
สตูดิโอ	studion	studio
สถานที่ท่องเที่ยวทางธรรมชาติ	naturliga attraktioner	natural attraction
สถานะ	status	status
สถานีคาราวาน	husvagnsstation	caravan station
สถานีวิทยุโทรทัศน์ไทยทีวีสีช่อง	thailändska tv-stationer med färg-tv-kanaler	thai television station number _____
สถานีโทรทัศน์ไทยพีบีเอส	thailändsk pbs-tv-station	thai public broadcasting service
สถาบัน	institution	office, department
สถาบันการศึกษา	läroanstalt	educational institution
สถาบันบัณฑิตพัฒนบริหารศาสตร์	national institute of development administration	satabunbunthitpakanabarihansart - a university in thailand, as known as nida
สถาบันพระบรมราชชนก	royal institute	red cross department
สถาบันวิจัยจุฬาภรณ์	chulabhorn research institute	julapon academy
สถาบันวิจัยและพัฒนา	forsknings- och utvecklingsinstitut	reseach and development institution
สถาบันศูนย์และหน่วยงานในมหาวิทยาลัย	institutioner, centra och institutioner vid universitet	current faculties/college/school/institutes
สถาบันสมทบ	associerad institution	affiliated institute
สถาบันอาชีวศึกษา	yrkesinstitut	ahchevasuksa academy
สถาบันอุดมศึกษา	högskolan	higher education institute
สถาบันเทคโนโลยีนานาชาติสิรินธร	sirindhorn international institute of technology	sirindhorn international institute of technology
