+	+	plus
擔任評審團	phục vụ như một bồi thẩm đoàn	join the jury
攘夷志士攘夷浪士じょういししじょういろうし	志士 攘夷 浪 士 じ ょ う い し し じ ょ	not chinese， it's japanese, cant translate.
攝影監督	giám sát nhiếp ảnh	film producer
收視平均	đánh giá trung bình	average viewership
收錄於	bao gồm trong	recorded in
政党	đảng chính trị	party
政府是我們的政府	chính phủ là chính phủ của chúng tôi	the government is our government
政治局常委　政治局委员　中央委员和军委第一副主席职务　免去胡启立的政治局常委　政治局委员　书记处书记职务　免去芮杏文阎明复的书记处书记职务　全会之前　中央政治局举行了扩大会议　为四中全会的召开作了必要准备	ủy ban thường vụ bộ chính trị ủy viên bộ chính trị và phó chủ tịch thứ nhất của ủy ban quân sự cách chức ủy ban thường vụ bộ chính trị hu qili, ủy viên bộ chính trị của ủy ban thư ký ủy ban bí thư trung ương ủy ban hội nghị ban bí thư trung ương chuẩn bị cần thiết cho cuộc họp toàn thể	made necessary preparations for the opening of the  the fourth session of the central committee of the cpc
政治文化	văn hóa chính trị	political culture
政治理念	ý chính trị	political idea
故事	câu chuyện	story
故事中的現世主要圍繞空座町空座町為現在的重靈地	cuộc sống hiện tại trong câu chuyện chủ yếu xoay quanh suzakucho suzakucho là trung tâm tâm linh hiện tại	mainly focusing on karakura-street. karakura-street is now the land of spirits.
故事圍繞著伙伴間的友誼和夢幻般的歷險開展當中除了少年漫畫中令人振奮的熱血場景和感動人心的畫面外作品的世界觀和人物設定亦深刻帶出各種現實的社會問題包括因種族階級宗教領土歧視等產生的衝突和矛盾	câu chuyện xoay quanh tình bạn và những cuộc phiêu lưu trong mơ giữa các đối tác. ngoài những cảnh đẫm máu thú vị và những bức ảnh chuyển động trong truyện tranh vị thành niên, thế giới và bối cảnh nhân vật của tác phẩm cũng đưa ra nhiều vấn đề xã hội thực tế, bao gồm cả tôn giáo chủng tộc xung đột và mâu thuẫn phát sinh từ sự phân biệt lãnh thổ	the conflict and issues caused by hierarchy, religion, territory, discrimination
故意杀人罪	giết người có chủ ý	intentional homicide
效果	hiệu quả	effect
敖犬小煜	ao inu xiaoyu	owodog xiao yu
敗犬女王	nữ hoàng chó bị đánh bại	queen of no marriage
教育学院	cao đẳng sư phạm	education school
教育程度	trình độ học vấn	educational level
数据	dữ liệu	data
數	số	number
文化史	lịch sử văn hóa	cultural history
文化艺术	văn hóa nghệ thuật	culture and arts
文字	văn bản	character
文学	văn học	literature
文档授权协议	thỏa thuận cấp phép tài liệu	the contract of granting documents
文革時期	trong cuộc cách mạng văn hóa	cultural revolution period
料理	ẩm thực	food
斧手蒙卡被擊敗後招待拯救了城鎮的魯夫和索隆吃飯	sau thất bại của axe monka, giải trí ruff và sauron, người đã cứu thị trấn để ăn	after defeated, the waiter rescued luffy and zoro to eat
斯洛伐克	slovakia	slovakia
新不了情	tình yêu mới	love without end
新世代	thế hệ mới	new world generation
新人獎	giải thưởng người mới	new human
新加坡博覽中心	hội chợ triển lãm singapore	international exposition center in singapore
新加坡金曲奖	giải thưởng giai điệu vàng singapore	singapore hits awards
新加坡金曲獎	giải thưởng giai điệu vàng singapore	gold song award of singapore
新加坡金曲獎十大金曲	giải thưởng giai điệu vàng singapore top ten giai điệu vàng	singapore super star awards top 10 songs
新华网	xinhuanet	xinhua net
新城勁爆兒歌頒獎禮	lễ trao giải bài hát thiếu nhi new york madden	metro radio kids hit awards presentation
新城勁爆流行音樂頒獎禮勁爆歌曲	new city madden pop music awards madden song	metro radio hits music awards presentation hit songs
新城勁爆流行音樂頒獎禮勁爆歌曲十大	mười bài hát hay nhất trong new york madden pop music awards	hot pop music award ceremony top ten hot songs
新城勁爆組合	thành phố mới madden	metro madden group
新城國語力亞洲歌手大獎	giải thưởng ca sĩ châu á tiếng phổ thông thành phố mới	xincheng mandarin asian singer award
新城國語力頒獎禮	lễ trao giải tiếng phổ thông thành phố mới	metro radio mandarin hits music awards presentation
新城國語力頒獎禮新城國語力全國最受歡迎偶像	lễ trao giải tiếng phổ thông tiếng trung quốc xincheng tiếng phổ thông quốc gia thần tượng phổ biến	prize giving ceremony metro-radio mandarin power nation-wide most popular idol
新城新城勁爆頒獎禮新城勁爆歌曲	lễ trao giải madness xincheng madness	metro radio / metro radio hits awards / metro radio hits
新好情人	người yêu mới tốt	new lover
新教	tin lành	protestantism
新春習字	tết nguyên đán	new spring learning writing
新時代的動盪篇漫畫動畫	phim hoạt hình truyện tranh hỗn loạn của thời đại mới	the new times turmoil (cartoon)
新時代電視主辦加拿大中文電台城市電視及娛樂生活雜誌協辦	kỷ nguyên mới được tài trợ bởi tạp chí cuộc sống giải trí và truyền hình trung quốc đài canada	fairchild radio, co-hosted by talentvision and popular lifestyle & entertainment magazine
新曲+精選	bài hát mới + nổi bật	new songs plus selected songs
新歌	bài hát mới	new songs
新浪香港	sina hồng kông	sina hongkong
新电信	viễn thông mới	singtel
新紮師妹	chị gái mới	love undercover
新装版	phiên bản mới	new package
新闻	tin tức	news
新闻出版	xuất bản tin tức	news media
新領導集體	lãnh đạo mới	new leader group
新高口	xingao khẩu	new advanced interpretation
方中信	fang zhongxin	alex fong chung sun
方位	định hướng	directions
方力申	fang lishen	alex fong
方大同專頁	trang đặc biệt fang datong	khalil fong's page
方大同未來演唱會	hòa nhạc tương lai fang datong	the future concerts of datong fang
方季惟	fang jiwei	alice fang
方宥心	fang youxin	youxin fang
方家	fangjia	the fang family
方言	phương ngữ	dialect
於第二部中登場的角色珍獸島的新住民身體卡在酒桶內的女子	nhân vật xuất hiện trong phần thứ hai của cư dân mới ở đảo jin beu, người phụ nữ có thân hình bị mắc kẹt trong thùng	newcomers in zhenshou island, a woman who stuck her body in a cask
旁觀者傷電影愛情故事主題曲	bystanders làm tổn thương phim tình yêu chủ đề bài hát	bystander hurts movie love story theme song
旅游指南	hướng dẫn du lịch	tourist guide
旅游景点	thu hút khách du lịch	tourist resorts
旅遊	du lịch	travel
旅遊景點	thu hút khách du lịch	tourist resort
日	ngày	day
日久生情	yêu mãi mãi	grow the feeling with the passing of time
日凌晨二時學生領袖宣佈有萬人參加絕食活動在當天記者會上王丹說昨晚我們作出了一項非常重要的決定即停止我們的絕食活動但是李鵬和楊尚昆說這次民主示威活動是動亂所以有二十萬人將繼續進行絕食一位北大語言教職員說他之所以參加絕食是因為學生是對的我們的政府錯了	vào lúc 2 giờ sáng, các nhà lãnh đạo sinh viên thông báo rằng 10.000 người đã tham gia tuyệt thực. trong cuộc họp báo ngày hôm đó, wang dan cho biết chúng tôi đã đưa ra một quyết định rất quan trọng vào đêm qua để ngăn chặn cuộc tuyệt thực của chúng tôi. hai trăm ngàn người sẽ tuyệt thực. một giảng viên của trường đại học bắc kinh nói rằng anh ta tham gia tuyệt thực vì các sinh viên đã đúng. chính phủ của chúng tôi đã sai.	hunger strike because the students are right, our government is wrong
日劇大賞	giải thưởng phim truyền hình nhật bản	japanese shows appreciation
日劇學院賞	giải thưởng học viện nhật bản	japanese tv drama series to appreciate
日喀则地区	shigatse	shigatse prefecture
日夜想你	nhớ em ngày đêm	thinking of you day and night
日年月日	ngày qua ngày	year month day
日文	tiếng nhật	japanese
日期	ngày	date
日期年月日	ngày tháng tháng ngày	date year month day
日期演唱會名稱舉行地點	địa điểm tổ chức buổi hòa nhạc	date concert name venue
日期演唱會站次舉行地點	địa điểm tổ chức buổi hòa nhạc	date, stops, and locations of the concerts
日期站次	trạm ngày	date and schedule
日本	nhật bản	japan
日本放送協會	hiệp hội phát thanh truyền hình nhật bản	japan broadcasting corporation
日本柳杉	gỗ tuyết tùng nhật bản	japanese cedar
日本武道館	nhật bản	japanese dojo
日本電視台系列白色之戀主題歌	phim truyền hình nhật bản tình yêu chủ đề trắng	japan tv channel white love series theme song
日治時期	thời kỳ nhật bản	during the japanese occupation
日版	phiên bản tiếng nhật	japanese verison
日語	tiếng nhật	japanese
日賣電視台	đài truyền hình bán hàng ngày	rimai television station
早年生涯	sự nghiệp sớm	early life
早期	sớm	early stage
早期發展	phát triển sớm	early development
旺角卡門	carmen, mong kok	as tears go by
昆明	côn minh	kunming
昆蟲族	gia đình côn trùng	insect race
昌吉回族自治州	tỉnh tự trị changji hui	hui autonomous prefecture of changji
明古魯省	bengkulu	bengkulu
明愛暗戀補習社	trường caritas crush	after school (twins)
明星逃服兵役各有奇招	các ngôi sao có thủ đoạn riêng cho nghĩa vụ quân sự	to avoid participating military service, pop stars all have their own moves
明知不知傻痴痴	không biết gì cả	silly for knowing and not knowing
星光遊樂園	công viên giải trí starlight	mr nic remix
星噬篇貓狗大戰老人與狗	star eater mèo và chó vs ông già và chó	constellation articles, the cat and dog war & the old man and the dog
星期一	thứ hai	monday
星期一至五節目	thứ hai đến thứ sáu	monday to friday programme
星期二	thứ ba	tuesday
星期六日	thứ bảy và chủ nhật	saturday, sunday
星期日節目	chương trình chủ nhật	saturday 17:30 - 18:00 (tv) schedule
星級	ngôi sao	star level
星級廚房	bếp sao	starry kitchen
星綻黑放大睛艷日拋隱形眼鏡	sao nở kính áp tròng mắt màu đen	one-day eye-enlarging contact con
星野真	hoshino shin	zhen xingye
春节	tết nguyên đán	the spring festival
春雨漫步武術指導	mùa xuân đi bộ hướng dẫn võ thuật	a walk in the spring rain martial arts guide
春風吹	gió xuân	spring breeze blows
是你是你	bạn là bạn	you are! you are!
是印尼最高的官方大樓	đây là tòa nhà chính thức cao nhất ở indonesia	is indonesia's highest official(government?) building
是我	là tôi	it is me
是雨還是眼淚	là mưa hay nước mắt	rain or tears
時任北京市市长陈希同在关于制止动乱和平息反革命暴乱的情况报告稱自月日起戒严部队战士负伤多人死亡数十人有多名非军人受伤余人死亡包括名大学生又指示威者用鐵棍鐵鏈菜刀燃燒瓶噴火器攻撃破壞長安街有軍車司機被打死西單首都電影院附近一名軍人被打死屍體掛在焚燒中的公車崇文門過街天橋上一名士兵被人從橋上扔下被澆上汽油燒死一名士兵的屍體被懸掛於阜成門立交橋的欄桿上翠微路口軍車被人投擲燃燒物名軍人燒死	vào thời điểm đó, thị trưởng bắc kinh chen xitong đã báo cáo về tình hình ngăn chặn tình trạng bất ổn và dập tắt các cuộc bạo loạn phản cách mạng. kể từ tháng 3, binh lính của quân đội đã bị thương và nhiều người đã bị giết. hàng chục người đã bị thương. một người điều khiển phương tiện quân sự đã bị giết. một người lính bị giết gần rạp chiếu phim xidan capital. một xác chết được treo trên xe buýt đang cháy. chongwenmen băng qua đường. một người lính bị ném ra khỏi cầu và đổ xăng. thi thể của một người lính bị thiêu rụi và được treo trên lan can cầu vượt fuchengmen. xe quân sự ở ngã tư cuiwei bị ném bởi vật liệu cháy. người lính nổi tiếng bị thiêu chết	on the crossing of tsuei wei rd, a flammable material was thrown on to a military vehicle and six soldiers were burn to death.
時光	thời gian	time
時分	thời gian	hour minute
時分時分	giờ phút	hour minute hour minute
時分～時分	giờ phút	hour/minute
時正清場時間到廣場上全部關燈戒嚴部隊發出廣播內容說我們呼籲全體市民和全體同學不要再燒垃圾不要再燒垃圾不要再加強廣場的混亂	vào thời điểm giải phóng mặt bằng, tất cả các đèn đã tắt trong quảng trường. các đội quân luật đã phát đi thông báo rằng chúng tôi kêu gọi tất cả người dân và tất cả học sinh ngừng đốt rác	please don't burn rubbish and exacerbate the chaos of square
時段	thời gian	period of time
時段逄星期一至五晚上時分至時分	giờ-thứ hai đến thứ sáu, tối đến giờ	time: monday to friday hour minutes pm
時間長度	khoảng thời gian	time span
晚晚乖	ngủ ngon	night obedience
晚間新聞	tin tức buổi tối	evening news
智利	chile	chile
暑假特別篇漫畫龍宮篇動畫乙姫的野心龍宮城第百七十四百八十二訓第巻第話全話	kỳ nghỉ hè phần đặc biệt truyện tranh cung điện rồng phần hoạt hình aimee&#39;s ambition dragon palace city thứ 174 882 tập vol. 1	volume 174-182, chapter (... in total)
暖	ấm áp	warm
暮蟬悲鳴之時　第一話	những lời đầu tiên của tang chế của manyan	when the cicada sings the sad song of dusk. chapter one
暱稱或英文名	biệt danh hoặc tên tiếng anh	nickname or english name
曖昧	mơ hồ	ambiguous
曙暮光	hoàng hôn	twilight
曲棍球	khúc côn cầu	hockey
曲目	theo dõi	song
曲目總數共首	tổng số bản nhạc	total tracks
曲順	qu thu	song order
更木剣八鈴木省吾月日のみゲスト出演	kanagi yagi, tỉnh suzuki đóng vai chính	japanese words
書	sách	book
書籍	sách	books
曾少宗	zeng shaozong	figaro ceng
曾梓明	zenging	zhen xing ming (name of a person)
曾獲獎項	giải thưởng	awards received
曾路得	zeng ruth	ruth chen
最	hầu hết	most
最佳動作設計獎林迪安	giải thưởng thiết kế hành động xuất sắc nhất	best action design, dion lam
最佳國際新人	diễn viên quốc tế xuất sắc nhất	the best international new comer
最佳外語片獎	giải thưởng phim nói tiếng nước ngoài hay nhất	best foreign movie award
最佳女主角如果愛	nữ diễn viên xuất sắc nhất nếu yêu	best actress (if love)
最佳專輯	album hay nhất	best album
最佳導演獎劉偉強麥兆輝	giải thưởng đạo diễn xuất sắc nhất liu weiqiang mai zhaohui	award for best director ： wai keung lau,  siu fai mak
最佳影視歌手	ca sĩ điện ảnh và truyền hình hay nhất	the best film and video singer
最佳改編劇本獎	giải thưởng kịch bản chuyển thể hay nhất	best adapted screenplay
最佳男主角	diễn viên xuất sắc nhất	best leading male actor
最佳男配角	nam diễn viên phụ xuất sắc nhất	best supporting actor
最佳進步獎香港電台	giải thưởng tiến bộ tốt nhất đài phát thanh truyền hình hồng kông	the best progress award [radio television hong kong]
最佳配樂獎	giải thưởng nhạc phim hay nhất	best sound of music award
最優秀合唱歌曲獎只對你有感覺	giải bài hát hợp xướng hay nhất chỉ dành cho bạn	best collaboration with vocals only have feelings for you
最受歡迎女歌手獎	giải thưởng nữ ca sĩ được yêu thích nhất	most welcomed female singer award
最受歡迎男歌手	nam ca sĩ nổi tiếng nhất	most welcomed male singer
最后你也走了	cuối cùng bạn đã rời đi	at the end you are also gone
最大震度級	độ lớn tối đa	the maximal degree of seismicity
最有前途新人獎	giải thưởng người mới hứa hẹn nhất	the most promising newcomer award
最終幻想	tưởng tượng cuối cùng	final fantasy
最经典的房中术书籍	cuốn sách phẫu thuật phòng cổ điển nhất	the classic book on sex
最高	cao nhất	the highest
最高名次第名	thứ hạng cao nhất	the highest rank
會川昇	hui chuansheng	shô aikawa
月	tháng	month
月島秀九郎	tsukijiro tsukishima	tsukishima shuukurou
月日三立型男大主廚錄影	video đầu bếp sanli sportsman hàng tháng	month day sanli estômago
月日三軍選拔	lựa chọn của ba đội quân	month day, three military contest
月日中央政治局常委决定在北京部分地区实行戒严	vào tháng 5, ủy ban thường vụ bộ chính trị đã quyết định thi hành luật quân sự ở một số khu vực của bắc kinh	the political bureau of the central committee of the cpc decided to enforce martial law in some areas of beijing
月日人被指放火搶劫被判死刑	người dân vào chủ nhật đã bị buộc tội đốt lửa và bị kết án tử hình	month date people were sentenced to death for committing arson and robbery
月日凌晨以後一輛裝甲車在建國門高速撞向一輛軍車車上載滿正在與軍人談話的群眾當場壓死人其中名是軍人但裝甲車沒有停下不少人顯得悲憤一些軍人甚至流淚	sau buổi sáng sớm của tháng, một chiếc xe bọc thép đã đâm vào một chiếc xe quân sự ở tốc độ cao jianguomen. nó chứa đầy những người đang nói chuyện với những người lính. tại chỗ, mọi người đã thiệt mạng. tên của người lính là một người lính, nhưng chiếc xe bọc thép không dừng lại.	stop numerous people appear sad even some generals are shedding tears
月日凌晨时半戒严部队开始对天安门广场实行清场约时左右广场上的学生开始撤离戒严部队同时进驻天安门广场至时半整个清场过程结束	quân đội bắt đầu dọn dẹp quảng trường thiên an môn vào đầu giờ.	marched into tiananmen square.ended the process of clearing out the square at [5] thirty
月日出生公分公斤	centimet sinh ra trong kilogam	month, date born centimeter kilogram
月日出生多歲公分公斤	nhiều centimet cm sinh vào ngày trong tháng	month day born years old centimeters kilograms
月日北京亦舉行百萬人大遊行不少機關幹部文化人科技界工業界人士參入隊伍喊出李鵬下台的口號	vào ngày 1, bắc kinh cũng đã tổ chức một cuộc diễu hành cho một triệu người. nhiều quan chức chính phủ, nhân viên văn hóa, giới khoa học và công nghệ, và những người công nghiệp đã tham gia vào đội và hô khẩu hiệu của li peng tuy	industrial representatives joining the force, shouting out the resignation of  li peng slogan
月日北京市急救中心公佈自學生絕食請願以來的天中截至月日北京市各大醫院共救治學生人次留院觀察人次无一人死亡	vào ngày đầu tiên của tháng, trung tâm sơ cứu bắc kinh đã thông báo những ngày kể từ ngày tuyệt vọng của các học sinh. kể từ ngày đầu tiên của tháng, các bệnh viện lớn của bắc kinh đã giải cứu và chữa trị cho số học sinh.	treated students, kept for observation, no one died
月日北京高校學生已复课但北京大学和北京师范大学学生仍有一半學生罷課有些学生认为中央对学生运动的定性不改变就不应该复课当晚北大和北师大学生自治联合会宣布次日将继续罢课	sinh viên đại học bắc kinh đã nối lại các lớp học vào ngày đầu tiên của tháng, nhưng một nửa số sinh viên từ đại học bắc kinh và đại học sư phạm bắc kinh vẫn đang đình công. một số sinh viên nghĩ rằng sự thay đổi về chất của chính phủ trung ương trong phong trào sinh viên không nên được tiếp tục vào tối hôm đó.	federation of students ' self-government announced that they would  continue  striking in next day
月日北大学生自治联合会成员王丹召开民主沙龙号召继续罢课声援准备到中国记者协会请愿抗议世界经济导报事件的记	vào ngày đầu tiên của tháng, wang dan, thành viên của liên đoàn tự trị sinh viên đại học bắc kinh, đã triệu tập salon dân chủ và kêu gọi tiếp tục đình công.	the report of petition to protest the world economic herald
月日发售	bán hàng tháng	month day started selling
月日台灣	đài loan	month date taiwan
月日数十万北京各界群众涌向天安门广场声援绝食学生阎明复在学生前說改革需要你们进行下去你们要爱护自己等待正义的裁判的这一天就要到来了我请求你们我可以和你们一起静坐请求你们能够爱惜自己然而學生未有理會勸告	vào một ngày trong tháng, hàng trăm ngàn người từ mọi tầng lớp ở bắc kinh đã đổ về quảng trường thiên an môn để hỗ trợ sinh viên tuyệt thực yan mingfu nói trước khi các sinh viên cải cách cần bạn tiếp tục bạn có thể trân trọng bản thân mình, nhưng các sinh viên đã nhận lời khuyên	can cherish yourself, yet students did not listen to the advice
月日新城勁爆頒獎禮	lễ trao giải tốt nhất	month/date: hong kong hit radio music awards ceremony
月日日	tháng ngày	month, day, day
月日早晨工自联的广播称诙会执委沈银汉被捕了另一名叫白宗雄的执委也被北京铁路公安分局抓走了	vào buổi sáng của tháng, phát thanh công đoàn tự quản tuyên bố rằng shen yinhan, thành viên ủy ban điều hành, đã bị bắt giữ. một giám đốc điều hành khác tên bai zongxiong cũng bị cục công an đường sắt bắc kinh bắt giữ	committee member has been arrested by beijing railway police station
月日明報頭版報導李鵬中槍指有年青武警軍官於人民大會堂內射殺李鵬並身亡後來被證實為誤報同版新聞還有北京兵變互相開火四路大軍圍攻二十七軍死十萬人也要再殺盛傳鄧小平病逝等等後來張健波指出當時很多信息是無法核實的有些根本無從判斷真假而且很受當時的情緒牽動不止是編輯室的而是受整個社會的情緒牽動	trang nhất của yueming ming báo cáo rằng li peng đã bắn một sĩ quan cảnh sát vũ trang trẻ, người đã bắn và giết li peng trong đại lễ đường nhân dân và sau đó được xác nhận là dương tính giả. phiên bản bắc kinh của cuộc nổi loạn đã nổ súng vào nhau. để tiêu diệt những tin đồn về cái chết của đặng tiểu bình, v.v.	from the editor's office, and also influenced by the emotions of the entire society
月日是運動擴大的轉捩點当日人民日報首次发表题為維護社會穩定是當前大局的社論指責數百人圍聚新華門前製造事端人民日报也发表社论批评新华门外学生静坐事件	ngày của tháng là bước ngoặt của sự mở rộng của phong trào. nhật báo nhân dân lần đầu tiên xuất bản một bài xã luận với tựa đề &quot;duy trì sự ổn định xã hội và tình hình hiện tại&quot;.	editorialize to criticize the student sit-down demonstration outside xinhuamen
