ส่งเสริม	promote	0.06714878502788478
ภาษาเกชัว	quechua language	0.06717130319075929
เป็นสีประจำ	official color	0.06723503428292942
จังหวัดเพชรบุรี	petcharaburi state	0.06725483980929765
โครงการนานาชาติ	international program	0.06727062168834073
อำเภอเมืองอุตรดิตถ์	mueang uttaradit district	0.06736689097828821
ภาพพิมพ์	lithography	0.06738341567357077
ในบางฉบับ	in a certain issue (of a magazine)	0.06739000077116546
ยุคโลหะ	metal age	0.06743056037814163
ซึ่งมีความหมายว่า	meaning	0.06752966479606413
สมภพ	sompob	0.06759890854425386
เพลงประจำมหาวิทยาลัย	university song	0.06772433829989247
พระองค์เจ้าสิริวัณณวรีนารีรัตน์	the name of one of the king's granddaughter	0.06773459517847068
เป็นบัวในสกุล	is a lotus in the family	0.06774010068868566
ณัฏฐธิดา	nattathida - a thai female actress	0.06787163768907448
จิกะไบต์	gigabyte	0.06799366198111169
เมืองยอง	mueng-yor	0.0680246975885587
คณะบัญชี	accounting department (major)	0.06817194960686371
ฮิตเลอร์	hitler	0.06824846184502856
โทรโข่ง	a megaphone, portable sound directing equipment.	0.0682809325233364
กัมปูเชีย	kampuchea	0.06832965830913486
ทิศตะวันตก	west	0.06833978513348082
อัลเดบารัน	arudebaran	0.06836943529447563
โอะกินะวะ	okinawa	0.06838873837439954
หินไซอัล	sial	0.06847159145110975
ในเอเชียตะวันออกเฉียงใต้	in southeast asia.	0.0684828138534743
สภาพอากาศ	weather conditions	0.06852237575351543
ไมอามี่	miami	0.06874268692089598
ไปรษณีย์นครศรีธรรมราช	nakornsritamarat postal station	0.06875230701754781
กว่า	than	0.06899740553936726
กรมทหารราบที่	infantry regiment	0.06902616716291185
ยุคอะซึกะ	asuka period	0.06905079060610307
กลอง	drum	0.0690820795386909
ตระกูลอินุซึกะ	inu-tsuka family	0.069176160323593
หมวดหมู่อดีตอาณานิคมของสเปน	category:former spanish colonies	0.06926045385704037
ฮิโซกะ	hisoka	0.0693174990111962
ดีเอ็นเอ	dna	0.06934143551969965
เภสัชจลนศาสตร์	pharmacokinetics	0.06936253136977125
โฟลเอ็ม	phloem	0.06952723803153332
เดอะซิมส์	the sims	0.06972515131907571
ประธานกรรมการ	chairman	0.06984251869037286
ปีจอโทศก	year of the dog	0.07005395050972293
หมวดหมู่สถาบันอุดมศึกษาในกรุงเทพมหานคร	category:universities in bangkok	0.07010477828817714
คำม่วง	kham muang	0.07037332144352575
สวนสมเด็จพระศรีนครินทร์	pra sri nakarin - a king of thailand	0.07043417631807962
บัณฑิต	bandit	0.07045339139996461
ทรงได้รับการทูลเกล้าฯ	the king of thailand gives out ____ to people	0.07045865565047015
สิทธิ	rights	0.07046906045271102
กลอบูลิน	globulin	0.07058817699173535
ข้อมูลทั่วไป	general information	0.07060112314987124
ในชิงร้อยชิงล้าน	game show to compete for 1 million baht	0.07067106364657352
ปาเลสไตน์	palestine	0.07077069402907588
พ่อมด	wizard	0.07077279802305252
รายพระนามพระมหากษัตริย์ไทย	list of thai monarchs	0.07092335373448996
สงครามเกาหลี	korean war	0.07100879061834943
ประเทศฟินแลนด์	finland	0.07100905089357268
อำเภอเฉลิมพระเกียรติ	amphur chalermprakiet	0.07106598179791433
อเมริกัน	american	0.07120911498492485
ครู	teacher	0.07121560825452745
๑๘	18	0.07123691568125019
กัมพูชาเป็นประเทศที่มีป่าไม้อุดมสมบูรณ์มากที่สุดหากเปรียบเทียบกับประเทศเพื่อนบ้าน	cambodia is the country with nice, healthy forests	0.0712373036940184
อดิศักดิ์	adisak	0.07129359961649992
พากย์เป็น	subtitle	0.07135800591208942
ผลงานหนังสือ	publication	0.07137342896530925
พลอสนธิ	sonthi - a famous thai army officer	0.0714116358023508
๒๕๔๗	2004	0.07159799811116067
ยุคเฮอัง	heian period of japan	0.0716071512032045
ธกรุงไทย	krung thai bank	0.07164568100980266
วิทยาเขตเฉลิมพระเกียรติ	vittaya kat chalerm pra kiet - a location at kasetsat university in thailand	0.07165745962323632
รางวัลนักร้องไทยสากลชายยอดนิยม	best thai male singer award	0.07166925204083208
อยู่ห่างออกไปจากชายฝั่ง	away offshore	0.07173729395677533
ตะละภัฏ	talaput - a surname	0.07192957142627045
เจ้าฟ้าภาณุรังษีสว่างวงศ์	prince panuragui bright chestnut.	0.07196475062557174
ดังนั้น	for that reason	0.07198690195441902
อดีตรองหัวหน้าหน่วยที่	former lieutenant	0.07227342850375645
ลี้สุวรรณ	lisuwan	0.0722847053507486
อักษรเกาหลี	korean alphabets	0.07228892143903322
ชิคิกามิ	shikigami	0.07238490145886022
ชั้นยศ	rank	0.07255960022372912
ความยาว	length	0.07259066531896306
สนธิ	sonti - a male's name	0.07268592033376126
มีดาบฟันวิญญาณ	have a sword to fight the ghost	0.07269795030473795
แอลจีเรีย	algeria	0.07280653961400174
ค่าจีดีพี	gdp - an economics term	0.07310672149916221
แอซิด	acid	0.07313075042808753
ของมัน	their	0.07315657248808106
และตำแหน่ง	and position	0.07320658894866236
กลุ่มดาวกล้องจุลทรรศน์	microscopium	0.07328241791278925
เจ้าฟ้ากรมพระยานริศรานุวัติวงศ์	prince narisara nuvativongse	0.07358735320937275
ประจวบคีรีขันธ์	prajoubkirikan state	0.07387045854129101
โรค	disease	0.07388651398757101
รีเนียม	rhenium	0.0738971739115791
ซัลฟาไดอะซีน	sulfadiazine	0.07393816934913552
กีฬา	sport	0.07404473428450771
ปืนพกกึ่งอัตโนมัติ	semi-automatic pistol	0.07405961173062091
แอมเวย์	amway	0.07412375592509624
จากละครเรื่อง	from the soap opera	0.07417967401784024
ในปีนี้	this year	0.07421667070625138
เทศบาลเมืองมหาสารคาม	thesaban mueang maha sarakham	0.07426638217640402
ขรรค์ชัย	kanchai - a male's name	0.07427550277412055
เทพพิทักษ์	theppitak	0.07429499027889445
กกกก	a thai letter repeated 4 times	0.07430855239866982
ดูแล	care	0.07440205718273821
สารพฤกษเคมี	phytochemical	0.07451232424020751
ใจดี	kind	0.07455893212392348
ดิศกุล	disakul (last name)	0.07463362666980443
เฮาส์	house	0.07466026600115103
บทบาททางการเมือง	politic	0.07466276701467986
ในขณะที่	while	0.07489792652446038
ในช่วงสงครามโลกครั้งที่สอง	during world war ii	0.07501417125402585
บางส่วน	some	0.075045959803805
สมเด็จพระบรมโอรสาธิราชฯ	the crown prince of thailand	0.07504829534057356
สุกิจ	sukit	0.07507303128825246
ทองประสม	thongprasom	0.07508433973205059
สยามบรมราชกุมารี	the current king's eldest daughter, the eldest princess	0.07530242195647235
ซาอิ	chai - a japanese name	0.0753062755028572
สุขาภิบาล	sukhapibal (name of district)	0.07546536733526003
สารีวงษ์	sariwong	0.07553731892240696
เอ็มม่า	emma	0.07555484301159265
เดือดทะลุจุดศูนย์	zero point breakthrough	0.0755868834593942
ไทโรซีน	thyrosine	0.07567733047953741
เพียงพอ	enough	0.07568560496740394
ไวท์สเปล	white spell	0.07571571463788421
จากสารานุกรมบริทานิกา	from printed information	0.07573735681612837
เป็นวิญญาณเทียมเพศชาย	the spirit who is a male	0.07584717533035469
ภาควิชาวิศวกรรมเครื่องกล	department of mechanical engineering	0.07602264725357016
กองบินปีกหมุนที่	flight corp number __________	0.07609681791705611
เนเธอร์แลนด์	netherlands	0.07609681791705612
ปรีดา	prida - a male's name	0.07631504016379136
ไวน์	wine	0.07632694023886356
อมฤต	ummarit - a male's name	0.0763918853463127
ทางทิศตะวันออก	east	0.07646769621207229
วัฒนา	wattana	0.07646769621207229
ธนิต	thanit	0.07649083445293592
คนที่ไปช่วยรุ่นที่	volunteer group number __________	0.07655948613233585
จำเริญ	jamroen	0.07678325569935647
เกาะ	island	0.07682137617431578
นักแสดง	actor/actress	0.07687026816059733
ริเอะ	rie tanaga - a japanese singer	0.07689099288164995
สาธารณรัฐเช็ก	czech republic	0.07690513970167621
นิตยสารชีวจิต	cheewajit magazine	0.07691285749298629
ตำบลนางแล	nang lae province	0.07693339585934691
ล่าทา	lata	0.0770863619081297
นักศึกษาวิชาทหาร	army reserve force students	0.0771803324336346
ไลท์	light	0.07728839365617143
ตะวันออก	east	0.07728946808495632
ข้าหลวงกำกับราชการเมืองขุขันธ์คนที่	government worker for ku khan city	0.07729767054245029
จรัญญา	jarunya - a surname	0.07734040056907757
แต่ในปัจจุบัน	in the present	0.07742713970770997
ลำดับพระปฐมวงศ์ในพระบรมราชวงศ์จักรี	order of the kings	0.07742727784595249
องคชาต	penis	0.07746095038979299
เส้นใย	fiber	0.07755495021213048
ท่ายาง	tha yang	0.0777214629060299
ยุคเรเนสซองส์	renaissance	0.07772499725741205
ไชโย	chaiyo	0.07781202547048614
ฟิสิกส์อนุภาค	particle physics	0.07782766503488123
ยิ่งลักษณ์	yingluck	0.07790936308257465
เอเธนส์	athens	0.07803418891830642
เส้นพุ่ง	yarn that is used for weaving	0.07823581569606047
วว	office of ____________	0.07828858021023453
แมวป่า	jungle cat	0.07831107321141417
เรซูเม	resume	0.07854238239837195
โรงเรียนเจ้าพระยาวิทยาคม	chao praya vitanakom school	0.07854619939076635
ให้พลเอกเปรม	general prem - a former military figure	0.07867840062658578
อาร์เมเนีย	armenia	0.07888676391515491
ธุรกิจ	business	0.07892035466877052
เอสเอ็ม	sm	0.07897330155725737
หมู่	district, group	0.07903967887634815
สตรอเบอรี่	strawberry	0.07919643299677208
ฟิวชัน	fusion	0.07943652131868238
ภูมิรัตน์	poomirath	0.07946552039336639
สนิทวงศ์	there are families.	0.07960617734592355
พระบาทสมเด็จพระนั่งเกล้าเจ้าอยู่หัว	jessadabodindra	0.07969178682713011
ท่าศาลา	sala pier	0.07971493464311125
ดอกอ้อ	dok aou	0.07987023541887249
ชม	chom	0.08006061165768359
กระนวน	granuan - location in knon kan province	0.08026413442872006
กาเหว่าที่บางเพลง	the cuckoo's song.	0.08038084860923292
ปวดข้อ	joint pain	0.0804466689852496
ทางรถไฟ	rail	0.0804466689852496
อำเภอแม่แตง	mae taeng district	0.08045005098416545
โทน	tone	0.0805672791950433
แพลทฟอร์ม	platform	0.08056998340431679
แอนดรอยด์	android	0.08064944946126348
ณภัทร	napat	0.08084973595029021
เสนาเมือง	senamuang	0.08089057350067196
เกาะคา	ko kha	0.08093690455226066
เพลย์สเตชัน	playstation	0.08102053976334989
ฮอลโลว์	hollow	0.08102709319183993
คริสต์ศาสนา	christainity	0.0810806524591976
เทศบาลเมืองชัยภูมิ	mueang chaiyaphum	0.08109001162591262
ทรงผนวช	ordain	0.08113245333106145
สนเกรวิลเลีย	grevilea - family of 250 types of plants	0.08114482834663755
จากภาษากรีก	greek language	0.08121877920273171
ซาลาดิน	saladin	0.08145503738596524
ยางธรรมชาติ	natural rubber	0.08162083986900805
สารละลาย	solution	0.08194131520912472
นายกำพล	kamphon	0.08194178846925718
โซเฟีย	sofia	0.0820549314819826
ทศกัณฐ์	ravana	0.08212051554151975
ชาร์ป	sharp	0.08226542147446961
ฆ้อง	gong	0.08235825015287235
ชลิต	chalit	0.082453934369284
โรงพยาบาลอานันทมหิดล	ananthamahidol hospital	0.0826154953809437
คณะพยาบาลศาสตร์	nursing department	0.08268933778603323
พระที่นั่งบรมพิมาน	the king's seat	0.08277827090032153
เดชา	decha	0.08283088386735664
ต่อมาวันที่	later on the date	0.08301990687547127
วิศวกรรมเครื่องกล	engineering	0.08317659847698529
การปฏิวัติอุตสาหกรรม	industrial revolution	0.08340360040753567
สนามแม่เหล็ก	magnetic field	0.0834245780895624
พยายามชี้ให้สาธารณชนและนานาชาติ	encourage to promote the people and international policies	0.0834893090510496
สำนักงานคณะกรรมการวัฒนธรรมแห่งชาติ	office of arts and culture preservation of thailand	0.08362994929231617
นิวัฒน์	niwat	0.08367886414174469
อำเภอบางเสาธง	bang sao thong district	0.08369411540831691
กะโหลก	skull	0.08380852780681423
พจนานุกรมออนไลน์	online dictionary	0.08382368828580726
โยฮันน์	johann	0.08385527633560104
จะเข้	jakhe	0.08400109149943347
นายสุนทร	mr. soontorn - a male's name	0.08401187359654497
บางครั้ง	sometimes	0.08403769872262173
พ่อขุนศรีอินทราทิตย์	po kun intarathip - the fist king of thailand	0.08442667078613782
ส่วนของผู้ถือหุ้น	shareholder fund	0.08490913728131756
ราชวงศ์ถัง	tang dynasty	0.08493996229377114
แต่งโดย	composed by	0.08498903246729263
อำเภอปากช่อง	pak chong district	0.08500231885430719
พันธเสน	panthasen (thai last name)	0.08520099587266397
อาร์มาดิลโล	armadillo	0.08521880296939158
มาตรฐาน	standard	0.08544567686658326
วันสงกรานต์	songkran day	0.08547330292887256
ผ้าอนามัยโซฟี	sofi sanitary napkin	0.08566170671399713
นักดนตรี	musician	0.08566418372370826
ฟิสิกส์ดาราศาสตร์	astrophysics	0.08566418372370826
ฟังไจ	fungi	0.08566831797130876
ต้นตอจักรวาลวิทยา	cosmogony	0.08576858347987994
วิวัฒนาการ	evolution	0.08578645666055572
รัศมี	radius	0.08580617343034197
เซโรไลเนอร์	seroliner	0.08594949211619639
อายุ	age	0.0859981777647044
มัทนะพาธา	matthanaphatha	0.08602920876283454
มิวสิกวีดีโอ	music video	0.08622775509998107
เด็กหญิงอายุ	the girl's age	0.08626706793262903
ศิริวรรณ	siriwan - a female's name	0.08636276950420332
ในช่วงสงครามโลกครั้งที่	in time of world war	0.08640058585444182
สถานีคาราวาน	caravan station	0.08645752190179633
แคม	cam	0.0866499810375739
จังหวัดสมุทรสงคราม	samut songkhram province	0.08668588884479107
กุ้ง	shrimp	0.08673772709564
บุตร	son	0.0867730232248882
หลักสูตรนานาชาติ	international course	0.08685922315922653
ดอว์ขิ่นจี	dorkingi	0.08693709704752388
จากอัลบั้ม	from the album	0.08695718532070613
แฮปปี้และชาร์ล	happy and charles	0.08697522407969005
ศรีสำโรง	si samrong	0.0871971757192914
ลักเซมเบิร์ก	luxembourg	0.08728434021784143
ประเทศซูดาน	sudan	0.08749105834907525
ลักษณะภูมิอากาศ	climate	0.08751174704996656
รถด่วนสายทางช้างเผือก	galactic express	0.08752221960420199
ได้กล่าวว่า	said	0.08758383839341097
พระบรมราชชนก	the king's sister	0.08759446212473761
บูมเมอแรง	boomerang	0.08762589502428049
แยกจากคลองบางกอกใหญ่ฝั่งซ้าย	forked from khlong bangkok yai	0.08773087548697187
การร่วมเพศทางทวารหนัก	sodomy	0.08777496361435119
อำเภอสามพราน	sam pran area	0.08780523766822755
เหตุการณ์สำคัญ	important event	0.08780866803839021
ตัวยักษ์	giant	0.08803739286158624
อำเภอโนนดินแดง	non din daeng district	0.08815795875905703
ส่วนใหญ่เป็นโรงสีข้าว	most of them are rice refinery	0.08815976660197364
รถยนต์อเนกประสงค์	automobile	0.08832405089342478
หมอชิต	mochit bus station	0.08841964448055649
กระทรวงสาธารณสุข	ministry of public health	0.08844894144994442
อัมพร	umpon - a female's name	0.08849722682632168
ธนาคารทหารไทย	tahanthai bank	0.08852610650894699
การจัดการคุณภาพ	quality control	0.08856180541557777
ที่จ่ายร้อยละ	costing	0.0885790546491621
ห้างหุ้นส่วนจำกัด	limited partnership	0.0886768845461251
ในพระบาทสมเด็จพระพุทธยอดฟ้าจุฬาโลก	under the reign of one of the thailand's past king	0.08869897231321845
ตัวเลขอย่างเป็นทางการ	official number	0.08877385852740372
เอี่ยมสุข	iamsuk	0.0888915731936405
เมฆ	cloud	0.08893189309736943
จากเรื่อง	from the story of ...	0.08908028188522878
ไดดาโนซีน	didanosine - medication	0.08927305077413068
ชีวประวัติ	biography	0.08927414695022515
โบอิง	boeing company	0.08930622574165843
สกอตแลนด์	scotland	0.08940020527552281
พระลอ	phra lo	0.08960611033945148
นกกระจอก	sparrow	0.08965206640545523
สส	representatives	0.08970290419197993
แกะ	sheep	0.08972230285149708
เขื่อนกิ่วลม	kio lom dam	0.08981891204055556
เบธเลเฮม	bethlehem	0.08983773442362726
ทองขาว	white gold	0.08999728554729303
บางใหญ่	bang yai - a location in thailand	0.09010328677989668
ไทลื้อ	group of laotians that lives on flatlands	0.09017414265469081
โซลดิ๊ก	sol-dig	0.0901990731784551
ปิยะพงษ์	piyapong	0.09058558532851037
เนื่องจากประเทศเหล่านั้นอยู่ในตำแหน่งบนโลกที่ต่างไปจากประเทศไทย	because those countries are in the group of...	0.09058802155313168
สาเหตุ	reasons	0.09059830434511013
ควินโต	quinto	0.09070139639364416
ตะลุยอวกาศ	space trek	0.09072761852812494
ทั้ง	all	0.09072766269542423
มิลฟีโอเล่	millefiore	0.0907316718309007
นพจินดา	noppajinda - a surname	0.0907390454003869
ราศีธนู	sagittarius	0.09080027635769825
ทุ่งสง	tong song or nakon sri thamarat state	0.09086457863343289
เวียนเทียนรอบอุโบสถหรือสถูปเจดีย์พุทธสถานต่าง	a thai religious ceremony	0.09112841217084786
กองทัพไทย	thai army	0.09117244247111941
โดยมีพระภิกษุสงฆ์นำเวียนเทียน	buddhist monks performing ceremony for vientien buddhist religious holiday	0.0912627358438716
หมวดหมู่บุคคลจากสถาบันบัณฑิตพัฒนศิลป์	group of staff from art schools	0.09134063177575691
ฮิมาวาริ	himawari - a japanese surname	0.09134460644449174
อภิรักษ์	apirak	0.0915490745316404
ไปรษณีย์ฉะเชิงเทรา	chachoengsao post office	0.09172672901731048
ไปรษณีย์หนองหาน	nong han postal office	0.0917715013579512
พระบรมราชินี	queen	0.09187880595863318
มีฉายาว่า	famous for...	0.0918870274207577
ช้อน	spoon	0.09190924547499109
นักร้อง	singer	0.09192533769660767
บัณฑิตวิทยาลัยร่วมด้านพลังงานและสิ่งแวดล้อม	joint graduate school of energy and environment	0.0920282794886006
ปิ่นเกล้า	pin glow - an area in thailand	0.09203383902961192
เลขาธิการสหประชาชาติ	united nations secretary-general	0.09212613345131264
คาซัคสถาน	kazakhstan	0.09216836912080312
หลังเหตุการณ์	after the event	0.09242616792326848
ความโน้มถ่วง	gravity	0.09245057870234293
หมวดหมู่โรค	group of disease	0.0924615802972742
โยชิโนะ	yoshino	0.09246477555233325
อำเภอกมลาไสย	kamalasai district	0.0924767729337559
สวนดุสิตโพล	suan dusit poll	0.09254463478384532
สงครามอวกาศ	space war	0.09262939520494415
โฮม	home	0.09263899502928687
คราม	indigo	0.09271018635068738
มีล่า	mila	0.09275659984203982
ตึก	building	0.09278028380345131
ผู้ชนะ	winner	0.09287872281302133
นักร้องเพลงไทยสากลชาย	male thai pop singer	0.09288782307282514
อิม	im	0.09300950376489071
กรรชัย	kanchai	0.0931094260720633
กระบะทราย	sand box	0.0931480825440068
สถาบันศูนย์และหน่วยงานในมหาวิทยาลัย	current faculties/college/school/institutes	0.09317463654072264
วงษ์คำเหลา	wongkamlao	0.09324049112011507
ฉาบ	cymbal	0.09342301311056854
วันที่ออกอากาศชื่อตอนแขกรับเชิญ	when the invitation comes out	0.09342871816286936
อึ๊งภากรณ์	ungpakorn - a famous surname	0.09349547847734693
นอกจาก	besides	0.09355290839178461
สปริงฟิลด์	springfield	0.09379890110465684
โรมัน	roman	0.09387700732906745
ไม่แตกกิ่ง	no chain	0.09430384028603861
กระวนกระวาย	nervous	0.09438375921386809
รำพันพิลาป	poem called rum pan pi lab	0.09441812368339833
และอเมริกาเหนือ	and north america	0.09449205770043147
จมูก	nose	0.09449942729851481
ไลบร้า	libra	0.09461088271084986
ประการที่	number	0.09476101344749932
ตอน	edition number	0.09492479367251053
ไอร์แลนด์เหนือ	northern ireland	0.09505387793034423
ไปรษณีย์อำนาจเจริญ	amnat charoen post office	0.09506371146098513
นิ่มสกุล	nimsakun	0.09509057628617867
รองประธานรัฐสภาคนที่หนึ่ง	an assistant head of a thai governmental committee	0.09511505513428718
ในยุคกลาง	in the middle ages	0.09525306324287525
มีลาภ	milap	0.0953206993594533
อำเภอราษีไศล	rasi salai district	0.09542695444466572
ซุง	sung	0.09551270320945125
ชาวไทย	thai	0.09574784832139357
อยู่	is	0.0957574159442317
ในอดีต	in the past	0.09576800306486147
