+	+	Nan
กองทัพบกไทย	thai hadsereg	Nan
กองทัพภาคที่	a régió hadserege	Nan
กองทัพเรือ	haditengerészet	None
กองทัพเรือไทย	thai haditengerészet	Nan
กองทัพแห่งความชอบธรรม	az igazság hadserege	Nan
กองทัพไทย	thai hadsereg	Nan
กองบิน	légierő	None
กองบินปีกหมุนที่	wing spinning wing	Nan
กองพลทหารม้าที่	a lovasság brigádja	Nan
กองพันทหารช่างที่	a mérnök brigád	Nan
กอด	ölelés	Nan
กันอริ	kanori	Nan
กันฟอร์ม	forma	None
กันทรลักษ์	kantharalak	Nan
กันตัง	kantang	Nan
กันดั้ม	gundam	Nan
กังหันชัยพัฒนา	chaipattana turbina	Nan
กองกลาง	középpályás	Nan
กะโหลกศีรษะ	koponya	Nan
กะเหรี่ยง	karen	Nan
กอล์ฟไมค์	golf mikrofon	Nan
กอล์ฟ	golf	Nan
กอลมเบต์	göreme	Nan
กอร์ดอน	gordon	None
กอนซาเลซ	gonzalez	Nan
กะโหลก	koponya	Nan
กรี	szürke	None
กว่า	mint	None
กวิน	kawin	Nan
กรุงธนบุรี	thon buri	Nan
กรุงลอนดอน	london	None
กรุงศรีอยุธยา	ayutthaya	Nan
กรุงเทพ	bangkok	Nan
กรุงเทพเชียงใหม่กรุงเทพ	bangkok, chiang mai, bangkok	Nan
กรุงเทพโพลล์	bangkok poll	Nan
กรุ๊ป	csoport	None
กลอง	dob	Nan
กลองมโหระทึก	nagy dob	Nan
กลองยาว	dob	Nan
กลองสองหน้า	két arcú dob	Nan
กลอน	vers	None
กลอบูลิน	fényes	None
กลาง	középső	None
กลิ่น	szag	Nan
กลุ่มดาวกล้องจุลทรรศน์	mikroszkópok csillagképei	Nan
กลุ่มดาวนกทูแคน	tukánmadár	Nan
กวาง	szarvas	None
กวม	guam	Nan
กล้ามเนื้อ	izom	Nan
กล้องถ่ายภาพ	kamera	Nan
กล้วยไม้ดาว	csillag orchidea	Nan
กล่าวคือ	vagyis	None
กวี	költő	None
กลูคากอน	glucon	Nan
กลุ่มที่	a csoport	Nan
กลุ่มดาวแมลงวัน	legyek	Nan
กลุ่มดาวแมงป่อง	skorpió	Nan
กลุ่มดาวเตาหลอม	nagyolvasztó kemence	Nan
กลุ่มดาวเข็มทิศ	csillagkép iránytű	Nan
กลุ่มดาวสิ่ว	véső	Nan
กลุ่มแสงอุษา	usa könnyű csoport	Nan
ขม	keserű	None
ขรรค์ชัย	khan chai	Nan
ขลุ่ยหลิบ	fuvola	Nan
คิด	gondol	Nan
คินนิคุแมน	kinnikuman	Nan
คิมิฮิโระ	kimihiro	Nan
คิระ	kira	Nan
คิเคียว	kikyo	Nan
คีตกวี	zeneszerző	None
คือประมาณ	körülbelül	None
คือเพลง	egy dal	Nan
คุณ	ön	None
คุณครูจอมเวท	a varázsló tanár	Nan
คุณปลื้ม	khun pluem	Nan
คุณหญิงโม	mo császárné	Nan
คุณากร	ön	None
คุราปิก้า	kurapika	Nan
คุโรซึจิ	kurotsuji	Nan
คุ้มค่า	jó ár-érték	Nan
คูกิมิยะ	kukimiya	Nan
งาน	munka	None
งดส่งเข้าประกวด	belépni tilos	Nan
ฆ้องวงใหญ่	nagy gong	Nan
ฆ้อง	gong	None
ฆ	juan	None
ค้างคาว	denevér	Nan
คิชิเนีย	kishinya	Nan
ค่ำแล้ว	szürkület	None
ค่าจีดีพี	gdp	None
ค่าความต้านทานตัวที่	az ellenállás értéke, hogy	Nan
คู่กรรม	partner	Nan
คูเวต	kuvait	Nan
คูเรียม	curium	Nan
คูคาคุ	kukaku	Nan
ค่าใช้จ่าย	a költség	Nan
งานอดิเรก	hobbi	Nan
คิงไลเนอร์	kingliner	Nan
คิงส์	kings	Nan
คาคาชิ	kakashi	Nan
คางาริ	kagari	Nan
คาซัคสถาน	kazahsztán	None
คาถาอัญเชิญ	varázsige	Nan
คาบ	időszak	None
คาบัคโรเน่	kabakhroone	Nan
คาบูโตะ	kabuto	Nan
คาปูชิโน่	cappuccino	Nan
คามิว	kamui	Nan
คาราคุระ	karakurában	Nan
คาร์ล	carl	None
คาวทอง	fishyong	Nan
คาเมนไรเดอร์	kamen rider	Nan
คาโรลัส	carolas	Nan
คำขวัญวันเด็ก	gyereknap szlogen	Nan
คำถามข้อที่	kérdés száma	Nan
คำนวณ	kiszámítja	Nan
คิง	király	None
คำแปล	fordítás	None
คำเมือง	városi szó	Nan
คำอธิบาย	a leírás	Nan
คำสุภาพ	udvarias szó	Nan
คำสุดท้ายของวรรคที่	a bekezdés utolsó szava	Nan
คิงส์คัพ	king&#39;s cup	Nan
คำสร้อย	szó	None
คำศัพท์	szójegyzék	None
คำวิลัยศักดิ์	kamwilai sak	Nan
คำม่วง	kham muang	Nan
คำมั่นสัญญา	ígéret	Nan
คำพ้องรูป	szinonimák	Nan
คำนาม	főnév	None
คำสรรพนาม	névmás	None
คั่ว	sült	None
งานเขียน	írások	None
งานโมเสก	mozaik	Nan
จักรพันธุ์	chakphan	Nan
จักรวาลวิทยา	kozmológia	Nan
จังหวัด	tartomány	None
จังหวัดกระบี่	krabi tartományban	Nan
จังหวัดกาญจนบุรี	kanchanaburi	Nan
จังหวัดกาฬสินธุ์	kalasin	Nan
จังหวัดขอนแก่น	khon kaen tartomány	Nan
จังหวัดคยองกี	gyeonggi tartomány	Nan
จังหวัดคยองซาง	gyeongsang tartomány	Nan
จังหวัดฉะเชิงเทรา	chachoengsao	Nan
จังหวัดชุมพร	chumphon	Nan
จังหวัดตราด	trat tartomány	Nan
จังหวัดตาก	tak tartomány	Nan
จังหวัดนครปฐม	nakhon pathom tartomány	Nan
จังหวัดนครพนม	nakhon phanom tartomány	Nan
จังหวัดนครสวรรค์	nakhon sawan tartomány	Nan
จังหวัดน่าน	nan tartományban	Nan
จังหวัดอุดรธานี	udon thani tartomány	Nan
จังหวัดหนองบัวลำภู	nong bua lamphu tartomány	Nan
จังหวัดสิงห์บุรี	sing buri tartományban	Nan
จังหวัดสมุทรสงคราม	samut songkhram tartomány	Nan
จังหวัดสงขลา	songkhla	Nan
จังหวัดลำพูน	lamphun	Nan
จักรพรรดิไททัส	titus császár	Nan
จังหวัดราชบุรี	ratchaburi	Nan
จังหวัดยโสธร	yasothon	Nan
จังหวัดมหาสารคาม	maha sarakham tartomány	Nan
จังหวัดพิษณุโลก	phitsanulok tartomány	Nan
จังหวัดพังงา	phang nga tartomány	Nan
จังหวัดพระนครศรีอยุธยา	phra nakhon si ayutthaya	Nan
จังหวัดปัตตานี	pattani tartomány	Nan
จังหวัดระยอง	rayong	Nan
งานเทางามสัมพันธ์	tao ngam kapcsolat	Nan
จักรพรรดิเนอร์วา	nirvana császár	Nan
จะได้	kapni fog	Nan
งามวงศ์วาน	ngamwongwan	Nan
งู	kígyó	None
งูอนาคอนดา	anakonda	Nan
จดหมายอากาศ	repülõposta	Nan
จตรัง	trang	Nan
จตุรงค์	chatuchak	Nan
จนกระทั่ง	amíg	None
จนกระทั่งปี	az évig	Nan
จนกระทั่งเมื่อปี	a tavalyig	Nan
จนครปฐม	nakhon pathom	Nan
จนมีคำกล่าวว่า	amíg ezt nem mondták	Nan
จน่าน	mon	None
จบุรีรัมย์	buriram	Nan
จมูก	orr	Nan
จระเข้และแอลลิเกเตอร์	krokodil és aligátor	Nan
จรัญญา	charanya	Nan
จริยธรรม	etika	Nan
จะเข้	citera	Nan
จะเขียนว่า	azt fogja mondani	Nan
จะต้องหาตัวแทนลงจากเวที	meg kell találnia egy képviselőt, hogy kiszálljon a színpadról	Nan
จอร์เจีย	grúzia	Nan
จอมเทียน	jomtien	Nan
จอมพลเรือ	hajó marsall	Nan
จักจั่น	kabóca	Nan
จอมพลสฤษดิ์	sarit tábornagy	Nan
จอมบึง	duzzadt	Nan
จสุราษฎร์ธานี	surat thani	Nan
จสตูล	satun	Nan
จลำพูน	lamphun	Nan
จริยา	hölgy	None
จริยศาสตร์	etika	Nan
จอมพลถนอม	chom phon thanom	Nan
คัมภีร์	szentírás	Nan
คัพ	csésze	Nan
คันธวงศ์	kanthavong	Nan
ข้อมูลโดย	adatok:	Nan
ข้อวิพากษ์วิจารณ์	kritika	None
ข้ามฉาก	a színpadon	Nan
ข้าวสาลี	búza	None
ข้าวหลาม	khao lam	Nan
ข้าวเกรียบปากหม้อ	rizs sós keksz	Nan
ข้าวเจ้า	hántolatlan rizs	Nan
ข้าวโพด	kukorica	None
ข้าหลวงกำกับราชการเมืองขุขันธ์คนที่	khukhan város kormányzója, kormányzója	Nan
ฃ	ฃ	Nan
คงยิ่ง	nagyon valószínű	Nan
คงเจริญ	valószínűleg prosper	Nan
คณะครุศาสตร์	pedagógiai kar	Nan
คณะครุศาสตร์อุตสาหกรรม	ipari oktatás kar	Nan
คณะที่	kar a	Nan
คณะบัญชี	számviteli kar	Nan
คณะปฏิรูปการปกครองแผ่นดิน	forradalmi bizottság	Nan
คณารศ	kanara	Nan
คณะแพทยศาสตร์โรงพยาบาลรามาธิบดี	ramathibodi kórház orvostudományi kar	Nan
คณะแพทยศาสตร์ศิริราชพยาบาล	orvosi kar siriraj kórház	Nan
คณะเกษตร	mezőgazdasági kar	Nan
คณะสาธารณสุขศาสตร์	közegészségügyi kar	Nan
คณะสหเวชศาสตร์	szövetséges egészségtudományi kar	Nan
ข้อมูลอื่นๆ	egyéb információk	Nan
คณะสถาปัตยกรรมศาสตร์	építészmérnöki kar	Nan
คณะวิศวกรรมศาสตร์	mérnöki kar	Nan
คณะวิทยาการจัดการ	menedzsmenttudományi kar	Nan
คณะรัฐมนตรีคณะที่	szekrény	Nan
คณะมนุษย์ศาสตร์และสังคมศาสตร์	humán és társadalomtudományi kar	Nan
คณะพยาบาลศาสตร์	ápolási kar	Nan
คณะประมง	halászati kar	Nan
คณะศิลปกรรมศาสตร์	szépművészeti kar	Nan
คนที่	a személy, aki	Nan
ข้อมูลปี	év adatai	Nan
ข้อมูลประเทศเดนมาร์ก	dánia információ	Nan
ขวด	üveg	Nan
ขวัญ	hangulat	None
ขวัญใจช่างภาพ	szeretett fotós	Nan
ขสมก	tömeg	None
ของ	nak,-nek	Nan
ของทุกปี	minden évben	Nan
ของประเทศจีน	kínából	Nan
ของมหาวิทยาลัย	az egyetemen	Nan
ของมัน	a	None
ของร่างกาย	a testből	Nan
ของสมเด็จฮุน	somdej hun	Nan
ของสิ่งมีชีวิต	az élő dolgokból	Nan
ของสุนทรภู่	a sunthorn phu-tól	Nan
ของเหลว	folyékony	None
ของโลก	a világból	Nan
ขอนแก่น	khon kaen	Nan
ขอบคุณที่รักกัน	köszönöm, hogy szeretsz	Nan
ข้อมูลทั่วไป	általános információ	Nan
ขุนหาญ	han	Nan
ขุขันธิน	khan tin	Nan
ขึ้นไป	fel	None
ขึ้นเป็น	legfeljebb	None
ขี้ผึ้ง	viasz	Nan
ข้อมูลปรากฏการณ์โลกร้อน	globális felmelegedés jelenség	Nan
ขีดเส้นใต้	aláhúzás	Nan
ขิง	gyömbér	Nan
ขาย	elad	Nan
ขา	láb	None
ขั้นที่	lépés	None
ขอให้เด็กสมัยปฏิวัติของข้าพเจ้า	május forradalmi gyermekeim	Nan
ขอเช็ดน้ำตา	töröljük le a könnyeket	Nan
ขิม	cimbalom	Nan
คนที่ไปช่วยรุ่นที่	az emberek, akik segítették a generációt	Nan
คนแคระ	törpe	None
คนแรก	első személyű	Nan
ความยาวช่วงคลื่น	hullámhossz	Nan
ความยาวเพลง	dal hossza	Nan
ความรัก	szerelem	None
ความรู้	a tudás	Nan
ความสว่าง	fényerősség	Nan
ความสัมพันธ์กับประเทศไทย	kapcsolatok thaifölddel	Nan
ความสัมพันธ์ระหว่างจีนกับอเมริกา	kína és amerika közötti kapcsolatok	Nan
ความสูง	a magasság	Nan
ความส่องสว่าง	fényerősség	Nan
ความหนาแน่นของประชากร	nép sűrűség	Nan
ความหมาย	a jelentés	Nan
ความหมายโดยพยัญชนะ	mássalhangzó jelentés	Nan
ความเข้มของการส่องสว่าง	fényerősség	Nan
ความเข้าใจ	megértés	Nan
ความเร่ง	gyorsulás	Nan
ความโกรธ	harag	Nan
ความโน้มถ่วง	gravitáció	Nan
คัทลียา	cattleya	Nan
คัญทัพ	fontos hadsereg	Nan
คัชชินสกี	kutchinski	Nan
คัง	kang	Nan
คอสตาริกา	costa rica	Nan
คอลลิงวูด	callingwood	Nan
ความยาวคลื่น	hullámhossz	Nan
คอร์ด	akkord	Nan
คอนเสิร์ตประสานเสียงสามสถาบัน	három intézet kóruskoncert	Nan
คอนเวนชัน	egyezmények	Nan
คอนสตรัคชั่น	építkezés	None
คอ	nyak	None
ควีนซี่	királynő	None
ควินโต	quinto	Nan
คอมพิวเตอร์ยุคที่	számítógépes korszak	Nan
ความยาว	a hosszúság	Nan
ความยากจน	szegénység	None
ความพอประมาณ	szerénység	Nan
คลอง	csatorna	None
ครูพิเศษจอมป่วน	troll tanár	Nan
ครู	tanár	None
ครุฑ	garuda	Nan
คริสต์ศาสนา	kereszténység	None
คริสตี	christi	Nan
คลองสาน	khlong san	Nan
คริส	chris	None
คราประยูร	prayun	Nan
ครั้งหนึ่ง	egyszer	None
ครอบครัว	család	None
ครอคโคไดล์	krokodil	Nan
คม	éles	None
คปค	év	None
คราม	indigó	Nan
จังหวัดเชียงราย	chiang rai	Nan
คลองเตย	khlong toei	Nan
คลาวิคอร์ด	osztály	None
ความฝันอันสูงสุด	a végső álom	Nan
ความบริสุทธิ์	tisztaság	Nan
ความนิยม	népszerűség	Nan
ความถี่	frekvencia	None
ความต่างศักย์	lehetséges különbség	Nan
ความจำ	az emlék	Nan
คลับ	klub	None
ความงาม	a szépség	Nan
ควอร์เตอร์	negyed	None
ควอน	kwon	Nan
คลื่นสึนามิ	tsunami	Nan
คลิป	csipesz	Nan
คลินิก	klinika	Nan
คลิก	kettyenés	Nan
ความกว้าง	szélesség	Nan
ลักเซมเบิร์ก	luxemburg	None
ธรรมศาสตร์	thammasat egyetem	Nan
ธานินทร์	thanin	Nan
มณฑลหูหนาน	hunan	Nan
มณีวรรณ	maniwan	Nan
มด	hangya	Nan
มดลูก	méh	Nan
มต้น	kezdődik	None
มธ	tu	Nan
มธรรมศาสตร์	thammasat egyetem	Nan
มน	kerek	None
มนุษย์	férfi	None
มนุษย์กลายพันธุ์	mutáns	Nan
มนเรศวร	naresuan	Nan
มปท	nps	Nan
มม	mm	None
มมหิดล	mahidol egyetem	Nan
มยุรา	páva	Nan
มลายู	maláj	None
มวยปล้ำ	birkózás	Nan
มหาวิทยาลัยปทุมธานี	pathum thani egyetem	Nan
มหาวิทยาลัยบูรพา	burapha egyetem	Nan
มหาวิทยาลัยนเรศวร	naresuan egyetem	Nan
มหาวิทยาลัยทักษิณ	thaksini egyetem	Nan
มหาวิทยาลัยขอนแก่น	khon kaen egyetem	Nan
มหาวิทยาลัย	egyetemi	None
มจก	m	None
มหาวรรค	maha buddha	Nan
มหาปรมาภรณ์ช้างเผือก	maha paramaporn chang phueak	Nan
มหาบัณฑิต	fő-	Nan
มหาชัย	mahachai	Nan
มหาชน	nyilvános	None
มหัพภาค	átfogó	None
มสงขลานครินทร์	songkla hercege	Nan
มหาวชิรมงกุฎ	mahavajira korona	Nan
มหาวิทยาลัยพะเยา	phayao egyetem	Nan
มกราคม	január	None
ภู่สว่าง	phoo sawang	Nan
ภาพยนตร์ลามก	csúnya filmek	Nan
ภาพรวม	áttekintés	Nan
ภายหลัง	utána	None
ภายหลังสงคราม	a háború után	Nan
ภายใต้ความช่วยเหลือจากกองทุนการเงินระหว่างประเทศ	a nemzetközi valutaalap támogatásával	Nan
ภายในวงขอบเหรียญเบื้องบนมีข้อความว่า	az érme tetején egy nyilatkozat arról, hogy	Nan
ภารกิจ	küldetés	None
ภาวะเศรษฐกิจของกัมพูชาหลังจากมีการเปลี่ยนแปลงการปกครองจากระบอบสังคมนิยมเป็นระบอบประชาธิปไตย	kambodzsa gazdasági körülményei a demokratikus szocializmusról a demokráciára való áttérés után	Nan
ภาษาญี่ปุ่น	japán	None
ภาษาบาลี	pali	Nan
ภาษาสเปน	spanyol nyelv	Nan
ภาษาอังกฤษ	angol nyelv	Nan
ภาษาอีสาน	északkeleti nyelv	Nan
ภาษาเกชัว	kecsua	Nan
ภาษาเฉพาะอาชีพ	szakmai nyelv	Nan
ภาษาเบสิก	alapvető	None
ภาษาเยอรมัน	német	None
ภูเขาน้ำแข็ง	úszó jéghegy	Nan
ภูเขา	hegy	None
ภูหลวง	phu luang	Nan
ภูมิรัตน์	bhumirat	Nan
ภูมิภาค	vidék	None
ภูมิประเทศและภูมิอากาศ	topográfia és éghajlat	Nan
ม	m	None
ภูพาน	phu phan	Nan
ภูกามยาว	phu kam yao	Nan
ภูกระดึง	phukradueng	Nan
ภิรมย์ภักดี	phirom phakdi	Nan
ภิรมย์	kellemes	None
ภิญโญ	egyre jobban	Nan
ภาษาโคบอล	cobol	Nan
ภูธเนศ	bhutanet	Nan
ภาพยนตร์ตอน	epizód	None
มหาวิทยาลัยภูมินทร์พนมเปญ	phumin egyetem, phnom penh	Nan
มหาวิทยาลัยมหาสารคาม	maha sarakham egyetem	Nan
มังกี้	majom	Nan
มังคุด	mangosztán	Nan
มัจฉานุ	matcha	Nan
มัชฌิมาปฏิปทา	középső út	Nan
มัทนะพาธา	muthana phatha	Nan
มัธยฐาน	középső	None
มัธยมศึกษา	középfokú oktatás	Nan
มัธยมศึกษาปีที่	9. évfolyam	Nan
มันติคอร์	manticore	Nan
มัลเจร่า	malera	Nan
มากกว่า	felett	None
มากที่สุด	a legtöbb	Nan
มากิ	maki	Nan
มาครอส	macross	Nan
มาจยาร์	mayar	Nan
มาจากภาษาละติน	latinul	None
มาซากิ	masaki	Nan
มาลี	mali	Nan
มาลากุล	malakul	Nan
มาลัยพร	malai porn	Nan
มาร์แชล	marshall	Nan
มาร์ตินีก	martinique	Nan
มาร์ติน	márton	None
มะเร็ง	rák	None
มาร์ช	mocsár	Nan
มาริสา	marisa	Nan
มายน์ส	mines	Nan
มานี	mani	Nan
มาตรา	szakasz	None
มาตรฐาน	alapértelmezett	Nan
มาดริด	madrid	None
มาริเบล	maribel	Nan
มหาวิทยาลัยมหาจุฬาลงกรณราชวิทยาลัย	mahachulalongkornrajavidyalaya university	Nan
มะริด	myeik	Nan
มะขาม	tamarindusz-fa gyümölcse	Nan
มหาวิทยาลัยมหิดล	mahidol egyetem	Nan
มหาวิทยาลัยรังสิต	rangsit egyetem	Nan
มหาวิทยาลัยราชภัฏบ้านสมเด็จเจ้าพระยา	bansomdejchaopraya rajabhat university	Nan
มหาวิทยาลัยราชภัฏสงขลา	songkhla rajabhat egyetem	Nan
มหาวิทยาลัยราชภัฏสวนสุนันทา	suan sunandha rajabhat egyetem	Nan
มหาวิทยาลัยราชภัฏอุตรดิตถ์	uttaradit rajabhat egyetem	Nan
มหาวิทยาลัยราชภัฏเทพสตรี	thepsatri rajabhat egyetem	Nan
มหาวิทยาลัยราชภัฏเลย	loei rajabhat egyetem	Nan
มหาวิทยาลัยวงษ์ชวลิตกุล	wongchawalitkun egyetem	Nan
มหาวิทยาลัยศรีนครินทรวิโรฒ	srinakharinwirot egyetem	Nan
มหาวิทยาลัยศรีปทุม	sripatum egyetem	Nan
มหาวิทยาลัยศิลปากร	silpakorn egyetem	Nan
มหาวิทยาลัยสุโขทัยธรรมาธิราช	sukhothai thammathirat nyílt egyetem	Nan
มหาวิทยาลัยอีสาน	északkeleti egyetem	Nan
มหาวิทยาลัยอุบลราชธานี	ubon ratchathani egyetem	Nan
มหาวิทยาลัยอ๊อกซฟอร์ด	oxfordi egyetem	Nan
มหาวิทยาลัยเกษตรศาสตร์	kasetsart egyetem	Nan
มอหาดใหญ่	mor hat yai	Nan
มอสส์	moha	Nan
มอส	moha	Nan
มอร์ริส	morris	Nan
มองโกเลียใน	belső-mongólia	Nan
มหาวิทยาลัยแห่งแรกของประเทศไทย	az első egyetem thaiföldön	Nan
มะม่วงหิมพานต์	kesu dió	Nan
มหาวิทยาลัยแม่โจ้	maejo egyetem	Nan
มหาวิทยาลัยเทคโนโลยีราชมงคลอีสาน	rajamangala műszaki egyetem, isan	Nan
มหาวิทยาลัยเทคโนโลยีราชมงคลสุวรรณภูมิ	rajamangala műszaki egyetem, suvarnabhumi	Nan
มหาวิทยาลัยเทคโนโลยีราชมงคลธัญบุรี	rajamangala thanyaburi műszaki egyetem	Nan
มหาวิทยาลัยเทคโนโลยีราชมงคลตะวันออก	rajamangala tawan-ok műszaki egyetem	Nan
มหาวิทยาลัยเทคโนโลยีราชมงคลกรุงเทพ	rajamangala krungthep műszaki egyetem	Nan
มหาวิทยาลัยเทคโนโลยีพระจอมเกล้าพระนครเหนือ	mongkut király műszaki egyeteme, észak-bangkok	Nan
มหาวิทยาลัยเปิด	szabadegyetem	Nan
มาสคาร่า	szempillafesték	Nan
ภาพยนตร์ชุดนี้	ez a filmkészlet	Nan
ภาพยนตร์	filmek	None
พาร์ค	park	None
พาวเวอร์บาย	teljesítmény vásárlás	Nan
พาเมล่า	pamela	Nan
พิชัย	phichai	Nan
พิชิต	uralkodj	Nan
พิณ	mandolin	Nan
พิธีกรรายการ	házigazda	Nan
พิบูลมังสาหาร	phibun mangsahan	Nan
พิพิธภัณฑสถานแห่งชาติ	nemzeti múzeum	Nan
พิพิธภัณฑ์	múzeum	None
พิม	pim	Nan
พิมประภา	phimprapa	Nan
พิมพ์เล็ก	kis nyomtatás	Nan
พิมลวรรณ	phimonwan	Nan
พิรุณ	eső	None
พิสุทธิ์	ragyogó	Nan
พิออจชา	phion tea	Nan
พุฒตาล	putthan	Nan
พื้นที่มหาวิทยาลัย	egyetemi körzet	Nan
พื้นฐานทางเศรษฐกิจ	gazdasági alap	Nan
พืชไม่มีท่อลำเลียง	növények csővezetékek nélkül	Nan
พืชที่สำคัญคือ	fontos növények	Nan
พืช	növény	None
พารามีเซียม	parametrikus	Nan
พึ่งสุนทร	támaszkodhatsz a sunthorn-ra	Nan
