+	+	None
กล้ามเนื้อ	mišića	None
กล้องถ่ายภาพ	kamera	Nan
กล้วยไม้ดาว	zvjezdana orhideja	Nan
กล่าวคือ	to znači	Nan
กวี	pjesnik	None
กลูคากอน	glucon	Nan
กลุ่มที่	grupa	None
กลุ่มดาวแมลงวัน	muhe	Nan
กลุ่มดาวแมงป่อง	škorpion	Nan
กลุ่มดาวเตาหลอม	visoka peć	Nan
กลุ่มดาวเข็มทิศ	kompas sazvežđa	Nan
กลุ่มดาวสิ่ว	dlijeto	Nan
กลุ่มแสงอุษา	usa light group	Nan
ขม	gorka	Nan
ขรรค์ชัย	khan chai	Nan
ขลุ่ยหลิบ	flauta	Nan
คิด	misli	None
คินนิคุแมน	kinnikuman	Nan
คิมิฮิโระ	kimihiro	Nan
คิระ	kira	Nan
คิเคียว	kikyo	Nan
คีตกวี	kompozitor	None
คือประมาณ	je oko	Nan
คือเพลง	je li pjesma	Nan
คุณ	ti	None
คุณครูจอมเวท	učitelj mađioničara	Nan
คุณปลื้ม	khun pluem	Nan
คุณหญิงโม	carica mo	Nan
คุณากร	ti	None
คุราปิก้า	kurapika	Nan
คุโรซึจิ	kurotsuji	Nan
คุ้มค่า	dobra vrijednost	Nan
คูกิมิยะ	kukimiya	Nan
งาน	posla	None
งดส่งเข้าประกวด	zabranjen ulaz	Nan
ฆ้องวงใหญ่	veliki gong	Nan
ฆ้อง	gong	Nan
ฆ	juan	None
ค้างคาว	šišmiš	Nan
คิชิเนีย	kishinya	Nan
ค่ำแล้ว	sumrak	None
ค่าจีดีพี	bdp	None
ค่าความต้านทานตัวที่	vrijednost otpora koja	Nan
คู่กรรม	partner	Nan
คูเวต	kuvajt	None
คูเรียม	kurijum	Nan
คูคาคุ	kuku	Nan
ค่าใช้จ่าย	troškova	None
งานอดิเรก	hobiji	Nan
คิงไลเนอร์	kingliner	Nan
คิงส์	kraljevi	None
คาคาชิ	kakashi	Nan
คางาริ	kagari	Nan
คาซัคสถาน	kazahstana	None
คาถาอัญเชิญ	nagon	None
คาบ	period	None
คาบัคโรเน่	kabakhroone	Nan
คาบูโตะ	kabuto	Nan
คาปูชิโน่	cappuccino	Nan
คามิว	kamui	Nan
คาราคุระ	karakura	Nan
คาร์ล	carl	None
คาวทอง	fishyong	Nan
คาเมนไรเดอร์	kamen rider	Nan
คาโรลัส	carolas	Nan
คำขวัญวันเด็ก	slogan dječijeg dana	Nan
คำถามข้อที่	broj pitanja	Nan
คำนวณ	izračunati	Nan
คิง	kralju	None
คำแปล	prevod	Nan
คำเมือง	gradska riječ	Nan
คำอธิบาย	opis	None
คำสุภาพ	pristojna reč	Nan
คำสุดท้ายของวรรคที่	posljednja riječ odlomka	Nan
คิงส์คัพ	king&#39;s cup	Nan
คำสร้อย	riječ	None
คำศัพท์	vokabular	Nan
คำวิลัยศักดิ์	kamwilaisak	Nan
คำม่วง	kham muang	Nan
คำมั่นสัญญา	obećaj	Nan
คำพ้องรูป	sinonimi	Nan
คำนาม	imenica	Nan
คำสรรพนาม	pronoun	Nan
คั่ว	pečena	Nan
งานเขียน	writings	Nan
งานโมเสก	mozaik	None
จักรพันธุ์	čakphan	Nan
จักรวาลวิทยา	kozmologija	Nan
จังหวัด	provincija	None
จังหวัดกระบี่	provincija krabi	Nan
จังหวัดกาญจนบุรี	kanchanaburi	Nan
จังหวัดกาฬสินธุ์	kalasin	Nan
จังหวัดขอนแก่น	provincija khon kaen	Nan
จังหวัดคยองกี	provincija gyeonggi	Nan
จังหวัดคยองซาง	provincija gyeongsang	Nan
จังหวัดฉะเชิงเทรา	chachoengsao	Nan
จังหวัดชุมพร	chumphon	Nan
จังหวัดตราด	provincija trat	Nan
จังหวัดตาก	provincija tak	Nan
จังหวัดนครปฐม	provincija nakhon pathom	Nan
จังหวัดนครพนม	provincija nakhon phanom	Nan
จังหวัดนครสวรรค์	nakhon sawan province	Nan
จังหวัดน่าน	provincija nan	Nan
จังหวัดอุดรธานี	provincija udon thani	Nan
จังหวัดหนองบัวลำภู	provincija nong bua lamphu	Nan
จังหวัดสิงห์บุรี	sing buri provincija	Nan
จังหวัดสมุทรสงคราม	provincija samut songkhram	Nan
จังหวัดสงขลา	songkhla	Nan
จังหวัดลำพูน	lamphun	Nan
จักรพรรดิไททัส	cara tita	Nan
จังหวัดราชบุรี	ratchaburi	Nan
จังหวัดยโสธร	yasothon	Nan
จังหวัดมหาสารคาม	provincija maha sarakham	Nan
จังหวัดพิษณุโลก	provincija phitsanulok	Nan
จังหวัดพังงา	provincija phang nga	Nan
จังหวัดพระนครศรีอยุธยา	phra nakhon si ayutthaya	Nan
จังหวัดปัตตานี	provincija pattani	Nan
จังหวัดระยอง	rayong	Nan
งานเทางามสัมพันธ์	tao ngam odnos	Nan
จักรพรรดิเนอร์วา	careva nirvana	Nan
จะได้	će dobiti	Nan
งามวงศ์วาน	ngamwongwan	Nan
งู	zmija	None
งูอนาคอนดา	anakonda	Nan
จดหมายอากาศ	vazdušna pošta	Nan
จตรัง	trang	Nan
จตุรงค์	chatuchak	Nan
จนกระทั่ง	dok	None
จนกระทั่งปี	do godine	Nan
จนกระทั่งเมื่อปี	sve do prošle godine	Nan
จนครปฐม	nakhon pathom	Nan
จนมีคำกล่าวว่า	sve dok to nije rečeno	Nan
จน่าน	pon	Nan
จบุรีรัมย์	buriram	Nan
จมูก	nosa	Nan
จระเข้และแอลลิเกเตอร์	krokodil i aligator	Nan
จรัญญา	charanya	Nan
จริยธรรม	etika	None
จะเข้	citer	Nan
จะเขียนว่า	reći će	Nan
จะต้องหาตัวแทนลงจากเวที	morate naći predstavnika koji bi sišao sa pozornice	Nan
จอร์เจีย	gruzije	Nan
จอมเทียน	jomtien	Nan
จอมพลเรือ	brod maršal	Nan
จักจั่น	cicada	Nan
จอมพลสฤษดิ์	feldmaršal sarit	Nan
จอมบึง	otečen	Nan
จสุราษฎร์ธานี	surat thani	Nan
จสตูล	satun	Nan
จลำพูน	lamphun	Nan
จริยา	dama	Nan
จริยศาสตร์	etika	None
จอมพลถนอม	chom phon thanom	Nan
คัมภีร์	pismo	None
คัพ	kup	None
คันธวงศ์	kanthavong	Nan
ข้อมูลโดย	data by	Nan
ข้อวิพากษ์วิจารณ์	kritika	None
ข้ามฉาก	preko scene	Nan
ข้าวสาลี	pšenica	None
ข้าวหลาม	khao lam	Nan
ข้าวเกรียบปากหม้อ	pirinčani krekeri	Nan
ข้าวเจ้า	neolušan	Nan
ข้าวโพด	kukuruz	None
ข้าหลวงกำกับราชการเมืองขุขันธ์คนที่	guverner, guverner grada khukhan	Nan
ฃ	ฃ	Nan
คงยิ่ง	vrlo moguće	Nan
คงเจริญ	vjerovatno prosperira	Nan
คณะครุศาสตร์	pedagoški fakultet	Nan
คณะครุศาสตร์อุตสาหกรรม	fakultet za industrijsko obrazovanje	Nan
คณะที่	fakultet na	Nan
คณะบัญชี	fakultet za računovodstvo	Nan
คณะปฏิรูปการปกครองแผ่นดิน	revolucionarni odbor	Nan
คณารศ	kanara	Nan
คณะแพทยศาสตร์โรงพยาบาลรามาธิบดี	medicinski fakultet, bolnica ramathibodi	Nan
คณะแพทยศาสตร์ศิริราชพยาบาล	medicinski fakultet bolnica siriraj	Nan
คณะเกษตร	poljoprivredni fakultet	Nan
คณะสาธารณสุขศาสตร์	fakultet za javno zdravstvo	Nan
คณะสหเวชศาสตร์	fakultet srodnih zdravstvenih nauka	Nan
ข้อมูลอื่นๆ	ostale informacije	Nan
คณะสถาปัตยกรรมศาสตร์	arhitektonski fakultet	Nan
คณะวิศวกรรมศาสตร์	tehnički fakultet	Nan
คณะวิทยาการจัดการ	fakultet nauka o upravljanju	Nan
คณะรัฐมนตรีคณะที่	kabinet	Nan
คณะมนุษย์ศาสตร์และสังคมศาสตร์	fakultet humanističkih i društvenih nauka	Nan
คณะพยาบาลศาสตร์	medicinski fakultet	Nan
คณะประมง	ribarski fakultet	Nan
คณะศิลปกรรมศาสตร์	fakultet likovnih umjetnosti	Nan
คนที่	ljudi	None
ข้อมูลปี	podaci o godini	Nan
ข้อมูลประเทศเดนมาร์ก	danska informacije	Nan
ขวด	boca	Nan
ขวัญ	morale	None
ขวัญใจช่างภาพ	voljeni fotograf	Nan
ขสมก	misa	Nan
ของ	od	None
ของทุกปี	svake godine	Nan
ของประเทศจีน	kina	None
ของมหาวิทยาลัย	univerziteta	None
ของมัน	njegova	None
ของร่างกาย	tela	Nan
ของสมเด็จฮุน	somdeja huna	Nan
ของสิ่งมีชีวิต	živih stvari	Nan
ของสุนทรภู่	sunthorn phu	Nan
ของเหลว	tečnost	None
ของโลก	svijeta	None
ขอนแก่น	khon kaen	Nan
ขอบคุณที่รักกัน	hvala ti što me voliš	Nan
ข้อมูลทั่วไป	opće informacije	Nan
ขุนหาญ	han	None
ขุขันธิน	khan tin	Nan
ขึ้นไป	gore	None
ขึ้นเป็น	do	None
ขี้ผึ้ง	vosak	None
ข้อมูลปรากฏการณ์โลกร้อน	fenomen globalnog zagrijavanja	Nan
ขีดเส้นใต้	podvući	Nan
ขิง	đumbir	Nan
ขาย	prodati	None
ขา	noga	Nan
ขั้นที่	korak	None
ขอให้เด็กสมัยปฏิวัติของข้าพเจ้า	neka moja revolucionarna djeca	Nan
ขอเช็ดน้ำตา	obrišemo suze	Nan
ขิม	dulcimer	Nan
คนที่ไปช่วยรุ่นที่	ljudi koji su pomogli generaciji	Nan
คนแคระ	patuljak	Nan
คนแรก	prva osoba	Nan
ความยาวช่วงคลื่น	talasna dužina	Nan
ความยาวเพลง	dužina pesme	Nan
ความรัก	ljubav	None
ความรู้	znanje	None
ความสว่าง	svjetlina	Nan
ความสัมพันธ์กับประเทศไทย	odnosi s tajlandom	Nan
ความสัมพันธ์ระหว่างจีนกับอเมริกา	odnosi kine i amerike	Nan
ความสูง	visina	None
ความส่องสว่าง	svjetlina	Nan
ความหนาแน่นของประชากร	gustoća naseljenosti	Nan
ความหมาย	značenje	None
ความหมายโดยพยัญชนะ	suglasničko značenje	Nan
ความเข้มของการส่องสว่าง	svjetlosni intenzitet	Nan
ความเข้าใจ	razumevanje	Nan
ความเร่ง	ubrzanje	None
ความโกรธ	ljutnja	Nan
ความโน้มถ่วง	gravitacija	Nan
คัทลียา	cattleya	Nan
คัญทัพ	važna vojska	Nan
คัชชินสกี	kutchinski	Nan
คัง	kang	Nan
คอสตาริกา	kosta rika	Nan
คอลลิงวูด	callingwood	Nan
ความยาวคลื่น	talasna dužina	Nan
คอร์ด	akord	Nan
คอนเสิร์ตประสานเสียงสามสถาบัน	koncert zbora tri instituta	Nan
คอนเวนชัน	konvencije	Nan
คอนสตรัคชั่น	izgradnja	None
คอ	vrat	Nan
ควีนซี่	kraljice	None
ควินโต	quinto	Nan
คอมพิวเตอร์ยุคที่	doba računara	Nan
ความยาว	dužina	None
ความยากจน	siromaštvo	Nan
ความพอประมาณ	skromnost	Nan
คลอง	kanal	None
ครูพิเศษจอมป่วน	nastavnik trola	Nan
ครู	učitelj	None
ครุฑ	garuda	Nan
คริสต์ศาสนา	hrišćanstvo	Nan
คริสตี	christi	Nan
คลองสาน	khlong san	Nan
คริส	chris	Nan
คราประยูร	prayun	Nan
ครั้งหนึ่ง	jednom	None
ครอบครัว	porodica	None
ครอคโคไดล์	krokodil	Nan
คม	oštar	Nan
คปค	godina	None
คราม	indigo	Nan
จังหวัดเชียงราย	chiang rai	Nan
คลองเตย	khlong toei	Nan
คลาวิคอร์ด	klasa	None
ความฝันอันสูงสุด	vrhunski san	Nan
ความบริสุทธิ์	čistoća	Nan
ความนิยม	popularnost	None
ความถี่	frekvencija	None
ความต่างศักย์	potencijalna razlika	Nan
ความจำ	sećanje	Nan
คลับ	klub	None
ความงาม	ljepota	Nan
ควอร์เตอร์	četvrtina	Nan
ควอน	kwon	Nan
คลื่นสึนามิ	tsunami	Nan
คลิป	isječak	Nan
คลินิก	klinika	Nan
คลิก	klikni	Nan
ความกว้าง	širina	Nan
ลักเซมเบิร์ก	luksemburg	None
ธรรมศาสตร์	univerzitet thammasat	Nan
ธานินทร์	thanin	Nan
มณฑลหูหนาน	hunan	Nan
มณีวรรณ	maniwan	Nan
มด	mrav	None
มดลูก	maternica	Nan
มต้น	počnite	Nan
มธ	tu	None
มธรรมศาสตร์	univerzitet thammasat	Nan
มน	okrugli	Nan
มนุษย์	čovek	Nan
มนุษย์กลายพันธุ์	mutant	Nan
มนเรศวร	naresuan	Nan
มปท	nps	Nan
มม	mm	None
มมหิดล	mahidol univerzitet	Nan
มยุรา	paun	Nan
มลายู	malajski	Nan
มวยปล้ำ	hrvanje	Nan
มหาวิทยาลัยปทุมธานี	univerzitet pathum thani	Nan
มหาวิทยาลัยบูรพา	univerzitet burapha	Nan
มหาวิทยาลัยนเรศวร	naresuan university	Nan
มหาวิทยาลัยทักษิณ	thaksin university	Nan
มหาวิทยาลัยขอนแก่น	univerzitet khon kaen	Nan
มหาวิทยาลัย	univerzitet	None
มจก	m	None
มหาวรรค	maha buddha	Nan
มหาปรมาภรณ์ช้างเผือก	maha paramaporn chang phueak	Nan
มหาบัณฑิต	majstore	Nan
มหาชัย	mahachai	Nan
มหาชน	javno	None
มหัพภาค	sveukupno	Nan
มสงขลานครินทร์	princ songkla	Nan
มหาวชิรมงกุฎ	mahavajira kruna	Nan
มหาวิทยาลัยพะเยา	univerzitet phayao	Nan
มกราคม	januar	None
ภู่สว่าง	phoo sawang	Nan
ภาพยนตร์ลามก	gadan film	Nan
ภาพรวม	pregled	None
ภายหลัง	posle	None
ภายหลังสงคราม	posle rata	Nan
ภายใต้ความช่วยเหลือจากกองทุนการเงินระหว่างประเทศ	uz pomoć međunarodnog monetarnog fonda	Nan
ภายในวงขอบเหรียญเบื้องบนมีข้อความว่า	na vrhu novčića je izjava koja	Nan
ภารกิจ	misija	None
ภาวะเศรษฐกิจของกัมพูชาหลังจากมีการเปลี่ยนแปลงการปกครองจากระบอบสังคมนิยมเป็นระบอบประชาธิปไตย	ekonomski uvjeti kambodže nakon prelaska iz demokratskog socijalizma u demokratiju	Nan
ภาษาญี่ปุ่น	japanci	Nan
ภาษาบาลี	pali	None
ภาษาสเปน	španski jezik	Nan
ภาษาอังกฤษ	engleski jezik	Nan
ภาษาอีสาน	sjeveroistočni jezik	Nan
ภาษาเกชัว	quechua	Nan
ภาษาเฉพาะอาชีพ	žargon	Nan
ภาษาเบสิก	osnovni	None
ภาษาเยอรมัน	njemački	None
ภูเขาน้ำแข็ง	ledeno brijeg	Nan
ภูเขา	planina	None
ภูหลวง	phu luang	Nan
ภูมิรัตน์	bhumirat	Nan
ภูมิภาค	region	None
ภูมิประเทศและภูมิอากาศ	topografija i klima	Nan
ม	m	None
ภูพาน	phu phan	Nan
ภูกามยาว	phu kam yao	Nan
ภูกระดึง	phukradueng	Nan
ภิรมย์ภักดี	phirom phakdi	Nan
ภิรมย์	prijatno	Nan
ภิญโญ	sve više i više	Nan
ภาษาโคบอล	cobol	Nan
ภูธเนศ	bhutanet	Nan
ภาพยนตร์ตอน	epizoda	None
มหาวิทยาลัยภูมินทร์พนมเปญ	univerzitet phumin, pnom pen	Nan
มหาวิทยาลัยมหาสารคาม	univerzitet maha sarakham	Nan
มังกี้	majmun	Nan
มังคุด	mangosteen	Nan
มัจฉานุ	matcha	Nan
มัชฌิมาปฏิปทา	srednji put	Nan
มัทนะพาธา	muthana phatha	Nan
มัธยฐาน	medijan	Nan
มัธยมศึกษา	srednje obrazovanje	Nan
มัธยมศึกษาปีที่	grade	None
มันติคอร์	manticore	Nan
มัลเจร่า	malera	Nan
มากกว่า	preko	None
มากที่สุด	najviše	None
มากิ	maki	Nan
มาครอส	macross	Nan
มาจยาร์	mayar	Nan
มาจากภาษาละติน	od latinskog	Nan
มาซากิ	masaki	Nan
มาลี	mali	None
มาลากุล	malakul	Nan
มาลัยพร	malai porn	Nan
มาร์แชล	marshall	None
มาร์ตินีก	martinique	Nan
มาร์ติน	martin	None
มะเร็ง	rak	None
มาร์ช	marsh	Nan
มาริสา	marisa	Nan
มายน์ส	mine	Nan
มานี	mani	Nan
มาตรา	odjeljak	Nan
มาตรฐาน	standardna	None
มาดริด	madrid	Nan
มาริเบล	maribel	Nan
มหาวิทยาลัยมหาจุฬาลงกรณราชวิทยาลัย	mahachulalongkornrajavidyalaya university	Nan
มะริด	myeik	Nan
มะขาม	tamarind	Nan
มหาวิทยาลัยมหิดล	mahidol univerzitet	Nan
มหาวิทยาลัยรังสิต	univerzitet rangsit	Nan
มหาวิทยาลัยราชภัฏบ้านสมเด็จเจ้าพระยา	univerzitet bansomdejchaopraya rajabhat	Nan
มหาวิทยาลัยราชภัฏสงขลา	univerzitet songkhla rajabhat	Nan
มหาวิทยาลัยราชภัฏสวนสุนันทา	univerzitet suan sunandha rajabhat	Nan
มหาวิทยาลัยราชภัฏอุตรดิตถ์	univerzitet uttaradit rajabhat	Nan
มหาวิทยาลัยราชภัฏเทพสตรี	univerzitet thepsatri rajabhat	Nan
มหาวิทยาลัยราชภัฏเลย	loei rajabhat univerzitet	Nan
มหาวิทยาลัยวงษ์ชวลิตกุล	univerzitet wongchawalitkun	Nan
มหาวิทยาลัยศรีนครินทรวิโรฒ	univerzitet srinakharinwirot	Nan
มหาวิทยาลัยศรีปทุม	univerzitet sripatum	Nan
มหาวิทยาลัยศิลปากร	univerzitet silpakorn	Nan
มหาวิทยาลัยสุโขทัยธรรมาธิราช	otvoreni univerzitet sukhothai thammathirat	Nan
มหาวิทยาลัยอีสาน	sjeveroistočni univerzitet	Nan
มหาวิทยาลัยอุบลราชธานี	univerzitet ubon ratchathani	Nan
มหาวิทยาลัยอ๊อกซฟอร์ด	univerzitet u oxfordu	Nan
มหาวิทยาลัยเกษตรศาสตร์	kasetsart univerzitet	Nan
มอหาดใหญ่	mor hat yai	Nan
มอสส์	moss	Nan
มอส	moss	Nan
มอร์ริส	morris	Nan
มองโกเลียใน	unutrašnja mongolija	Nan
มหาวิทยาลัยแห่งแรกของประเทศไทย	prvi univerzitet na tajlandu	Nan
มะม่วงหิมพานต์	indijski oraščić	Nan
มหาวิทยาลัยแม่โจ้	univerzitet maejo	Nan
มหาวิทยาลัยเทคโนโลยีราชมงคลอีสาน	rajamangala university of technology isan	Nan
มหาวิทยาลัยเทคโนโลยีราชมงคลสุวรรณภูมิ	rajamangala university of technology suvarnabhumi	Nan
มหาวิทยาลัยเทคโนโลยีราชมงคลธัญบุรี	rajamangala university of technology thanyaburi	Nan
มหาวิทยาลัยเทคโนโลยีราชมงคลตะวันออก	rajamangala tehnološki univerzitet tawan-ok	Nan
มหาวิทยาลัยเทคโนโลยีราชมงคลกรุงเทพ	rajamangala university of technology krungthep	Nan
มหาวิทยาลัยเทคโนโลยีพระจอมเกล้าพระนครเหนือ	sveučilišni tehnološki univerzitet kralja mongkuta sjeverni bangkok	Nan
มหาวิทยาลัยเปิด	otvoreni univerzitet	Nan
มาสคาร่า	maskara	Nan
ภาพยนตร์ชุดนี้	ovaj filmski set	Nan
ภาพยนตร์	filmova	None
พาร์ค	park	None
พาวเวอร์บาย	power buy	Nan
พาเมล่า	pamela	Nan
พิชัย	phichai	Nan
พิชิต	osvojiti	Nan
พิณ	mandolina	Nan
พิธีกรรายการ	domaćin	None
พิบูลมังสาหาร	phibun mangsahan	Nan
พิพิธภัณฑสถานแห่งชาติ	nacionalni muzej	Nan
พิพิธภัณฑ์	muzej	None
พิม	pim	Nan
พิมประภา	phimprapa	Nan
พิมพ์เล็ก	mali ispis	Nan
พิมลวรรณ	phimonwan	Nan
พิรุณ	kiša	None
พิสุทธิ์	sjajan	Nan
พิออจชา	phion čaj	Nan
พุฒตาล	putthan	Nan
พื้นที่มหาวิทยาลัย	univerzitetsko područje	Nan
พื้นฐานทางเศรษฐกิจ	ekonomska osnova	Nan
พืชไม่มีท่อลำเลียง	postrojenja bez cjevovoda	Nan
พืชที่สำคัญคือ	važne su biljke	Nan
พืช	biljka	None
พารามีเซียม	parametrično	Nan
พึ่งสุนทร	oslanjajte se na sunthorn	Nan
พี่น้อง	braćo	Nan
พีอีเอ	pia	Nan
พีระศรี	phirasri	Nan
พีระมิด	piramida	None
พีท	pete	None
พิเศษนครกิจ	nakornkit special	Nan
พี่สาวของ	sestro	Nan
พุทธคยา	bodh gaya	Nan
พารา	para	None
พากย์เป็น	pod nazivom	Nan
พลอากาศเอกหญิง	ženski acm	Nan
พลฯ	opšte	None
พลังงานคลื่น	talasna snaga	Nan
พลังงานนิวเคลียร์	nuklearne energije	Nan
พลังงานลม	snaga vjetra	Nan
พลังงานไฟฟ้า	električna energija	Nan
พลัส	plus	None
พลาซา	plaza	Nan
พลาสติก	plastični	Nan
พลาสมา	plazma	None
พลเรือเอก	admirale	Nan
พลเอกสนธิ	general sonthi	Nan
พวกสัตว์ลำตัวกลม	životinje okruglog tijela	Nan
พศ	pet	None
พอ	dosta	None
พอตเตอร์	potter	Nan
พอตเตอร์กับเจ้าชายเลือดผสม	lončar i polukrvni princ	Nan
พัลซาร์	pulsar	Nan
พับลิชชิ่ง	izdavaštvo	Nan
พันธเสน	bond	Nan
พันธุ์สุนัข	pasmina pasa	Nan
พันธุ์พืช	biljne vrste	Nan
พันธุศาสตร์	genetika	Nan
พายุ	oluja	None
พันธมิตร	savez	None
พัทยาใต้	south pattaya	Nan
พัทยาเหนือ	sjeverna pattaya	Nan
พัฒน์ชัย	phatchai	Nan
พัชรี	phachari	Nan
พอล	paul	None
พอยท์	tačka	None
พัน	hiljadu	None
ภาพยนตร์การ์ตูนไทย	tajlandski crtani film	Nan
พุทธนิกายเถรวาท	theravada budizam	Nan
พุทธศักราช	budistička era	Nan
ฟุตบอล	fudbal	None
ฟุตบอลอาเซียนเยาวชน	asean youth football	Nan
ฟุตบอลเอเชียเยาวชน	azijski omladinski fudbal	Nan
ฟู	pun	None
ฟูจิ	fuji	Nan
ฟูลส์	pun	None
ฟ้อน	ples	Nan
ฟ้า	plava	None
ฟ้าร้อง	grom	Nan
ฟ้าหลัว	izlazak sunca	Nan
ภมรมนตรี	bamamon montri	Nan
