+	+	Nan
ห้วยขวาง	huai khwang	Nan
ห้วยทับทัน	huai thap than	Nan
ห้องน้ำ	wc	Nan
ห้องสมุด	könyvtár	None
ห้าง	bolt	Nan
ห้างฉัตร	hangbeszélgetés	Nan
ห้างหุ้นส่วนจำกัด	korlátozott partnerség	Nan
ฬาพานิช	kereskedelmi	None
อก	mell	Nan
อคิลลีส	achilles	Nan
องคชาต	nemi szervek	Nan
องคต	szervezet	None
องค์กรปกครองส่วนท้องถิ่น	önkormányzati szervezet	Nan
องค์การนิสิต	hallgatói szervezet	Nan
องค์การมหาชน	állami szervezet	Nan
องค์การสหประชาชาติ	egyesült nemzetek	Nan
องค์บาก	ong bak	Nan
อนึ่ง	mellékesen	Nan
อนาลโย	analoyn	Nan
อนันตรัย	anantai	Nan
อนันตยะ	anantaya	Nan
อธิบายว่า	magyarázd el ezt	Nan
อธิการบดีมหาวิทยาลัยธรรมศาสตร์	a thammasat egyetem elnöke	Nan
ห่วงใย	gondoskodó	Nan
อธิการบดี	kancellár	None
อดีตรองนายกรัฐมนตรี	volt miniszterelnök-helyettes	Nan
อดีตผู้บัญชาการทหารบก	volt katonai parancsnok	Nan
อดีต	korábbi	None
อดิศักดิ์	adisak	Nan
องอาจ	bátor	None
องค์ประกันหงสา	hongsa biztosítás	Nan
อดีตรองหัวหน้าหน่วยที่	az egység volt helyettese	Nan
อนุทิน	napló	None
หเตุการณ์	helyzet	None
หุ่น	báb	Nan
หลักสูตรวิทยาศาสตรมหาบัณฑิต	master of science program	Nan
หลังจาก	utána	None
หลังสงคราม	a háború után	Nan
หลังสงครามโลกครั้งที่	a világháború után	Nan
หลังสงครามโลกครั้งที่สอง	a második világháború után	Nan
หลังเหตุการณ์	esemény után	Nan
หลาย	sok	None
หลีกภัย	menekülni	None
หลุมดำจิ๋ว	apró fekete lyuk	Nan
หล่มสัก	lom sak	Nan
หวาย	rattan	Nan
หอก	lándzsa	Nan
หอประชุมพ่อขุนรามคำแหงมหาราช	ramkhamhaeng király, a nagy nézőtér	Nan
หอมรดกไทย	thai heritage hall	Nan
หอย	kagylófélék	Nan
หอไอเฟล	eiffel-torony	Nan
หัก	levonási	Nan
หุตะสิงห์	huta sing	Nan
หี	punci	Nan
หินไซอัล	palakő	Nan
หินแกรนิต	gránit	None
หินเชิร์ต	kő ing	Nan
หินอ่อน	üveggolyó	Nan
หุ่นยนต์	robot	Nan
หินปูน	mészkő	None
หาดทรายแก้ว	sai kaew strand	Nan
หาง	farok	Nan
หัวใจ	szív	None
หัวโขน	maszk	Nan
หัวหิน	hua hin	Nan
หัว	fej	None
หาบเร่	házaló	Nan
หลักสูตรภาษาไทย	thai nyelv tanfolyam	Nan
อนุสรณ์สถาน	emlékmű	None
อปักธงชัย	pak thongchai	Nan
ออกมาในอะนิเมะเท่านั้น	csak az anime-ben jelenik meg	Nan
ออกอากาศ	adás	Nan
ออกอากาศครั้งที่	sugárzott	Nan
ออกอากาศทางช่อง	broadcast on	Nan
ออกัสตัส	augustus	Nan
ออกเป็น	ba	Nan
ออกแบบตัวละคร	karakter kialakítása	Nan
ออนไลน์	online	Nan
ออฟ	ki	None
ออลแบนี	szövetségesek	None
ออสเตรเลีย	ausztrália	None
ออโตทรอพ	autobot	Nan
อะ	mit	None
อะซูไรต์	azurite	Nan
อะตอม	atom	None
อะนิเมะ	anime	None
อะบุราเมะ	aburame	Nan
อัธฮา	athha	Nan
อัตราการว่างงาน	munkanélküliségi ráta	Nan
อัฒภาค	pontosvessző	Nan
อัญมณี	drágakő	Nan
อังการา	ankara	Nan
อังกฤษสมัยแองโกล-นอร์มัน	anglo-norman angol	Nan
ออกฉายครั้งแรกเมื่อวันที่	először vetítették	Nan
อักษรเกาหลี	koreai ábécé	Nan
อักษร	levél	None
อะโลน	egyedül	None
อะโกนิสต์	az agonista	Nan
อะลูมิเนียม	alumínium	None
อะมาเดอุส	amadeus	Nan
อะพาไทต์	apatit	Nan
อักษรย่อ	rövidítések	Nan
อนุสรา	anusara	Nan
ออ	vagy	None
อสมท	mcot	Nan
อพอลโล่	apollo	None
อพิมาย	aphimai	Nan
อภัยนุราช	megbocsát	Nan
อภินันท์	aphinan	Nan
อภิปรัชญา	metafizika	None
อภิรักษ์	aphirak	Nan
อมฤต	halott	None
อมาตยกุล	amatayakun	Nan
อยู่	vannak	None
อยู่วิทยา	fiziológia	Nan
อยู่ห่างออกไปจากชายฝั่ง	messze a parttól	Nan
อยู่แล้ว	már	None
อยู่ในเขตอำเภอกุฉินารายณ์	található kuchinarai kerületben	Nan
อย่างต่อเนื่อง	folyamatosan	None
อย่างแพร่หลาย	széles körben	Nan
อย่างไรก็ตาม	azonban	None
อร	orn	Nan
อศรีประจันต์	asri prachan	Nan
อวัยวะเพศ	nemi szervek	Nan
อวัยวะสืบพันธุ์หญิง	női nemi szervek	Nan
อวัยวะสืบพันธุ์สตรีด้านนอก	női nemi szervek kívülről	Nan
อวอร์ดส	díjak	None
อลิซ	alice	Nan
อสามชุก	sam chuk	Nan
อลาสก้า	alaszka	None
อรุณี	arunee	Nan
อริยสัจ	nemes igazság	Nan
อรัญประเทศ	aranyaprathet	Nan
อรรถพร	athaphon	Nan
อรรถกถา	kommentár	Nan
อรทัย	fiatal lány	Nan
อลังการ	díszítés	Nan
อันดับ	értékelés	Nan
หลักสูตรภาษาอังกฤษ	angol nyelvtanfolyam	Nan
หลักสูตรนานาชาติ	nemzetközi kurzus	Nan
หน้าอก	mellkas	Nan
หมวด	csoport	None
หมวดหมู่	kategória	None
หมวดหมู่กลุ่มดนตรีที่ก่อตั้งในปี	zenei csoport kategória:	Nan
หมวดหมู่กลุ่มดนตรีสัญชาติเกาหลี	koreai zenecsoport kategória	Nan
หมวดหมู่กวีชาวไทย	thai költő kategória	Nan
หมวดหมู่การฉลองปีใหม่	új év ünnepe kategóriában	Nan
หมวดหมู่การประท้วงในประเทศไทย	kategória tiltakozás thaiföldön	Nan
หมวดหมู่การ์ตูนญี่ปุ่นแนวโชเน็น	kategória: japán rajzfilm, shonen stílusban	Nan
หมวดหมู่จุลชีววิทยา	mikrobiológiai kategória	Nan
หมวดหมู่ชาวไทยที่นับถือศาสนาพุทธ	kategória thai buddhisták	Nan
หมวดหมู่ชาวไทยที่เกิดในต่างประเทศ	kategória thaiföldön született tengerentúlon	Nan
หมวดหมู่ดาวเคราะห์ชั้นใน	belső bolygó kategória	Nan
หมวดหมู่ดาวเคราะห์หิน	bolygó kő kategóriája	Nan
หมวดหมู่ทหารอากาศชาวไทย	thai légierő kategóriája	Nan
หมวดหมู่ทหารเรือชาวไทย	thai tengerészet kategóriája	Nan
หมวดหมู่นักการเมืองไทย	a thai politikusok kategóriája	Nan
หมวดหมู่ประวัติศาสตร์ไทย	thai történelem kategória	Nan
หมวดหมู่บุคคลที่เกี่ยวข้องกับเหตุการณ์	az eseményhez kapcsolódó személyek kategóriája	Nan
หมวดหมู่บุคคลจากโรงเรียนมงฟอร์ตวิทยาลัย	a montfort college egyének kategóriája	Nan
หมวดหมู่บุคคลจากโรงเรียนนายร้อยพระจุลจอมเกล้า	kategóriák a chulachomklao királyi katonai akadémiától	Nan
หมวดหมู่บุคคลจากสถาบันบัณฑิตพัฒนศิลป์	a bunditpatanasilpa intézet embereinek kategóriája	Nan
หมวดหมู่บุคคลจากมหาวิทยาลัยอ๊อกซฟอร์ด	egyéni kategória az oxfordi egyetemen	Nan
หน่วยพันธุกรรม	genetikai egység	Nan
หมวดหมู่บุคคลจากมหาวิทยาลัยสุโขทัยธรรมาธิราช	kategóriák a sukhothai thammathirat open university-től	Nan
หมวดหมู่บุคคลจากจุฬาลงกรณ์มหาวิทยาลัย	kategóriák a chulalongkorn egyetemen	Nan
หมวดหมู่บอยแบนด์	fiú zenekar kategória	Nan
หมวดหมู่บริษัทที่ก่อตั้งในปี	kategória vállalat alapítva	Nan
หมวดหมู่บริษัทของไทย	thai vállalat kategóriája	Nan
หมวดหมู่นายกรัฐมนตรีไทย	kategória thai miniszterelnök	Nan
หมวดหมู่นักร้องไทย	thai énekes kategória	Nan
หมวดหมู่บุคคลจากมหาวิทยาลัยธรรมศาสตร์	kategória a thammasat egyetemen	Nan
หมวดหมู่ประเภทของภาพยนตร์	film kategória kategória	Nan
หน่วยประมวลผลกลาง	központi feldolgozó egység	Nan
หน่วยที่	mértékegység	Nan
ส่วนหัว	fejléc	Nan
ส่วนในฤดูฝนน้ำจะท่วมทุกปี	az esős évszakban a víz minden évben eláraszt.	Nan
ส่วนใหญ่	a legtöbb	Nan
ส่วนใหญ่เป็นโรงสีข้าว	legtöbbjük rizsmalom.	Nan
ส่องแสง	ragyog	Nan
ส้ม	narancs	None
ส้มเช้ง	narancs narancs	Nan
ส้มโอ	grapefruit	Nan
หงษ์ทอง	hong thong	Nan
หงษ์มานพ	hong manop	Nan
หงสกุล	hong sakul	Nan
หญ้าทะเล	tengeri fű	Nan
หญ้าฝรั่น	sáfrány	Nan
หนองคาย	nong khai	Nan
หนองม่วง	nong muang	Nan
หนองหาน	nong han	Nan
หนองฮี	nong hee	Nan
หน่วยทหารในค่าย	katonai egység a táborban	Nan
หน่วยคำเติม	morféma	Nan
หน่วยความจำ	memória	None
หนุ่ม	fiatal	None
หนุมาน	hanuman	Nan
หนึ่งธิดา	egy lány	Nan
หน่วยบัญชาการนาวิกโยธิน	tengeri központ	Nan
หนึ่ง	egy	None
หนังสือลามก	pornográfiai könyvek	Nan
หนังสือการ์ตูน	képregény	None
หนังสือ	könyv	None
หนัก	nehéz	None
หนอน	féreg	Nan
หนองแซง	zang	Nan
หนังใหญ่	nagy film	Nan
หลักสูตรปกติ	normál tanfolyam	Nan
หมวดหมู่ปรัชญา	filozófia kategória	Nan
หมวดหมู่พระราชปทินัดดาในรัชกาลที่	kategória királyi uralom az uralkodásban	Nan
หมอชิต	morchit	Nan
หมากรุกสากล	nemzetközi sakk	Nan
หมายความว่า	eszközök	None
หมู่	sertés	Nan
หมู่ที่	falu	None
หมู่เกาะเคย์แมน	kajmán-szigetek	Nan
หมู่เกาะแบลีแอริก	baleár-szigetek	Nan
หมู่เกาะโซโลมอน	salamon-szigetek	Nan
หม่อมราชวงศ์ปรีดิยาธร	r. pridiyathorn	Nan
หม่อมหลวงปิ่น	anya pin	Nan
หม่อมเจ้าจุฑาวัชร	jutawatchai herceg	Nan
หม่อมเจ้าวัชรวีร์	watcharawee herceg	Nan
หม่อมเจ้าวัชรเรศร	anya watcharachorn	Nan
หม้อข้าวหม้อแกงลิง	nepenthes	Nan
หยุ่น	rugalmas	Nan
หรั่ง	lang	Nan
หรือ	vagy	None
หลักสูตรที่เปิดสอน	tanfolyam	Nan
หลักสูตรการจัดการดุษฏีบัณฑิต	filozófia doktori menedzsment program	Nan
หลักสี่	laksi	Nan
หลักทรัพย์	értékpapír	Nan
หลักจริยธรรม	etika	Nan
หลอดเลือดแดงใหญ่เอออร์ตา	főütőér	Nan
หมวดหมู่โรงเรียนบุรุษในประเทศไทย	férfi iskolai kategória thaiföldön	Nan
หลอดอาหาร	nyelőcső	Nan
หลวง	királyi	None
หรือเรียกว่า	vagy hívják	Nan
หรือที่เรียกกันว่า	más néven	Nan
หรือที่รู้จักกันในชื่อ	vagy más néven	Nan
หรือชื่อทางการคือ	vagy hivatalos név	Nan
หรือการแสดงธงชาติ	vagy megmutatja a nemzeti zászlót	Nan
หลอก	ál	Nan
หมวดหมู่พระราชนัดดาในรัชกาลที่	kategória a királyi unokája	Nan
หมวดหมู่โรงเรียนที่มีอัตราการแข่งขันสูง	a magas versenyszintű iskolák kategóriája	Nan
หมวดหมู่แนวพระราชดำริ	kezdeményezési kategória	Nan
หมวดหมู่พระราชปนัดดาในรัชกาลที่	kategória panadda király az uralkodásban	Nan
หมวดหมู่พิธีกรไทย	kategória thai előadók	Nan
หมวดหมู่ฟุตบอลในประเทศไทย	labdarúgás kategória thaiföldön	Nan
หมวดหมู่ภัยธรรมชาติ	természeti katasztrófa kategóriája	Nan
หมวดหมู่ภัยพิบัติทางการแพทย์	orvosi katasztrófa kategória	Nan
หมวดหมู่มหาวิทยาลัยธรรมศาสตร์	thammasat university kategória	Nan
หมวดหมู่รัชกาลที่	a kategória uralkodása	Nan
หมวดหมู่รัฐคอมมิวนิสต์	kommunista államkategória	Nan
หมวดหมู่รัฐมนตรีว่าการกระทรวงการต่างประเทศไทย	a thaiföldi külügyminiszter kategóriája	Nan
หมวดหมู่รัฐวิสาหกิจไทย	kategória thai vállalkozások	Nan
หมวดหมู่รัฐสิ้นสภาพในทวีปเอเชีย	kategória ázsia eloltotta	Nan
หมวดหมู่รัฐและดินแดนที่ก่อตั้งในปี	megállapított állam- és területkategóriák	Nan
หมวดหมู่รายการโทรทัศน์ไทย	thai televíziós műsor kategória	Nan
หมวดหมู่ละครโทรทัศน์ไทย	kategória thai televíziós dráma	Nan
หมวดหมู่วัฒนธรรมไทย	thai kultúra kategóriája	Nan
หมวดหมู่วันสำคัญทางศาสนาที่นับโดยปฏิทินจันทรคติ	a fontos vallási napok kategóriái a holdnaptárban számolva	Nan
หมวดหมู่ศิลปินสังกัดจีเอ็มเอ็ม	művészkategória a gmm alatt	Nan
หมวดหมู่เพศศึกษา	szexuális nevelés kategóriája	Nan
หมวดหมู่เครื่องเทศ	fűszerkategória	Nan
หมวดหมู่อวัยวะเพศ	nemi kategória	Nan
หมวดหมู่อวัยวะ	orgona kategória	Nan
หมวดหมู่อดีตอาณานิคมของอังกฤษ	brit volt gyarmati kategória	Nan
หมวดหมู่อดีตอาณานิคมของสเปน	spanyol volt gyarmati kategória	Nan
หมวดหมู่โรค	betegségkategória	Nan
หมวดหมู่อดีตอาณานิคมของฝรั่งเศส	korábbi francia gyarmati kategória	Nan
หมวดหมู่สิ้นสุดในคริสต์ศตวรรษที่	a kategória a 19. században ért véget.	Nan
หมวดหมู่สิ่งก่อสร้างในพุทธศตวรรษที่	az épület kategóriája a 21. században	Nan
หมวดหมู่สัตว์เลื้อยคลาน	hüllő kategória	Nan
หมวดหมู่สัตว์มีแกนสันหลัง	kategória gerincállatok	Nan
หมวดหมู่สมุนไพร	gyógynövény-kategória	Nan
หมวดหมู่สถาบันอุดมศึกษาในกรุงเทพมหานคร	bangkok felsőoktatási intézményeinek kategóriái	Nan
หมวดหมู่สโมสรในพรีเมียร์ลีก	klubkategória a premier league-ben	Nan
อันประกอบด้วย	a következőket tartalmazza	Nan
อันโตนิโอ	antonio	None
อันโตนีโอ	antonio	None
อุณหเคมี	termokémia	Nan
อุดม	termékeny	None
อุดรธานี	udon thani	Nan
อุตตมะโยธิน	uppharat yothin	Nan
อุตรดิตถ์	uttaradit	Nan
อุทยาน	park	None
อุทยานประวัติศาสตร์พนมรุ้ง	phanom rung történelmi park	Nan
อุทยานประวัติศาสตร์พิมาย	phimai történelmi park	Nan
อุทยานแห่งชาติคลองตรอน	khlong tron nemzeti park	Nan
อุทยานแห่งชาติดอยภูคา	doi phu kha nemzeti park	Nan
อุทยานแห่งชาติดอยอินทนนท์	doi inthanon nemzeti park	Nan
อุทยานแห่งชาติทุ่งแสลงหลวง	thung salaeng luang nemzeti park	Nan
อุทยานแห่งชาติธารโบกขรณี	mint bok khorani nemzeti park	Nan
อุทยานแห่งชาติน้ำตกสี่ขีด	si khit vízesés nemzeti park	Nan
อุทยานแห่งชาติน้ำพอง	nam phong nemzeti park	Nan
อุทยานแห่งชาติภูผาเหล็ก	iron mountain nemzeti park	Nan
อุทยานแห่งชาติภูพาน	phu phan nemzeti park	Nan
อุภัยราศี	bocsáss meg az állatöv	Nan
อุปนิสัย	karakter	None
อุปกรณ์คอมพิวเตอร์	számítógép tartozékok	Nan
อุปกรณ์	felszerelés	Nan
อุบล	ubon	Nan
อุทุมพรพิสัย	uthumphon phisai	Nan
อุณหภูมิ	hőfok	Nan
อุทยานแห่งชาติไทรทอง	sai thong nemzeti park	Nan
อุทยานแห่งชาติหาดนพรัตน์ธาราหมู่เกาะพีพี	noppharat thara beach nemzeti park, phi phi-szigetek	Nan
อุทยานแห่งชาติภูแลนคา	phulanca nemzeti park	Nan
อุทยานแห่งชาติภูเวียง	phu wiang nemzeti park	Nan
อุทยานแห่งชาติภูเรือ	phu ruea nemzeti park	Nan
อุทยานแห่งชาติภูสอยดาว	phu soi dao nemzeti park	Nan
อุทยานแห่งชาติภูสวนทราย	phu suan sai nemzeti park	Nan
อุทยานแห่งชาติเขาหลวง	khao luang nemzeti park	Nan
อุรุกวัย	uruguay	Nan
อุซึมากิ	uzumaki	Nan
อื่น	egy másik	Nan
อำเภอแม่แจ่ม	mae chaem körzet	Nan
อำเภอแม่แตง	mae taeng körzet	Nan
อำเภอโนนดินแดง	nem din daeng kerület	Nan
อำเภอโนนสุวรรณ	nem suwan kerület	Nan
อิงค์	inc.	Nan
อิงลิช	angol	None
อิทธิพล	befolyás	None
อิน	ban ben	Nan
อินทิรา	indira	Nan
อินฟราเรด	infravörös	Nan
อินฮิบิเตอร์	inhibitor	Nan
อินุยาฉะ	inuyasha	Nan
อินเซคทิวอรา	inseqtura	Nan
อินเดียน	indián	None
อินเด็กซ์	index	None
อินโดนีเซีย	indonézia	None
อิม	imm	Nan
อือ	igen!	Nan
อึ๊งภากรณ์	ungphakorn	Nan
อึ	szar	Nan
อีกด้วย	is	None
อีกครั้ง	még egyszer	Nan
อีก	több	None
อุ	o	Nan
อิโนะ	én nem	Nan
อิหร่าน	irán	None
อิสตันบูล	isztambul	None
อิริโทรมัยซิน	elektrolízis	Nan
อิรัก	irak	Nan
อิมแพ็ค	hatás	None
อิมาจิน	imajin	Nan
อิเควทอเรียลกินี	egyenlítői-guinea	Nan
อำเภอแม่ทะ	mae tha kerület	Nan
อุเทน	uthen	Nan
อู๋	wu	Nan
ฮิโซกะ	hisoka	Nan
ฮิโรชิ	hiroshi	Nan
ฮีชอล	heechul	Nan
ฮุก	horog	Nan
ฮโยยอน	hyoyeon	Nan
ฯพณฯ	őkegyelmessége	Nan
เกตส์	gates	Nan
เกตุทัต	ketthat	Nan
เกมที่	a játék	Nan
เกมบุค	játszma, meccs	Nan
เกรย์	szürke	None
เกษตรกรรม	mezőgazdaság	None
เกษตรวิสัย	kaset wisai	Nan
เกษมศรี	kasemsri	Nan
เกอริง	gering	Nan
เกอไทต์	goethe	None
เกาหลีใต้	dél-korea	Nan
เกียรติศักดิ์	dicsőség	Nan
เกียรติประวัติ	becsület	Nan
เกียรติ	becsület	Nan
เกิดนิมิตร	készítsen jövőképet	Nan
เกิดจากเชื้อไวรัส	a vírus okozta	Nan
เกิดจากการรวมตัวของ	beépítése okozta	Nan
ฮิวงะ	hyuuga	Nan
เกิดจากการรวมชิ้นส่วนที่	azokat az alkatrészeket kombinálva, amelyek	Nan
เกิดขึ้นหลังจากมหาวิทยาลัยศรีนครินทรวิโรฒวิทยาเขตต่างๆ	a srinakharinwirot egyetem után jött létre	Nan
เกิด	született	None
เกาะสุมาตรา	sumatra	Nan
เกาะลูซอน	luzon-sziget	Nan
เกาะคา	kauai	Nan
เกาะ	sziget	None
เกิดขึ้นเมื่อวันที่	megtörtént	None
อู	ou	Nan
ฮิราโกะ	hirako	Nan
ฮินาตะ	hinata	Nan
อเมริกัน	amerikai	None
อเมริกา	amerika	None
อเมริกาเหนือ	észak amerika	Nan
อเล็กซานเดอร์	sándor	None
อเล็กซ์	alex	None
อโลหะ	félfém	Nan
อ่อนเพลีย	fáradt	Nan
อ่าน	olvas	Nan
อ่าวลึก	ao luek	Nan
อ้างว่า	azt állítják, hogy	Nan
อ้างว้าง	elhagyatott	Nan
ฮอกกี้	jégkorong	None
ฮอท	forró	None
ฮอฟมัน	hoffman	Nan
ฮอยเกนส์	hogens	Nan
ฮอร์โมน	hormon	Nan
ฮอลแลนด์	hollandia	None
ฮิตเลอร์	hitler	None
ฮิซานะ	hisana	Nan
ฮิซาชิ	hisashi	Nan
ฮาวาย	hawaii	None
ฮารุกะ	haruka	Nan
ฮายาโตะ	hayato	Nan
ฮิมาวาริ	himawari	Nan
ฮานอย	hanoi	Nan
ฮาจิ	hachi	Nan
ฮัมบูร์ก	hamburg	None
ฮันกึล	hangul	Nan
ฮักบี้	viszontlátásra	Nan
ฮอว์ค	seahawks	Nan
ฮอลโลว์	üreges	Nan
ฮาตาเกะ	hatake	Nan
อำเภอแจ้ห่ม	chae hom kerület	Nan
อำเภอเสริมงาม	soem ngam körzet	Nan
อำเภอเวียงแก่น	wiang kaen körzet	Nan
อานโตนิโอ	antonio	None
อาบาราอิ	abarai	Nan
อายุ	kor	None
อารยา	araya	Nan
อาร์	r	None
อาร์กอน	argon	Nan
อาร์คิมิดีส	archimedes	Nan
อาร์ม	kar	None
อาร์มาดิลโล	tatú	Nan
อาร์เคด	árkád	Nan
อาร์เมเนีย	örményország	Nan
อาร์เอ็นเอ	rns	Nan
อาร์โนลด์	arnold	None
อาวุธคือ	a fegyver az	Nan
อาวุธประจำกาย	személyes fegyver	Nan
อาหาร	étel	None
อาเจียน	hányás	Nan
อำเภอดอยสะเก็ด	doi saket körzet	Nan
อำเภอจอมทอง	chom thong körzet	Nan
อำเภอคูเมือง	khu mueang körzet	Nan
