เงินในบัญชีธนาคาร	bancar	0.22867293810535178
ไข้สูง	mare	0.22876579680155132
หน่วยพันธุกรรม	unitate	0.22877420065756515
เสียงเปิด	deschis	0.22944246830172904
หมวดหมู่การ์ตูนญี่ปุ่นแนวโชเน็น	stil	0.22946586065145874
หมวดหมู่รัฐวิสาหกิจไทย	întreprinderi	0.22980919179600207
สาเหตุ	cauză	0.22996524215752284
ระยะ	fază	0.23005937296326393
สามอัศวินในจินตนาการ	fantezie	0.23031526954544637
พฤกษศาสตร์	botanică	0.23059578056975338
โรงละคร	teatru	0.23107194324721142
รัฐสภา	parlament	0.2312735517596792
โรลเลอร์เบลด	cu	0.23129947510462506
ทำงาน	muncă	0.23139133785297505
ยุคเฮอัง	epoca	0.23217854158676682
กองทัพ	armata	0.23220990295673663
จิตรกรรม	pictură	0.23230068485873348
เซบาสเตียน	sebastian	0.23314196755402192
ทัพเรือภาคที่	naval	0.23320157555044038
การไฟฟ้าส่วนภูมิภาค	electrică	0.23433647936953886
ธรณีสัณฐานวิทยา	solului	0.2353270832297445
สถานีโทรทัศน์ไทยพีบีเอส	televiziune	0.23541080515666638
เลโอ	leu	0.23588297390705668
แหล่งโบราณคดีบ้านเชียง	arheologic	0.23667058739944025
ถนนประชาธิปก	democrației	0.2373803704383041
ที	t	0.23785254673816908
มัชฌิมาปฏิปทา	mijloc	0.23814717029261218
ชั้นยศ	rang	0.23836076676225754
ความหมายโดยพยัญชนะ	semnificativ	0.23866793561598676
ราชวงศ์หยวน	dinastia	0.23883636929108323
กรมศิลปากร	plastice	0.2392676601116423
ประธานสภารัฐสภา	parlamentului	0.2403523906140261
ไม่สามารถทำการเกษตรได้	agricultura	0.24232995249198178
ป่าชายหาด	de	0.24348076035710087
นิวเคลียส	nucleu	0.24437594273765503
ให้พลเอกเปรม	generalul	0.24457154715703888
ไม่มีแขน	arme	0.24461591812398498
ศิษย์เก่าคณะรัฐศาสตร์	politice	0.24553833312491546
ถนนมิตรภาพ	drumul	0.2458919774212562
ลำดับพระมหากษัตริย์ไทย	regelui	0.24593962541357683
โรงเรียนราชินีบน	reginei	0.246151266516019
จังหวัดพิษณุโลก	provincia	0.24642150651104655
ศาลหลักเมือง	orașului	0.24652760723217457
เวิลด์	lumea	0.24670750053142795
เพลงพระราชนิพนธ์	regală	0.24691211356866838
แบ่งได้เป็น	în	0.2471652124474386
ได้ดังนี้	urmează	0.24726530825607307
อังกฤษสมัยแองโกล-นอร์มัน	engleza	0.2472890592587022
คำนาม	substantiv	0.2475195752682877
ระดับอาชีวศึกษา	nivelul	0.24767519389734668
สไตรค์	lovitură	0.24812629341797177
ในฤดูกาล	sezon	0.24893182586338922
ฟุตบอลเอเชียเยาวชน	tineret	0.24919414972492795
สาขาวิชาวิศวกรรมอาหาร	alimentară	0.2495572365508504
เหตุการณ์	eveniment	0.24985515038618353
ยุคก่อนประวัติศาสตร์	epoca	0.2499653025122152
ก่อนที่จะตกเป็นของฝรั่งเศสในเวลาต่อมา	târziu	0.25029141752974426
ข้อมูลปี	anul	0.2509806677916661
เซอร์วิส	serviciu	0.25105781221973883
หมวดหมู่กลุ่มดนตรีสัญชาติเกาหลี	muzică	0.2516493054562997
องคต	organizare	0.2518818802590298
เป็นประธาน	președinte	0.2527513218302982
พลทหาร	soldat	0.2528093235120187
รองประธานรัฐสภาคนที่หนึ่ง	parlamentului	0.2536908631763934
เพราะว่า	deoarece	0.25453987474644935
เป็นปลาตู้สวยงาม	de	0.2550527693892053
ฟอน	von	0.25547126597394454
ในปลายปี	anului	0.2556745413328572
ชาวไทยภูเขา	tribul	0.25570686006954024
บริเวณเขตภูเขาทางภาคเหนือ	nord	0.2558352959771957
วันสำคัญ	importantă	0.25584993864356625
ซึ่งเรียกว่า	numit	0.25585616279730605
ฟุตบอลอาเซียนเยาวชน	tineret	0.2564391561146272
และสัตว์	animale	0.25693935827097875
เบนจามิน	benjamin	0.2569532314845962
จังหวัดกระบี่	provincia	0.2571618215547217
ผลประเสริฐ	rezultate	0.2574662230048852
กฎของโคไซน์	legea	0.2575305881266752
ยศ	rang	0.259030505523127
สิ่งเสพติด	medicament	0.2597969322616719
สื่อสิ่งพิมพ์	de	0.2598873995742916
ถึงกระนั้น	acestea	0.26003640817025303
สายสีน้ำเงิน	albastră	0.26036039806291134
ธุรกิจการบิน	aviație	0.26172215344779015
ระบบสืบพันธุ์	sistem	0.26284313834421513
เจ้าเมืองขุขันธ์	guvernatorul	0.2628578746134994
เข็มศิลปวิทยา	arta	0.262934410566686
เฟส	fază	0.2632818346792947
แคร็กเกอร์	de	0.26362122697571766
ทรัพยากรน้ำ	apă	0.26371023053354664
จังหวัดตาก	provincia	0.26443891141366027
ผู้ช่วยศาสตราจารย์	profesor	0.2654880628468568
ในภาษาไทย	în	0.2658736146110565
แฮปปี้	fericit	0.26620552357285227
และรถไฟ	și	0.26625241848270786
เป็นสีประจำ	obișnuită	0.26643139048379655
แยกจากคลองชักพระฝั่งซ้าย	stânga	0.2669642974954562
เดือนตุลาคม	octombrie	0.2670444820092645
อิรัก	irak	0.2678396331256199
จังหวัดนครปฐม	provincia	0.26844776646392376
สำรวจ	studiu	0.2686077422764884
ดารา	stea	0.26861231866131297
เอ๋	așa	0.2686967375602188
ทรัพย์เพิ่ม	suplimentare	0.26891518838379586
ฟู	deplin	0.2692508620993565
พิธีกรรายการ	gazdă	0.26934628696444685
มีสูตรการคำนวณหาจำนวนฟัน	de	0.2694882626915072
วิธีการหาความสัมพันธ์	relații	0.26959230605952267
รูปร่าง	formă	0.26962052884246757
กีฬา	sportiv	0.27055165176365253
ฉบับชั่วคราว	temporară	0.2706934492425798
ศูนย์คอมพิวเตอร์	calcul	0.2713125527930172
สมเด็จพระเจ้าลูกเธอ	regală	0.27203927598869515
ประติมากรรมไทย	sculptură	0.27280560201911014
ซีเกมส์	mare	0.2734377929463152
ฟีฟ่าคลับเวิลด์คัพ	club	0.2736329684229288
นักเขียน	scriitorul	0.2751454896063823
ทั้ง	ambii	0.2755399536450331
แนวความคิดที่	concept	0.27603602533886173
ผลงานเพลง	muzică	0.27670289088498645
หมวดหมู่รัฐมนตรีว่าการกระทรวงการต่างประเทศไทย	thailanda	0.27716417478853395
มาดริด	madrid	0.2773033295554606
รายได้อื่น	venit	0.27738897384335726
กรับ	ridica	0.2777592273896224
ลูกปัด	de	0.2780124371366568
วิศวกรรมสิ่งแวดล้อม	mediu	0.27802794272054804
ตุลาคม	octombrie	0.2783878375671109
กีฬาทางน้ำ	acvatice	0.27877113281727806
สถาบันวิจัยและพัฒนา	dezvoltare	0.27911590568608063
ใช้ชื่อว่า	numit	0.2791451987875022
รูปวรรณยุกต์	forma	0.28000478172527876
ตึก	clădire	0.2801874357339565
เดือนธันวาคม	decembrie	0.280192526177453
ไม้หนีบผ้า	haine	0.28027210375912565
หมวดหมู่พิธีกรไทย	categoria	0.2817190034441225
เสมอ	mereu	0.28172070147489836
เครือข่าย	rețeaua	0.28207859458093765
วนอุทยานถ้ำจัน	parcul	0.2821994234602979
นำแสดงโดย	principale	0.28255223900621007
เพดานอ่อน	moale	0.28265563467438604
ได้สำเร็จ	succes	0.28279558483538747
จังหวัดมหาสารคาม	provincia	0.2828878198052741
สายสีชมพู	roz	0.28362553917897865
ดาวพุธ	mercur	0.2842462267076078
ออกอากาศครั้งที่	difuzat	0.28451240508322384
บวร	divin	0.28802387726057377
พระบาทสมเด็จพระปกเกล้าเจ้าอยู่หัว	regele	0.28815960073348573
อุทยานแห่งชาติเขาหลวง	național	0.28859653729116536
เปรู	peru	0.28875309010561334
ตาราง	masa	0.28895838513341504
รัฐประหาร	lovitură	0.2891849685396556
สนามฟุตบอล	fotbal	0.28946083816951906
ความส่องสว่าง	strălucire	0.29064734543981513
มหาวิทยาลัยเกษตรศาสตร์	universitatea	0.2920526470011286
พระปกเกล้าเจ้าอยู่หัว	regele	0.29269716177453187
อธิการบดีมหาวิทยาลัยธรรมศาสตร์	universității	0.2928273057492194
มากกว่า	peste	0.29301394804599634
ศาสตราจารย์	profesor	0.29346585634031636
ราบเป็นหน้ากลอง	simplu	0.2940153944877642
คำสุภาพ	cuvânt	0.2942229329406208
สาขาวิชานิติศาสตร์	drept	0.29443493105596075
ประเทศ	țară	0.29487137443740924
ได้เป็น	fii	0.294900043603277
กขขข	b	0.29556361311475027
เรย์	rază	0.2961055551044392
ศรีบุญเรือง	sri	0.29644045694057136
จุดจอมฟ้า	albastru	0.2964588108784488
วิทยาลัยเทคนิคธนบุรี	tehnic	0.2969510029807425
เทนนิส	tenis	0.29698510423386193
มีอุทยานแห่งชาติสำคัญหลายแห่ง	naționale	0.29758405755088496
กฎ	regulă	0.2981500541185578
ชั้น	clasă	0.298280794966177
สวนดุสิตโพล	sondaj	0.2991193793912392
เธอยัง	încă	0.3001524598681441
บางกอกกล๊าส	sticla	0.30086837179579284
ทู	asemenea	0.30088284718766317
ศาลเจ้าพ่อหลักเมือง	orașului	0.3011488624317308
จัดเมื่อวันที่	continuat	0.301159913189981
การแบ่งพื้นที่	perete	0.3020674967349958
ฟลายเวท	categorie	0.302458046856902
เล่มที่	carte	0.302469854050089
โซลโซไซตี้	societatea	0.30253549742480623
โนบิตะและอัศวินแดนวิหค	și	0.30396302493174526
การบริหารราชการแผ่นดิน	guvernamentală	0.3062530635190751
แผนที่	hartă	0.3064513391232657
และได้ปรากฏตัวตอนภาค	episod	0.3064532091176566
เป็นวิญญาณเทียมเพศชาย	masculin	0.30673522550387944
ได้รับ	obține	0.30735724115263746
กลาง	mijloc	0.30781802828467636
มองโกเลียใน	interioară	0.30809944990251514
ข้ามฉาก	scena	0.3084297293785355
โดยเจ้าฟ้าธรรมธิเบศรไชยเชษฐสุริยวงศ์	prințul	0.308740383290695
ในรัชสมัยพระบาทสมเด็จพระจอมเกล้าเจ้าอยู่หัว	regelui	0.3108633526408198
ภาษาญี่ปุ่น	japonez	0.3109061781639886
จังหวัดพังงา	provincia	0.31155994716022806
รถยนต์อเนกประสงค์	mașină	0.3118783052245947
สูง	înalt	0.311986065578288
ของโลก	lumii	0.3121911137062543
ปัจจุบันนี้	azi	0.31319308941245155
สถาบันการศึกษา	instituție	0.31470737796433257
หลุมดำจิ๋ว	neagră	0.3148492851178797
มหาวิทยาลัยมหิดล	universitatea	0.3160685791056563
ในการเลือกตั้ง	alegeri	0.3166407335874661
สำนักระบาดวิทยา	biroul	0.3169157448025958
สวัสดีปีใหม่	fericit	0.31731208786661835
จัดขึ้นเมื่อ	continuat	0.3187698131404909
ทรงยี่สิบหน้า	fețe	0.3194233134158087
ศูนย์การค้า	comercial	0.3195251430533185
อุทยานแห่งชาติภูเรือ	național	0.3201038870568155
เจ้าฟ้าภาณุรังษีสว่างวงศ์	prințul	0.32121302698713594
เจริญ	dezvolta	0.32122841736943425
สามัญ	comun	0.32161104915195354
โปรโมชั่น	promovare	0.32207876661791623
วัดสุทัศนเทพวรารามราชวรมหาวิหาร	lui	0.32222462610558716
โกลด์	aur	0.3224788868047614
เซลล์	celulă	0.323208813286248
รัชกาลสมเด็จพระจุลจอมเกล้าเจ้าอยู่หัว	regelui	0.3233388582011722
วัฒนธรรม	cultură	0.3238008807163375
วงแหวน	inel	0.32545041848897754
ชื่อเรื่อง	titlul	0.32614960077370464
ปีเตอร์	petru	0.3261699768573794
การยึดครองมะละกาของโปรตุเกสในปี	anul	0.3265988116206625
ล้อแม็กซ์อัลลอยขนาด	dimensiuni	0.3266572593637803
สิ้นพระชนม์ในรัชกาลที่	lui	0.3267939182547245
เมื่อวันจันทร์	luni	0.3270231403412048
ไลเบรชัน	bibliotecă	0.3271657776698176
สนเกรวิลเลีย	de	0.32815723704625793
ตัวละคร	caracterul	0.32817531130760486
อาณาจักรสุโขทัย	regatul	0.3299751179188048
ต้น	început	0.3310059353006621
ศักดิ์ศรี	prestigiu	0.3310992510938163
อิน	în	0.3316151483089575
พัน	mie	0.33206988735401405
เหรียญทอง	aur	0.3320937007598073
เยอรมัน	germana	0.33243419197864027
ชื่อยศภาษาไทย	titlul	0.33291818039910237
นักร้องเพลงไทยสากลชาย	internațional	0.3329461664095404
พันธุ์พืช	plante	0.33376410697137077
ในยุคกลาง	mediu	0.3338199721762534
ปริมาณการผลิต	producției	0.3351080801075831
รถไฟฟ้าชานเมืองสายสีแดงอ่อน	roșie	0.336265637756261
เป็นหัวหน้าพรรค	partid	0.336556088634501
สนธยา	amurg	0.3367741795642482
แก้ว	sticlă	0.33732883376036404
ดาราหญิงไทยยอดนิยม	feminin	0.3378141525501876
เลข	număr	0.3386785970931186
โชแปง	chopin	0.34002037077778724
ในเดือน	lună	0.341046676574026
ภาควิชาวิศวกรรมไฟฟ้า	electrică	0.3413015024534088
ภารกิจ	misiune	0.34134631020610223
มีข้อความว่า	marcat	0.3417199823050225
ภิญโญ	mult	0.3419908392269679
ทาวเวอร์	turnul	0.342002123386282
พุทธศตวรรษที่	secolului	0.3422957265496443
ความถี่	frecvență	0.3437370466545305
สื่อสารมวลชน	masă	0.34421347023073046
สงครามมหาเอเชียบูรพา	est	0.34472599595601555
มธรรมศาสตร์	universitatea	0.34555342697335534
เพราะ	deoarece	0.3461984395842553
ขสมก	masa	0.34622408111841896
โอภาส	strălucire	0.3484546149731217
เสียงเสียดแทรก	sunet	0.3491851824636471
พระที่นั่งดุสิตมหาปราสาท	lui	0.34923001019252375
เมือง	oraș	0.35000194321338784
ปากแม่น้ำสิงคโปร์	singapore	0.3519556846434602
เขตรักษาพันธุ์สัตว์ป่าภูหลวง	sălbatice	0.35227305920239016
จังหวัดตราด	provincia	0.3542008570753775
พระพันปีหลวง	mileniu	0.35435691855604673
บุคลิกภาพ	personalitate	0.3553036509223579
เทพมรณะ	moarte	0.35543283087849825
มหาวิทยาลัยมหาจุฬาลงกรณราชวิทยาลัย	universitatea	0.3562881037139731
อาดัม	adam	0.35649718320088947
โรงเรียนเทศบาล	publică	0.35692966714365704
เช้ามืดวันที่	zilei	0.3571568481895463
ศรีไพร	sri	0.3590903903480522
ความเข้มของการส่องสว่าง	luminoasă	0.359698687924807
วิทยาลัยการจัดการเพื่อการพัฒนา	dezvoltare	0.3598703214568058
ศิลปะ	artă	0.3623032503696809
ควอร์เตอร์	sfert	0.3624424321356593
เจ้าฟ้ากรมพระยานริศรานุวัติวงศ์	prințul	0.36296064784297477
บัณฑิตวิทยาลัยร่วมด้านพลังงานและสิ่งแวดล้อม	mediu	0.3643013078054764
ส่วนของผู้ถือหุ้น	proprii	0.3646388392741944
เป็นเจ้าเมืองปกครอง	guvernator	0.36479204841451623
รถประจำทางสาย	autobuz	0.36511050186136507
ตัวอย่างคำประพันธ์	versiune	0.3653134266614147
ได้รับรางวัล	premiu	0.3666497381779568
ปลาย	sfârșit	0.3667942225706337
รายชื่อภาพยนตร์ไทย	filme	0.3669879508121824
ประมาณ	despre	0.3672609246741527
ให้แก่ประชาชน	oamenilor	0.36732430529430043
ถวาย	oferi	0.36857208884374515
เจ้าเมือง	guvernator	0.36874846992932114
จังหวัดนครสวรรค์	provincia	0.3689963040399926
บนบก	teren	0.3692503920598537
นักวิทยาศาสตร์	știință	0.36934048254179147
องค์การมหาชน	publică	0.36938758757333673
มหาวิทยาลัยรังสิต	universitatea	0.3699281242769555
ลูกสาว	fiică	0.37120574644675697
และสโรชา	și	0.372567737701168
พอยท์	punct	0.3732291163885314
ศิษย์เก่าคณะเศรษฐศาสตร์	economie	0.37422697238351516
มีล่า	vânătoare	0.37442810814046995
ทางอากาศ	aerului	0.3752883447687387
พลตำรวจเอก	poliție	0.375372186666138
ลูน่า	luna	0.3766478941927044
น้ำหนัก	greutate	0.3782287576617129
อาคารอุบลรัตนราชกัญญา	clădirea	0.3807098224076199
ในกลุ่ม	grup	0.3830896684393223
คิงส์คัพ	regelui	0.38331708807012815
กองทัพไทย	armata	0.3837389498097856
แม่น้ำ	râu	0.3845603028674298
หมวดหมู่โรค	bolii	0.3852335182011291
แยกจากคลองบางกอกน้อยฝั่งซ้าย	stânga	0.38664968076949074
ผู้ว่าราชการจังหวัด	guvernator	0.3873797046972746
ฉันรักคุณ	te	0.3881638508212926
พระที่นั่งจักรพรรดิพิมาน	împăratului	0.38853586355756553
ศูนย์ลำปาง	centrul	0.3896526187258387
เครื่องตี	de	0.3899189056445336
พ่อขุนรามคำแหง	regele	0.3909607052041507
วัดหนองเพียร	templul	0.39114276575041756
อัตราการว่างงาน	de	0.3932656743382216
หมวดหมู่นักร้องไทย	categoria	0.39335145704730234
เส้นพุ่ง	linia	0.3939737233910406
ธารทิพย์	decât	0.3942622798592077
ในอดีต	trecut	0.39581847420146293
งดส่งเข้าประกวด	intrare	0.3961914200865917
พระอุโบสถ	templu	0.3964796236752285
สรรพสินค้า	magazin	0.39948109767751666
การใช้คำ	cuvintelor	0.3998791865774798
เพลงลูกทุ่งขับร้อง	muzica	0.4008756343902412
จุดกึ่งกลาง	mijloc	0.40100694602084974
สเตเดี้ยม	stadiu	0.4017394382314005
มหาวิทยาลัยพะเยา	universitatea	0.4022073275170878
ฤดูร้อน	cald	0.4079836820287476
ศิลปินแห่งชาติ	național	0.409067783617442
ละคร	dramă	0.4094268010473696
พรรคธรรมาธิปัตย์	partidul	0.409536442881751
เป็นต้นไม้ประจำมหาวิทยาลัย	universității	0.40956076169533034
สถาบันเทคโนโลยีพระจอมเกล้า	regelui	0.4136044560396423
ฬาพานิช	comercial	0.41487181593754097
หนุ่ม	tineri	0.4154552691949056
พระบาทสมเด็จพระนั่งเกล้าเจ้าอยู่หัว	regele	0.4176453683276691
เกิดขึ้นหลังจากมหาวิทยาลัยศรีนครินทรวิโรฒวิทยาเขตต่างๆ	universitatea	0.41815878547514745
กระบวนการสร้าง	construcție	0.42141544852444446
ภาพตรา	imaginea	0.4217046326774842
เวิร์คพอยท์สตูดิโอ	lucru	0.4225699845960243
ปี่กลาง	mijloc	0.42261182791607277
นักร้องชายไทย	masculin	0.4237741122900792
จำนวน	număr	0.4241704064156192
ขนาดใหญ่	mare	0.42589251111725446
รัศมี	rază	0.426236782507625
เรือสำรวจ	sondaj	0.42637935341841715
มหาวิทยาลัยราชภัฏเลย	universitatea	0.42642192959439834
นานา	numeroși	0.42685135382761596
กระดูกค้อน	de	0.4271563248871701
สถาบันสมทบ	asociată	0.42861129730428726
ศรเพชร	diamant	0.42871605822944314
แหวนมาเล่ริง	inelul	0.4311318194230466
มหาวิทยาลัยศรีนครินทรวิโรฒ	universitatea	0.4326379803731759
สัญลักษณ์ประจำมหาวิทยาลัย	universității	0.4332625123781828
ข้าวเกรียบปากหม้อ	de	0.43383732747758336
วัดเจดีย์หลวง	templul	0.4338917627789399
มหาวิทยาลัยมหาสารคาม	universitatea	0.4363679157109836
อุทยานแห่งชาติภูสอยดาว	național	0.43727647757671934
และดุษฎีบัณฑิต	filozofie	0.43919509751286995
ปีที่วางจำหน่าย	anul	0.43964170833062866
อวอร์ดส	premii	0.4406642028431325
มหาวิทยาลัยราชภัฏสวนสุนันทา	universitatea	0.4415674932654284
เศรษฐกิจพอเพียง	economie	0.44238255126185716
ภาษาเบสิก	bază	0.443342288209539
วงศ์ถั่ว	de	0.4437866358902697
คู่กรรม	partener	0.444743929184123
ได้มีโอกาสสร้างความสัมพันธ์อันดีต่อกัน	celălalt	0.4459902573216647
มหาวิทยาลัยราชภัฏบ้านสมเด็จเจ้าพระยา	universitatea	0.4461989211778831
เม	mai	0.44720754573263516
เนื่องจากประเทศเหล่านั้นอยู่ในตำแหน่งบนโลกที่ต่างไปจากประเทศไทย	thailanda	0.44908737684785804
รัฐประหารในประเทศไทย	thailanda	0.44931356294832714
มหาวิทยาลัยวงษ์ชวลิตกุล	universitatea	0.4495245251685631
มหาวิทยาลัยอุบลราชธานี	universitatea	0.45357860820577645
ปฏิทินช่อง	canalului	0.4542382549501849
พลังงานลม	putere	0.4549385330525803
มหาวิทยาลัยราชภัฏอุตรดิตถ์	universitatea	0.4555380106655049
กองทัพภาคที่	regiunii	0.4557643639008555
สไตล์การเล่น	joc	0.45644668433912255
ปัน	acțiune	0.4566851735773601
นวนิยาย	roman	0.45846184311054594
อาหาร	alimente	0.45961382624793684
