+	+	None
คำสุดท้ายของวรรคที่	பத்தியின் கடைசி சொல்	Nan
คิงส์คัพ	கிங்ஸ் கோப்பை	Nan
คำสร้อย	சொல்	Nan
คำศัพท์	சொல்லகராதி	Nan
คำวิลัยศักดิ์	கம்விலைசக்	Nan
คำม่วง	காம் முவாங்	Nan
คำมั่นสัญญา	வாக்குறுதி	Nan
คำพ้องรูป	ஒத்த	None
คำนาม	பெயர்ச்சொல்	Nan
คำสรรพนาม	உச்சரிப்பு	None
คั่ว	வறுக்கவும்	Nan
งานเขียน	எழுத்துக்கள்	Nan
งานโมเสก	மொசைக்	Nan
จักรพันธุ์	சக்பன்	Nan
จักรวาลวิทยา	அண்டவியல்	None
จังหวัด	மாகாணம்	None
จังหวัดกระบี่	கிராபி மாகாணம்	Nan
จังหวัดกาญจนบุรี	காஞ்சனபுரி	Nan
จังหวัดกาฬสินธุ์	கலாசின்	Nan
จังหวัดขอนแก่น	கோன் கான் மாகாணம்	Nan
จังหวัดคยองกี	கியோங்கி மாகாணம்	Nan
จังหวัดคยองซาง	கியோங்சாங் மாகாணம்	Nan
จังหวัดฉะเชิงเทรา	சச்சோங்சாவ்	Nan
จังหวัดชุมพร	சம்பன்	Nan
จังหวัดตราด	டிராட் மாகாணம்	Nan
จังหวัดตาก	தக் மாகாணம்	Nan
จังหวัดนครปฐม	நக்கோன் பாத்தோம் மாகாணம்	Nan
จังหวัดนครพนม	நக்கோன் பானோம் மாகாணம்	Nan
จังหวัดนครสวรรค์	நக்கோன் சவான் மாகாணம்	Nan
จังหวัดน่าน	நான் மாகாணம்	Nan
จังหวัดอุดรธานี	உடோன் தானி மாகாணம்	Nan
จังหวัดหนองบัวลำภู	நோங் புவா லம்பூ மாகாணம்	Nan
จังหวัดสิงห์บุรี	புரி மாகாணம் பாடுங்கள்	Nan
จังหวัดสมุทรสงคราม	சமுத் சாங்க்கிராம் மாகாணம்	Nan
จังหวัดสงขลา	சாங்ஹ்லா	Nan
จังหวัดลำพูน	லம்பூன்	Nan
จักรพรรดิไททัส	டைட்டஸ் பேரரசர்	Nan
จังหวัดราชบุรี	ராட்சபுரி	Nan
จังหวัดยโสธร	யசோதன்	Nan
จังหวัดมหาสารคาม	மகா சரகம் மாகாணம்	Nan
จังหวัดพิษณุโลก	பிட்சானுலோக் மாகாணம்	Nan
จังหวัดพังงา	பாங் நாகா மாகாணம்	Nan
จังหวัดพระนครศรีอยุธยา	ஃபிரா நக்கோன் சி அயுதயா	Nan
จังหวัดปัตตานี	பட்டானி மாகாணம்	Nan
จังหวัดระยอง	ராயோங்	Nan
งานเทางามสัมพันธ์	தாவோ நகம் உறவு	Nan
จักรพรรดิเนอร์วา	பேரரசர் நிர்வாணம்	Nan
จะได้	கிடைக்கும்	None
งามวงศ์วาน	ngamwongwan	Nan
งู	பாம்பு	None
งูอนาคอนดา	அனகோண்டா	Nan
จดหมายอากาศ	விமான அஞ்சல்	Nan
จตรัง	ட்ராங்	Nan
จตุรงค์	சதுசக்	Nan
จนกระทั่ง	வரை	None
จนกระทั่งปี	ஆண்டு வரை	Nan
จนกระทั่งเมื่อปี	கடந்த ஆண்டு வரை	Nan
จนครปฐม	நக்கோன் பாத்தோம்	Nan
จนมีคำกล่าวว่า	என்று சொல்லப்படும் வரை	Nan
จน่าน	திங்கள்	None
จบุรีรัมย์	புரிராம்	Nan
จมูก	மூக்கு	None
จระเข้และแอลลิเกเตอร์	முதலை மற்றும் முதலை	Nan
จรัญญา	சரண்யா	Nan
จริยธรรม	நெறிமுறைகள்	Nan
จะเข้	சித்தர்	None
จะเขียนว่า	சொல்வார்	Nan
จะต้องหาตัวแทนลงจากเวที	மேடையில் இருந்து இறங்க ஒரு பிரதிநிதியைக் கண்டுபிடிக்க வேண்டும்	Nan
จอร์เจีย	ஜார்ஜியா	Nan
จอมเทียน	ஜோம்டியன்	Nan
จอมพลเรือ	கப்பல் மார்ஷல்	Nan
จักจั่น	cicada	Nan
จอมพลสฤษดิ์	பீல்ட் மார்ஷல் சரித்	Nan
จอมบึง	வீக்கம்	None
จสุราษฎร์ธานี	சூரத் தானி	Nan
จสตูล	சாதுன்	Nan
จลำพูน	லம்பூன்	Nan
จริยา	பெண்	None
จริยศาสตร์	நெறிமுறைகள்	Nan
จอมพลถนอม	சோம் ஃபோன் தானோம்	Nan
คัมภีร์	வேதம்	None
คัพ	கோப்பை	Nan
คันธวงศ์	காந்தவோங்	Nan
ข้อมูลโดย	வழங்கியவர்	Nan
ข้อวิพากษ์วิจารณ์	திறனாய்வு	Nan
ข้ามฉาก	காட்சி முழுவதும்	Nan
ข้าวสาลี	கோதுமை	None
ข้าวหลาม	காவ் லாம்	Nan
ข้าวเกรียบปากหม้อ	அரிசி பட்டாசுகள்	Nan
ข้าวเจ้า	நெல்	None
ข้าวโพด	சோளம்	None
ข้าหลวงกำกับราชการเมืองขุขันธ์คนที่	ஆளுநர், குகான் நகர ஆளுநர்	Nan
ฃ	ฃ	Nan
คงยิ่ง	அநேகமாக	Nan
คงเจริญ	அநேகமாக செழிக்கும்	Nan
คณะครุศาสตร์	கல்வித்துறை	Nan
คณะครุศาสตร์อุตสาหกรรม	தொழில்துறை கல்வி பீடம்	Nan
คณะที่	இல் ஆசிரிய	Nan
คณะบัญชี	கணக்கியல் பீடம்	Nan
คณะปฏิรูปการปกครองแผ่นดิน	புரட்சிகர குழு	Nan
คณารศ	கனரா	Nan
คณะแพทยศาสตร์โรงพยาบาลรามาธิบดี	மருத்துவ பீடம், ராமதிபோடி மருத்துவமனை	Nan
คณะแพทยศาสตร์ศิริราชพยาบาล	மருத்துவ பீடம் சிரிராஜ் மருத்துவமனை	Nan
คณะเกษตร	வேளாண்மை பீடம்	Nan
คณะสาธารณสุขศาสตร์	பொது சுகாதார பீடம்	Nan
คณะสหเวชศาสตร์	கூட்டு சுகாதார அறிவியல் பீடம்	Nan
ข้อมูลอื่นๆ	பிற தகவல்	Nan
คณะสถาปัตยกรรมศาสตร์	கட்டிடக்கலை பீடம்	Nan
คณะวิศวกรรมศาสตร์	பொறியியல் ஆசிரியர்	Nan
คณะวิทยาการจัดการ	மேலாண்மை அறிவியல் பீடம்	Nan
คณะรัฐมนตรีคณะที่	மந்திரி சபை	Nan
คณะมนุษย์ศาสตร์และสังคมศาสตร์	மனிதநேயம் மற்றும் சமூக அறிவியல் பீடம்	Nan
คณะพยาบาลศาสตร์	நர்சிங் பீடம்	Nan
คณะประมง	மீன்வள பீடம்	Nan
คณะศิลปกรรมศาสตร์	நுண்கலை பீடம்	Nan
คนที่	மக்கள்	None
ข้อมูลปี	ஆண்டு தரவு	Nan
ข้อมูลประเทศเดนมาร์ก	டென்மார்க் தகவல்	Nan
ขวด	பாட்டில்	Nan
ขวัญ	மன உறுதியும்	Nan
ขวัญใจช่างภาพ	அன்பான புகைப்படக்காரர்	Nan
ขสมก	நிறை	Nan
ของ	of	Nan
ของทุกปี	ஒவ்வொரு வருடமும்	Nan
ของประเทศจีน	சீனாவின்	Nan
ของมหาวิทยาลัย	பல்கலைக்கழகத்தின்	None
ของมัน	அதன்	None
ของร่างกาย	உடலின்	None
ของสมเด็จฮุน	சோம்தேஜ் ஹுன்	Nan
ของสิ่งมีชีวิต	உயிரினங்களின்	None
ของสุนทรภู่	சுந்தோர்ன் ஃபூவின்	Nan
ของเหลว	திரவ	None
ของโลก	உலகின்	None
ขอนแก่น	கோன் கான்	Nan
ขอบคุณที่รักกัน	என்னை நேசித்ததற்கு நன்றி	Nan
ข้อมูลทั่วไป	பொதுவான செய்தி	Nan
ขุนหาญ	ஹான்	Nan
ขุขันธิน	கான் டின்	Nan
ขึ้นไป	மேலே	None
ขึ้นเป็น	அது வரை	Nan
ขี้ผึ้ง	மெழுகு	None
ข้อมูลปรากฏการณ์โลกร้อน	புவி வெப்பமடைதல் நிகழ்வு	Nan
ขีดเส้นใต้	அடிக்கோடிட்டு	Nan
ขิง	இஞ்சி	Nan
ขาย	விற்க	Nan
ขา	கால்	None
ขั้นที่	படி	None
ขอให้เด็กสมัยปฏิวัติของข้าพเจ้า	எனது புரட்சிகர குழந்தைகள்	Nan
ขอเช็ดน้ำตา	கண்ணீரைத் துடைப்போம்	Nan
ขิม	dulcimer	Nan
คนที่ไปช่วยรุ่นที่	தலைமுறைக்கு உதவியவர்கள்	Nan
คนแคระ	குள்ள	None
คนแรก	முதல் நபர்	Nan
ความยาวช่วงคลื่น	அலை நீளம்	Nan
ความยาวเพลง	பாடல் நீளம்	Nan
ความรัก	காதல்	None
ความรู้	அறிவு	None
ความสว่าง	பிரகாசம்	Nan
ความสัมพันธ์กับประเทศไทย	தாய்லாந்துடன் உறவுகள்	Nan
ความสัมพันธ์ระหว่างจีนกับอเมริกา	சீனாவுக்கும் அமெரிக்காவிற்கும் இடையிலான உறவுகள்	Nan
ความสูง	உயரம்	None
ความส่องสว่าง	பிரகாசம்	Nan
ความหนาแน่นของประชากร	மக்கள் அடர்த்தி	Nan
ความหมาย	பொருள்	Nan
ความหมายโดยพยัญชนะ	மெய் பொருள்	Nan
ความเข้มของการส่องสว่าง	ஒளிரும் தீவிரம்	Nan
ความเข้าใจ	புரிதல்	Nan
ความเร่ง	முடுக்கம்	None
ความโกรธ	கோபம்	None
ความโน้มถ่วง	ஈர்ப்பு	None
คัทลียา	கேட்லியா	Nan
คัญทัพ	முக்கியமான இராணுவம்	Nan
คัชชินสกี	குச்சின்ஸ்கி	Nan
คัง	காங்	Nan
คอสตาริกา	கோஸ்ட்டா ரிக்கா	Nan
คอลลิงวูด	காலிங்வுட்	Nan
ความยาวคลื่น	அலைநீளம்	None
คอร์ด	நாண்	Nan
คอนเสิร์ตประสานเสียงสามสถาบัน	மூன்று நிறுவனங்கள் கொயர் கச்சேரி	Nan
คอนเวนชัน	மாநாடுகள்	Nan
คอนสตรัคชั่น	கட்டுமானம்	None
คอ	கழுத்து	None
ควีนซี่	ராணி	None
ควินโต	குயின்டோ	Nan
คอมพิวเตอร์ยุคที่	கணினி சகாப்தம்	Nan
ความยาว	நீளம்	None
ความยากจน	வறுமை	None
ความพอประมาณ	அடக்கம்	None
คลอง	கால்வாய்	None
ครูพิเศษจอมป่วน	பூதம் ஆசிரியர்	Nan
ครู	ஆசிரியர்	None
ครุฑ	கருடா	Nan
คริสต์ศาสนา	கிறிஸ்தவம்	None
คริสตี	கிறிஸ்டி	Nan
คลองสาน	க்ளோங் சான்	Nan
คริส	கிறிஸ்	Nan
คราประยูร	பிரயுன்	Nan
ครั้งหนึ่ง	ஒரு முறை	Nan
ครอบครัว	குடும்பம்	None
ครอคโคไดล์	முதலை	Nan
คม	கூர்மையான	Nan
คปค	ஆண்டு	None
คราม	இண்டிகோ	Nan
จังหวัดเชียงราย	சியாங் ராய்	Nan
คลองเตย	க்ளோங் டோய்	Nan
คลาวิคอร์ด	வர்க்கம்	None
ความฝันอันสูงสุด	இறுதி கனவு	Nan
ความบริสุทธิ์	தூய்மை	None
ความนิยม	புகழ்	None
ความถี่	அதிர்வெண்	None
ความต่างศักย์	சாத்தியமான வேறுபாடு	Nan
ความจำ	நினைவகம்	None
คลับ	சங்கம்	None
ความงาม	அழகு	None
ควอร์เตอร์	காலாண்டு	Nan
ควอน	க்வோன்	Nan
คลื่นสึนามิ	சுனாமி	None
คลิป	கிளிப்	Nan
คลินิก	சிகிச்சையகம்	Nan
คลิก	கிளிக் செய்க	Nan
ความกว้าง	அகலம்	None
ลักเซมเบิร์ก	லக்சம்பர்க்	Nan
ธรรมศาสตร์	தம்மசாத் பல்கலைக்கழகம்	Nan
ธานินทร์	தானின்	Nan
มณฑลหูหนาน	ஹுனன்	Nan
มณีวรรณ	மணிவன்	Nan
มด	எறும்பு	None
มดลูก	கருப்பை	None
มต้น	தொடங்குங்கள்	Nan
มธ	tu	Nan
มธรรมศาสตร์	தம்மசாத் பல்கலைக்கழகம்	Nan
มน	சுற்று	None
มนุษย์	ஆண்	None
มนุษย์กลายพันธุ์	விகாரி	Nan
มนเรศวร	நரேசுவான்	Nan
มปท	என்.பி.எஸ்	Nan
มม	எம்.எம்	Nan
มมหิดล	மஹிடோல் பல்கலைக்கழகம்	Nan
มยุรา	மயில்	None
มลายู	மலாய்	None
มวยปล้ำ	மல்யுத்தம்	Nan
มหาวิทยาลัยปทุมธานี	பதும் தானி பல்கலைக்கழகம்	Nan
มหาวิทยาลัยบูรพา	புராஃபா பல்கலைக்கழகம்	Nan
มหาวิทยาลัยนเรศวร	நரேசுவான் பல்கலைக்கழகம்	Nan
มหาวิทยาลัยทักษิณ	தாக்சின் பல்கலைக்கழகம்	Nan
มหาวิทยาลัยขอนแก่น	கோன் கான் பல்கலைக்கழகம்	Nan
มหาวิทยาลัย	பல்கலைக்கழகம்	Nan
มจก	எம்	None
มหาวรรค	மகா புத்தர்	Nan
มหาปรมาภรณ์ช้างเผือก	மஹா பரமபார்ன் சாங் ஃபியூக்	Nan
มหาบัณฑิต	குரு	None
มหาชัย	மகாசாய்	Nan
มหาชน	பொது	None
มหัพภาค	ஒட்டுமொத்த	Nan
มสงขลานครินทร์	சாங்க்லா இளவரசர்	Nan
มหาวชิรมงกุฎ	மகாவாஜிரா கிரீடம்	Nan
มหาวิทยาลัยพะเยา	பயோ பல்கலைக்கழகம்	Nan
มกราคม	ஜனவரி	None
ภู่สว่าง	ஃபூ சவாங்	Nan
ภาพยนตร์ลามก	மோசமான திரைப்படங்கள்	Nan
ภาพรวม	கண்ணோட்டம்	Nan
ภายหลัง	பிறகு	None
ภายหลังสงคราม	போருக்குப் பிறகு	Nan
ภายใต้ความช่วยเหลือจากกองทุนการเงินระหว่างประเทศ	சர்வதேச நாணய நிதியத்தின் உதவியுடன்	Nan
ภายในวงขอบเหรียญเบื้องบนมีข้อความว่า	நாணயத்தின் மேற்புறத்தில் ஒரு அறிக்கை உள்ளது	Nan
ภารกิจ	மிஷன்	None
ภาวะเศรษฐกิจของกัมพูชาหลังจากมีการเปลี่ยนแปลงการปกครองจากระบอบสังคมนิยมเป็นระบอบประชาธิปไตย	ஜனநாயக சோசலிசத்திலிருந்து ஜனநாயகத்திற்கு மாறிய பின்னர் கம்போடியாவின் பொருளாதார நிலைமைகள்	Nan
ภาษาญี่ปุ่น	ஜப்பானியர்கள்	None
ภาษาบาลี	பாலி	Nan
ภาษาสเปน	ஸ்பானிஷ் மொழி	Nan
ภาษาอังกฤษ	ஆங்கில மொழி	Nan
ภาษาอีสาน	வடகிழக்கு மொழி	Nan
ภาษาเกชัว	கெச்சுவா	Nan
ภาษาเฉพาะอาชีพ	ஜர்கன்	Nan
ภาษาเบสิก	அடிப்படை	None
ภาษาเยอรมัน	ஜெர்மன்	None
ภูเขาน้ำแข็ง	பனிப்பாறை	Nan
ภูเขา	மலை	None
ภูหลวง	ஃபூ லுவாங்	Nan
ภูมิรัตน์	பூமிரத்	Nan
ภูมิภาค	பகுதி	Nan
ภูมิประเทศและภูมิอากาศ	நிலப்பரப்பு மற்றும் காலநிலை	Nan
ม	மீ	None
ภูพาน	ஃபூ ஃபான்	Nan
ภูกามยาว	ஃபூ காம் யாவ்	Nan
ภูกระดึง	புக்ராதுங்	Nan
ภิรมย์ภักดี	ஃபிரோம் பக்தி	Nan
ภิรมย์	மகிழ்ச்சி	Nan
ภิญโญ	பெருகிய முறையில்	Nan
ภาษาโคบอล	cobol	Nan
ภูธเนศ	பூட்டானெட்	Nan
ภาพยนตร์ตอน	அத்தியாயம்	Nan
มหาวิทยาลัยภูมินทร์พนมเปญ	ஃபுமின் பல்கலைக்கழகம், புனோம் பென்	Nan
มหาวิทยาลัยมหาสารคาม	மகா சாரகம் பல்கலைக்கழகம்	Nan
มังกี้	குரங்கு	None
มังคุด	மாங்கோஸ்டீன்	Nan
มัจฉานุ	மாட்சா	Nan
มัชฌิมาปฏิปทา	நடுத்தர பாதை	Nan
มัทนะพาธา	முத்தனா பாத்தா	Nan
มัธยฐาน	சராசரி	None
มัธยมศึกษา	இடைநிலைக் கல்வி	Nan
มัธยมศึกษาปีที่	தரம் 9	Nan
มันติคอร์	மன்டிகோர்	Nan
มัลเจร่า	மலேரா	Nan
มากกว่า	ஓவர்	Nan
มากที่สุด	மிக அதிகம்	Nan
มากิ	மக்கி	Nan
มาครอส	மேக்ரோஸ்	Nan
มาจยาร์	மாயர்	Nan
มาจากภาษาละติน	லத்தீன் இருந்து	Nan
มาซากิ	மசாகி	Nan
มาลี	மாலி	Nan
มาลากุล	மலாக்குல்	Nan
มาลัยพร	மலாய் ஆபாச	Nan
มาร์แชล	மார்ஷல்	Nan
มาร์ตินีก	மார்டினிக்	Nan
มาร์ติน	மார்ட்டின்	None
มะเร็ง	புற்றுநோய்	Nan
มาร์ช	மார்ஷ்	Nan
มาริสา	மரிசா	Nan
มายน์ส	சுரங்கங்கள்	Nan
มานี	மணி	None
มาตรา	பிரிவு	None
มาตรฐาน	தரநிலை	None
มาดริด	மாட்ரிட்	Nan
มาริเบล	மரிபெல்	Nan
มหาวิทยาลัยมหาจุฬาลงกรณราชวิทยาลัย	மகாச்சுலலாங்கொர்ன்ராஜாவித்யாலயா பல்கலைக்கழகம்	Nan
มะริด	மெயிக்	Nan
มะขาม	புளி	Nan
มหาวิทยาลัยมหิดล	மஹிடோல் பல்கலைக்கழகம்	Nan
มหาวิทยาลัยรังสิต	ரங்சிட் பல்கலைக்கழகம்	Nan
มหาวิทยาลัยราชภัฏบ้านสมเด็จเจ้าพระยา	பன்சோம்தேஜ்சோபிரய ராஜபட் பல்கலைக்கழகம்	Nan
มหาวิทยาลัยราชภัฏสงขลา	சாங்ஹ்லா ராஜபட் பல்கலைக்கழகம்	Nan
มหาวิทยาลัยราชภัฏสวนสุนันทา	சுவான் சுனந்தா ராஜபட் பல்கலைக்கழகம்	Nan
มหาวิทยาลัยราชภัฏอุตรดิตถ์	உத்தரடித் ராஜபட் பல்கலைக்கழகம்	Nan
มหาวิทยาลัยราชภัฏเทพสตรี	தெப்சத்ரி ராஜபட் பல்கலைக்கழகம்	Nan
มหาวิทยาลัยราชภัฏเลย	லோய் ராஜபட் பல்கலைக்கழகம்	Nan
มหาวิทยาลัยวงษ์ชวลิตกุล	வோங்சவாலிட்குன் பல்கலைக்கழகம்	Nan
มหาวิทยาลัยศรีนครินทรวิโรฒ	ஸ்ரீநாகரின்விரோட் பல்கலைக்கழகம்	Nan
มหาวิทยาลัยศรีปทุม	ஸ்ரீபதம் பல்கலைக்கழகம்	Nan
มหาวิทยาลัยศิลปากร	சில்பாகார்ன் பல்கலைக்கழகம்	Nan
มหาวิทยาลัยสุโขทัยธรรมาธิราช	சுகோதாய் தமதிராத் திறந்த பல்கலைக்கழகம்	Nan
มหาวิทยาลัยอีสาน	வடகிழக்கு பல்கலைக்கழகம்	Nan
มหาวิทยาลัยอุบลราชธานี	உபோன் ராட்சதானி பல்கலைக்கழகம்	Nan
มหาวิทยาลัยอ๊อกซฟอร์ด	ஆக்ஸ்போர்டு பல்கலைக்கழகம்	Nan
