องค์กรปกครองส่วนท้องถิ่น	locale	0.06250215144116968
หลักทรัพย์	valoare	0.06266413875522586
เกิด	fost	0.06288628277586117
เวลาประมาณ	estimat	0.06294047499655085
ครู	profesor	0.06332366856531013
หมวดหมู่	categorie	0.06333975471972039
น้ำมะนาว	de	0.06334048908780482
ขี้ผึ้ง	ceară	0.06356073903942581
ราชวงศ์ทิพย์จักราธิวงศ์	familia	0.06392411282490175
ลำดับ	ordin	0.06406134919008465
เริ่มจากเดือนพฤศจิกายนเมษายน	aprilie	0.0641742432557706
กับนางสุจาริณี	doamna	0.06428259000556175
ภาพถ่าย	fotografie	0.0643737313409865
ทีวีอินไซด์	interior	0.06440589934996509
เดือนมิถุนายน	iunie	0.06464734462764817
ห้างหุ้นส่วนจำกัด	limitat	0.06485797990184498
กว่า	decât	0.06485831854517574
โดยมี	cu	0.06508306559821414
ภาพยนตร์	filme	0.06512439631646184
ทไย	ce	0.06533173226003802
เรดวัน	zi	0.06546741610135978
จะต้องหาตัวแทนลงจากเวที	scenă	0.06586198939957215
ประเทศเม็กซิโก	mexic	0.06606888899030738
ซึ่งมีทั้งหมด	toate	0.06640180635991871
ในกาลต่อมา	viitor	0.06647797223326893
บ้านเขว้า	casă	0.0665895652383901
จนกระทั่งปี	anul	0.06666177228850825
ฟิลิปปินส์	filipine	0.06674740387617344
หลักจริยธรรม	etică	0.06687308288582514
เหล่านี้	aceste	0.06712957981632237
และครอบครัว	familia	0.06728826488228998
ตัวอย่างภาพยนตร์	filmului	0.06728853115692339
เพียงพอ	destul	0.06735887422912967
สมเด็จพระนางเจ้าสิริกิติ์	regina	0.06741449589738763
กรมรบพิเศษที่	de	0.06794760953120106
หมวดหมู่การฉลองปีใหม่	nou	0.06835268832211
กระบี่กระบอง	cu	0.06852910974117793
อำเภอราษีไศล	raionul	0.06882531325649979
สถาบันวิจัยจุฬาภรณ์	cercetare	0.06893165657495609
รางวัลนักร้องยอดเยี่ยม	cântăreț	0.0689873949572225
ศิลปะเครื่องปั้นดินเผา	arta	0.06904492197605071
ด้านการเกษตร	agricol	0.06917989042029697
ด็อก	câine	0.06920415327890816
แต่ไม่ประสบความสำเร็จ	succes	0.06930486181383197
ตระกูลอินุซึกะ	familia	0.0695095747770559
ฟรานซ์	franz	0.06967125544790964
รายการวันสำคัญทางพุทธศาสนา	importante	0.06976094616274335
ทวีปเอเชีย	asia	0.06977743583931535
บาคุกันธาตุไฟ	bakugan	0.06986007887247105
ศูนย์ค้าส่ง	cu	0.06987127774684038
มีทั้งสิ้น	toate	0.06996264671038088
ศูนย์บริการวิชาการ	academice	0.07002581422078917
หมวดหมู่กวีชาวไทย	poetului	0.0701779796056348
กันฟอร์ม	formă	0.07023627068471879
โมโนไซต์	site	0.0702388973274611
ดาวยูเรนัส	uranus	0.07030980104810373
ได้เคลื่อนไหวตรวจสอบการทำงานของรัฐบาลกัมพูชาอย่างแข็งขัน	guvernului	0.07037094859740622
กีฬาแหลมทอง	sport	0.07060577577077816
ระเบียบ	ordin	0.07072058886380173
ดำรงตำแหน่ง	poziție	0.07086701989068682
ด้วย	cu	0.07093228083301922
การบริหารจัดการ	administrare	0.07093878524303153
ซ้าย	stânga	0.07099336169392463
ความหนาแน่นของประชากร	populației	0.07104719614960356
ดูเพิ่มเติม	mult	0.0710564809147836
แย้มบุญเรือง	pentru	0.07115837093555824
เพลงประกอบภาพยนตร์	filmului	0.07116436640958755
หน่วยความจำ	memorie	0.07139785431905163
เอเธนส์	atena	0.07140209796910672
ในเบื้องต้น	inițial	0.07141059520518951
ทั้งหมด	toate	0.07147299988011044
ด้านการกีฬา	sport	0.07175211269335978
วอล์ค	jos	0.07184281628616163
พาร์ค	parc	0.07185108213806395
ในเดือนมีนาคม	în	0.07226669272587634
รายนามอธิการบดี	președintelui	0.07227009478879053
ทางหลวงพิเศษ	specială	0.07235577017215433
สุขภาพ	sănătate	0.07243814020931405
อาเธอร์	arthur	0.07254625188255247
พัทยาเหนือ	nord	0.07264984549612744
เอี่ยมยิ่ง	sunt	0.07277620761570942
พิพิธภัณฑสถานแห่งชาติ	național	0.07290945885381019
ราชวงศ์ถัง	dinastia	0.07299800367057581
ตำบลโพนครก	districtul	0.07315909832380935
ด้านหน้า	față	0.07373242064670596
ของมหาวิทยาลัย	universitate	0.07377406541402877
การปฏิรูประบบจัดเก็บภาษีเงินได้	venit	0.07402306084565793
มต้น	începe	0.0742857826026676
วัดหน้าพระธาตุ	templu	0.07461824436005894
เขตเลือกตั้งที่	târg	0.07486313803956536
ประกอบด้วย	include	0.07508705308731353
ดาวเคราะห์แคระ	planeta	0.07514207359020227
สัตว์มีแกนสันหลัง	coloană	0.07528423935344096
มหาวิทยาลัยอ๊อกซฟอร์ด	oxford	0.07541771068956381
เธรซ	tracia	0.07572049293845608
ออกัสตัส	augustus	0.07588027865332653
อลาสก้า	alaska	0.0761978773188257
ทางทิศเหนือติดกับประเทศไทยและลาว	și	0.07651638730137932
โฟโตสเฟียร์	foto	0.07682035498910648
ฆ	juan	0.07687968982982664
คำถามข้อที่	numărul	0.07704068855679738
ทเวนตี้	douăzeci	0.07709598669374615
บิ๊กซี	mare	0.07724792431319567
รศ	asociat	0.07729796841013495
ภูมิประเทศและภูมิอากาศ	climă	0.07731727959920409
รายพระนามพระมหากษัตริย์ไทย	regilor	0.07740028624434431
พรรคสังคมประชาธิปไตย	democrat	0.07747869080722161
พลอากาศเอกหญิง	feminin	0.07756779985970011
ภาคกลาง	regiune	0.0776531650202384
จากละคร	dramă	0.07770663052053405
สายสีม่วง	linie	0.078191225434487
ตรุษจีน	chinezesc	0.07830668718719096
ฮอลโลว์	gol	0.07833695819800753
การเพิ่มสิทธิประโยชน์แก่นักลงทุนต่างประเทศ	străini	0.07833816899425275
แฟมิลีที่ไปพักผ่อนที่เกาะมาเฟีย	insula	0.0787129203387868
สร้าง	crea	0.0788781191320194
เดิมชื่อ	anterior	0.0788781191320194
โครงสร้างภายใน	structura	0.07893375459238176
ลีกคัพ	ligii	0.07926062622499713
จากภาษากรีก	greacă	0.07935151259462045
ต่าง	diferit	0.07972976486554104
ต่อกันด้วยพันธะ	cu	0.07993967652569803
มหาบัณฑิต	maestru	0.08007072957495963
กล่าวคือ	adică	0.08017995615832757
หินอ่อน	marmură	0.08028885861330193
สาธารณรัฐโดมินิกัน	republica	0.08050282798343832
มหาวิทยาลัยเปิด	deschisă	0.08052678908651818
จังหวัดสมุทรสงคราม	provincia	0.0805385136778953
บรรณาธิการ	editor	0.08055317215299765
ประกาศเป็นป่าสงวน	declarată	0.08154135946826842
ภาควิชาสูติศาสตร์และนรีเวชวิทยา	și	0.08193871345793297
พจนานุกรมออนไลน์	online	0.0820689980115158
เป็นพระราชโอรสพระองค์เดียวในพระบาทสมเด็จพระปรมินทรมหาภูมิพลอดุลยเดช	regelui	0.08211734247220706
โมลิบดีนัม	molibden	0.08218759773122063
คณะสถาปัตยกรรมศาสตร์	arhitectură	0.08226051418146985
เยลโล่	galben	0.08240168609681507
ได้กล่าวว่า	spus	0.08271318582200753
ได้รับฉายาว่า	porecla	0.08320273286148244
เพลงเปิด	deschidere	0.08337796117020767
แย้มนาม	nume	0.0834727998372446
ทางทิศตะวันออกติดกับเวียดนาม	cu	0.08352581937762962
กวี	poet	0.08354418679066433
อาทิ	precum	0.08369081707757497
นั้น	acea	0.08370958219675548
ผิวขาว	alba	0.08376880918067102
ดังนั้น	de	0.08396699540116304
คอมพิวเตอร์ยุคที่	era	0.08397168159799293
ไปบรรจบแม่น้ำเจ้าพระยา	râului	0.08428818488067392
ศิษย์เก่าคณะมนุษยศาสตร์	științe	0.08429809680557628
ลักษณะภูมิอากาศ	climat	0.0844845526539823
อำเภอศรีเมืองใหม่	mai	0.08454732331024772
ประวัติศาสตร์ไทย	istorie	0.08482805550741253
ปั๊บ	brusc	0.08518491806729583
มูลนิธิชัยพัฒนา	fundația	0.08528191727512041
เทศบาลนครเชียงใหม่	mai	0.08529888833966105
ต่อมาในรัชกาลที่	domnie	0.08535640120622269
ภายหลัง	după	0.08536620002486116
โดเมน	domeniu	0.08544044480739121
อินโดนีเซีย	indonezia	0.08558416419289865
นัดกับนัด	cu	0.08562540942241763
ยูฟ่า	uefa	0.08572001547281949
เพิ่มมา	mult	0.08574826117461432
อุทยานแห่งชาติดอยภูคา	doi	0.08576851347176116
สมาคมประชาชาติแห่งเอเชียตะวันออกเฉียงใต้	de	0.0859233080818175
ส่วนส่งกำลังบำรุง	secțiunea	0.08628834390358078
ที่จ่ายร้อยละ	procent	0.08682294041369372
วุฒิสภา	senat	0.08703831106555507
เปอร์เซีย	persia	0.08714887654198171
สันติ	pace	0.08715621349132507
ฝ่ายบริหาร	administrare	0.08717278659953866
หมวดหมู่อดีตอาณานิคมของอังกฤษ	britanică	0.08721720357504141
ทหารอากาศ	aeriană	0.08723571045303252
รูทีเนียม	ruteniu	0.08734241598998511
เกียรติศักดิ์	glorie	0.0878966122215919
ปารีส	paris	0.08800503273460689
ดัชนีการพัฒนามนุษย์	dezvoltare	0.0880471486016451
นิเทศศาสตรบัณฑิต	arte	0.0883511689762825
สถาบันอาชีวศึกษา	institutul	0.08838007110870032
ภมรมนตรี	show	0.08841472063919043
ยกเว้น	cu	0.08883789396433228
ธรรมศาสตร์	universitatea	0.08902081851944743
สาธารณรัฐออสเตรีย	austria	0.08908232571015717
โรงเรียนปรินส์รอยแยลส์วิทยาลัย	colegiul	0.08914719060609062
รุ่ง	zi	0.08915826771297457
จเชียงใหม่	mai	0.0891646692862963
ไวน์	vin	0.08921361892504653
หมวดหมู่นักการเมืองไทย	politicieni	0.08921820310146476
วงศ์ปลากดทะเล	pești	0.08928829456518113
วังหิน	de	0.08953390974451221
บทนมัสการนอบน้อมบูชาพระพุทธเจ้า	cult	0.0895490064117981
รางวัลไนน์เอ็นเตอร์เทน	de	0.08973508797623687
ในช่วงแรก	început	0.08975021109332845
พันธเสน	legătură	0.08985311214867575
ละติจูด	latitudine	0.09006285713004052
หลังเหตุการณ์	eveniment	0.09013981610591212
โรงเรียนประชานิเวศน์	școala	0.09031533646380584
ภาคตะวันตก	occidentală	0.09039324914988472
ไอน์สไตน์	einstein	0.09056803739247178
และเป็นสมาชิกราชวงศ์	regale	0.09077004710300896
ในเดือนมิถุนายน	iunie	0.09089766064046034
ทรงถือหุ้นจำนวน	în	0.09097793922709785
ดวงพร	avere	0.09111919522835195
และคำว่า	cuvântul	0.09114810322880548
ไปรษณีย์เดชอุดม	poștal	0.09139963796705891
จากเรื่อง	poveste	0.09142792460236346
ชุมชนออนไลน์ชาวจังหวัดสกลนคร	online	0.09160196276053566
โดยสรุป	concluzie	0.09214801043800562
อยู่ห่างออกไปจากชายฝั่ง	coastă	0.09229404560858621
ที่นี้	aici	0.0925326492643668
วันมหาสงกรานต์	ziua	0.09259285775708238
ผู้ว่าการธนาคารแห่งประเทศไทย	băncii	0.09283129407834906
บริวเวอรี่	bere	0.09290971108172665
ดอยอินทนนท์	doi	0.09292426701100756
การวิจัย	cercetare	0.093241361864548
นักเต้นนำ	plumb	0.09325080415863693
เนะ	dreapta	0.09330682251658876
มีจำนวน	număr	0.0933376055764992
โรคประจำตัว	boala	0.09339094120716925
ฝูงชนวุ่นวาย	mulțime	0.09358518665856898
ศรีประจวบ	da	0.09361573530246022
เรียะชอาณาจักร	regat	0.09370584371000887
คาบ	perioadă	0.09371063808169632
ยุคสามก๊ก	regate	0.09393601395560593
สำเนียง	accent	0.09403801182487526
คุณ	tu	0.09417330834557985
พลังงานไฟฟ้า	electrică	0.09433544059171256
หลักสูตรที่เปิดสอน	curs	0.09435072162226764
คุ้มค่า	valoare	0.09493368015934005
พื้นที่มหาวิทยาลัย	universității	0.09500798271522957
รถโดยสารประจำทาง	autobuz	0.09517805254924155
วงเวียน	sens	0.0954199700517067
เมอร์คิวรี	mercur	0.09578175985842868
สำนักหอสมุดกลาง	centrală	0.09593675691648122
อานุภาพ	putere	0.09603079943065326
โครงการก่อสร้าง	de	0.09603680120603415
พายุ	furtună	0.09605168067726542
ทุก	fiecare	0.09612197959945197
ไดโนเสาร์ของโนบิตะ	lui	0.09656161434609839
โรงเรียนดาราวิทยาลัย	colegiul	0.09658866169650931
ศูนย์การบินทหารบก	armatei	0.09669367506925947
เบส	bas	0.09685742001988877
ศรีเมือง	sri	0.09696646893642896
ถนนสุขุมวิท	drumul	0.09698563396042809
ของสุนทรภู่	de	0.09744635220734318
บีฟเค้ก	de	0.09761184200363882
ความนิยม	popularitate	0.09767634701125738
เขตบางกอกใหญ่	districtul	0.09775537321877487
สันติสุข	pace	0.09786243567013846
โรงเรียนสาธิตแห่งมหาวิทยาลัยเกษตรศาสตร์	universității	0.09788979339236553
คณะวิศวกรรมศาสตร์	de	0.09796859779340579
บวก	pozitiv	0.09801388176344318
วิทยาลัยแพทยศาสตร์พระมงกุฎเกล้า	medicină	0.09835467197227579
มีลาภ	avere	0.09842287291103698
และสังคม	societatea	0.09849029445215937
ซ	c	0.09854281117067257
จังหวัดอุดรธานี	provincia	0.09885960337618256
เรียกกันว่า	denumit	0.09920282365497322
ในสมัยก่อน	vremuri	0.09943998453358091
ขวด	sticla	0.09964536669269311
วันละ	zi	0.0997020232605823
งานเทางามสัมพันธ์	relația	0.09995266585731666
หน่วยที่	unitate	0.10008504007459162
มหาวิทยาลัยสุโขทัยธรรมาธิราช	deschisă	0.10020151271156973
เรียล	real	0.1003733586984625
มีความยาว	lungime	0.10074741416322612
พระบาทสมเด็จพระปรเมนทรมหาอานันทมหิดล	regele	0.10077422593652952
เจ้าฟ้ามหิดลอดุลเดช	prințul	0.10089186039363382
ส่งเสริม	promova	0.10091971755716253
เขียนโดย	de	0.10103297488606362
ผลการแข่งขัน	ale	0.10112253582371529
สงครามเย็น	rece	0.10115965241301014
สมเด็จพระบรมราชาที่	regele	0.1012218001259475
จนกระทั่ง	cand	0.10147581528545578
ราชวงศ์จิ้นตะวันออก	est	0.10148794207568004
จูเซปเป	giuseppe	0.1015470922462939
มากที่สุด	mai	0.10165589967369693
ความยาว	lungimea	0.10172578662144932
อันได้แก่	inclusiv	0.10197941284391616
อันโตนิโอ	antonio	0.10209506117330133
ปีพุทธศักราช	anul	0.10212330480897801
วงศ์เทวัญ	familie	0.1023633185751704
พีระมิด	piramidă	0.10236555323379105
จำกัดมหาชน	limitat	0.10291017810255415
แบ่งประเทศไทยออกเป็น	în	0.10305245519070041
ระดับการกระโดดสูง	mare	0.10323245263598924
สุดท้ายตายด้วยฝีมือ	prin	0.10346495388519462
ซูเปอร์เซ็นเตอร์	centru	0.10384011473804867
อื่น	alt	0.10399421647773963
กองการศึกษา	educație	0.10400384133298021
หมวดหมู่บุคคลจากมหาวิทยาลัยอ๊อกซฟอร์ด	oxford	0.10417113216787915
ในรัฐบาล	guvern	0.10421791308510679
เขตมีนบุรี	min	0.10452334338981498
ภาวะเศรษฐกิจของกัมพูชาหลังจากมีการเปลี่ยนแปลงการปกครองจากระบอบสังคมนิยมเป็นระบอบประชาธิปไตย	democrație	0.10487729680158178
หมวดหมู่ภัยธรรมชาติ	naturale	0.1051554989426675
ศูนย์แพทยศาสตรศึกษาชั้นคลินิก	medicină	0.10542102154762174
ตระกูลยามานากะ	familia	0.10543154854193429
คงเจริญ	să	0.10550855604034304
ในภายหลัง	mai	0.10551668379415953
กรมควบคุมโรค	bolilor	0.10557146582877354
วิทยาลัยพยาบาลบรมราชชนนี	de	0.10562144263948159
คณะครุศาสตร์อุตสาหกรรม	industrială	0.10563362580742318
โรคไต	de	0.10572188260025388
รณภพ	lume	0.10572588290414973
ม	m	0.10653568121764276
ทองใหญ่	mare	0.10666170821763213
อย่างแพร่หลาย	largă	0.10697711287790329
พิรุณ	ploaie	0.10711568216984922
อาวุธประจำกาย	personală	0.10724689729373915
จังหวัดหนองบัวลำภู	provincia	0.10730288570385119
อะ	ce	0.10741949458529618
บริสุทธิ์	pur	0.1076140333099526
วิจิตรศิลป์	frumoase	0.1079429287937603
แอนด์	și	0.10805236837051697
ผู้บริหาร	executiv	0.10808854561199603
วิทยาลัยวิชาการศึกษา	învățământ	0.10817448925645125
ภาควิชาวิศวกรรมเครื่องกล	mecanică	0.10824059442316575
และสังคมศาสตร์	sociale	0.10843389979571745
เซอร์	domn	0.10844501873697508
ในภาษาอิตาลี่	italiana	0.10853281258442696
หมวดหมู่รัฐคอมมิวนิสต์	comunist	0.10876367614213701
คณะมนุษย์ศาสตร์และสังคมศาสตร์	sociale	0.10888320720734043
ผลสำรวจ	rezultatele	0.10904188773897472
หมวดหมู่รัฐและดินแดนที่ก่อตั้งในปี	stabilite	0.10907893658553844
หน่วยทหารในค่าย	lagăr	0.10930261802664923
ปลิงทะเล	mare	0.10955595169258281
บ้านแพ้ว	casă	0.10967220330117845
แคมเล็ก	mică	0.10977308383296792
ทีมใดที่จำนวนข้อที่ถูกน้อยกว่า	decât	0.11014558301613042
พระราชลัญจกรประจำพระองค์	regal	0.110153668108917
วังหลัง	palat	0.11028806702118747
สถาบันเทคโนโลยีราชมงคล	tehnologie	0.11030109305872562
เห็นภาพลวงตา	vezi	0.11038111983578942
หมวดหมู่บุคคลจากสถาบันบัณฑิตพัฒนศิลป์	institutul	0.1106917187528648
สีดำ	neagră	0.11073571159682227
หนึ่ง	unu	0.11079463158553751
ออกแบบตัวละคร	personajelor	0.11098843903618781
เครื่องขัตติยราชอิสริยาภรณ์อันมีเกียรติคุณรุ่งเรืองยิ่งมหาจักรีบรมราชวงศ์	dinastiei	0.1111154619229276
คิงส์	regii	0.1111244570483942
ฟ้า	albastru	0.11174551725239956
เบา	ușoară	0.11177885283134104
เวโรนา	verona	0.11191153757841919
หมวดหมู่มหาวิทยาลัยธรรมศาสตร์	universității	0.11197654226158417
เฉพาะด้านตะวันออกเฉียงใต้เท่านั้นที่เป็นที่ราบลุ่มแม่น้ำโขง	râului	0.11214914107157879
ความฝันอันสูงสุด	suprem	0.11217156606491661
กระทรวงอุตสาหกรรม	industriei	0.11248999835537737
พืชไม่มีท่อลำเลียง	fără	0.11276578579061884
รังสีแกมมา	raze	0.11280223730453297
จังหวัดเชียงราย	rai	0.11287093956562967
พระบาทสมเด็จพระเจ้าอยู่หัวเสด็จฯ	regele	0.11293378518919188
จีนตัวย่อ	chineză	0.11302617523954503
กลองมโหระทึก	mare	0.11336916993866583
เอล	el	0.11362133315605671
ศิลป์	artă	0.11367566059991556
ขวัญใจช่างภาพ	iubit	0.11408105159996072
และรัสเซีย	rusia	0.11442191662282122
ม้า	cal	0.11460701682011264
กาเหว่าที่บางเพลง	cântece	0.11479534393932414
เทศบาลเมืองชัยภูมิ	municipiul	0.11485605259974699
เมื่อปีพศ	trecut	0.11490895651355018
ภาควิชาคณิตศาสตร์	matematică	0.11495608079569829
หรือที่รู้จักกันในชื่อ	de	0.11495751502782803
อาจารย์	profesor	0.11497332238885186
เรื่องสั้น	poveste	0.11500070990042413
ตระกูลนารา	familia	0.11505268718087147
เยอรมนี	germania	0.11538363263029768
สมัย	perioadă	0.11544333457460286
โดยในวันที่	continuare	0.11559129521379385
อุทยานแห่งชาติภูเวียง	național	0.11563119948521532
เนื้อที่	zonă	0.11576003638549225
ปากีสถาน	pakistan	0.11606190322894487
เย	voi	0.11612083811367546
มาร์ติน	martin	0.11620114245825167
จังหวัดขอนแก่น	provincia	0.11622134805331918
นาวาอากาศเอกหญิง	de	0.11636292265452179
แต่งโดย	de	0.11640522384783235
ชะอวด	mare	0.11646255365324941
ตัวอย่าง	exemplu	0.11663823961482021
กองพลทหารม้าที่	de	0.11688226176634378
นำกลับมาสร้างใหม่อีกครั้ง	nou	0.11734829940266918
นักร้องนักดนตรี	cântăreț	0.11782581714778564
และกลายเป็นอู่ข้าวอู่น้ำที่มีชื่อเสียงของไทย	thailanda	0.11792111009202375
