+	+	Nan
ภาวะเศรษฐกิจของกัมพูชาหลังจากมีการเปลี่ยนแปลงการปกครองจากระบอบสังคมนิยมเป็นระบอบประชาธิปไตย	економічні умови камбоджі після переходу від демократичного соціалізму до демократії	Nan
ภาษาญี่ปุ่น	японці	Nan
ภาษาบาลี	палій	Nan
ภาษาสเปน	іспанська мова	Nan
ภาษาอังกฤษ	англійська мова	Nan
ภาษาอีสาน	північно-східна мова	Nan
ภาษาเกชัว	кечуа	Nan
ภาษาเฉพาะอาชีพ	жаргон	Nan
ภาษาเบสิก	основні	None
ภาษาเยอรมัน	німецька	None
ภูเขาน้ำแข็ง	айсберг	None
ภูเขา	гора	None
ภูหลวง	фу луанг	Nan
ภูมิรัตน์	пумірат	Nan
ภูมิภาค	область	None
ภูมิประเทศและภูมิอากาศ	топографія та клімат	Nan
ม	м	None
ภูพาน	фу фан	Nan
ภูกามยาว	фу кам яо	Nan
ภูกระดึง	phukradueng	Nan
ภิรมย์ภักดี	фіром факді	Nan
ภิรมย์	приємний	Nan
ภิญโญ	все більше	Nan
ภาษาโคบอล	кобол	Nan
ภูธเนศ	бутанет	Nan
ภาพยนตร์ตอน	епізод	Nan
มหาวิทยาลัยภูมินทร์พนมเปญ	університет імені пуріна пномпена	Nan
มหาวิทยาลัยมหาสารคาม	університет маха сарахам	Nan
มังกี้	мавпа	Nan
มังคุด	мангостін	Nan
มัจฉานุ	матча	Nan
มัชฌิมาปฏิปทา	середній шлях	Nan
มัทนะพาธา	мутана фата	Nan
มัธยฐาน	медіана	Nan
มัธยมศึกษา	вища освіта	Nan
มัธยมศึกษาปีที่	9 клас	Nan
มันติคอร์	мантікоре	Nan
มัลเจร่า	малера	Nan
มากกว่า	над	None
มากที่สุด	найбільший	None
มากิ	макі	Nan
มาครอส	макрос	Nan
มาจยาร์	майя	None
มาจากภาษาละติน	з латині	Nan
มาซากิ	масакі	Nan
มาลี	малі	None
มาลากุล	малакул	Nan
มาลัยพร	малайська порно	Nan
มาร์แชล	маршалл	Nan
มาร์ตินีก	мартініка	Nan
มาร์ติน	мартін	Nan
มะเร็ง	рак	Nan
มาร์ช	болото	Nan
มาริสา	маріса	Nan
มายน์ส	шахти	Nan
มานี	мані	Nan
มาตรา	розділ	None
มาตรฐาน	стандартний	Nan
มาดริด	мадрид	Nan
มาริเบล	марібель	Nan
มหาวิทยาลัยมหาจุฬาลงกรณราชวิทยาลัย	університет махачулонгкорнраджавідялая	Nan
มะริด	myeik	Nan
มะขาม	тамаринд	Nan
มหาวิทยาลัยมหิดล	махідольський університет	Nan
มหาวิทยาลัยรังสิต	університет рангсіт	Nan
มหาวิทยาลัยราชภัฏบ้านสมเด็จเจ้าพระยา	університет бансомдейчаопрая раджабхат	Nan
มหาวิทยาลัยราชภัฏสงขลา	університет сонгхла раджабхат	Nan
มหาวิทยาลัยราชภัฏสวนสุนันทา	університет суана сунанди раджабхат	Nan
มหาวิทยาลัยราชภัฏอุตรดิตถ์	уттарадітський університет раджабхата	Nan
มหาวิทยาลัยราชภัฏเทพสตรี	університет тепсатрі раджабхат	Nan
มหาวิทยาลัยราชภัฏเลย	університет лоей раджабхат	Nan
มหาวิทยาลัยวงษ์ชวลิตกุล	університет вонгваваліткун	Nan
มหาวิทยาลัยศรีนครินทรวิโรฒ	університет срінахарінвіро	Nan
มหาวิทยาลัยศรีปทุม	сріптумський університет	Nan
มหาวิทยาลัยศิลปากร	університет сілпакорн	Nan
มหาวิทยาลัยสุโขทัยธรรมาธิราช	сухотайський відкритий університет ім	Nan
มหาวิทยาลัยอีสาน	північно-східний університет	Nan
มหาวิทยาลัยอุบลราชธานี	університет убона ратчатані	Nan
มหาวิทยาลัยอ๊อกซฟอร์ด	оксфордський університет	Nan
มหาวิทยาลัยเกษตรศาสตร์	касецартський університет	Nan
มอหาดใหญ่	мор хат яй	Nan
มอสส์	мох	Nan
มอส	мох	Nan
มอร์ริส	морріс	Nan
มองโกเลียใน	внутрішня монголія	Nan
มหาวิทยาลัยแห่งแรกของประเทศไทย	перший університет таїланду	Nan
มะม่วงหิมพานต์	горіх кешью	Nan
มหาวิทยาลัยแม่โจ้	університет маейо	Nan
มหาวิทยาลัยเทคโนโลยีราชมงคลอีสาน	раджамангальський технологічний університет ісан	Nan
มหาวิทยาลัยเทคโนโลยีราชมงคลสุวรรณภูมิ	раджамангальський технологічний університет суварнабхумі	Nan
มหาวิทยาลัยเทคโนโลยีราชมงคลธัญบุรี	раджамангальський технологічний університет тханьябурі	Nan
มหาวิทยาลัยเทคโนโลยีราชมงคลตะวันออก	раджамангальський технологічний університет таван-ок	Nan
มหาวิทยาลัยเทคโนโลยีราชมงคลกรุงเทพ	раджамангальський технологічний університет крюнгтеп	Nan
มหาวิทยาลัยเทคโนโลยีพระจอมเกล้าพระนครเหนือ	університет короля монгкута в північному бангкоку	Nan
มหาวิทยาลัยเปิด	відкритий університет	Nan
มาสคาร่า	туш для вій	Nan
ภาพยนตร์ชุดนี้	цей набір фільмів	Nan
ภาพยนตร์	фільми	None
พาร์ค	парк	None
พาวเวอร์บาย	покупка потужності	Nan
พาเมล่า	памела	Nan
พิชัย	фічай	Nan
พิชิต	підкорити	Nan
พิณ	мандоліна	Nan
พิธีกรรายการ	господар	None
พิบูลมังสาหาร	пібун мангсахан	Nan
พิพิธภัณฑสถานแห่งชาติ	національний музей	Nan
พิพิธภัณฑ์	музей	None
พิม	пім	Nan
พิมประภา	фімпрапа	Nan
พิมพ์เล็ก	дрібний друк	Nan
พิมลวรรณ	фімонван	Nan
พิรุณ	дощ	Nan
พิสุทธิ์	блискучий	Nan
พิออจชา	фіонча	Nan
พุฒตาล	путтан	Nan
พื้นที่มหาวิทยาลัย	університетська область	Nan
พื้นฐานทางเศรษฐกิจ	економічна основа	Nan
พืชไม่มีท่อลำเลียง	установки без трубопроводів	Nan
พืชที่สำคัญคือ	важливими є рослини	Nan
พืช	рослина	Nan
พารามีเซียม	параметричний	Nan
พึ่งสุนทร	покладайтеся на сунторн	Nan
พี่น้อง	брати	None
พีอีเอ	pia	Nan
พีระศรี	фірасрі	Nan
พีระมิด	піраміда	None
พีท	піт	Nan
พิเศษนครกิจ	nakornkit special	Nan
พี่สาวของ	сестра	None
พุทธคยา	бодх гая	Nan
พารา	пара	None
พากย์เป็น	оголошено як	Nan
พลอากาศเอกหญิง	жіночий асм	Nan
พลฯ	загальні	None
พลังงานคลื่น	сила хвилі	Nan
พลังงานนิวเคลียร์	атомна енергетика	Nan
พลังงานลม	енергія вітру	Nan
พลังงานไฟฟ้า	електроенергія	Nan
พลัส	плюс	None
พลาซา	плаза	Nan
พลาสติก	пластикові	Nan
พลาสมา	плазма	Nan
พลเรือเอก	адмірал	Nan
พลเอกสนธิ	генерал сонті	Nan
พวกสัตว์ลำตัวกลม	круглі тіла тварини	Nan
พศ	пт	Nan
พอ	достатньо	None
พอตเตอร์	поттер	Nan
พอตเตอร์กับเจ้าชายเลือดผสม	поттер і напівкровний принц	Nan
พัลซาร์	пульсар	Nan
พับลิชชิ่ง	видавництво	None
พันธเสน	облігація	Nan
พันธุ์สุนัข	порода собак	Nan
พันธุ์พืช	види рослин	Nan
พันธุศาสตร์	генетика	Nan
พายุ	шторм	Nan
พันธมิตร	союз	None
พัทยาใต้	південна паттайя	Nan
พัทยาเหนือ	північна паттайя	Nan
พัฒน์ชัย	фатчай	Nan
พัชรี	фахарі	Nan
พอล	пол	None
พอยท์	точка	None
พัน	тис	None
ภาพยนตร์การ์ตูนไทย	тайський мультфільм	Nan
พุทธนิกายเถรวาท	теравадський буддизм	Nan
พุทธศักราช	буддійська епоха	Nan
ฟุตบอล	футбол	None
ฟุตบอลอาเซียนเยาวชน	футбол asean	Nan
ฟุตบอลเอเชียเยาวชน	азіатський молодіжний футбол	Nan
ฟู	повна	None
ฟูจิ	фуджі	Nan
ฟูลส์	повна	None
ฟ้อน	танцювати	Nan
ฟ้า	синій	None
ฟ้าร้อง	грім	None
ฟ้าหลัว	схід сонця	Nan
ภมรมนตรี	бамамон монтрі	Nan
ภักดี	лояльний	Nan
ภัณฑิลา	пантіла	Nan
ภาคกลาง	центральний регіон	Nan
ภาคคนแสดง	показати	None
ภาคตะวันตก	західний регіон	Nan
ภาคตะวันออกเฉียงเหนือ	північно-східний регіон	Nan
ภาพพิมพ์	роздрукувати зображення	Nan
ภาพพาโนรามา	панорама	Nan
ภาพถ่าย	фото	None
ภาพตรา	зображення печатки	Nan
ภาคใต้ตอนล่าง	нижній південний регіон	Nan
ภาคเหนือ	північ	None
ฟุตซอล	футзал	Nan
ภาควิชาเทคโนโลยีอาหาร	кафедра харчових технологій	Nan
ภาควิชาวิศวกรรมไฟฟ้า	кафедра електротехніки	Nan
ภาควิชาวิศวกรรมเครื่องกล	кафедра машинобудування	Nan
ภาควิชาฟิสิกส์	кафедра фізики	Nan
ภาควิชาพยาธิวิทยา	кафедра патології	Nan
ภาควิชาคณิตศาสตร์	кафедра математики	Nan
ภาคพิเศษ	спеціальний	None
ภาควิชาสูติศาสตร์และนรีเวชวิทยา	кафедра акушерства та гінекології	Nan
พุทธศตวรรษที่	буддійський вік	Nan
ฟีฟ่าคลับเวิลด์คัพ	кубок світу з футболу fifa	Nan
ฟิสิกส์อนุภาค	фізика частинок	Nan
พุ่มพวง	жінка	None
พู่กัน	кисть	Nan
พ่อขุนรามคำแหง	короля рамкхаменга	Nan
พ่อขุนศรีอินทราทิตย์	король інтрататіт	Nan
พ่อมด	майстер	None
พ่ายแพ้ให้กับ	втрачено в	Nan
พ๎ร	ласкаво просимо	Nan
ฟง	фонг	Nan
ฟรานซ์	франц	None
ฟรีดริช	фрідріх	None
ฟรีด้อม	безкоштовне підкрадання	Nan
ฟรีแวร์	безкоштовно	Nan
ฟลายเวท	легкий вага	Nan
ฟลูวาสแตติน	флувастин	Nan
ฟอน	фон	None
ฟอร์ด	ford	Nan
ฟอสฟอรัส	фосфор	Nan
ฟิสิกส์ดาราศาสตร์	астрофізика	Nan
ฟิวชัน	злиття	None
ฟิลิปีโน	філіппінське	Nan
ฟิลิปปินส์	філіппіни	Nan
ฟิลิป	філіп	Nan
ฟินแลนด์	фінляндія	None
ฟีนิลคีโตนูเรีย	фенілкетонурія	Nan
ฟิชเชอร์	фішер	Nan
ฟาง	солом’яний	Nan
ฟัน	зуби	None
ฟังไจ	слухай хайме	Nan
ฟังเพลง	слухати музику	Nan
ฟังพระธรรมเทศนา	слухайте проповіді	Nan
ฟอสเฟต	фосфат	Nan
ฟาน	ван	Nan
มาเก๊า	макао	Nan
มาเฟีย	мафія	None
มาเรีย	марія	None
รัฐธรรมนูญแห่งราชอาณาจักรไทย	конституція королівства таїланду	Nan
รัฐบาลไทย	уряд тайланду	Nan
รัฐบุรุษ	державний діяч	Nan
รัฐประหาร	переворот	None
รัฐประหารในประเทศไทย	переворот в таїланді	Nan
รัฐมนตรีว่าการกระทรวงคมนาคม	міністр транспорту	Nan
รัฐวิสาหกิจ	державне підприємство	Nan
รัฐวิสาหกิจไทย	тайські державні підприємства	Nan
รัฐสภา	парламент	None
รัฐสีมาคุณากรปิยชาติ	ратхасіма кунакорнпіячат	Nan
รัฐอิลลินอยส์	іллінойс	Nan
รัฐเทกซัส	техас	Nan
รัตนบุรี	раттанабурі	Nan
รัตนาธิเบศร์	раттанатібет	Nan
รับบทโดย	грає	None
รับพระราชทาน	прийміть	Nan
รัศมี	радіус	Nan
ราชวงศ์ทิพย์จักราธิวงศ์	королівська родина, чакратівонг	Nan
ราชวงศ์ถัง	династія тан	Nan
ราชวงศ์ชิง	династія цін	Nan
ราชวงศ์จิ้นตะวันออก	східна династія цзінь	Nan
ราชมังคลากีฬาสถาน	стадіон раджамангала	Nan
ราชนาวี	вмс	Nan
รัชดาภิเษก	ратчадафісек	Nan
ราชตระกูล	королівська сім&#39;я	Nan
รางวัลโนเบล	нобелівська премія	Nan
รางวัลนาฏราช	нагороди королівської танцівниці	Nan
รางวัลนักร้องไทยสากลชายยอดนิยม	популярна міжнародна співачка чоловічого тайського співака	Nan
รางวัลนักร้องยอดเยี่ยม	нагорода найкращої співачки	Nan
รากแก่น	основний корінь	Nan
รัสเซล	рассел	Nan
รางวัลไนน์เอ็นเตอร์เทน	дев&#39;ятка премія розваг	Nan
ราชวงศ์บ้านพลูหลวง	королівський будинок плу луанг	Nan
รัชกาลสมเด็จพระจุลจอมเกล้าเจ้าอยู่หัว	правління короля чулалонгкорна	Nan
รังสีแกมมา	гамма-промінь	Nan
ระดับการกระโดดสูง	стрибок у висоту	Nan
ระดับปริญญาเอก	рівень доктора філософії	Nan
ระดับปริญญาโท	магістерський степінь	Nan
ระดับมัธยมศึกษา	вторинний рівень	Nan
ระดับอาชีวศึกษา	професійний рівень	Nan
ระนอง	ранонг	Nan
ระนาด	ксилофон	Nan
ระนาดทุ้ม	альт ксилофон	Nan
ระนาดเอก	альто	Nan
ระบบ	система	None
ระบบกษัตริย์ของกัมพูชา	камбоджійська монархія	Nan
ระบบรัฐสภา	парламентська система	Nan
ระบบสืบพันธุ์	репродуктивна система	Nan
ระบบสุริยะ	сонячна система	Nan
ระบบโครงกระดูก	скелетна система	Nan
ระบบใช้อำนาจเด็ดขาด	абсолютна система живлення	Nan
ระยะ	фаза	None
รังสีเอกซ์	рентген	None
รังสี	промінь	Nan
รังสิตคลอง	рангсіт хлонг	Nan
รักแห่งสยาม	любов до сіаму	Nan
รักษาสิ่งแวดล้อม	охороняти довкілля	Nan
รักษาศีล	дотримуйтесь заповідей	Nan
รัชกาลที่	панувати	Nan
ระโนด	мертві	Nan
ระเบียง	балкон	Nan
ระหว่างสงครามโลกครั้งที่	під час світової війни	Nan
ระหว่างปี	протягом року	Nan
ระวิ	між	None
ระยะเวลาการดำรงตำแหน่ง	термін служби	Nan
ระยะเวลา	тривалість	None
ระเบียบ	замовлення	None
ระดับกระโดดสูง	стрибок у висоту	Nan
ราชวงศ์พระร่วง	династія фра руанг	Nan
ราชวงศ์อู่ทอง	династія u-thong	Nan
รูปวรรณยุกต์	тональна форма	Nan
รูปสามเหลี่ยมมุมป้าน	тупий трикутник	Nan
รูปสี่เหลี่ยมด้านขนาน	паралелограма	Nan
รูสเวลต์	рузвельт	Nan
ร็อดฟอร์ม	форма стрижня	Nan
ร่วมแสดงกับ	виконайте з	Nan
ร้องคู่กับ	співайте разом з	Nan
ร้องร่วมกับ	співайте з	Nan
ร้องโดย	співає	Nan
ร้อยตรี	другий лейтенант	Nan
ร้านอาหาร	ресторан	Nan
ฤดูกาล	сезон	None
ฤดูฝน	сезон дощів	Nan
ฤดูร้อน	спекотний сезон	Nan
ล	the	Nan
ลงวันที่	датується	None
ลพบุรี	лоп бурі	Nan
ลักษณะภูมิอากาศ	клімат	None
ลักษณะทางกายภาพ	фізичні характеристики	Nan
ลักษณะทั่วไป	загальна характеристика	Nan
ลักษณะ	погляд	None
ละติจูด	широту	Nan
ละครโทรทัศน์	мильна опера	Nan
รูปร่าง	форма	None
ละครเพลง	музичний	None
ละครวิทยุ	радіодрама	Nan
ละครชาตรี	чатрі драми	Nan
ละคร	драма	None
ลอร์ด	бог	None
ลอยกระทง	фестиваль лоя кратонга	Nan
ลอนดอน	лондон	None
ละครสั้น	коротка драма	Nan
ราชวงศ์หยวน	династія юань	Nan
รูปภาพ	зображення	None
รูดอล์ฟ	рудольф	Nan
ราชสกุล	маркери	Nan
ราชสีมา	ратчасіма	Nan
ราชินิกุล	родичі королеви	Nan
ราบเป็นหน้ากลอง	будьте зрозумілі	Nan
รามอินทรา	рамінтра	Nan
รายการ	список	None
รายการวันสำคัญทางพุทธศาสนา	список важливих буддійських дат	Nan
รายชื่อ	список	None
รายชื่อคำในภาษาไทยที่มักเขียนผิด	список тайських слів, які часто пишуться неправильно	Nan
รายชื่อภาพยนตร์ไทย	список тайських фільмів	Nan
รายชื่อหุ่นยนต์ใน	список роботів в	Nan
รายชื่ออธิการบดี	список канцлерів	Nan
รายชื่อเพลง	список пісень	Nan
รายนามรองอธิการประจำวิทยาเขต	перелік імен віце-канцлерів у кампусі	Nan
รายนามอธิการบดี	список президента	Nan
รายพระนามพระมหากษัตริย์ไทย	список королів тайланду	Nan
รายะนาค	рая нак	Nan
รุ่งเพชร	зубчастий петч	Nan
รุ่งสว่าง	світанок	Nan
รุ่ง	світанок	Nan
รุจิพรรณ	руджіпан	Nan
รีเนียม	ренію	Nan
รีสอร์ท	курорт	None
รูทีเนียม	рутеній	None
ริเอะ	ри	Nan
ริมแม่น้ำเจ้าพระยา	річка річки чао-прая	Nan
ริน	налити	Nan
รำพันพิลาป	кричати	Nan
ราศีธนู	стрілець	Nan
ราวพุทธศตวรรษที่	приблизно століття	Nan
รายได้อื่น	інші прибутки	Nan
ริวซากิ	рюзакі	Nan
รอบเมือง	навколо міста	Nan
รอบที่	круглий	Nan
รอบชิงชนะเลิศระดับประเทศ	національний фінал	Nan
มีน	хв	Nan
มีนบุรี	мін бурі	Nan
มีนวิทยา	мінологія	Nan
มีนายกรัฐมนตรี	майте прем&#39;єр-міністра	Nan
มีประวัติศาสตร์ยาวนาน	має довгу історію	Nan
มีพรมแดนทางทิศใต้จรดกับอ่าวไทย	на півдні межує з таїландською затокою	Nan
มีภูเขาล้อมรอบอยู่	в оточенні гір	Nan
มีลักษณะดังนี้	має такі характеристики	Nan
มีลักษณะภูมิประเทศคล้ายชามหรืออ่าง	з такими функціями, як миска або таз	Nan
มีลาภ	пощадити	Nan
มีล่า	полюй	Nan
มีสูตรการคำนวณหาจำนวนฟัน	існує формула для обчислення кількості зубів.	Nan
