+	+	Nan
ลูน่า	луна	Nan
ลูซิเฟอร์	люцифер	Nan
ลูกอัณฑะ	яєчка	Nan
ลูกอม	цукерки	Nan
ลูกสาว	дочка	None
ลูกปัด	бісер	Nan
ล่ำซำ	грудочка	Nan
ลุงบุญมีระลึกชาติ	дядько бунмі пригадав націю	Nan
ลี้	лі	Nan
ลีเมอร์	лемур	Nan
ลีซอ	лісу	None
ลีกคัพ	кубок ліги	Nan
ลิเทียม	літій	Nan
ลิเก	музична народна драма	Nan
ลี้สุวรรณ	лі суван	Nan
วิญญาณ	дух	None
วอลท์	уолт	Nan
วะสี	васі	Nan
วันพฤหัสบดี	четвер	Nan
วันพุธ	середа	Nan
วันมหาสงกรานต์	день маха сонгкрана	Nan
วันละ	день	None
วันศุกร์	п’ятниця	Nan
วันสงกรานต์	день сонгкрана	Nan
วันสำคัญ	важливий день	Nan
วันสำคัญทางพุทธศาสนา	важливий день буддизму	Nan
วันหยุดราชการ	народне свято	Nan
วันอังคาร	вівторок	Nan
วันอาทิตย์	неділя	Nan
วันอาสาฬหบูชา	асанха буча	Nan
วันเกิด	день народження	Nan
วันเสาร์	субота	Nan
วันแรม	день	None
วัย	у віці	Nan
วัลลิโภดม	валліфодом	Nan
วิชาการคอม	академічний комп&#39;ютер	Nan
วิชาการ	академічний	None
วิจิตรศิลป์	витончені мистецтва	Nan
วิจัย	дослідження	None
วิคตอเรีย	вікторія	None
วิกตอร์	віктор	None
วันนี้ที่รอคอย	чекаємо сьогодні	Nan
วาไรตี้	різноманітність	None
วาเรีย	варія	Nan
วาลีน	валін	Nan
วาลคิรี	валькірія	Nan
วารินชำราบ	варінчамрап	Nan
วานูอาตู	вануату	Nan
วัสดุฟิสไซล์	роздільний матеріал	Nan
วาเลนไทน์	валентина	Nan
วอล์ค	прогулянка	Nan
วันที่เข้าฉาย	дата виходу	Nan
วันที่ขึ้นเครื่องหมาย	дата підписання	Nan
วัง	палац	None
วังจันทร์	ван чан	Nan
วังสระปทุม	палац sra pathum	Nan
วังสะพุง	ван сафунг	Nan
วังหลัง	палац	None
วังหิน	кам&#39;яний палац	Nan
วัชรพล	ватчараполь	Nan
วัฒนชัย	ватханачай	Nan
วัฒนธรรม	культури	None
วัฒนวิทูกูร	ваттанавіткун	Nan
วัฒนา	ваттана	Nan
วัดกลาง	середній храм	Nan
วัดป่าเลไลยก์วรวิหาร	ват па лелай воравіхан	Nan
วัดพระธาตุดอยสุเทพราชวรวิหาร	ват фра, що дой сутеп, ратчаворавіхан	Nan
วัดพระฝางสวางคบุรีมุนีนาถ	ват фра фанг сангхабурі мунінат	Nan
วัดพระมหาธาตุวรมหาวิหาร	ват фра махатхат ворамахавіхарн	Nan
วัดพระยืนพุทธบาทยุคล	ват фра юен футтайахон	Nan
วันชัย	wanchai	Nan
วัน	день	None
วัตสัน	ватсон	Nan
วัตต์	ватт	Nan
วัดโพธิ์	ват фо	Nan
วัดเจดีย์หลวง	храм чеді луанг	Nan
วันที่ออกอากาศชื่อตอนแขกรับเชิญ	дата трансляції, назва епізоду, поява гостей	Nan
วัดหน้าพระธาตุ	na phra той храм	Nan
วัดสุทัศนเทพวรารามราชวรมหาวิหาร	храм сутасана тепа варарама	Nan
วัดสองพี่น้อง	пісня храму фі нонг	Nan
วัดระฆังโฆสิตาราม	храм ракхангкосарам	Nan
วัดพระเชตุพนวิมลมังคลารามราชวรมหาวิหาร	wat phra chetuphon vimolmangklararam ratchaworamahawihan	Nan
วัดพระศรีรัตนมหาธาตุ	ват фра сі раттана махатхат	Nan
วัดพระลอย	храм фра лої	Nan
วัดหนองเพียร	храм нонг фіан	Nan
สตรอเบอรี่	полуниця	Nan
สตรีวิทยา	рентгенологія	Nan
สติปัญญา	інтелект	Nan
สารานุกรมไทยฉบับราชบัณฑิตยสถาน	тайська енциклопедія королівський інститут	Nan
สารีวงษ์	sareewong	Nan
สาวิตรี	савітрі	Nan
สาเหตุ	причина	None
สำนวนเก่า	стара ідіома	Nan
สำนักงานขนส่งกรุงเทพมหานครพื้นที่	управління місцевого транспорту бангкока	Nan
สำนักงานคณะกรรมการวัฒนธรรมแห่งชาติ	управління національної комісії з питань культури	Nan
สำนักงานโครงการพัฒนาแห่งสหประชาชาติ	управління програми розвитку оон	Nan
สำนักระบาดวิทยา	бюро епідеміології	Nan
สำนักราชเลขาธิการ	секретаріат	None
สำนักวิทยบริการ	управління академічних ресурсів	Nan
สำนักหอสมุด	бібліотека	None
สำนักหอสมุดกลาง	центральна бібліотека	Nan
สำรวจ	опитування	None
สำราญ	радісно	Nan
สำหรับ	для	None
สำหรับประเทศไทย	для таїланду	Nan
สินิทธา	сітіта	Nan
สินสมุทร	гріх самут	Nan
สินค้าอุปโภคบริโภค	споживчі товари	Nan
สินค้าคงเหลือ	запаси	None
สิน	гріх	Nan
สิทธิมนุษยชน	права людини	Nan
สารานุกรมไทย	тайська енциклопедія	Nan
สิทธิ	права	None
สิงหไตรภพ	сінгха тріпоп	Nan
สิงหาคม	серпень	None
สำโรง	самронг	Nan
สำเนียง	наголос	Nan
สำหรับในปี	бо за рік	Nan
สำหรับใช้เป็นตราหัวหนังสือราชการไทย	для використання в якості печатки на тайландському урядовому буклеті	Nan
สิงโต	лев	None
สิปปภาค	zippy region	Nan
สารละลาย	рішення	None
สารพฤกษเคมี	фітохімія	Nan
สาขาวิชาเคมี	кафедра хімії	Nan
สาขาวิชาเทคโนโลยีชีวภาพ	програма біотехнології	Nan
สาขาวิชาเศรษฐศาสตร์	економіка	None
สาขาศิลปะสถาปัตยกรรม	мистецька архітектура	Nan
สาขาสมุย	відділення самуї	Nan
สาขาหัวหิน	відділення хуа хін	Nan
สาครสินธุ์	сакорн гріх	Nan
สาทร	сатхорн	Nan
สาธารณรัฐประชาชนจีน	народна республіка китай	Nan
สาธารณรัฐออสเตรีย	республіка австрія	Nan
สาธารณรัฐอินโดนีเซีย	республіка індонезія	Nan
สาธารณรัฐเช็ก	чеська республіка	Nan
สาธารณรัฐโดมินิกัน	домініканська республіка	Nan
สานติวัตร	сантіват	Nan
สามก๊ก	три королівства	Nan
สามชัย	сам чай	Nan
สามชุก	сам чук	Nan
สารต้านอนุมูลอิสระ	антиоксиданти	Nan
สายเมืองทอง	лінія mueang thong	Nan
สายเดียว	одина рядок	Nan
สายหมอก	туман	Nan
สายสีม่วง	фіолетова лінія	Nan
สายสีน้ำเงิน	синя лінія	Nan
สารภี	сарафі	Nan
สายสีชมพู	рожева лінія	Nan
สายรุ้ง	веселка	Nan
สายรัชกาลที่	пізнє правління	Nan
สายการบิน	авіакомпанії	Nan
สามัญ	звичайний	None
สามอัศวินในจินตนาการ	три лицарі-фантазії	Nan
สามพราน	сампран	Nan
สายสนั่น	грім лінії	Nan
สาขาวิชาศิลปอุตสาหกรรม	художній відділ	Nan
สิเรียม	сиріум	Nan
สิ่งมีชีวิต	живі речі	Nan
สุปรีย์	супрі	Nan
สุพจน์	сухот	Nan
สุพล	супон	Nan
สุมณทิพย์	sumonthip	Nan
สุรชาติ	сурачат	Nan
สุรพล	сурапон	Nan
สุรพันธ์	сурафан	Nan
สุรวุฒิ	суравут	Nan
สุรศักดิ์	сурасак	Nan
สุรัสวดี	surasawadee	Nan
สุราษฎร์ธานี	сурат тані	Nan
สุรินทร์	сурін	Nan
สุริยัน	суріан	Nan
สุริโยไท	суріотай	Nan
สุลต่าน	султан	None
สุวนันท์	суванан	Nan
สุวรรณรัฐ	суваннарат	Nan
ส่งเสริม	сприяти	Nan
สไตล์การเล่น	стиль гри	Nan
สไตรค์	страйк	Nan
สเปน	іспанія	None
สเตเดี้ยม	стадіон	None
สเตอรอล	стерол	Nan
สุนัขจิ้งจอก	лисиця	Nan
สเตราส์	стросс	Nan
สูงจากระดับน้ำทะเลปานกลาง	високо над рівнем моря	Nan
สูง	високий	None
สุ่น	сонце	None
สุโขทัย	сухотай	Nan
สุเทพ	сатеп	Nan
สุวรรณานนท์	суваннанон	Nan
สู่	до	None
สิ่ง	річ	None
สุนทรเวช	sunthornwet	Nan
สุนทร	sunthorn	Nan
สิ่งเสพติด	ліки	Nan
สิ้นพระชนม์ในรัชกาลที่	помер у правління с	Nan
สี	колір	None
สีขาว	білий колір	Nan
สีดำ	чорний колір	Nan
สีน้ำตาล	коричневий колір	Nan
สีน้ำเงิน	синій	None
สีฟ้า	синій	None
สีม่วง	фіолетовий	Nan
สีลม	вітряк	Nan
สึนะ	цуна	Nan
สึนะโยชิ	цунайоші	Nan
สืบต่อมา	спадщина	None
สื่อสารมวลชน	масова комунікація	Nan
สื่อสิ่งพิมพ์	друковані медіа	Nan
สุกิจ	сукіт	Nan
สุขภาพ	здоров&#39;я	Nan
สุธี	вчений	None
สุทัศน์	suthat	Nan
สุทัศนะจินดา	сутасачінда	Nan
สุทธิชัย	sutthichai	Nan
สุดารัตน์	сударат	Nan
สุดสาคร	sudsakorn	Nan
สุนทรภู่	сунтхорн фу	Nan
สุดท้ายตายด้วยฝีมือ	нарешті, вмирайте від майстерності.	Nan
สุจาริณี	sucharinee	Nan
สุจริตกุล	сухаріткун	Nan
สุครีพ	sukree	Nan
สุขุมวิท	сухумвіт	Nan
สุขาภิบาล	санітарний	Nan
สุขสวัสดิ์	суксават	Nan
สุชิน	сухін	Nan
สาขาวิชาวิศวกรรมอิเล็กทรอนิกส์	програма електронної інженерії	Nan
สาขาวิชาวิศวกรรมอาหาร	харчова інженерія	Nan
สาขาวิชาวิศวกรรมคอมพิวเตอร์	комп&#39;ютерна інженерія	Nan
สนิม	іржа	Nan
สนเกรวิลเลีย	сосновий виноград	Nan
สปริงฟิลด์	спрінгфілд	Nan
สปรินเตอร์	спринтер	Nan
สปาร์ค	іскра	Nan
สพ	спец	Nan
สภานิติบัญญัติแห่งชาติ	національні законодавчі збори	Nan
สภาผู้แทนนิสิต	рада представників студентів	Nan
สภาพอากาศ	погода	None
สมจิตต์	сомхіт	Nan
สมจิตร	сомхіт	Nan
สมชัย	сомчай	Nan
สมชาย	сомчай	Nan
สมภพ	народження	None
สมศรี	сомсрі	Nan
สมศักดิ์	сомсак	Nan
สมัคร	застосувати	Nan
สมเด็จพระนางเจ้าสิริกิติ์	королева сірікіт	Nan
สมเด็จพระนางเจ้ารำไพพรรณี	королева рамбха барні	Nan
สมเด็จ	її величність	Nan
สมุทวณิช	самутаваніч	Nan
สมาชิกฤดูกาลที่	учасники сезону	Nan
สมาชิกรับเชิญตอนพิเศษ	запрошені учасники до спеціальних епізодів	Nan
สนิทวงศ์	саніт вонг	Nan
สมาคมประชาชาติแห่งเอเชียตะวันออกเฉียงใต้	асоціація держав південно-східної азії	Nan
สมัยสุโขทัย	сухотайський період	Nan
สมัยรัชกาลที่	панувати	Nan
สมัยที่	коли	None
สมัยก่อนประวัติศาสตร์	доісторичні часи	Nan
สมัยกรุงธนบุรี	період тонбурі	Nan
สมัย	періоду	None
สมัยอาณานิคมฝรั่งเศส	французький колоніальний період	Nan
สมเด็จพระนางเจ้าฯ	її величність	Nan
สนามไฟฟ้า	електричне поле	Nan
สนามฟุตบอล	футбольне поле	Nan
สตึก	сатуек	Nan
สตูดิโอ	студія	Nan
สถานที่ท่องเที่ยวทางธรรมชาติ	природні пам&#39;ятки	Nan
สถานะ	статус	None
สถานีคาราวาน	станція каравану	Nan
สถานีวิทยุโทรทัศน์ไทยทีวีสีช่อง	тайські телевізійні станції з кольоровими телеканалами	Nan
สถานีโทรทัศน์ไทยพีบีเอส	тайська телебачення pbs	Nan
สถาบัน	заклад	None
สถาบันการศึกษา	навчальний заклад	Nan
สถาบันบัณฑิตพัฒนบริหารศาสตร์	національний інститут адміністрації розвитку	Nan
สถาบันพระบรมราชชนก	королівський інститут	Nan
สถาบันวิจัยจุฬาภรณ์	чулабхорнський науково-дослідний інститут	Nan
สถาบันวิจัยและพัฒนา	науково-дослідний інститут	Nan
สถาบันศูนย์และหน่วยงานในมหาวิทยาลัย	установи, центри та кафедри в університетах	Nan
สถาบันสมทบ	асоційований заклад	Nan
สถาบันอาชีวศึกษา	професійний інститут	Nan
สถาบันอุดมศึกษา	вищий навчальний заклад	Nan
สนามชัยเขต	санам чай хет	Nan
สนามกีฬากลาง	центральний стадіон	Nan
สนธิไชย	сонтіхай	Nan
สนธิ	стик	Nan
สนธยา	сутінки	Nan
สธ	sth	Nan
สนามแม่เหล็ก	магнітне поле	Nan
สถิติศาสตร์	статистика	None
สถาปนิก	архітектор	None
สถาบันโภชนาการ	інститут харчування	Nan
สถาบันเทคโนโลยีราชมงคล	раджамангальський технологічний інститут	Nan
สถาบันเทคโนโลยีพระจอมเกล้าเจ้าคุณทหารลาดกระบัง	технологічний інститут короля монгкута ладкрабанг	Nan
สถาบันเทคโนโลยีพระจอมเกล้า	інститут технологій короля монгкута	Nan
สถาบันเทคโนโลยีนานาชาติสิรินธร	сіріндхорн міжнародний технологічний інститут	Nan
สถาปัตยกรรมไทย	тайська архітектура	Nan
สมเด็จพระบรมราชาที่	король	None
สมเด็จพระบรมโอรสาธิราช	престолонаследник	Nan
สมเด็จพระบรมโอรสาธิราชฯ	престолонаследник	Nan
สะเดา	неем	Nan
สัจธรรม	правда	None
สัญญา	договір	None
สัญลักษณ์ประจำมหาวิทยาลัย	логотип університету	Nan
สัดส่วน	пропорція	Nan
สัตว์	тварина	Nan
สัตว์มีกระดูกสันหลัง	хребетні	Nan
สัตว์มีแกนสันหลัง	хребет	None
สัตว์เลี้ยงลูกด้วยน้ำนม	ссавці	Nan
สัตว์เลื้อยคลาน	рептилія	Nan
สัตว์เลื้อยคลานในอันดับนี้	рептилії в цьому званні	Nan
สัทศาสตร์	фонетика	Nan
สันติ	мир	None
สันติสุข	мир	None
สัมผัสนอก	зовнішня рима	Nan
สัมพันธ์	відносини	None
สัมมา	правильно	None
สาขาวิชาวิทยาการคอมพิวเตอร์	програма з інформатики	Nan
สาขาวิชารัฐประศาสนศาสตร์	департамент державного управління	Nan
สาขาวิชาบริหารธุรกิจ	програма ділового адміністрування	Nan
สาขาวิชานิติศาสตร์	юридичний факультет	Nan
สาขาลำปาง	лампанг відділення	Nan
สาขาย่อย	підгалузь	Nan
สะล้อ	гальма	Nan
สาขามนุษยศาสตร์	гуманітарні науки	Nan
สาขาปราจีนบุรี	прачінбурі відділення	Nan
สาขาประจวบคีรีขันธ์	відділення прачуап-хірі-хана	Nan
สาขานิเทศศาสตร์	мистецтво спілкування	Nan
สาขานครสวรรค์	відділення nakhon sawan	Nan
สาขานครราชสีมา	відділення нахон ратчасіма	Nan
สาขา	відділення	None
สาขาพิษณุโลก	відділення фітсанулок	Nan
สะตอ	сато	Nan
สะดวก	легко	None
สอยดาว	верхня частина	Nan
สร้าง	творити	Nan
สราวุธ	саравут	Nan
สรรพสินค้า	універмаг	Nan
สร	створіть	Nan
สยามพารากอน	сіам парагон	Nan
สยามบรมราชกุมารี	сіам	Nan
สลักใจ	вразити	Nan
สยามดารา	сіам дара	Nan
สมเด็จพระเจ้าภคินีเธอ	її королівська високість	Nan
สมเด็จพระเจ้ากรุงธนบุรี	крунг тон бурі	Nan
สมเด็จพระอนุชาธิราช	сомдей анухаттірат	Nan
สมเด็จพระศรีนครินทราบรมราชชนนี	нвч принцеса маха чакри сіріндорн	Nan
สมเด็จพระรามาธิบดีที่	король раматібоді	Nan
สมเด็จพระมหิตลาธิเบศร	somdet phra mahidol latibes	Nan
สมเด็จพระเจ้าลูกเธอ	її королівська високість	Nan
ส่วนต่อขยายบางซื่อท่าพระ	розширення bang sue tha phra	Nan
สวนดุสิตโพล	опитування суана дусіта	Nan
สวนสมเด็จพระศรีนครินทร์	парк somdet phra srinagarindra	Nan
สองสาย	два дроти	Nan
สหวงษ์	сахавонг	Nan
สหราชอาณาจักร	об&#39;єднане королівство	Nan
สหรัฐอเมริกา	нас.	Nan
สหรัฐอาหรับเอมิเรตส์	об&#39;єднані арабські емірати	Nan
สหพันธ์สาธารณรัฐเยอรมนี	федеративна республіка німеччина	Nan
สวนผึ้ง	суан пхуенг	Nan
สส	таємно	Nan
สวิตเซอร์แลนด์	швейцарія	None
สวัสดีปีใหม่	щасливого нового року	Nan
สวัสดิ์	сават	Nan
สวรรคโลก	саванхалок	Nan
สวรรคตหรือ	помер	None
สวรรคต	помер	None
สวี	люкс	Nan
ลา	ля	Nan
เก็กโค	checco	Nan
เขตจอมทอง	район чом тонг	Nan
โชอิจิ	шоїчі	Nan
โชแปง	шопен	Nan
โซน	зона	None
โซนยอชิแด	покоління дівчат	Nan
โซนี่	sony	Nan
โซล	сеул	Nan
โซลดิ๊ก	солдик	Nan
โซลโซไซตี้	суспільство душі	Nan
โซเดียม	натрію	Nan
โซเฟีย	софія	None
โดจินชิ	чи джінчі	Nan
โดย	від	None
โดยคำว่า	до слова	Nan
โดยตรง	безпосередньо	None
โดยทรงพระกรุณาโปรดเกล้าฯ	милосердно наданий його величністю	Nan
โดยที่	де	None
โดยบ่งบอกถึงปริมาณและคุณภาพของสิ่งตีพิมพ์อิเล็กทรอนิกส์ของสถาบัน	зазначаючи кількість та якість електронних видань інституту	Nan
โดเมกิ	домоме	Nan
โดราเอมอนฉบับภาพยนตร์	doraemon movie edition	Nan
โดยในวันที่	по на	Nan
โดยใช้ทางหลวงแผ่นดินหมายเลข	по національному шосе	Nan
โดยใช้ชื่อว่า	по імені	Nan
โดยเจ้าฟ้าธรรมธิเบศรไชยเชษฐสุริยวงศ์	принц таматибіт сорнчай четчуріявонг	Nan
โชว์	показати	None
โดยสรุป	підводячи підсумок	Nan
โดยมีพระภิกษุสงฆ์นำเวียนเทียน	з ченцем, що веде процесію, запалену свічку	Nan
