สถาบันเทคโนโลยีนานาชาติสิรินธร	sirindhorn international institute of technology	0.013599111496146241
พระบาทสมเด็จพระพุทธยอดฟ้าจุฬาโลก	king rama 1 of chakri monarchy (bangkok)	0.013616342820244176
กานซู	honshu in china	0.013666419218959903
ปัจจุบันประเทศไทยมีภาพยนตร์ที่มุ่งสู่ตลาดโลก	currently thailand has international movies	0.013723174735956101
เครื่องราชอิสริยาภรณ์อันเป็นโบราณมงคลนพรัตนราชวราภรณ์	the ancient and auspicious order of the nine gems	0.013776626168642623
บราเธอร์ส	brothers	0.013803355282525675
พรรคชาติไทย	thai nation party	0.01384231077420044
เริ่มก่อสร้าง	began constuction	0.013851857366412054
ที่เกิดขึ้น	appear	0.013852242503075193
จันทรุปราคา	lunar eclipse	0.013880900242218804
พระราชวังดุสิต	dusit palace	0.013904862392950709
เฉลิมชัย	chalermchai	0.01392209510585139
สยามพารากอน	siam paragon	0.013944486134988906
อำเภอพิปูน	phipun district	0.013959989673880728
ในคริสต์ศตวรรษที่	in the #___ century	0.013962282035560287
นายแพทย์	male doctor	0.013975259274359641
โรงเรียนสาธิตแห่งมหาวิทยาลัยเกษตรศาสตร์	kasetsart university laboratory school	0.013978390620540482
เวโรนา	verona	0.01403683646342401
วิเศษแก้ว	visetkeaw - surname of a singer	0.01404675142258821
มีสูตรการคำนวณหาจำนวนฟัน	dental formula	0.01405167528704366
เจ้าฟ้ามหาวชิรุณหิศ	crown prince maha vajirunhis	0.014065205902486074
และคำว่า	and the word "......."	0.014068809588880111
หุตะสิงห์	hutasingha	0.014072452991428903
มหาวิทยาลัยอีสาน	issan univbersity	0.014116669361510186
เมืองสุรินทร์	surin city	0.014127974507558308
ไนโตรเจน	nitrogen	0.014129042362175425
สึนะโยชิ	tsunayoshi	0.014145331798404213
ปีพุทธศักราช	buddhism year	0.0141539012473937
ธรรมศักดิ์	tamasak - surname of an elected prime minister	0.014160391729502906
ปาย	pai	0.014161236202525731
อุทยานแห่งชาติภูพาน	phu phan national park	0.014186197308905328
เอเชียเหนือ	north asia	0.014193538543462957
รศ	ratanakosin era	0.014257945427219327
ประวัติศาสตร์ไทย	thai history	0.014265572418026918
สีม่วง	purple	0.014270907842114046
สายสีม่วง	purple line	0.01433946298292531
ยามาโตะ	yamato - a japanese name	0.014404977906420539
ร้อยตรี	second lieutenant	0.014423547561261043
น้ำพอง	nam pong in kon kan province	0.014438247474982178
ขุขันธิน	kukuntin	0.014470205514621888
หญ้าฝรั่น	saffron	0.01461940674755029
ปากน้ำ	samutpragan province in thailand	0.01465041584993241
ละครวิทยุ	soap opera broadcasted on the radio	0.014660706199876658
อเล็กซานเดอร์	alexander	0.014691164335591827
อุทยานแห่งชาติภูเวียง	phu wiang national park	0.014694406488212627
เร้กเก้	reggae	0.014715926057601955
แห่งบันนัม	of bannam	0.014723929670355984
นายชวน	mr. chuan	0.014732585803176768
นักสู้อันดับ	fighter rank	0.014752460710164148
แคลคูลัสเชิงอนุพันธ์	differential calculus	0.01478215256721396
หนองฮี	nong hi - a location in thailand	0.014822638280895707
เมืองปราจีนบุรี	prachinburi	0.014870644169874537
ธนบุรี	thonburi	0.01490632399835787
ในปีที่	in the year	0.014907988041718964
โสณกุล	sonakul	0.01492380937524555
สหวงษ์	sawong - a male's name	0.015023252223426833
วิทยาลัยพยาบาลกองทัพเรือ	royal thai navy college of nursing	0.01502563845174104
นิรมิต	niramit	0.015052459380308473
ลักษณะสำคัญ	main characteristics	0.01507694818501523
กระบวนการสร้างและสลาย	metabolism	0.015082964989552024
หลักสูตรวิทยาศาสตรมหาบัณฑิต	degree requirements for a bachelor degree in science	0.015124275151662925
โดยสรุป	in summary.	0.015143369935784155
ศุกลวัฒน์	sukolawat (a person's name)	0.015150332349511866
พระราชวังเดิม	phra racha wang derm	0.015208245544897948
เงินทุน	fund	0.01522828820482757
ชิลี	chile	0.015248070443295418
พระปกเกล้าเจ้าอยู่หัว	king rama vii	0.015295389443308563
และอื่น	etc.	0.015296382211623627
โรงเรียนปรินส์รอยแยลส์วิทยาลัย	the prince royal's college	0.015326425686349912
หาง	tail	0.015399183346077394
หัวโขน	khon mask	0.015426415081767925
อำเภอยางชุมน้อย	choom noi province	0.01543404128787847
จูล	joule	0.015436483700242459
มหาวิทยาลัยวงษ์ชวลิตกุล	vongchavalitkul university	0.015456783750173727
ภาพถ่าย	photograph	0.01558724133919056
สัทศาสตร์	phonetics	0.015594120496437026
จังหวัดฉะเชิงเทรา	chachoengsao province	0.01564453879831505
มือ	hand	0.015760198597225685
ประเทศสเปน	spain	0.015798823854111542
อาร์คิมิดีส	archimedes	0.015801015833521677
โรตารี	rotary	0.01585225687061841
หมวดหมู่รายการโทรทัศน์ไทย	the group of thai television channels	0.0159149896753366
จังหวัดเชียงใหม่	chiang mai province	0.0159488818920077
เจ้าฟ้ามหิดลอดุลเดช	prince mahidol adulyadej	0.01596336479465998
ที่อยู่อาศัย	residence	0.015979872465784074
อำเภอพระประแดง	pra-pradaeng district	0.0160134465671872
เทศบาลนครนครราชสีมา	nakhon ratchasima	0.016039664870242984
คงยิ่ง	kongying	0.01615254111031446
หมวดหมู่เพศศึกษา	sex education category	0.016169871440189245
ของสิ่งมีชีวิต	living things	0.016180610533950424
จเชียงใหม่	chiang mai	0.01618277763976352
อรรถพร	uttapon - a female's name	0.01619950496320761
วิทยาลัยนวัตกรรมและการจัดการ	the college specialized in arts	0.01620875958950191
สาขานครสวรรค์	nakhon sawan branch	0.01625353340384847
สมเด็จพระเจ้ากรุงธนบุรี	the king of the thonburi kingdom	0.016253947046027072
งู	snake	0.01632286396648211
เป็นหัวหน้าพรรค	party leader	0.016391517121782374
สาธารณรัฐประชาชนจีน	people's republic of china	0.01640468492838991
แม่น้ำชี	chi river	0.01641685552028359
ดิวิชั่น	division	0.016422403546334417
ดัตช์	dutch	0.0164351149131246
ฟ้าหลัว	haze	0.01653203116333571
วิทยาลัยการจัดการเพื่อการพัฒนา	management for development college	0.016597390509608352
ประติมากรรมไทย	thai sculpture	0.016604091050502933
กำกับโดยอภิชาติพงศ์	produced by apichartpong - a famous thai movie producer	0.01672523199026728
อุทยานแห่งชาติดอยอินทนนท์	national park doi inthanon in northern thailand	0.01674530421184823
นักปรัชญา	philosophist	0.01685680402516324
และสังคม	and society	0.016859697447447516
หรือ	or	0.01691891206480784
โหม่ง	mong - a thai musical instrument	0.017025467118590966
แก้วบัวสาย	kaeobuasai	0.017029954392774757
จริยา	lady	0.017041604880594054
อำเภอหนองกี่	nong kee district	0.017087822229309074
ตัวสะกด	final consonant	0.017118718550362615
และจังหวัดใกล้เคียง	and nearby state	0.017141118789545454
การแข่งขัน	competition	0.01717616693898384
ทรัมเป็ต	trumpet	0.017203298487657864
ในการประเมินผลงานวิจัยของสถาบัน	in research evaluating of institute	0.01720679529093844
ภูกระดึง	phu kradueng	0.017209739538397346
สราวุธ	sarawut	0.01724061360732073
อำเภอท่าวุ้ง	tha wung district	0.01725707966258149
เจ้าฟ้ากรมพระยานริศรานุวัดติวงศ์	refer to a title of a royal family member - jao fa krom pra ya rissanuwattiwong	0.017416500734439917
เมือง	city	0.017490520490555116
ชื่อเดิม	former name	0.017496164211507365
เชียงของ	chiang khong	0.017550240799494757
สาขานครราชสีมา	nakhon ratchasima branch	0.017601412283195006
รณชัย	ronnachai	0.01778384417771123
มหาวิทยาลัยปทุมธานี	pathumthani university	0.017870377562273308
เป๊ปซี่	pepsi	0.01789404534178569
หัวหิน	hua hin	0.017894767784996917
อินุยาฉะ	inuyacha - a japanese cartoon	0.0179054423652571
อสามชุก	sam chuk district	0.017926328409476923
ฟิลิปปินส์	philippines	0.017944122535021256
สมัยก่อนประวัติศาสตร์	prehistory	0.017946403664734822
เถรวาท	buddha's teaching	0.01799965747919235
งานโมเสก	mosaic	0.018009935731842185
จากโซล	from soeul	0.018016201983984025
ใต้	south	0.018073095342457365
ละครชาตรี	lakorn-chatri	0.018098361808418312
จากเว็บไซต์กระทรวงการต่างประเทศ	from the website of foreign department	0.018129698450952178
กรมขุนอิศเรศรังสรรค์	the convention of angels	0.0181524000342379
มีขนาดใหญ่	large	0.01817722482781815
ฮิซานะ	hisana	0.01822618772784784
รัฐประหาร	coup d'état	0.018261504231939275
โรงเรียนพระตำหนักสวนกุหลาบ	the school in the king's compound.  it is reserved for the princess and the royal family	0.018269223646490258
อำเภอแจ้ห่ม	chae hom district	0.01827395616076427
ขา	leg	0.01830309588201058
เจ้าฟ้ามหิดลอดุลยเดช	prince mahidol adulyadej	0.018317057521219867
กุหลาบ	rose	0.018350513306116315
ชาญชัย	chanchai	0.018354079532533252
จากเว็บ	from the web	0.01838146622951651
ค่าความต้านทานตัวที่	resistance value of the	0.018420445765304515
เมื่อปีพุทธศักราช	in b.e.	0.018488305001096505
เปียงยาง	pyongyang	0.018495635178806195
ได้เคลื่อนไหวตรวจสอบการทำงานของรัฐบาลกัมพูชาอย่างแข็งขัน	underground investigation	0.018498705351647698
การปฏิรูปศาสนา	religious reformation	0.018564244845081904
พงษ์ไพบูลย์	pongphatboon	0.01869674289561086
มหาวิทยาลัยเกษตรศาสตร์	kasetsart university	0.018698113096038207
พบหลักฐานของมนุษย์ซึ่งมีอายุเก่าแก่ที่สุดถึงห้าแสนปี	found an evidence of the the oldest human that lived in that area	0.01870730709157224
ท้องสนามหลวง	sanamloung - a landmark in thailand	0.018712592388965738
บทสวดสรภัญญะที่ขึ้นต้นด้วยธรรมมะคือ	a buddhist prayer	0.018749295163657583
ของสุนทรภู่	belong to soon thong pu (a thai legend)	0.01878971030526241
ป่าชายเลน	mangrove forest	0.018843676063925886
สงครามมหาเอเชียบูรพา	world war two	0.01884955413635324
อำเภอโนนสุวรรณ	none su wan province	0.01891556597735157
มหาวิทยาลัยขอนแก่น	khon kaen university	0.018966668723776618
พรรคการเมืองใหม่	kan mai meung political party	0.01896771444602754
ในปี	in the year	0.019027932844929405
มหาวิทยาลัยเปิด	open university	0.019030577103505694
โคเคน	cocain	0.0191055964285641
หมู่เกาะเคย์แมน	cayman island	0.019139481673111552
เมื่อเดือนมีนาคม	in march	0.019172931204626854
ปราบดาภิเษก	prapdapisek	0.019190465302171222
จังหวัดหนองบัวลำภู	nong bua lamphu province	0.01919213004239771
บริเวณรอบทะเลสาบเขมร	area around the lake in cambodia	0.019194970562447823
ปฏิภาณ	male's name patipan	0.019321851595782463
รถไฟฟ้ามหานคร	metropolitan rapid transit	0.019326613348138726
อะลูมิเนียม	aluminum	0.019331255318419956
ดิสนีย์	disney	0.019375310282897133
สินค้าอุปโภคบริโภค	consumer goods	0.019403235457350104
เหรียญ	coin	0.01943087808882277
ฉ	ninth thai alphabet	0.0194372670873264
ก่อนที่จะตกเป็นของฝรั่งเศสในเวลาต่อมา	belonging to france, under the control of france	0.019502809486880796
ดอก	flower	0.019545340836054505
บังคลาเทศ	bangladesh	0.019577982276703553
ศิษย์เก่าคณะมนุษยศาสตร์	former humanity student	0.01961432073018449
ประชากรศาสตร์	literature subject	0.019632932054536627
ใหญ่	big	0.019677048033231073
หมวดหมู่ปรัชญา	category:philosophy	0.019759740014734406
สำหรับประเทศไทย	for thailand	0.0197991471024099
ศูนย์การบินทหารบก	marine forces	0.01981679738631148
ชิงร้อย	ching roi	0.019877653011097843
สถาบันวิจัยและพัฒนา	reseach and development institution	0.019904065358006297
หลุมดำจิ๋ว	small black hole	0.019936462127152894
ชมชื่น	chomchuen	0.01994076834683802
น้ำค้าง	dew	0.020006571112524782
เราเตอร์	router	0.020012229003638794
มีด	knife	0.020026509579340573
อ่อนเพลีย	fatigue	0.020058585312337028
มอสส์	moss	0.020145870317785534
วันมหาสงกรานต์	songkran day	0.020162815470168415
แม่จริม	mae charim	0.02017453063253549
เบ็นเท็น	ben 10	0.020193559209125723
ด้านการเกษตร	agriculture	0.020199636251855484
ชาคริต	charkrit	0.020234646296005705
ภาพตรา	coat of arms	0.020240353940850477
สมัยกรุงธนบุรี	thonburi era	0.020245145339048295
ดรทรงศักดิ์	doctor songsuk - a famous person	0.02032935989342386
ตระกูลยามานากะ	yamanaka clan	0.02035863641826428
กฎ	rule	0.020423458622418685
สุนทรเวช	surname "sundaravej"	0.020431999650750033
เบอร์ลิน	berlin	0.02043328501709469
ปีที่วางจำหน่าย	the year that the product was on the market	0.020455190260935938
คม	sharp	0.02046849102107052
ช่องเชิงเทิน	machicolation	0.020483806768220245
หินอ่อน	marble	0.020543572222538824
แมกนีเซียม	magnesium	0.020545088552877257
ความรัก	love	0.020571324541066065
เส้นทแยงมุม	diagonal	0.020590025387452873
มาเลเซีย	malaysia	0.02059149801781814
โพรทิสต์	protist	0.0206256333732224
ไอพอด	ipod	0.02064598593561506
ไทยทีวีสีช่อง	thai tv	0.02064820345486432
เอ็กโปรพลาซ่า	expo plaza in thailand	0.02065575051590772
บรรพชีวินวิทยา	paleontology	0.02066215199297675
ไทยานนท์	taiyanon - a thai surname	0.02066242456943679
ราชสีมา	ratchasima	0.020953216874695684
อิหร่าน	iran	0.02103154779595531
อำเภอสองแคว	song khwae district	0.021034950249271028
นครราชสีมา	nakhon ratchasima	0.02106554645831121
วัดพระยืนพุทธบาทยุคล	the standing buddha temple of puttabatyukol	0.021155875814310207
อลาสก้า	alaska	0.021182106010885927
วรรณสุทธิ์	wannasut - surname of an actress	0.02126952842433164
มัธยฐาน	median	0.021276369957219432
พนมไพร	phanom phrai	0.02134571094834607
ธงชาติ	national flag	0.02141073566954572
๒๔๕๐	2450	0.021437848364254105
ดาวพุธ	mercury	0.021454653604190573
ลิฟวิ่งมอลล์	living mall	0.021457873297258782
หลักสูตรปกติ	normal program	0.021491696827785425
จระเข้และแอลลิเกเตอร์	crocodile and alligator	0.021506826116822867
โปเกมอน	pokemon	0.021519395572893323
จังหวัด	province	0.021571271080804654
เพชรา	petchara - name of a famous actress	0.021608356272839486
จนครปฐม	nakhon pathom	0.02169056110059626
อำเภอท่าตูม	ta toom district	0.021691794852401105
บลีช	bleach	0.021702214806013975
ในช่วงแรก	in the first part, primarily	0.021712932039016457
เพชร	diamond	0.02175605861780764
การเต้นรำ	dance	0.021765569098744435
เข็มศิลปวิทยา	khem sinlapawitthaya	0.02180122663825226
องอาจ	ongart	0.021813779114686852
ประวัติศาสตร์สเปน	history of spain	0.021862090420862578
พุทธศักราช	buddhist era	0.021971712843730888
นายดำรง	mr dumrong - a male's name	0.022003920077470287
วิศว	engineering	0.022011032244572713
อวัยวะสืบพันธุ์หญิง	female reproductive system	0.022095881455545946
เทศบาลเมืองสกลนคร	municipality of sakonnakon	0.02215705538879753
เมืองลำพูน	lumpoon province	0.022266238418115696
หมวดหมู่การฉลองปีใหม่	the group in charge of new year celebration	0.022295577733001247
วัดพระลอย	wat phra loi	0.02230046512644627
เป็นพ่อของ	is the father of	0.022305860880503875
จุลจอมเกล้าเจ้าอยู่หัว	phra chunla chom klao chao yu hua	0.022371097320940444
หมากรุกสากล	chess	0.022448523602511365
อำเภอดอยสะเก็ด	doi saket district	0.022461087675831482
สาขาวิชาวิศวกรรมคอมพิวเตอร์	computer engineering	0.022467977404663095
สภาผู้แทนนิสิต	college student representatives	0.022570812793239487
ร้านอาหาร	restaurants	0.022576517422802735
วงศ์ปลาเสือตอ	datnioididae	0.022603963282316675
สาธารณรัฐโดมินิกัน	dominican republic	0.0226497358415882
ตัวหาร	divisor	0.022652011803212795
พลังงานคลื่น	wave power	0.022701378092666608
นก	bird	0.022768835123428387
คาโรลัส	carolus linnaeus	0.022774547589152948
อำเภออมก๋อย	om koi district in chiang mai, thailand	0.022778477059465823
ฝิ่น	opium	0.022798211609970285
แทยอน	taeyeon	0.02282380163603614
อำเภอรัตนบุรี	rhatanaburi district	0.022879067543714614
รัตนบุรี	rattanaburi	0.02293873554119451
พระชนม์	the father of the king	0.022951694730311317
ดิค	dick - the name	0.02304878629298717
เธอจะอยู่กับฉันตลอดไป	you will be with me forever	0.023063349541802197
สุทธิชัย	suttichai - a male's first name	0.023096695566246564
และกัมพูชา	and cambodia	0.023127865521305618
ซบที่อกฉัน	cry in my arms	0.023145239535168817
ไกลกังวล	klai kangwon	0.02315605918902506
ระบบรัฐสภา	rajya sabha system of governing	0.02323252334691213
ดิน	soil	0.023271633674244275
อินโดนีเซีย	indonesia	0.023328281481540786
ประเทศแคนาดา	canada	0.023328617306615604
คำพ้องรูป	hemonym	0.023330015746921378
ไฮเดรนเยีย	hydrangea	0.02336991688832654
รัฐวิสาหกิจ	financial situation of the country	0.023398260318570053
หมวดหมู่ละครโทรทัศน์ไทย	thai drama category	0.023444768174554112
บางปะกอก	bang prakok - an area in bangkok	0.02346434469424444
การต่างประเทศ	foreign affairs	0.023524581911814647
ชื่อเล่น	nickname	0.02358900656279157
ภาพพาโนรามา	panoramic image	0.02361826822464889
วิทยาเขตพิษณุโลก	pissanulok college	0.02363940719113785
ในภาษาสันสกฤต	in sanskrit language	0.02372530797334755
แอร์ไลน์	airlines	0.023737808094848503
ฤดูฝน	rainy season	0.023768897914877577
พิสุทธิ์	pisut - a male's name	0.02377913483739668
ซ่าหริ่ม	a type of thai dessert	0.023786373998271628
พระพุทธชินราช	phra buddha chinnarat	0.02379000925745536
ยุคก่อนประวัติศาสตร์	prehistory	0.023802027112873016
การขับถ่าย	excretion	0.02382802637714614
ยาปฏิชีวนะ	antibiotic	0.023830146825317724
ท่าน้ำนนท์	nam non pier	0.02384680433005013
ทองผาภูมิ	thong pha phum	0.02397165026093687
ขึ้นไป	next one up	0.023977715055255932
โมบิลสูทกันดั้ม	mobile suit gundam	0.023981003162959626
เช่นกัน	as well	0.0239858837190621
คณะปฏิรูปการปกครองแผ่นดิน	national administrative reform council	0.024037896776389036
ตระกูลเซนจู	chen ju dynasty	0.02405955555859289
วัสดุฟิสไซล์	fissile material	0.024082039139216766
อำเภอศรีณรงค์	si narong district	0.0240888264897409
หมวดหมู่	category	0.024140072090756026
เป็นปลาตู้สวยงาม	is an ornamental fish	0.02414165882987373
ภาพรวม	group of pictures	0.024258582522167317
นิกาย	sect	0.02429966191391643
ศาสนาฮินดู	hinduism	0.02430850559988544
เรือยกพลขึ้นบก	boat for advance the army	0.02432524958826215
หอก	spear	0.024337471468328983
ที่มี	possess	0.024414257225397
สูงจากระดับน้ำทะเลปานกลาง	above average sea level	0.024481467098144135
มีนวิทยา	ichthyology	0.024521167059751492
อรัญประเทศ	arranyapratet - a location in thailand	0.02460790303379653
ปภัสรา	papatsara	0.024641181179435173
ในเดือนมิถุนายน	in june	0.024708708290559392
บนบก	on land	0.024711945933021187
วิคตอเรีย	victoria	0.024726633840131847
ซึ่งมีทั้งหมด	in total of	0.02476677324929357
บทนมัสการนอบน้อมบูชาพระพุทธเจ้า	a prayer to the lord buddha	0.024871459140960703
ทหารอากาศ	air force	0.02488104193937011
จนกระทั่งเมื่อปี	until the year	0.024956404135274442
โปรแกรมคอมพิวเตอร์	computer program	0.0250819488716017
ข้อมูลปี	information from the year ________	0.025083137004320296
อะซูไรต์	azurite	0.025123084448803158
นิฮง	nippon or nikon, a japanese reading language	0.02526448151131585
อุทยานประวัติศาสตร์พิมาย	phimai historical park	0.02526477599966164
ทานากะ	tanage - a japanese name	0.025284257031076344
ลิเทียม	lithium	0.025285908072108607
กริม	grim	0.025301034508138726
บางแสน	bang saen	0.025314210176053314
รอบเมือง	around town	0.02531912450670301
นิวเคลียร์	nuclear	0.025394062095904207
โรงเรียนการบิน	flight school	0.025476634259167352
