+	+	Nan
ห้วยขวาง	хуай кванг	Nan
ห้วยทับทัน	хуай тхап, ніж	Nan
ห้องน้ำ	туалет	Nan
ห้องสมุด	бібліотека	None
ห้าง	магазин	Nan
ห้างฉัตร	повісити чат	Nan
ห้างหุ้นส่วนจำกัด	обмежене партнерство	Nan
ฬาพานิช	комерційний	Nan
อก	груди	Nan
อคิลลีส	ахілл	Nan
องคชาต	геніталії	Nan
องคต	організація	None
องค์กรปกครองส่วนท้องถิ่น	організація місцевого самоврядування	Nan
องค์การนิสิต	студентська організація	Nan
องค์การมหาชน	громадська організація	Nan
องค์การสหประชาชาติ	об&#39;єднані нації	Nan
องค์บาก	онг бак	Nan
อนึ่ง	до речі	Nan
อนาลโย	аналой	Nan
อนันตรัย	анантай	Nan
อนันตยะ	анантая	Nan
อธิบายว่า	поясніть це	Nan
อธิการบดีมหาวิทยาลัยธรรมศาสตร์	президент університету таммасат	Nan
ห่วงใย	турботливий	Nan
อธิการบดี	канцлер	Nan
อดีตรองนายกรัฐมนตรี	колишній віце-прем&#39;єр-міністр	Nan
อดีตผู้บัญชาการทหารบก	колишній військовий командир	Nan
อดีต	колишній	None
อดิศักดิ์	адісак	Nan
องอาจ	доблесний	Nan
องค์ประกันหงสา	страхування hongsa	Nan
อดีตรองหัวหน้าหน่วยที่	колишній заступник керівника підрозділу	Nan
อนุทิน	щоденник	None
หเตุการณ์	ситуація	None
หุ่น	ляльковий	Nan
หลักสูตรวิทยาศาสตรมหาบัณฑิต	програма магістра наук	Nan
หลังจาก	після	None
หลังสงคราม	після війни	Nan
หลังสงครามโลกครั้งที่	після світової війни	Nan
หลังสงครามโลกครั้งที่สอง	після другої світової війни	Nan
หลังเหตุการณ์	після події	Nan
หลาย	багато	None
หลีกภัย	втеча	Nan
หลุมดำจิ๋ว	крихітна чорна діра	Nan
หล่มสัก	лом сак	Nan
หวาย	ротанга	Nan
หอก	спис	Nan
หอประชุมพ่อขุนรามคำแหงมหาราช	король рамкхаменг великий аудиторій	Nan
หอมรดกไทย	зал тайської спадщини	Nan
หอย	молюсків	Nan
หอไอเฟล	ейфелева вежа	Nan
หัก	відрахувати	Nan
หุตะสิงห์	хута співай	Nan
หี	кицька	Nan
หินไซอัล	сланцевий камінь	Nan
หินแกรนิต	граніт	None
หินเชิร์ต	кам’яна сорочка	Nan
หินอ่อน	мармур	Nan
หุ่นยนต์	робот	Nan
หินปูน	вапняк	Nan
หาดทรายแก้ว	пляж sai kaew	Nan
หาง	хвіст	Nan
หัวใจ	серце	None
หัวโขน	маска	Nan
หัวหิน	хуа хін	Nan
หัว	голова	Nan
หาบเร่	яструб	Nan
หลักสูตรภาษาไทย	курс тайської мови	Nan
อนุสรณ์สถาน	меморіал	None
อปักธงชัย	пак тонгчай	Nan
ออกมาในอะนิเมะเท่านั้น	виходить тільки в аніме	Nan
ออกอากาศ	мовлення	None
ออกอากาศครั้งที่	ефір на	Nan
ออกอากาศทางช่อง	трансляція на	Nan
ออกัสตัส	август	None
ออกเป็น	в	None
ออกแบบตัวละคร	дизайн персонажів	Nan
ออนไลน์	інтернет	None
ออฟ	вимкнено	Nan
ออลแบนี	союзники	Nan
ออสเตรเลีย	австралія	None
ออโตทรอพ	автомат	Nan
อะ	що	None
อะซูไรต์	азурит	Nan
อะตอม	атом	None
อะนิเมะ	аніме	None
อะบุราเมะ	абураме	Nan
อัธฮา	атха	Nan
อัตราการว่างงาน	рівень безробіття	Nan
อัฒภาค	крапка з комою	Nan
อัญมณี	дорогоцінний камінь	Nan
อังการา	анкара	None
อังกฤษสมัยแองโกล-นอร์มัน	англо-нормандська англійська	Nan
ออกฉายครั้งแรกเมื่อวันที่	перший показ екрана	Nan
อักษรเกาหลี	корейський алфавіт	Nan
อักษร	лист	None
อะโลน	поодинці	Nan
อะโกนิสต์	агоніст	Nan
อะลูมิเนียม	алюміній	Nan
อะมาเดอุส	амадей	Nan
อะพาไทต์	апатит	None
อักษรย่อ	скорочення	None
อนุสรา	анусара	Nan
ออ	або	None
อสมท	mcot	Nan
อพอลโล่	аполлон	Nan
อพิมาย	афімей	Nan
อภัยนุราช	пробач	Nan
อภินันท์	афінан	Nan
อภิปรัชญา	метафізика	Nan
อภิรักษ์	афірак	Nan
อมฤต	мертві	Nan
อมาตยกุล	аматаякун	Nan
อยู่	є	None
อยู่วิทยา	фізіологія	Nan
อยู่ห่างออกไปจากชายฝั่ง	далеко від узбережжя	Nan
อยู่แล้ว	вже	None
อยู่ในเขตอำเภอกุฉินารายณ์	розташований у районі кучінараї	Nan
อย่างต่อเนื่อง	постійно	None
อย่างแพร่หลาย	широко	None
อย่างไรก็ตาม	проте	None
อร	орн	Nan
อศรีประจันต์	асрі прачан	Nan
อวัยวะเพศ	геніталії	Nan
อวัยวะสืบพันธุ์หญิง	жіночі статеві органи	Nan
อวัยวะสืบพันธุ์สตรีด้านนอก	жіночі статеві органи зовні	Nan
อวอร์ดส	нагороди	None
อลิซ	аліса	Nan
อสามชุก	сам чук	Nan
อลาสก้า	аляска	Nan
อรุณี	аруні	Nan
อริยสัจ	благородна правда	Nan
อรัญประเทศ	араніяпратет	Nan
อรรถพร	афафон	Nan
อรรถกถา	коментар	Nan
อรทัย	молода дівчина	Nan
อลังการ	орнаментація	Nan
อันดับ	рейтинг	None
หลักสูตรภาษาอังกฤษ	курс англійської мови	Nan
หลักสูตรนานาชาติ	міжнародний курс	Nan
หน้าอก	груди	Nan
หมวด	групи	None
หมวดหมู่	категорія	None
หมวดหมู่กลุ่มดนตรีที่ก่อตั้งในปี	категорія музичної групи, заснована в	Nan
หมวดหมู่กลุ่มดนตรีสัญชาติเกาหลี	категорія корейської музичної групи	Nan
หมวดหมู่กวีชาวไทย	категорія тайського поета	Nan
หมวดหมู่การฉลองปีใหม่	новорічна категорія святкування	Nan
หมวดหมู่การประท้วงในประเทศไทย	категорія протесту в таїланді	Nan
หมวดหมู่การ์ตูนญี่ปุ่นแนวโชเน็น	категорія: японський мультфільм, стиль шонен	Nan
หมวดหมู่จุลชีววิทยา	категорія мікробіологія	Nan
หมวดหมู่ชาวไทยที่นับถือศาสนาพุทธ	категорія тайських буддистів	Nan
หมวดหมู่ชาวไทยที่เกิดในต่างประเทศ	категорія тайців, народжених за кордоном	Nan
หมวดหมู่ดาวเคราะห์ชั้นใน	категорія внутрішньої планети	Nan
หมวดหมู่ดาวเคราะห์หิน	категорія планета камінь	Nan
หมวดหมู่ทหารอากาศชาวไทย	категорія ввс тайланду	Nan
หมวดหมู่ทหารเรือชาวไทย	категорія військово-морського флоту тайланду	Nan
หมวดหมู่นักการเมืองไทย	категорія тайських політиків	Nan
หมวดหมู่ประวัติศาสตร์ไทย	категорія історії тайської мови	Nan
หมวดหมู่บุคคลที่เกี่ยวข้องกับเหตุการณ์	категорія людей, пов’язаних із подією	Nan
หมวดหมู่บุคคลจากโรงเรียนมงฟอร์ตวิทยาลัย	категорія осіб з montfort college	Nan
หมวดหมู่บุคคลจากโรงเรียนนายร้อยพระจุลจอมเกล้า	категорії від королівської військової академії чулахомклао	Nan
หมวดหมู่บุคคลจากสถาบันบัณฑิตพัฒนศิลป์	категорія людей з інституту бундітпатанасільпи	Nan
หมวดหมู่บุคคลจากมหาวิทยาลัยอ๊อกซฟอร์ด	індивідуальна категорія з оксфордського університету	Nan
หน่วยพันธุกรรม	генетична одиниця	Nan
หมวดหมู่บุคคลจากมหาวิทยาลัยสุโขทัยธรรมาธิราช	категорії від сухотайського відкритого університету ім	Nan
หมวดหมู่บุคคลจากจุฬาลงกรณ์มหาวิทยาลัย	категорії від університету чулалонгкорн	Nan
หมวดหมู่บอยแบนด์	категорія хлопчика	Nan
หมวดหมู่บริษัทที่ก่อตั้งในปี	компанія, заснована в	Nan
หมวดหมู่บริษัทของไทย	категорія тайської компанії	Nan
หมวดหมู่นายกรัฐมนตรีไทย	категорія прем&#39;єр-міністра тайланду	Nan
หมวดหมู่นักร้องไทย	категорія тайської співачки	Nan
หมวดหมู่บุคคลจากมหาวิทยาลัยธรรมศาสตร์	категорія від університету thammasat	Nan
หมวดหมู่ประเภทของภาพยนตร์	категорія категорії фільмів	Nan
หน่วยประมวลผลกลาง	центральний процесор	Nan
หน่วยที่	одиниця	None
ส่วนหัว	заголовок	Nan
ส่วนในฤดูฝนน้ำจะท่วมทุกปี	у сезон дощів вода щорічно буде розливатися.	Nan
ส่วนใหญ่	більшість	None
ส่วนใหญ่เป็นโรงสีข้าว	більшість із них - рисові млини.	Nan
ส่องแสง	блиск	Nan
ส้ม	помаранчевий	Nan
ส้มเช้ง	помаранчевий апельсин	Nan
ส้มโอ	грейпфрут	Nan
หงษ์ทอง	хонг тонг	Nan
หงษ์มานพ	гонг маноп	Nan
หงสกุล	гонко сакул	Nan
หญ้าทะเล	морська трава	Nan
หญ้าฝรั่น	шафран	Nan
หนองคาย	nong khai	Nan
หนองม่วง	нонг муанг	Nan
หนองหาน	нонг хань	Nan
หนองฮี	nong hee	Nan
หน่วยทหารในค่าย	військова частина в таборі	Nan
หน่วยคำเติม	морфема	Nan
หน่วยความจำ	пам&#39;ять	Nan
หนุ่ม	молодий	None
หนุมาน	хануман	Nan
หนึ่งธิดา	одна дочка	Nan
หน่วยบัญชาการนาวิกโยธิน	морський штаб	Nan
หนึ่ง	один	None
หนังสือลามก	порнографічні книги	Nan
หนังสือการ์ตูน	книга коміксів	Nan
หนังสือ	книга	None
หนัก	важкий	None
หนอน	глист	Nan
หนองแซง	занг	Nan
หนังใหญ่	великий фільм	Nan
หลักสูตรปกติ	нормальний хід	Nan
หมวดหมู่ปรัชญา	категорія філософії	Nan
หมวดหมู่พระราชปทินัดดาในรัชกาลที่	категорія королівський правління під час правління	Nan
หมอชิต	морхіт	Nan
หมากรุกสากล	міжнародні шахи	Nan
หมายความว่า	засоби	None
หมู่	свинячий	Nan
หมู่ที่	село	None
หมู่เกาะเคย์แมน	кайманові острови	Nan
หมู่เกาะแบลีแอริก	балеарські острови	Nan
หมู่เกาะโซโลมอน	соломонові острови	Nan
หม่อมราชวงศ์ปรีดิยาธร	р. прідіяторн	Nan
หม่อมหลวงปิ่น	мама пін	Nan
หม่อมเจ้าจุฑาวัชร	принц джутаватчай	Nan
หม่อมเจ้าวัชรวีร์	принц ватчараве	Nan
หม่อมเจ้าวัชรเรศร	мама ватчарахорн	Nan
หม้อข้าวหม้อแกงลิง	непентес	Nan
หยุ่น	гнучка	Nan
หรั่ง	ланг	Nan
หรือ	або	None
หลักสูตรที่เปิดสอน	курс	None
หลักสูตรการจัดการดุษฏีบัณฑิต	доктор філософських програм з менеджменту	Nan
หลักสี่	лаксі	Nan
หลักทรัพย์	цінні папери	Nan
หลักจริยธรรม	етика	None
หลอดเลือดแดงใหญ่เอออร์ตา	аорта	None
หมวดหมู่โรงเรียนบุรุษในประเทศไทย	чоловіча шкільна категорія в таїланді	Nan
หลอดอาหาร	стравохід	Nan
หลวง	королівський	None
หรือเรียกว่า	або зателефонували	Nan
หรือที่เรียกกันว่า	також відомий як	Nan
หรือที่รู้จักกันในชื่อ	або відомий як	Nan
หรือชื่อทางการคือ	або офіційна назва	Nan
หรือการแสดงธงชาติ	або показ національного прапора	Nan
หลอก	псевдо	Nan
หมวดหมู่พระราชนัดดาในรัชกาลที่	категорія королівський онук правління	Nan
หมวดหมู่โรงเรียนที่มีอัตราการแข่งขันสูง	категорія шкіл з високим рівнем конкуренції	Nan
หมวดหมู่แนวพระราชดำริ	категорія ініціативи	Nan
หมวดหมู่พระราชปนัดดาในรัชกาลที่	категорія король панадда в царювання	Nan
หมวดหมู่พิธีกรไทย	категорія тайських ведучих	Nan
หมวดหมู่ฟุตบอลในประเทศไทย	футбольна категорія в таїланді	Nan
หมวดหมู่ภัยธรรมชาติ	категорія стихійного лиха	Nan
หมวดหมู่ภัยพิบัติทางการแพทย์	категорія медичних катастроф	Nan
หมวดหมู่มหาวิทยาลัยธรรมศาสตร์	категорія університету thammasat	Nan
หมวดหมู่รัชกาลที่	категорія правління	Nan
หมวดหมู่รัฐคอมมิวนิสต์	комуністична державна категорія	Nan
หมวดหมู่รัฐมนตรีว่าการกระทรวงการต่างประเทศไทย	категорія міністра закордонних справ таїланду	Nan
หมวดหมู่รัฐวิสาหกิจไทย	категорія тайські підприємства	Nan
หมวดหมู่รัฐสิ้นสภาพในทวีปเอเชีย	категорія держава припинилася в азії	Nan
หมวดหมู่รัฐและดินแดนที่ก่อตั้งในปี	встановлені категорії держави та території	Nan
หมวดหมู่รายการโทรทัศน์ไทย	категорія програми тайського телебачення	Nan
หมวดหมู่ละครโทรทัศน์ไทย	категорія тайська телевізійна драма	Nan
หมวดหมู่วัฒนธรรมไทย	категорія тайської культури	Nan
หมวดหมู่วันสำคัญทางศาสนาที่นับโดยปฏิทินจันทรคติ	категорії важливих релігійних днів, що рахуються за місячним календарем	Nan
หมวดหมู่ศิลปินสังกัดจีเอ็มเอ็ม	категорія виконавців під gmm	Nan
หมวดหมู่เพศศึกษา	категорія сексуального виховання	Nan
หมวดหมู่เครื่องเทศ	категорія спецій	Nan
หมวดหมู่อวัยวะเพศ	генітальна категорія	Nan
หมวดหมู่อวัยวะ	категорія органів	Nan
หมวดหมู่อดีตอาณานิคมของอังกฤษ	британська колишня колоніальна категорія	Nan
หมวดหมู่อดีตอาณานิคมของสเปน	колишня іспанська колоніальна категорія	Nan
หมวดหมู่โรค	категорія хвороб	Nan
หมวดหมู่อดีตอาณานิคมของฝรั่งเศส	французька колишня колоніальна категорія	Nan
หมวดหมู่สิ้นสุดในคริสต์ศตวรรษที่	категорія закінчилася в 19 столітті.	Nan
หมวดหมู่สิ่งก่อสร้างในพุทธศตวรรษที่	категорія будівель у 21 столітті	Nan
หมวดหมู่สัตว์เลื้อยคลาน	категорія рептилій	Nan
หมวดหมู่สัตว์มีแกนสันหลัง	категорія хребетна вісь	Nan
หมวดหมู่สมุนไพร	категорія трав	Nan
หมวดหมู่สถาบันอุดมศึกษาในกรุงเทพมหานคร	категорії вищих навчальних закладів бангкока	Nan
หมวดหมู่สโมสรในพรีเมียร์ลีก	клубна категорія у прем&#39;єр-лізі	Nan
อันประกอบด้วย	складається з	Nan
อันโตนิโอ	антоніо	Nan
อันโตนีโอ	антоніо	Nan
อุณหเคมี	термохімія	Nan
อุดม	родючі	Nan
อุดรธานี	удон тані	Nan
อุตตมะโยธิน	уфарат йотин	Nan
อุตรดิตถ์	уттарадіт	Nan
อุทยาน	парк	None
อุทยานประวัติศาสตร์พนมรุ้ง	історичний парк фаном рунг	Nan
อุทยานประวัติศาสตร์พิมาย	історичний парк фімай	Nan
อุทยานแห่งชาติคลองตรอน	національний парк хлонг трон	Nan
อุทยานแห่งชาติดอยภูคา	національний парк дой фу	Nan
อุทยานแห่งชาติดอยอินทนนท์	національний парк дої іттанон	Nan
อุทยานแห่งชาติทุ่งแสลงหลวง	національний парк тун салаєнг луанг	Nan
อุทยานแห่งชาติธารโบกขรณี	ніж національний парк бок хорані	Nan
อุทยานแห่งชาติน้ำตกสี่ขีด	національний парк водоспаду сі хіт	Nan
อุทยานแห่งชาติน้ำพอง	національний парк нам фонга	Nan
อุทยานแห่งชาติภูผาเหล็ก	національний парк iron mountain	Nan
อุทยานแห่งชาติภูพาน	національний парк фу фун	Nan
อุภัยราศี	пробачте зодіаку	Nan
อุปนิสัย	характер	None
อุปกรณ์คอมพิวเตอร์	комп&#39;ютерні аксесуари	Nan
อุปกรณ์	обладнання	None
อุบล	убон	Nan
อุทุมพรพิสัย	uthumphon phisai	Nan
อุณหภูมิ	температура	None
อุทยานแห่งชาติไทรทอง	національний парк сай тонг	Nan
อุทยานแห่งชาติหาดนพรัตน์ธาราหมู่เกาะพีพี	національний парк пляжу нопфарат тара, острови фі-фі-фі	Nan
อุทยานแห่งชาติภูแลนคา	національний парк пхуланка	Nan
อุทยานแห่งชาติภูเวียง	національний парк phu wiang	Nan
อุทยานแห่งชาติภูเรือ	національний парк phu ruea	Nan
อุทยานแห่งชาติภูสอยดาว	національний парк phu soi dao	Nan
อุทยานแห่งชาติภูสวนทราย	національний парк фу суан сай	Nan
อุทยานแห่งชาติเขาหลวง	національний парк хао луанг	Nan
อุรุกวัย	уругвай	Nan
อุซึมากิ	узумакі	Nan
อื่น	інший	None
อำเภอแม่แจ่ม	район мае мем	Nan
อำเภอแม่แตง	район мае таенг	Nan
อำเภอโนนดินแดง	нон дін даенг	Nan
อำเภอโนนสุวรรณ	район нон-суван	Nan
อิงค์	inc.	Nan
อิงลิช	англійська	None
อิทธิพล	вплив	None
