ฮายาโตะ	hayada - a japanese surname	0.1313281625297969
กันอริ	gan-ari	0.13133868844782984
วิโนทัย	winothai	0.13138279700528369
ยุคศตวรรษที่	century	0.1314002775342187
ชุมแพ	choompa - location in thailand	0.13170278602014893
ทำบุญตักบาตรฯ	put food offerings into a buddhist monk's bowl	0.13197944875620993
เกตุทัต	kettut - a surname	0.13202391881079503
ศรียาภัย	siyaphai	0.13210365567522875
รฟม	public transit	0.1321754671364776
ฤดูกาล	season	0.13219530690104786
ทว่า	however	0.13224608174336505
หมวดหมู่ภัยธรรมชาติ	catagory: natural disasters	0.1322888073190344
๙	nine	0.13234800128253052
อิริโทรมัยซิน	erythromycin	0.13250129097571198
คอนเสิร์ตประสานเสียงสามสถาบัน	chulalongkorn kasetsart thammasat choral concert	0.13252152570991685
ส่องแสง	shining light	0.1326518512460634
หมวดหมู่พระราชนัดดาในรัชกาลที่	catagory: royal heirs during the "blank" reign	0.1326726852369648
งานเทางามสัมพันธ์	public party	0.13287774959168577
อานุภาพ	power	0.1329210684366626
พี่สาวของ	the sister of ____________	0.13305469381265933
ภาษาบาลี	balese language	0.13310203867898038
ในสหรัฐอเมริกา	in united states of america	0.13311927507268567
เขตจอมทอง	jomthong area	0.133382079635109
ความพอประมาณ	estimate	0.133464213595293
มานี	mani	0.13383872785481948
ต่อมาในรัชกาลที่	afterwards, in the reign of	0.13385322148848505
มีความหมายว่า	meaning	0.13385360535848578
นาทาล	exactly: "natal;"  proper name: natarle	0.13426359938698643
ครูพิเศษจอมป่วน	kru pisat jom poun  - name of a story	0.13451841732377745
เข้าชิงไนน์เอ็นเตอร์เทนอวอร์ดส	compete in entertaining world	0.13453085107375992
ความสัมพันธ์ระหว่างจีนกับอเมริกา	relationship with china and the usa	0.13490329124582726
เวลาประมาณ	approximate time	0.13498777546337112
แก๊สธรรมชาติ	natural gas	0.13506919438444628
ชัยชนะ	chaichana	0.1353179998176407
มาจยาร์	magyar	0.13552029423278192
สุรวุฒิ	surawut	0.1355703641242597
ลามิวูดีน	lamivudine	0.1359192856863767
ตะวันออกเฉียงเหนือ	east	0.1359282975132969
โมโคนะ	mokona - a japanese word	0.13594323886144763
เมืองโคราช	muang korat	0.1359874268581746
๑๔	14	0.13635679221002342
ธนาคารเกษตร	farmer's bank	0.13649162362348471
วิทยาการคอมพิวเตอร์	computer science	0.13654413333318963
เบื่ออาหาร	not appetite, eating disorder.	0.13705715017723905
นิกเกิล	nickel	0.13705872500718477
ราชวงศ์อู่ทอง	utong empire in ancient thailand	0.13711714411893006
ด้วย	with	0.13722469747530766
วิลเลจ	village	0.1375547035855309
นาวาอากาศเอกหญิง	woman airforce captain	0.13770989662670113
องค์กรปกครองส่วนท้องถิ่น	local administration	0.13772549728523328
คณะวิศวกรรมศาสตร์	engineering department	0.13773220751811832
มธ	tu	0.1378457528569419
หรือเรียกว่า	called	0.13790116595839425
มิตรชัย	mitchai	0.13812510325925903
สัตว์มีแกนสันหลัง	chordata	0.13819260077858406
นักวิทยาศาสตร์	scientist	0.13830057137612886
โดยที่	by	0.1386804529094978
เจ้าจอม	king's concubine	0.13886336285409445
เวิร์ม	worm	0.13919271619821855
ซึง	feeling touched (by the music or movie)	0.13931261207649343
เครื่องแต่งกาย	clothes	0.13952385547463247
สืบต่อมา	live on	0.13965252858106536
อำเภอลาดหลุมแก้ว	lat lum kaeo district	0.13979248368951466
เขตวังทองหลาง	wang thonglang district	0.14005586701020126
ได้เป็น	is	0.1401708462786698
ศัพท์	terminology	0.14046638877046183
เทคนิคอิลลูชั่น	technique illusion	0.14078419836210335
ปจ	two letters acronym	0.14085593224566548
เสียง	sound	0.14107647545263954
มีอุณหภูมิเฉลี่ย	average temperature	0.1411891484188157
อำเภอคูเมือง	khu mueang district	0.1413056100476698
ไม่ใช่	no	0.14133998890267316
แคลิฟอร์เนีย	california	0.1415192826229669
อำเภอบ้านหมี่	ban mi district	0.14165434877572083
การคมนาคม	transportation department	0.14171049597802624
ฮันกึล	hangeul	0.14176039253189393
สนามกีฬากลาง	main athletic field	0.1417943262708598
ไรงะ	reiya - a character from a japanese story	0.14184927413344875
เฟนิรามีน	pheniramine	0.1419696257565456
หมวดหมู่รัฐวิสาหกิจไทย	category:government-owned companies of thailand	0.1419697787235266
ออกอากาศครั้งที่	aired on	0.14212727423956498
กลูคากอน	glucagon	0.14219854243096522
เชอร์รี่	cherry	0.14243496593050234
ภาคตะวันออกเฉียงเหนือ	northeast region	0.14256220002461664
บารัก	barack	0.142655155196151
หมวดหมู่เครื่องเทศ	herbs	0.14266541070170582
ไท	tai	0.14291698140187523
คอ	neck	0.14296883247628323
พลเอกสนธิ	general sonthi	0.14299054208831222
โดยในวันที่	on the date of ___	0.14314434326450953
พอตเตอร์	potter	0.1431563598353694
เมืองเคมบริดจ์	city of cambridge	0.1434146018449492
เพลงลูกทุ่งขับร้อง	luk thung song	0.14351417706121283
อย่างแพร่หลาย	many, various	0.14356865896016627
ลีกคัพ	league cup	0.14358848173111288
โรงละคร	theater	0.14394346576699893
อำเภอสารภี	sarape district	0.14422282837927286
เนื้อที่ประมาณ	approximate area	0.14452939084863692
กระทรวงกลาโหม	defense ministry	0.144864894215312
ภาควิชาฟิสิกส์	physics	0.14505203424935756
ประธานศาลฎีกา	president of the supreme court	0.14506174031962735
คณะที่	the current administration	0.14512959522705607
เครือข่าย	network	0.14516776741882909
นักเขียนการ์ตูน	cartoonist	0.14517917823440848
สถิติศาสตร์	statistic	0.14520093701429035
บี้	flatten	0.14526959339596524
หัว	head	0.14529580488442312
ไข้สูง	high fever	0.14543760405422937
เพลงเปิด	opening song	0.1455956744025365
ทรงยี่สิบหน้า	icosahedron	0.14595059336401686
แสงสิงแก้ว	sangsingkaew	0.14598559610964706
วันเสาร์	saturday	0.14610755968051728
กระดูกต้นแขน	humerus	0.14610929954940122
รูสเวลต์	roosevelt	0.14615525739809498
เซอร์วิส	service	0.14617458638932063
วิเศษ	magic	0.1463892797716824
จึงใช้ธาตุหมอกและเมฆาได้	using magic with cloud and spells	0.14643667403885033
ฮารุกะ	haruka - a japanese name	0.1465007592527665
ให้เสียงพากย์	dubbed	0.1465645443020807
สถาบัน	office, department	0.14676555228832097
เหล่านี้	these	0.14683377950382911
หมวดหมู่ชาวไทยที่เกิดในต่างประเทศ	thais that were born outside thailand	0.146924034267892
สถาบันการศึกษา	educational institution	0.14696503722483992
ด้านการกีฬา	sports	0.14712958101998191
พระนคร	capital	0.14722703328895467
เพดานอ่อน	gill	0.14731393362221343
เพชรเกษม	petchakasem area in bangkok	0.14746184356248504
มิลจิ	mulji	0.14755922289031803
วันละ	per day	0.1478478749568133
นอกจากนี้แล้ว	besides	0.14822377723594857
เฮติ	haiti	0.14826755262866023
บุช	(george) bush	0.1483185826243598
สกุลหยาดน้ำค้าง	d. etrythrorhiza - a type of plant	0.14857511744665577
หาบเร่	street vending	0.14890087300553198
มนุษย์	man	0.14896702201390216
ฟ้า	blue	0.14904536898032167
อริยสัจ	teaching of buddha	0.1491005487830484
งานอดิเรก	hobby	0.14910654771408552
ดี	good	0.149122683582803
เอ็ดเวิร์ด	edward	0.14927028332838121
โน	no	0.1495988663301878
ทุก	every	0.14973619543176173
วัดสองพี่น้อง	two siblings temple	0.1499925604981891
ที่มีชื่อว่า	named	0.15024943720873307
ยัง	to	0.15032077230377322
ในการเลือกตั้ง	election	0.15047860836644278
คำศัพท์	vocabulary	0.1505085499041306
เซลล์	cell	0.150952894718699
ชะอำ	cha-am (name of thai district)	0.15100364679253211
ทรงห้าหน้า	polyhedron	0.15100630725996025
ซีซี	cc	0.15104701112294952
สายเมืองทอง	muang thong line	0.1510656397890323
อมาตยกุล	amattayakun	0.15116007364092207
คันธวงศ์	kunntavong - a surname	0.15118511421604874
ความงาม	beauty	0.15141340428867547
วันศุกร์	friday	0.1516286312442839
คลินิก	clinic	0.15188971883915517
กันฟอร์ม	gun form	0.15216646554939195
แอล	l	0.15224004680922995
กลุ่มดาวนกทูแคน	tucana	0.15235565357683672
ศาสนาโซโรอัสเตอร์	zoroastrianism	0.15235841859961555
เดือนมิถุนายน	june	0.15243602799445838
หมวดหมู่พิธีกรไทย	host for thai shows	0.15263311392905748
เครื่องปั้นดินเผาและเซรามิค	pottery and ceramic	0.15273590308208046
จอร์เจีย	georgia	0.1530105566755659
วทบ	bachelor of science	0.15303453636744305
กทม	bangkok	0.1530818335323925
แคลิฟอร์เนียม	california	0.15317539577748807
ตลาดโลตัส	lotus market	0.15337718094877217
ซึ่งเกิดจากปัจจัยภายนอก	which is caused by external factors	0.15337742710303773
อำเภอเมืองเชียงใหม่	mung chiang mai district	0.15342336564409514
กาย	body	0.15342989320068193
ศูนย์การศึกษาแม่ฮ่องสอน	maehongsorn learning center	0.1536698777891674
คาบ	period	0.15411031257849817
หนังสือลามก	pornographic magazines	0.15431012033227193
ศรเพชร	sonpet	0.15443769992214348
เลขที่	number	0.1546052140898037
สีขาว	white	0.15473468252971476
แล้วเดินเวียนรอบปูชนียสถาน	walk with lighted candles in hand around a temple	0.1548935506152397
ยิ้มสู้	smile	0.15493939971104143
อุบล	ubol - a place in thailand	0.15525575975547662
ดาวอาร์คตุรุส	arcturus	0.15530582468995593
พระเกียรติยศ	honor	0.15535633652550626
วันอาสาฬหบูชา	asalha puja	0.155432169719518
องค์การมหาชน	public organization	0.1558047439282168
โครงการก่อสร้าง	construction project	0.15595845057556496
บริสุทธิ์	pure	0.1561440282806992
เพิ่มมา	more	0.1561741365450339
นายสุชาติ	mr. suchat	0.15628203723861947
ไปบรรจบแม่น้ำเจ้าพระยา	runs to chao phraya river	0.1563378086889465
แกมเบีย	cambia	0.1565060890043063
เทศบาลนครเชียงใหม่	chiang mai municipality	0.15662017590956645
คิง	king	0.15687772441977849
กองพันทหารช่างที่	troop unit number ___________`	0.15702165352095082
นักแสดงรับเชิญ	guest star	0.1570662726552544
คอนสตรัคชั่น	construction	0.15729092859435223
คณะมนุษย์ศาสตร์และสังคมศาสตร์	humanity department	0.1573134386269249
ปาริชาต	tiger’s claw	0.15749761145314553
สมเด็จพระเจ้าลูกเธอ	the king's daughter, the princess	0.15759276580084405
เอซ	letter h	0.1580180878809242
และเปียโน	and piano	0.15804299710817316
เขตภาษีเจริญ	phasi charoen district	0.15825480725576524
ระยะ	phase	0.15831178600945503
บรมนาถชาติอาชาวศรัย	something has to do with the king - too obscure	0.1583476967256118
อำเภอทับคล้อ	amphoe tap khlo	0.15842085598284766
แบทเทิลบรอลเลอร์	battle brawlers	0.1588953535072983
แยกจากคลองบางกอกน้อยฝั่งซ้าย	forks from the left branch of khlong bangkok noi	0.15923507386051258
กระนั้น	however	0.1592524528355172
โอภาส	oh pas - a thai name	0.15925967922737275
เขตมีนบุรี	min buri district	0.16017695828673928
กลาง	in the middle	0.16055857499151976
ซม	cm.	0.1608044328832365
พรนารายณ์	phonnarai	0.16090175981158386
ในทางตรงกันข้าม	on the contrary	0.1610197281887846
งดส่งเข้าประกวด	enroll in the contest	0.16114479280256375
มหาวิทยาลัยราชภัฏบ้านสมเด็จเจ้าพระยา	bansomdejchaopraya rajabhat university	0.1612810742147249
ชื่อยศภาษาไทย	thai title	0.16130689455447353
แดนสุพรรณ	dansuphan	0.16154978261859335
ยุคสามก๊ก	three kingdoms - the legend	0.16159568157052023
ชนะ	winning	0.1616183754828035
หลักทรัพย์	property	0.16183627016209925
วิสา	wisa	0.1618416038483771
เมื่อประมาณ	estimate	0.16198275457011418
ตัวละครจากเรื่อง	soap opera based on a written story	0.162051336568651
ประติมากรรม	production of a play	0.16210994939087728
ฮินาตะ	hinada - a japanese story	0.16212887690528618
ราชสกุล	royal family members	0.16225879060014656
๔๘	48	0.16228699078836661
สธ	two letters from thai alphabets	0.1622939142637208
และได้ปรากฏตัวตอนภาค	appeared	0.16230892545503
หมวดหมู่รัฐคอมมิวนิสต์	communist countries	0.16237692668575487
ตรงกับวันขึ้น	on the date of	0.16247351354987732
วัลลิโภดม	wanliphodom	0.1628512338913264
เยอรมนี	germany	0.1630449164150953
ฟูลส์	fools	0.1631326291212803
วิทยาลัยครูสวนสุนันทา	soun sunanta teachers college	0.16346208947726384
เอ็กโทเดิร์ม	ectoderm, top level of skin layer.	0.16370402023996516
ความยาวช่วงคลื่น	wave length	0.16396036784256512
ปืนใหญ่กลางกระสุนวิถีโค้ง	cannon	0.16420256134841263
อศรีประจันต์	master sri prajan - a priest's name	0.1642621459600642
แย้มนาม	yamnam - a surname	0.16455308437031288
การรักษาพยาบาล	nursing care	0.16462465268732437
แกรมมี่	grammy	0.16473181270309648
ในกรณีนี้	in this case	0.1647389085322903
พงษ์พานิช	phongphanit	0.16485197527947018
แผนที่	map	0.16492167441638664
ว้าวุ่น	wawun	0.1651296282655667
หมวดหมู่สัตว์มีแกนสันหลัง	category:chordates	0.1652439579274296
อำเภอบางละมุง	bang lamung district	0.16551333306537272
สมเด็จพระเจ้าภคินีเธอ	the king's sister, som dej pra jao pakini ther	0.1656882788911713
คำนวณ	calculate	0.16574226381548954
สุริยัน	suriyan - a male actor	0.16589523369684317
ขวัญใจช่างภาพ	miss photogenic	0.1660574993977335
จันทร์ภักดี	juntapukdee - surname of a famous actor	0.16639347618595846
สะดวก	convenient	0.16640964533989816
มิถุนายน	june	0.16648124194821626
ราบเป็นหน้ากลอง	flattened like a drum (meaning to be defeated)	0.16719334523230736
เลโอนาร์โด	leonardo	0.1674450572715396
ประจำปี	annual	0.16779868073109824
อัธฮา	athha	0.16784734551027242
โรงเรียนเขมะสิริอนุสสรณ์	kamasirianussorn school	0.16790628832803814
นายกรัฐมนตรีไทย	thai prime minister	0.1679796145175647
ศาสตราจารย์	professor	0.16811846179314052
ขณะที่	while	0.1683212473190842
เจ้าฟ้าอุบลรัตนราชกัญญา	princess ubon ratana graz's' contract.	0.16844461622710666
นายณรงค์	mr. narong - a male's name	0.16844894452717288
กระบี่กระบอง	krabi krabong (swordplay)	0.1684952489101539
ฉลองพระชนมายุ	celebrated birth anniversary of	0.16849906866330888
เคยสู้กับโกคุเทระ	fought with gokudera	0.16852682043385128
สิ่ง	thing	0.16873688960154917
จิตรกร	painter	0.16883657152555187
ฮอยเกนส์	huygens	0.16892534512877216
เป็นต้น	etc.	0.1689822176146879
เดิมเรียกว่า	formerly known as	0.1689822176146879
เรือสำรวจ	survey vessel	0.16971599986390604
กรมศิลปากร	fine arts department	0.1698578676061779
ออกัสตัส	augustus	0.17019632608222585
สนามชัยเขต	sanamchaikate - a location in thailand	0.17026076780011787
ข้าวเจ้า	white rice	0.17040166541594653
สรรพสินค้า	department store	0.17048785690886187
ส่วนหัว	top part	0.17049798163300697
เมื่อวันจันทร์	on monday	0.17089040086389343
สำนักหอสมุดกลาง	the central library	0.17092406618926534
เชียงปุม	chiang poom - area in thailand	0.17092879841120168
ตำบลยะวึก	tambon yawuek	0.17102385186905572
เข้ารอบ	made it to the next round, selected from the initial round	0.17112349054065187
ภูธเนศ	putanet - a male's name	0.17116320852800584
สาขาวิชาวิศวกรรมอาหาร	food engineering	0.17120641513933677
ไม้ไม่ผลัดใบ	plants that have leaves all year round	0.1714383992865775
ในช่วงปี	in the year of ________	0.17151770254685625
มัลเจร่า	wonderweiss margera - a cartoon character	0.17182213975923102
เป็นอดีตหัวหน้าหน่วยที่	is the former leader of the unit	0.1719274943633769
แฮ็ค	hack	0.17206456600416084
วัดหนองเพียร	wat nong pien - a temple in thailand	0.17247610928084428
ฝ่าแดนเขาวงกต	in the boundaries of kao wonkut	0.17287257783432336
มิเกล	miguel	0.1730482673031716
ในรัฐบาล	in the government	0.17314561368857062
ของโลก	of the world	0.1732023575887679
หุ่นยนต์	robot	0.1732303654209137
ผู้พิทักษ์แห่งพิรุณ	rain defender	0.17326062867729783
เลิฟ	love	0.1732758543259071
พยาธิกำเนิด	pathogenesis	0.17349019421657494
มหาชน	public	0.1737391424475646
รายชื่อภาพยนตร์ไทย	a list of thai movies	0.1739113336267731
เรื่อง	story	0.17409850018365206
ประกาศิต	command	0.17426391727055393
ซัลฟานิลาไมด์	sulfanilamide	0.17427520881277245
ตรานี้	this seal	0.1742994016110904
ฮอฟมัน	hoofman - a name	0.17458765866117182
ยุทธนาวี	naval battle	0.1746285999670285
โมฮัมหมัด	mohamad	0.17479485248278703
๑๕	15	0.1748919848102908
เปียโตร	pietro	0.17490808765352303
ความถี่	frequency	0.1749454988364759
อากาศ	air, weather	0.1750342675708057
เม่น	porcupine	0.1750817156808092
ดินเซนฮอฟเฟอร์	dientzenhofer - as in christoph or leonhard or johannes	0.17530275591356914
สุทัศน์	sutas	0.17546283459397413
เอ็นเทอร์เทนเมนท์	entertainment	0.17577437656033504
แคน	kan - a type of thai music	0.17588205308739394
คั่ว	roast	0.175945534970132
สาขาประจวบคีรีขันธ์	prachuap khiri khan branch	0.17602620329586696
เขตวัฒนา	watana district	0.1761119712884231
ทรัพย์วิจิตร	wealth	0.17612439635557578
ปุ๋ย	pui	0.1763249156462491
เหรียญรัตนาภรณ์	a special thai medallion	0.17657197057161889
ตระกูล	clan	0.1766053737105371
ไลฟ์สไตน์	life style	0.17697098321938887
แนวความคิดที่	idea number...	0.1772865043527163
กับนางสุจาริณี	with mrs. sujarinee	0.17793559119954985
เดือนอ้าย	first lunar month	0.17799393863578894
ศาสนา	religion	0.17807265617399706
สุขภาพ	health	0.1781750398791131
เซโรนอส	zeronos	0.17833898542758586
บอยซ์	boys	0.17835677444495157
ชาติ	nation	0.17837184753244836
วิตามินอี	vitamin e	0.1785037476494565
อานันทมหิดล	ahnanmahidol - someone with the king's surname	0.17851945960774304
ก่อนที่	before	0.17853661907665727
ลำลูกกา	lumlookka - a location in thailand	0.17856498961244263
หมวดหมู่ประเภทของภาพยนตร์	types of film	0.1786807822762362
ซุปเปอร์มาร์เก็ต	supermarket	0.178709594265443
เช้ามืดวันที่	in dawn of	0.17871365782235907
จิตใจ	mind	0.17898596646997575
พื้นที่มหาวิทยาลัย	university area	0.1790762658789714
ฟังพระธรรมเทศนา	listen to the gospel	0.1793230551893282
แทนเจนต์	tangent	0.1795134770682785
อิโนะ	ino	0.1797498400364379
ทิฟฟานี่	tiffany - female's name	0.17981975354649068
หลังจาก	after	0.18027118951005697
ชื่ออัลบั้ม	album name	0.18036587699517348
แองกวิลลา	anguilla	0.18038393868094513
สุเทพ	suthep - first name of a famous singer	0.18068848911977675
ไกรลาศ	krailard	0.180810043602281
หมวดหมู่ดาวเคราะห์ชั้นใน	group of stars inside	0.1808688585117591
ต้นสกุล	clan	0.18100535535739892
ประเด็นที่	point number	0.18108251910870124
อภัยนุราช	aphainurat	0.18118055056608928
งามวงศ์วาน	ngamwongwan	0.1819041061040056
๒๕๕๐	2550	0.18210055725781593
โฆษิตพิพัฒน์	the surname kopitpipat	0.18222581049188516
เกียรติศักดิ์	reputation.  kietisak can be a male's name	0.18290218266360203
เฮียวงะ	heonga	0.18312386503328676
รอบ	surrounding	0.18315119543726413
เดียวกัน	same	0.18333535022058
ฉี่	qi	0.18340314962824464
ไซน์	sine	0.18367310024579878
นาที	minute	0.1837044072887823
ด้านหน้า	front	0.18389594011518917
เริ่มการผลิตนำเข้า	importing	0.18435867367199563
หลักสูตรที่เปิดสอน	curriculum	0.1843834205035844
มลายู	malay	0.18450468022944694
รถโดยสารประจำทางสาย	bus	0.1849838424268074
พรรคสังคมประชาธิปไตย	social democratic party	0.18514493558739212
วอลท์	walt	0.1851608530333403
อินฟราเรด	infared	0.1852054701219229
โครงการเรียนภาษาอังกฤษแบบเข้ม	intensive english program	0.18539616682341717
และที่สำคัญคือ	and important thing is...	0.18547090174880462
วิศวกร	engineer	0.18555527986374862
ธีม	theme	0.18556080404771252
โทบรามัยซิน	tobramycin	0.18558619240364432
ดาราหญิงไทยยอดนิยม	famous actress	0.18565571283048957
สไตรค์	strike	0.18581159345278433
กิ่งแก้ว	kingkaew	0.18584138433809125
สำนักงานขนส่งกรุงเทพมหานครพื้นที่	thai general transport	0.18597906831433603
