ดาวเสาร์	saturn	0.0
ขั้นที่	etapa	0.0
หม่อมเจ้าวัชรเรศร	mama	0.0
แท็กซี่	taxi	2.563948383452231e-15
หมายความว่า	mijloace	1.2586417220164825e-06
อำเภอแม่แตง	districtul	1.3006944992481662e-06
โรม	roma	1.708056403577976e-06
อิทธิพล	influență	3.3560921736538864e-06
พรรคสม	de	4.059374287466439e-06
สาขานิเทศศาสตร์	artele	6.527128979895235e-06
ภูมิภาค	regiune	7.622748955208663e-06
สถาบันโภชนาการ	de	8.481383829717759e-06
ยุทธนาวี	marinei	8.929089049049925e-06
วะสี	fost	1.6315241478452616e-05
อำเภอเมืองพิจิตร	districtul	2.1530420984305246e-05
ทนายความ	avocat	2.4106226798069585e-05
ผู้เล่นชุด	jucător	2.4898619101720943e-05
ปรากฏการณ์โลกร้อน	globală	2.541067191075373e-05
อำเภอท่าตูม	districtul	2.6970065915969102e-05
ภายใต้ความช่วยเหลือจากกองทุนการเงินระหว่างประเทศ	internațional	2.7663530897791816e-05
ของ	de	2.9281519602739866e-05
หมวดหมู่พระราชปทินัดดาในรัชกาลที่	domnie	2.9681410719208358e-05
รายชื่ออธิการบดี	lista	3.40486624882015e-05
ยุวธิดา	fiică	3.957141668671503e-05
คีตกวี	compozitor	4.267963384165186e-05
พยายามชี้ให้สาธารณชนและนานาชาติ	și	5.567997801148603e-05
โรงเรียนการบิน	zbor	5.849530242673706e-05
ประธานศาลฎีกา	președintele	6.614418096403287e-05
ภูเขาน้ำแข็ง	aisberg	7.484623575964664e-05
อำเภอฝาง	districtul	8.918578403338998e-05
โรงเรียนพระตำหนักสวนกุหลาบ	școala	9.135456169332516e-05
ในประเทศญี่ปุ่น	japonia	9.223084305535205e-05
อำเภอพัฒนานิคม	districtul	9.486961416553485e-05
ดอกไม้ประจำจังหวัด	floare	9.646401960742353e-05
ตา	ochi	0.00010007323246224691
น้ำ	apă	0.00010267060157336942
รักษาสิ่งแวดล้อม	mediul	0.00010523418975095505
เรด	roșu	0.00013764214485661127
ทดลอง	proces	0.00013987719247891362
เอสโตเนีย	estonia	0.00014577649230141602
สัมมา	dreapta	0.00014857369505254144
จึงใช้ธาตุหมอกและเมฆาได้	și	0.00014942068894344747
รูปสี่เหลี่ยมด้านขนาน	paralelogram	0.00015105106926845217
แต่ใน	în	0.0001608529931109131
ภาควิชาเทคโนโลยีอาหาร	alimentară	0.00016250425085073743
งานเขียน	scrieri	0.0001692200986966188
สงคราม	război	0.00017113225797342653
หม่อมเจ้าวัชรวีร์	prințul	0.00017732134829359268
อำเภอพระประแดง	districtul	0.00018080078268916378
การพัฒนา	dezvoltarea	0.0001864507368384997
ความรัก	dragoste	0.00019633994293484776
ราชวงศ์พระร่วง	dinastia	0.0002306100856625825
ปรัชญาตะวันตก	occidentală	0.00023235444338250044
ฮอท	fierbinte	0.00023567657493904923
อำเภอพลับพลาชัย	districtul	0.0002496616483435292
แม่	mamă	0.0002529954711054079
แม่น้ำชี	râul	0.0002546134717021361
รวมทั้งประเทศที่ให้ความช่วยเหลืออื่นๆ	asistență	0.0002906319178476565
หลังจาก	după	0.00029730914253060927
แอร์ไลน์	aeriene	0.0003026469107566607
โรงเรียนศึกษานารี	învățământ	0.00031407138387570804
ทหารหน่วยอาเฟลันดราที่	trupul	0.0003157110836395382
หมวดหมู่กลุ่มดนตรีที่ก่อตั้งในปี	în	0.0003509591072487674
เมืองใหญ่	mare	0.00035363855605329925
แหวน	inel	0.00036418089259819054
เนื่องจาก	cand	0.0004149974018999469
สเปน	spania	0.00046369561870561563
ไปรษณีย์กาฬสินธุ์	poștal	0.0004747661421626956
วีรบุรุษ	erou	0.00048505782772795513
มหาวิทยาลัย	universitate	0.0004974725118840555
ในช่วงสงครามเย็น	rece	0.0005285311649531672
พบหลักฐานของมนุษย์ซึ่งมีอายุเก่าแก่ที่สุดถึงห้าแสนปี	de	0.0005322924347960805
คณะสาธารณสุขศาสตร์	publică	0.0005382486300702922
วงศ์กำแหง	familie	0.0005508735590720261
อำเภอลำปลายมาศ	districtul	0.0005526787688569252
โรงเรียนบดินทรเดชา	școala	0.0005562413598720567
สมัยอาณานิคมฝรั่งเศส	franceză	0.0005581874102831834
อัฟกานิสถาน	afganistan	0.0005636404102784232
โรงเรียนเขมะสิริอนุสสรณ์	școala	0.0005932980037232752
เมื่อประมาณ	cand	0.0006855295505062247
เอเอฟซีแชมเปียนส์ลีก	campionilor	0.0007137936042810627
โรงเรียนเจ้าพระยาวิทยาคม	școala	0.0007353102308236461
อำเภอกันทรลักษ์	districtul	0.0007715838349323388
ภูเขา	munte	0.0007997697163382014
เฮาส์	casă	0.0008244188783606399
อำเภอสหัสขันธ์	districtul	0.0009017369705074907
ซึ่งแท้จริงแล้ว	întradevăr	0.0009088445990885812
ฮิตเลอร์	hitler	0.0009455205896766134
เพลงประจำจังหวัด	cântec	0.0009874664291840988
หมวดหมู่อดีตอาณานิคมของฝรั่งเศส	franceză	0.0010452781834011553
ลิปปี	de	0.001065158593992472
โซเดียม	sodiu	0.001075129621706671
ชมพู	roz	0.0011611771456076384
อำเภอสารภี	districtul	0.0011725304630765627
วิศวกรรมเครื่องกล	mecanică	0.0011853092636054602
พลังงานนิวเคลียร์	energie	0.0012134779012258818
ในดาร์ฟูร์	în	0.0012392396810096571
อำเภอเฉลิมพระเกียรติ	districtul	0.001333627785285118
การสังคายนาครั้งที่	comandă	0.0013556003149551143
หมวดหมู่โรงเรียนที่มีอัตราการแข่งขันสูง	ridicat	0.0013602058719792787
ตะวันออก	est	0.0013933836093994686
มีอยู่	exista	0.0014471267809309364
ตระกูลปาร์ค	de	0.0014599959291536218
โครงการนานาชาติ	internațional	0.0014658295801198973
ดอก	floare	0.0014728508946534758
งานโมเสก	mozaic	0.0015014282116010942
เริ่มก่อสร้าง	construcția	0.0015139618577335253
มจก	m	0.0015326323946836624
แผลศักดิ์สิทธิ์	sfântă	0.0015410464330164264
โดยใช้ทางหลวงแผ่นดินหมายเลข	națională	0.0015423075300209789
โรงเรียนนนทรีวิทยา	școala	0.0015579477471556501
ทางทิศตะวันออก	est	0.0015915263325150162
เมื่อปีพุทธศักราช	budiste	0.0016571426868968076
โรงเรียนนายเรือ	navală	0.0017032127607778647
ตระกูลเซนจู	familia	0.0017704099995251331
นิรุกติศาสตร์	etimologie	0.0017771346445554614
ขบวนรถสินค้า	tren	0.0017771346445554614
อำเภอแจ้ห่ม	cartierul	0.0017988143780730602
สิทธิมนุษยชน	omului	0.0018307603966924047
จอร์เจีย	georgia	0.0019092604471372073
ไม่ทราบข้อมูล	necunoscute	0.0019576955357147032
เหลือสมาชิก	membrii	0.001988768813769666
กระทรวงการต่างประเทศ	externe	0.0020038784018303396
วงเงิน	limită	0.0020212900075775118
ลำดับพระปฐมวงศ์ในพระบรมราชวงศ์จักรี	dinastia	0.0020700374286798336
อำเภอเชียงของ	districtul	0.002109917177391408
ไปรษณีย์สามเสนใน	poștal	0.0021448825298609527
ไนโตรเจน	azot	0.002185254555025003
สมัยที่	cand	0.0022129104234021512
มีฉายาว่า	porecla	0.002245524254647377
ครอบครัว	familie	0.0022527442276338732
กัมพูชาเป็นประเทศที่มีป่าไม้อุดมสมบูรณ์มากที่สุดหากเปรียบเทียบกับประเทศเพื่อนบ้าน	țările	0.0022950288170149255
เอกชน	privat	0.0023268870806057193
เด็กและเยาวชน	tineret	0.0023403159401687605
ปานามา	panama	0.0023469577909185236
หม่อมเจ้าจุฑาวัชร	prințul	0.002382375360810258
อำเภออมก๋อย	districtul	0.002421770600527079
รูปสามเหลี่ยมมุมป้าน	triunghi	0.0024593389307463864
แก้วบัวสาย	de	0.0024874748987344015
อำเภอสิชล	districtul	0.002490461854998434
ปัจจุบันมีที่นั่งอยู่ในสภาผู้แทนราษฎร	reprezentanților	0.002492943822944922
ช็อกโกแลต	ciocolată	0.002499577440941316
สีน้ำเงิน	albastru	0.002555135248387778
พยัญชนะ	consoană	0.0025648724535191755
อรทัย	tânără	0.002570966587697544
กองกำลังกึ่งทหาร	forțele	0.0025724768342076858
อุทยานแห่งชาติน้ำพอง	național	0.0025880914746788187
หอมรดกไทย	patrimoniului	0.002638287516137038
ชนะ	victorie	0.00264777552697117
ท่าอากาศยานเลย	aeroportul	0.0026831676411086243
ก่อตั้ง	fondat	0.002785148607039439
โมซาร์ท	mozart	0.002834131111362603
อำเภอกมลาไสย	districtul	0.002929925098267061
กอล์ฟไมค์	de	0.002930912741745834
กรมอุตุนิยมวิทยา	departamentul	0.002969307077776979
อำเภอจอมทอง	districtul	0.003139990356202037
ประเทศอียิปต์	egipt	0.0032488362264615454
กองทัพแห่งความชอบธรรม	dreptate	0.003260689032509403
อุทยานแห่งชาติภูผาเหล็ก	național	0.0032609935848263954
ชัยชนะ	victorie	0.003323277316916587
มีอุณหภูมิเฉลี่ย	medie	0.0033556642321078936
อายุ	vârstă	0.0034358572214667647
กลุ่มที่	grupul	0.003465072572432953
บทสวดสรภัญญะที่ขึ้นต้นด้วยธรรมมะคือ	sunt	0.003483212052115987
อาณาจักรแพกเจ	regatul	0.0035821216154119763
ทอง	aur	0.003582662398110478
อำเภอปากช่อง	districtul	0.0036255654039950864
การต่างประเทศ	străine	0.003707226903174176
ดวงอาทิตย์	soarele	0.003778607692122686
เพลงปิดเรื่อง	de	0.003862583588249147
ดาวเคราะห์	planetă	0.0038989717272505664
ยุคโบราณ	timpuri	0.003962481104039694
อะลูมิเนียม	aluminiu	0.003996195562960086
เริ่มตั้งแต่อาณาจักรอยุธยาได้โจมตีอาณาจักรเขมร	regatul	0.00403139597051037
สำนักวิทยบริการ	academice	0.004039147598909266
นโยบายทางการทูตของจีน	chinei	0.004043025840049255
ไปรษณีย์โพนพิสัย	poștal	0.004070664674953209
โซน	zona	0.004096729311815603
อำเภอสังขะ	districtul	0.004115584107115961
พระธิดา	fiică	0.004207702363523095
แมวไทย	pisica	0.0042356656105201375
ชมพูทวีป	india	0.004239154884368094
กองบิน	aeriană	0.004240625097948957
ประเทศสวีเดน	suedia	0.0043183871678377506
หมวดหมู่พระราชนัดดาในรัชกาลที่	domniei	0.00436441896259471
อำเภอเวียงชัย	districtul	0.0043727688295989685
อำเภอทับคล้อ	districtul	0.004482577587910015
เสรี	liber	0.004539599868825132
การวิเคราะห์	analiza	0.004552208070568833
ตัวอย่างเช่น	exemplu	0.004659597063582744
โฟลเอ็ม	m	0.004715490752171722
ดิวิชั่น	divizia	0.004845329187291095
น้อยมาก	puțini	0.0049186650197891105
สิงโต	leu	0.004933386124280009
ประเทศฟินแลนด์	finlanda	0.004976642070446183
ตอน	cand	0.005023461094227365
ชื่ออัลบั้ม	albumului	0.0050409087959507855
แคลคูลัสเชิงอนุพันธ์	calcul	0.005120571028355066
คณะบัญชี	contabilitate	0.0052403765526368735
สถาบันศูนย์และหน่วยงานในมหาวิทยาลัย	universități	0.005266731956785049
ข้อมูลปรากฏการณ์โลกร้อน	globale	0.005380142429520727
ลำลูกกาคลอง	canalul	0.005389146567014919
ประเทศเกาหลี	coreea	0.005453378999542801
สัตว์เลื้อยคลานในอันดับนี้	rang	0.005509389310273671
ประเทศและดินแดน	teritorii	0.005586203076812524
แพร่	răspândire	0.005713160145562022
งาน	muncă	0.00575197189784979
ประเทศสเปน	spania	0.00581724085577159
เบอร์ลิน	berlin	0.005996477618584664
โรงพยาบาลอุตรดิตถ์	spitalul	0.00602665308258982
ศึกนันทบุเรง	bătălia	0.006083706774785642
อคิลลีส	ahile	0.006107783782892244
รักแห่งสยาม	de	0.006139023987259479
ขา	picior	0.0061575981537705755
อำเภอขุขันธ์	districtul	0.006287672651059914
สุนัขจิ้งจอก	vulpea	0.006365969388101782
แทลเลียม	taliu	0.006388330346920455
ไปรษณีย์อำนาจเจริญ	poștal	0.006617090068696417
เครื่องสาย	coarde	0.0068234886041322815
สายรัชกาลที่	târziu	0.006832628837093375
ระยะเวลาการดำรงตำแหน่ง	serviciu	0.006973163906731393
การสื่อสาร	comunicare	0.007016235665566422
ผลงานหนังสือ	carte	0.007016889271143553
และพรรคฟุนซินเปค	și	0.007032036605001763
ก่อนที่	de	0.007152046167237056
นักดนตรี	muzician	0.007295141674242297
แบคทีเรีย	bacterii	0.0073253617562834645
พระบาทสมเด็จพระเจ้าอยู่หัวภูมิพลอดุลยเดชทรงพระกรุณาโปรดเกล้าฯ	plăcere	0.007429446298567587
ด้านหลัง	spate	0.007461402516967302
สารานุกรมไทย	enciclopedia	0.007521355927186054
เทเบิลเทนนิส	masa	0.007586070523013081
เป็นเมืองหลวง	capitala	0.007621650968179548
องค์การนิสิต	studenților	0.007625176908790226
อำเภอเกาะคา	districtul	0.007627033592733433
ภาคตะวันออกเฉียงเหนือ	regiunea	0.007666561695084979
ลอนดอน	londra	0.007667927257220923
ทนาย	avocat	0.007676482505680771
สมเด็จพระเจ้าภคินีเธอ	regală	0.007703654277291531
จิตวิทยา	psihologie	0.0077565217195671625
ในระยะหลัง	timp	0.007857591446436406
อำเภอเมืองกาฬสินธุ์	districtul	0.007883109395045952
ต่อมาวันที่	următoare	0.007920303249638707
จักรพรรดิไททัส	împăratul	0.007931362144995352
เอชไอวี	hiv	0.007948437163255165
หมวดหมู่พระราชปนัดดาในรัชกาลที่	domnie	0.00800643596380763
เปียโน	pian	0.00810875989125219
อิเควทอเรียลกินี	ecuatorială	0.008210287548698377
หมวดหมู่จุลชีววิทยา	categoria	0.008277539552348738
โรงเรียนยุพราชวิทยาลัย	școala	0.008289619586887394
เลิฟ	dragoste	0.008412785669228253
ศูนย์ภาษา	limbi	0.008484055990548174
การตอบรับ	părere	0.008516157848566738
เทศบาลนครเชียงราย	rai	0.008525098687582097
สภาพอากาศ	vremea	0.008578000198734132
ในปีที่	anul	0.008599840009110408
แล้วเดินเวียนรอบปูชนียสถาน	jurul	0.008750844065403723
ข้าวโพด	porumb	0.008790150620197756
อาณาจักร	regat	0.008804161627996365
ระบบใช้อำนาจเด็ดขาด	absolută	0.008833095388738508
ศูนย์รังสิต	centru	0.008835008061983203
ในสมัยกรุงศรีอยุธยา	perioada	0.008874238383522057
ภายหลังสงคราม	dupa	0.008882636798660146
อาร์คิมิดีส	arhimede	0.008988907700038773
ธนาคารกรุงศรีอยุธยา	banca	0.009300071740078445
เกมบุค	joc	0.00935680009252805
จังหวัดเพชรบุรี	provincia	0.00949066548522077
อำเภอเสริมงาม	districtul	0.00949379619360922
พิออจชา	de	0.009561922005194462
พระยศขณะนั้น	atunci	0.009578848333344107
บางกอกน้อย	noi	0.009582788100042004
สมเด็จพระศรีนครินทราบรมราชชนนี	prințesa	0.009638478536629871
และโลก	lumea	0.009694338888941403
เวอร์ชัน	versiune	0.009803576683053048
อำเภอสามพราน	districtul	0.009822060685319775
ระบบกษัตริย์ของกัมพูชา	monarhia	0.009897449974525532
ข้าวสาลี	grâu	0.009937881947151861
ภาษาอังกฤษ	engleza	0.009960454461414392
ฟินแลนด์	finlanda	0.009986769062844294
ได้สู้กับ	cu	0.009998694349318446
เคยสู้กับโกคุเทระ	cu	0.009998694349318446
ชา	ceai	0.01001080239512856
ระดับมัธยมศึกษา	secundar	0.010115764581498902
ไม่ต่ำกว่า	decât	0.01013258854774867
อำเภอบัวใหญ่	districtul	0.010225245177936836
หลักสูตรนานาชาติ	internațional	0.010243072313869171
พระจันทร์	lună	0.010298651172225745
ส่วนใหญ่	mai	0.01032732440954717
เกาะลูซอน	insula	0.01037024863204812
ดี	bun	0.01045254440967345
พระพุทธศาสนา	budism	0.010507403937798272
อำเภอคูเมือง	districtul	0.010537948886230183
ต่างๆ	variat	0.010650371794650634
วันที่ออกอากาศชื่อตอนแขกรับเชิญ	apariția	0.010657632803392532
ฟุตบอล	fotbal	0.010694601976664867
หมวดหมู่อวัยวะ	organe	0.010747162911690922
พระบรมราชินี	regină	0.010778267675239261
กำกับโดยอภิชาติพงศ์	de	0.010853693652694263
สงครามเกาหลี	războiul	0.010932413730330274
มีลักษณะดังนี้	caracteristici	0.010958099548194506
ไว้ว่า	spune	0.010968697492239233
อำเภอครบุรี	districtul	0.010999143861328971
กรุงลอนดอน	londra	0.01105794055557277
ชื่อเดิม	nume	0.011111980204376449
ในภาษาอังกฤษ	engleza	0.011139209374208698
สีขาว	alba	0.011162683308907885
ราชมังคลากีฬาสถาน	stadionul	0.011488110928436832
การจัดการคุณภาพ	calitate	0.01157253073687259
สมาชิกฤดูกาลที่	membrii	0.01159757599952548
แคมใหญ่	mare	0.011601990477270114
โรงพยาบาลรามาธิบดี	spitalul	0.0116079602163196
ทำหน้าที่	datoria	0.011739011167510695
กระนั้น	acestea	0.011800903105148149
พระนามต้นราชสกุล	nume	0.011852936772426504
สิทธิ	drepturile	0.011886598812674643
ปรากฏตัวตอนแรกในตอน	episod	0.01202477160627174
ที่มา	sursă	0.012119747847902216
ไปรษณีย์ภูเวียง	poștal	0.01217589011753063
หลวง	regal	0.012258695615874567
สถานีคาราวาน	de	0.012318221902123873
อำเภอเมืองอุตรดิตถ์	districtul	0.012354580046707662
รัฐบาลไทย	guvernul	0.012374929212360147
ประธานาธิบดี	președinte	0.01240665871774272
ไปรษณีย์อุบลราชธานี	poștal	0.012529049349518562
เพศชาย	masculin	0.012604564599491396
ตัวสะกด	ortografie	0.012648060724721945
สถาบันบัณฑิตพัฒนบริหารศาสตร์	dezvoltării	0.01281065565928314
ดินแดน	teritoriu	0.013416752210152262
คำอธิบาย	descriere	0.013529698397345712
อำเภอเมืองสุรินทร์	districtul	0.013567177885904629
จอมพลเรือ	nava	0.013624826020575046
ซึ่งมีความหมายว่า	înseamnă	0.013682082372171849
การกีฬา	sport	0.013709468654630526
รอบเมือง	jurul	0.013967009447701406
โดยที่	unde	0.01403244690704957
เมื่อเดือนมีนาคม	în	0.01404510394566918
ภาควิชาฟิสิกส์	fizică	0.014057904324095715
ดอกไม้	floare	0.014089234367483208
หมวดหมู่บุคคลที่เกี่ยวข้องกับเหตุการณ์	eveniment	0.01418662632765297
หมวดหมู่แนวพระราชดำริ	inițiativă	0.014210447711791691
ปรัชญา	filozofie	0.014214456666658814
อำเภอพุทธมณฑล	districtul	0.014232097870465928
อดีตรองหัวหน้าหน่วยที่	unității	0.014282709780907807
เครื่องบิน	avioane	0.01437857312719059
ผลงานโฆษณา	reclamă	0.01446920745999232
ในสมัยพุทธกาล	modernă	0.01448508377190177
โดย	de	0.01448808288275942
แม่น้ำโขง	râul	0.014643516321480988
มือ	mână	0.014712148931232877
มูลนิธิอานันทมหิดล	fundația	0.01481633660308169
คลับ	club	0.014823196862176483
ระดับปริญญาเอก	doctorat	0.01494035026472166
ในช่วงปี	anului	0.015524280441296763
เพลโต	platon	0.015535660421784623
โรค	boală	0.015578499307797755
รวมทั้ง	inclusiv	0.01576719735479217
เป็นครั้งแรก	dată	0.01586389038369976
จะเขียนว่า	spune	0.01592005092259829
กองการเจ้าหน้าที่	personal	0.015992941184757564
ประเทศแคนาดา	canada	0.016047915526777128
อำเภอปราสาท	districtul	0.016187782354038612
การท่องเที่ยว	turism	0.016196809596643713
การคมนาคม	transport	0.016237782559318088
ระบบรัฐสภา	parlamentar	0.01625465194573809
เนื้อที่ประมาณ	zona	0.016256236148408855
เพลงประจำมหาวิทยาลัย	universitare	0.016331186312394195
ฟิสิกส์อนุภาค	particulelor	0.016460918379879782
บ้านปราสาท	castelului	0.016530434373131946
จัดโดย	de	0.01653984419476903
ศ	prof	0.016700912140897986
ร้องร่วมกับ	cu	0.016775538388541247
จึงเปิดโอกาสให้	ocazia	0.016781010690044205
วิทยาเขตสารสนเทศเพชรบุรี	informației	0.016781010690044205
เสรีภาพ	libertate	0.01695066778011077
แมว	pisică	0.016992022981822032
จากเว็บไซต์กระทรวงต่างประเทศ	externe	0.017003225158966972
ก่อตั้งโดย	de	0.01708722331644362
สงครามอวกาศ	războiul	0.017147914577728598
