+	+	None
ห้วยขวาง	huai khwang	Nan
ห้วยทับทัน	huai thap than	Nan
ห้องน้ำ	toalet	Nan
ห้องสมุด	biblioteka	None
ห้าง	dućan	Nan
ห้างฉัตร	hang chat	Nan
ห้างหุ้นส่วนจำกัด	ograničeno partnerstvo	Nan
ฬาพานิช	komercijalno	Nan
อก	dojke	None
อคิลลีส	ahil	Nan
องคชาต	genitalije	Nan
องคต	organizacija	None
องค์กรปกครองส่วนท้องถิ่น	organizacija lokalne uprave	Nan
องค์การนิสิต	organizacija studenata	Nan
องค์การมหาชน	javna organizacija	Nan
องค์การสหประชาชาติ	ujedinjeni narodi	Nan
องค์บาก	ong bak	Nan
อนึ่ง	slučajno	None
อนาลโย	analoy	Nan
อนันตรัย	anantai	Nan
อนันตยะ	anantaya	Nan
อธิบายว่า	objasnite to	Nan
อธิการบดีมหาวิทยาลัยธรรมศาสตร์	predsjednik univerziteta thammasat	Nan
ห่วงใย	brižna	Nan
อธิการบดี	kancelara	Nan
อดีตรองนายกรัฐมนตรี	bivši potpredsjednik vlade	Nan
อดีตผู้บัญชาการทหารบก	bivši vojni zapovjednik	Nan
อดีต	bivša	None
อดิศักดิ์	adisak	Nan
องอาจ	odvažan	Nan
องค์ประกันหงสา	hongsa osiguranje	Nan
อดีตรองหัวหน้าหน่วยที่	bivši zamjenik šefa jedinice	Nan
อนุทิน	dnevnik	Nan
หเตุการณ์	situacija	None
หุ่น	lutka	Nan
หลักสูตรวิทยาศาสตรมหาบัณฑิต	master of science program	Nan
หลังจาก	posle	None
หลังสงคราม	posle rata	Nan
หลังสงครามโลกครั้งที่	posle svetskog rata	Nan
หลังสงครามโลกครั้งที่สอง	posle drugog svetskog rata	Nan
หลังเหตุการณ์	nakon događaja	Nan
หลาย	mnogi	None
หลีกภัย	bijeg	Nan
หลุมดำจิ๋ว	sitna crna rupa	Nan
หล่มสัก	lom sak	Nan
หวาย	ratana	Nan
หอก	koplje	Nan
หอประชุมพ่อขุนรามคำแหงมหาราช	kralj ramkhamhaeng veliki auditorij	Nan
หอมรดกไทย	dvorana tajlandske baštine	Nan
หอย	školjke	Nan
หอไอเฟล	ajfelova kula	Nan
หัก	odbiti	Nan
หุตะสิงห์	huta sing	Nan
หี	maca	Nan
หินไซอัล	škriljasti kamen	Nan
หินแกรนิต	granit	Nan
หินเชิร์ต	kamena košulja	Nan
หินอ่อน	mramor	None
หุ่นยนต์	robot	Nan
หินปูน	krečnjak	Nan
หาดทรายแก้ว	plaža sai kaew	Nan
หาง	rep	None
หัวใจ	srce	None
หัวโขน	maska	Nan
หัวหิน	hua hin	Nan
หัว	glava	None
หาบเร่	hawker	Nan
หลักสูตรภาษาไทย	kurs tajlandskog jezika	Nan
อนุสรณ์สถาน	spomen obilježje	Nan
อปักธงชัย	pak thongchai	Nan
ออกมาในอะนิเมะเท่านั้น	izlazi samo u animeu	Nan
ออกอากาศ	emitovanje	Nan
ออกอากาศครั้งที่	emitovano	Nan
ออกอากาศทางช่อง	emitiranje dalje	Nan
ออกัสตัส	augustus	Nan
ออกเป็น	ulazak	None
ออกแบบตัวละคร	dizajn karaktera	Nan
ออนไลน์	online	None
ออฟ	isključeno	Nan
ออลแบนี	saveznici	None
ออสเตรเลีย	australija	None
ออโตทรอพ	autobot	Nan
อะ	šta	None
อะซูไรต์	azurite	Nan
อะตอม	atom	None
อะนิเมะ	anime	Nan
อะบุราเมะ	aburame	Nan
อัธฮา	athha	Nan
อัตราการว่างงาน	stopa nezaposlenosti	Nan
อัฒภาค	zarez	Nan
อัญมณี	dragulj	Nan
อังการา	ankara	Nan
อังกฤษสมัยแองโกล-นอร์มัน	anglo-norman engleski	Nan
ออกฉายครั้งแรกเมื่อวันที่	prvo prikazano	Nan
อักษรเกาหลี	korejska abeceda	Nan
อักษร	pismo	None
อะโลน	sam	None
อะโกนิสต์	agonista	Nan
อะลูมิเนียม	aluminijum	Nan
อะมาเดอุส	amadeus	Nan
อะพาไทต์	apatite	Nan
อักษรย่อ	skraćenice	Nan
อนุสรา	anusara	Nan
ออ	ili	None
อสมท	mcot	Nan
อพอลโล่	apolon	Nan
อพิมาย	aphimai	Nan
อภัยนุราช	oprosti	Nan
อภินันท์	aphinan	Nan
อภิปรัชญา	metafizika	None
อภิรักษ์	aphirak	Nan
อมฤต	smrt	None
อมาตยกุล	amatayakun	Nan
อยู่	su	None
อยู่วิทยา	nauka	None
อยู่ห่างออกไปจากชายฝั่ง	daleko od obale	Nan
อยู่แล้ว	već	None
อยู่ในเขตอำเภอกุฉินารายณ์	smješten u okrugu kuchinarai	Nan
อย่างต่อเนื่อง	neprekidno	None
อย่างแพร่หลาย	široko	None
อย่างไรก็ตาม	kako god	Nan
อร	orn	Nan
อศรีประจันต์	asri prachan	Nan
อวัยวะเพศ	genitalije	Nan
อวัยวะสืบพันธุ์หญิง	ženski genitalni organi	Nan
อวัยวะสืบพันธุ์สตรีด้านนอก	spoljni ženski organi spolja	Nan
อวอร์ดส	nagrade	None
อลิซ	alice	Nan
อสามชุก	sam chuk	Nan
อลาสก้า	aljaska	Nan
อรุณี	arunee	Nan
อริยสัจ	plemenita istina	Nan
อรัญประเทศ	aranyaprathet	Nan
อรรถพร	athaphon	Nan
อรรถกถา	komentar	Nan
อรทัย	mlada djevojka	Nan
อลังการ	ukras	None
อันดับ	ocena	Nan
หลักสูตรภาษาอังกฤษ	kurs engleskog jezika	Nan
หลักสูตรนานาชาติ	međunarodni kurs	Nan
หน้าอก	prsa	Nan
หมวด	grupa	None
หมวดหมู่	kategorija	None
หมวดหมู่กลุ่มดนตรีที่ก่อตั้งในปี	kategorija muzičke grupe osnovana u	Nan
หมวดหมู่กลุ่มดนตรีสัญชาติเกาหลี	kategorija korejske muzičke grupe	Nan
หมวดหมู่กวีชาวไทย	kategorija tajlandskog pjesnika	Nan
หมวดหมู่การฉลองปีใหม่	novogodišnja kategorija proslave	Nan
หมวดหมู่การประท้วงในประเทศไทย	kategorija protesta na tajlandu	Nan
หมวดหมู่การ์ตูนญี่ปุ่นแนวโชเน็น	kategorija: japanski crtić, shonen stil	Nan
หมวดหมู่จุลชีววิทยา	kategorija mikrobiologije	Nan
หมวดหมู่ชาวไทยที่นับถือศาสนาพุทธ	kategorija tajlandski budisti	Nan
หมวดหมู่ชาวไทยที่เกิดในต่างประเทศ	kategorija tajlanda rođenih u inozemstvu	Nan
หมวดหมู่ดาวเคราะห์ชั้นใน	kategorija unutarnje planete	Nan
หมวดหมู่ดาวเคราะห์หิน	planet stone kategorija	Nan
หมวดหมู่ทหารอากาศชาวไทย	thai air force kategorija	Nan
หมวดหมู่ทหารเรือชาวไทย	kategorija tajlandske mornarice	Nan
หมวดหมู่นักการเมืองไทย	kategorija tajlandskih političara	Nan
หมวดหมู่ประวัติศาสตร์ไทย	kategorija povijesti tajlanda	Nan
หมวดหมู่บุคคลที่เกี่ยวข้องกับเหตุการณ์	kategorija ljudi povezanih sa događajem	Nan
หมวดหมู่บุคคลจากโรงเรียนมงฟอร์ตวิทยาลัย	kategorija pojedinaca sa montfort koledža	Nan
หมวดหมู่บุคคลจากโรงเรียนนายร้อยพระจุลจอมเกล้า	kategorije s kraljevske vojne akademije chulachomklao	Nan
หมวดหมู่บุคคลจากสถาบันบัณฑิตพัฒนศิลป์	kategorija ljudi sa instituta bunditpatanasilpa	Nan
หมวดหมู่บุคคลจากมหาวิทยาลัยอ๊อกซฟอร์ด	pojedinačna kategorija sa univerziteta oxford	Nan
หน่วยพันธุกรรม	genetska jedinica	Nan
หมวดหมู่บุคคลจากมหาวิทยาลัยสุโขทัยธรรมาธิราช	kategorije sa pučkog otvorenog univerziteta sukhothai thammathirat	Nan
หมวดหมู่บุคคลจากจุฬาลงกรณ์มหาวิทยาลัย	kategorije sa univerziteta chulalongkorn	Nan
หมวดหมู่บอยแบนด์	kategorija dječaka	Nan
หมวดหมู่บริษัทที่ก่อตั้งในปี	kompanija osnovana u	Nan
หมวดหมู่บริษัทของไทย	kategorija kompanije iz tajlanda	Nan
หมวดหมู่นายกรัฐมนตรีไทย	kategorija tajlandski premijer	Nan
หมวดหมู่นักร้องไทย	kategorija tajlandskih pevača	Nan
หมวดหมู่บุคคลจากมหาวิทยาลัยธรรมศาสตร์	kategorija sa univerziteta thammasat	Nan
หมวดหมู่ประเภทของภาพยนตร์	kategorija filmskih kategorija	Nan
หน่วยประมวลผลกลาง	centralna procesna jedinica	Nan
หน่วยที่	jedinica	None
ส่วนหัว	header	Nan
ส่วนในฤดูฝนน้ำจะท่วมทุกปี	u kišnoj sezoni voda će poplaviti svake godine.	Nan
ส่วนใหญ่	većina	None
ส่วนใหญ่เป็นโรงสีข้าว	većina njih su mlinovi riže.	Nan
ส่องแสง	sijati	Nan
ส้ม	narandžasta	Nan
ส้มเช้ง	narančasta narandža	Nan
ส้มโอ	grejpfrut	Nan
หงษ์ทอง	hong thong	Nan
หงษ์มานพ	hong manop	Nan
หงสกุล	hong sakul	Nan
หญ้าทะเล	morska trava	Nan
หญ้าฝรั่น	šafran	Nan
หนองคาย	nong khai	Nan
หนองม่วง	nong muang	Nan
หนองหาน	nong han	Nan
หนองฮี	nong hee	Nan
หน่วยทหารในค่าย	vojna jedinica u logoru	Nan
หน่วยคำเติม	morpheme	Nan
หน่วยความจำ	memorija	None
หนุ่ม	mlad	None
หนุมาน	hanuman	Nan
หนึ่งธิดา	jedna kćerka	Nan
หน่วยบัญชาการนาวิกโยธิน	štab marinaca	Nan
หนึ่ง	jedan	None
หนังสือลามก	pornografske knjige	Nan
หนังสือการ์ตูน	strip	Nan
หนังสือ	knjiga	None
หนัก	teška	None
หนอน	crv	Nan
หนองแซง	zang	Nan
หนังใหญ่	veliki film	Nan
หลักสูตรปกติ	normalni kurs	Nan
หมวดหมู่ปรัชญา	kategorija filozofija	Nan
หมวดหมู่พระราชปทินัดดาในรัชกาลที่	kategorija kraljevska vladavina za vrijeme vladavine	Nan
หมอชิต	morchit	Nan
หมากรุกสากล	međunarodni šah	Nan
หมายความว่า	znači	None
หมู่	svinja	None
หมู่ที่	selo	None
หมู่เกาะเคย์แมน	kajmanska ostrva	Nan
หมู่เกาะแบลีแอริก	balearska ostrva	Nan
หมู่เกาะโซโลมอน	salomonova ostrva	Nan
หม่อมราชวงศ์ปรีดิยาธร	r. pridiyathorn	Nan
หม่อมหลวงปิ่น	mama pin	Nan
หม่อมเจ้าจุฑาวัชร	princ jutawatchai	Nan
หม่อมเจ้าวัชรวีร์	prince watcharawee	Nan
หม่อมเจ้าวัชรเรศร	mama watcharachorn	Nan
หม้อข้าวหม้อแกงลิง	nepenthes	Nan
หยุ่น	fleksibilan	Nan
หรั่ง	lang	Nan
หรือ	ili	None
หลักสูตรที่เปิดสอน	kurs	Nan
หลักสูตรการจัดการดุษฏีบัณฑิต	doktor filozofskog programa menadžment	Nan
หลักสี่	laksi	Nan
หลักทรัพย์	hartije od vrednosti	Nan
หลักจริยธรรม	etika	None
หลอดเลือดแดงใหญ่เอออร์ตา	aorta	Nan
หมวดหมู่โรงเรียนบุรุษในประเทศไทย	kategorija muških škola na tajlandu	Nan
หลอดอาหาร	jednjak	Nan
หลวง	kraljevski	Nan
หรือเรียกว่า	ili pozvano	Nan
หรือที่เรียกกันว่า	takođe poznat kao	Nan
หรือที่รู้จักกันในชื่อ	ili poznat kao	Nan
หรือชื่อทางการคือ	ili je službeno ime	Nan
หรือการแสดงธงชาติ	ili pokazujući državnu zastavu	Nan
หลอก	pseudo	Nan
หมวดหมู่พระราชนัดดาในรัชกาลที่	kategorija kraljevski unuk vladavine	Nan
หมวดหมู่โรงเรียนที่มีอัตราการแข่งขันสูง	kategorija škole sa visokom stopom takmičenja	Nan
หมวดหมู่แนวพระราชดำริ	kategorija inicijative	Nan
หมวดหมู่พระราชปนัดดาในรัชกาลที่	kategorija kralj panadda u vladavini	Nan
หมวดหมู่พิธีกรไทย	kategorija tajlandski izlagači	Nan
หมวดหมู่ฟุตบอลในประเทศไทย	nogometna kategorija na tajlandu	Nan
หมวดหมู่ภัยธรรมชาติ	kategorija prirodne katastrofe	Nan
หมวดหมู่ภัยพิบัติทางการแพทย์	kategorija medicinske katastrofe	Nan
หมวดหมู่มหาวิทยาลัยธรรมศาสตร์	kategorija univerziteta thammasat	Nan
หมวดหมู่รัชกาลที่	kategorija vladavine	Nan
หมวดหมู่รัฐคอมมิวนิสต์	kategorija komunističke države	Nan
หมวดหมู่รัฐมนตรีว่าการกระทรวงการต่างประเทศไทย	kategorija tajlandskog ministra vanjskih poslova	Nan
หมวดหมู่รัฐวิสาหกิจไทย	kategorija tajlandska preduzeća	Nan
หมวดหมู่รัฐสิ้นสภาพในทวีปเอเชีย	država ugašena u aziji	Nan
หมวดหมู่รัฐและดินแดนที่ก่อตั้งในปี	kategorija država i teritorija osnovana u	Nan
หมวดหมู่รายการโทรทัศน์ไทย	kategorija programa tajlandske televizije	Nan
หมวดหมู่ละครโทรทัศน์ไทย	kategorija tajlandske televizijske drame	Nan
หมวดหมู่วัฒนธรรมไทย	kategorija tajlandske kulture	Nan
หมวดหมู่วันสำคัญทางศาสนาที่นับโดยปฏิทินจันทรคติ	kategorije važnih vjerskih dana koje se računaju po mjesečevom kalendaru	Nan
หมวดหมู่ศิลปินสังกัดจีเอ็มเอ็ม	kategorija izvođača pod gmm	Nan
หมวดหมู่เพศศึกษา	kategorija seksualnog obrazovanja	Nan
หมวดหมู่เครื่องเทศ	kategorija začina	Nan
หมวดหมู่อวัยวะเพศ	kategorija genitalija	Nan
หมวดหมู่อวัยวะ	kategorija organa	Nan
หมวดหมู่อดีตอาณานิคมของอังกฤษ	britanska bivša kolonijalna kategorija	Nan
หมวดหมู่อดีตอาณานิคมของสเปน	bivša kolonijalna španska kategorija	Nan
หมวดหมู่โรค	kategorija bolesti	Nan
หมวดหมู่อดีตอาณานิคมของฝรั่งเศส	francuska bivša kolonijalna kategorija	Nan
หมวดหมู่สิ้นสุดในคริสต์ศตวรรษที่	kategorija je završila u 19. vijeku.	Nan
หมวดหมู่สิ่งก่อสร้างในพุทธศตวรรษที่	kategorija građevina u 21. vijeku	Nan
หมวดหมู่สัตว์เลื้อยคลาน	kategorija gmazova	Nan
หมวดหมู่สัตว์มีแกนสันหลัง	kategorija životinje iz kičme	Nan
หมวดหมู่สมุนไพร	kategorija biljaka	Nan
หมวดหมู่สถาบันอุดมศึกษาในกรุงเทพมหานคร	kategorije visokoškolskih ustanova u bangkoku	Nan
หมวดหมู่สโมสรในพรีเมียร์ลีก	kategorija kluba u premier ligi	Nan
อันประกอบด้วย	koji se sastoji od	Nan
อันโตนิโอ	antonio	None
อันโตนีโอ	antonio	None
อุณหเคมี	termohemija	Nan
อุดม	plodna	Nan
อุดรธานี	udon thani	Nan
อุตตมะโยธิน	uppharat yothin	Nan
อุตรดิตถ์	uttaradit	Nan
อุทยาน	park	None
อุทยานประวัติศาสตร์พนมรุ้ง	istorijski park phanom rung	Nan
อุทยานประวัติศาสตร์พิมาย	istorijski park phimai	Nan
อุทยานแห่งชาติคลองตรอน	nacionalni park khlong tron	Nan
อุทยานแห่งชาติดอยภูคา	nacionalni park doi phu kha	Nan
อุทยานแห่งชาติดอยอินทนนท์	nacionalni park doi inthanon	Nan
อุทยานแห่งชาติทุ่งแสลงหลวง	nacionalni park thung salaeng luang	Nan
อุทยานแห่งชาติธารโบกขรณี	od nacionalnog parka bok khorani	Nan
อุทยานแห่งชาติน้ำตกสี่ขีด	nacionalni park vodopada si khit	Nan
อุทยานแห่งชาติน้ำพอง	nacionalni park nam phong	Nan
อุทยานแห่งชาติภูผาเหล็ก	nacionalni park iron mountain	Nan
อุทยานแห่งชาติภูพาน	nacionalni park phu phan	Nan
อุภัยราศี	oprosti zodijak	Nan
อุปนิสัย	karakter	None
อุปกรณ์คอมพิวเตอร์	računarski pribor	Nan
อุปกรณ์	opreme	None
อุบล	ubon	Nan
อุทุมพรพิสัย	uthumphon phisai	Nan
อุณหภูมิ	temperaturu	None
อุทยานแห่งชาติไทรทอง	nacionalni park sai thong	Nan
อุทยานแห่งชาติหาดนพรัตน์ธาราหมู่เกาะพีพี	nacionalni park noppharat thara, ostrva phi phi	Nan
อุทยานแห่งชาติภูแลนคา	nacionalni park phulanca	Nan
อุทยานแห่งชาติภูเวียง	nacionalni park phu wiang	Nan
อุทยานแห่งชาติภูเรือ	nacionalni park phu ruea	Nan
อุทยานแห่งชาติภูสอยดาว	nacionalni park phu soi dao	Nan
อุทยานแห่งชาติภูสวนทราย	nacionalni park phu suan sai	Nan
อุทยานแห่งชาติเขาหลวง	nacionalni park khao luang	Nan
อุรุกวัย	urugvaj	Nan
อุซึมากิ	uzumaki	Nan
อื่น	drugi	None
อำเภอแม่แจ่ม	okrug mae chaem	Nan
อำเภอแม่แตง	okrug mae taeng	Nan
อำเภอโนนดินแดง	okrug non din daeng	Nan
อำเภอโนนสุวรรณ	okrug non suwan	Nan
อิงค์	inc.	Nan
อิงลิช	engleski	None
อิทธิพล	uticaj	None
อิน	in	Nan
อินทิรา	indira	Nan
อินฟราเรด	infracrveni	Nan
อินฮิบิเตอร์	inhibitora	Nan
อินุยาฉะ	inuyasha	Nan
อินเซคทิวอรา	inseqtura	Nan
อินเดียน	indijanski	Nan
อินเด็กซ์	indeks	Nan
อินโดนีเซีย	indonezija	None
อิม	imm	Nan
อือ	da!	Nan
อึ๊งภากรณ์	ungphakorn	Nan
อึ	sranje	Nan
อีกด้วย	također	None
อีกครั้ง	ponovo	None
อีก	više	None
อุ	o	None
อิโนะ	ja ne	Nan
อิหร่าน	iran	None
อิสตันบูล	istanbul	None
อิริโทรมัยซิน	elektroliza	None
อิรัก	irak	Nan
อิมแพ็ค	uticaj	None
อิมาจิน	imajin	Nan
อิเควทอเรียลกินี	ekvatorijalna gvineja	Nan
อำเภอแม่ทะ	okrug mae tha	Nan
อุเทน	uthen	Nan
อู๋	wu	Nan
ฮิโซกะ	hisoka	Nan
ฮิโรชิ	hiroshi	Nan
ฮีชอล	heechul	Nan
ฮุก	kuka	Nan
ฮโยยอน	hyoyeon	Nan
ฯพณฯ	njegova ekselencija	Nan
เกตส์	kapije	Nan
เกตุทัต	ketthat	Nan
เกมที่	igra	None
เกมบุค	igra	None
เกรย์	siva	Nan
เกษตรกรรม	poljoprivreda	None
เกษตรวิสัย	kaset wisai	Nan
เกษมศรี	kasemsri	Nan
เกอริง	gering	Nan
เกอไทต์	goethe	Nan
เกาหลีใต้	sjeverna koreja	Nan
เกียรติศักดิ์	slava	Nan
เกียรติประวัติ	čast	None
เกียรติ	čast	None
เกิดนิมิตร	stvorite viziju	Nan
เกิดจากเชื้อไวรัส	uzrokuje ga virus	Nan
เกิดจากการรวมตัวของ	prouzrokovano ugradnjom	Nan
ฮิวงะ	hyuga	Nan
เกิดจากการรวมชิ้นส่วนที่	uzrokovano kombiniranjem dijelova koji	Nan
เกิดขึ้นหลังจากมหาวิทยาลัยศรีนครินทรวิโรฒวิทยาเขตต่างๆ	nastao nakon univerziteta srinakharinwirot	Nan
เกิด	rođen	None
เกาะสุมาตรา	sumatra	Nan
เกาะลูซอน	ostrvo luzon	Nan
เกาะคา	kauai	Nan
เกาะ	ostrvo	None
เกิดขึ้นเมื่อวันที่	pojavio se dana	Nan
อู	ou	Nan
ฮิราโกะ	hirako	Nan
ฮินาตะ	hinata	Nan
อเมริกัน	američko	Nan
อเมริกา	amerika	None
อเมริกาเหนือ	sjeverna amerika	Nan
อเล็กซานเดอร์	aleksandra	None
อเล็กซ์	alex	Nan
อโลหะ	nemetalni	Nan
อ่อนเพลีย	umorna	Nan
อ่าน	čitati	None
อ่าวลึก	ao luek	Nan
อ้างว่า	tvrdite to	Nan
อ้างว้าง	pustoš	Nan
ฮอกกี้	hokej	None
ฮอท	vruće	Nan
ฮอฟมัน	hoffman	Nan
ฮอยเกนส์	hogens	Nan
ฮอร์โมน	hormona	None
ฮอลแลนด์	holland	Nan
ฮิตเลอร์	hitler	None
ฮิซานะ	hisana	Nan
ฮิซาชิ	hisashi	Nan
ฮาวาย	havaji	Nan
ฮารุกะ	haruka	Nan
ฮายาโตะ	hayato	Nan
ฮิมาวาริ	himawari	Nan
ฮานอย	hanoi	Nan
ฮาจิ	hachi	Nan
ฮัมบูร์ก	hamburg	Nan
ฮันกึล	hangul	Nan
ฮักบี้	zbogom	Nan
ฮอว์ค	seahawks	Nan
ฮอลโลว์	šuplje	Nan
ฮาตาเกะ	hatake	Nan
อำเภอแจ้ห่ม	okrug chae hom	Nan
อำเภอเสริมงาม	okrug soem ngam	Nan
อำเภอเวียงแก่น	okrug wiang kaen	Nan
อานโตนิโอ	antonio	None
อาบาราอิ	abarai	Nan
อายุ	dob	None
อารยา	araya	Nan
อาร์	r	None
อาร์กอน	argon	Nan
อาร์คิมิดีส	arhimed	Nan
อาร์ม	ruka	None
อาร์มาดิลโล	armadillo	Nan
อาร์เคด	arcade	Nan
อาร์เมเนีย	jermenija	Nan
อาร์เอ็นเอ	rna	Nan
อาร์โนลด์	arnold	Nan
อาวุธคือ	oružje je	Nan
อาวุธประจำกาย	lično oružje	Nan
อาหาร	hrana	None
อาเจียน	povraćati	Nan
อำเภอดอยสะเก็ด	okrug doi saket	Nan
อำเภอจอมทอง	okrug chom thong	Nan
อำเภอคูเมือง	okrug khu mueang	Nan
อำเภอครบุรี	okrug khon buri	Nan
อำเภอขุนหาญ	okrug khun han	Nan
อำเภอขุขันธ์	okrug khukhan	Nan
