มดลูก	uterus	7.849006133197684e-16
กระเพาะอาหาร	stomach	2.0811711568766046e-08
นายสมชัย	mr. somchai	3.3155603987738995e-08
พีระมิด	pyramid	4.467484113171989e-08
ข้อมูลประเทศเดนมาร์ก	information on denmark	1.0164127091320792e-07
นักบินอวกาศ	astronaut	6.250925710353886e-07
รายชื่อคำในภาษาไทยที่มักเขียนผิด	common misspelled thai words	7.519686202737027e-07
ระบบกษัตริย์ของกัมพูชา	cambodian monarchy	8.520537421290735e-07
ปี่กลาง	a thai woodwind instrument	1.0019011353088207e-06
วัดพระเชตุพนวิมลมังคลารามราชวรมหาวิหาร	wat pra chetpnvimolmungklaramrajavoramahavihan	1.3394776889576574e-06
โดราเอมอนฉบับภาพยนตร์	doraemon movie edition	1.5031370006291513e-06
พริกหวาน	sweet pepper	1.8115129873450142e-06
อำเภอปาย	pai district	1.8115129873450142e-06
อำนาจอธิปไตย	sovereignty	2.0719548209513203e-06
มหาวิทยาลัยเทคโนโลยีราชมงคลอีสาน	rajamangala university of technology isan	2.0889152118662803e-06
โรลเลอร์เบลด	rollerblade	2.203992114563384e-06
ซีลีเนียม	selenium (chemical element)	2.3808559121515186e-06
หลังสงครามโลกครั้งที่สอง	after world war ii	2.822165195948488e-06
องค์การนิสิต	student organization	2.9696571481856037e-06
นครปฐม	nakhon pathom	4.033299657515223e-06
อาณาจักรแพกเจ	pakja territory	4.4381145242339705e-06
อาร์เอ็นเอ	rna	5.471283634219017e-06
กำลังจะปรับเปลี่ยนเป็น	is changing to	5.9229205393041904e-06
อำเภอเชียงของ	chiang khong district	6.027014827142906e-06
และในปี	and in the year	7.290085350372963e-06
โรงแรม	hotel	7.65801734636157e-06
พลังงานไฟฟ้า	electrical energy	8.939556547302785e-06
ไปรษณีย์อุบลราชธานี	ubon ratchathani post office	1.1858045058446287e-05
เซ็กส์	sex	1.1889141045897702e-05
ซูรินาเม	suriname	1.2450699095311811e-05
แขวงหลวงพระบาง	luang pra bang province	1.2501321255135996e-05
เศรษฐศาสตร์มหภาค	macroeconomics	1.2629061798083432e-05
ประกอบด้วย	include	1.6149033774551895e-05
จอมบึง	chom bueng	1.652201619000653e-05
อุทยานประวัติศาสตร์พนมรุ้ง	phanom rung historical park	1.6743420069387293e-05
ไชยา	chaiya	1.6850455334443096e-05
ในคศ	in the year	1.9182419208946877e-05
วิศวกรรมสิ่งแวดล้อม	environmental engineering	1.9498873287657037e-05
พลอย	ploy	2.175265268320923e-05
ออกเป็น	into	2.253391334898389e-05
ภาวะเศรษฐกิจของกัมพูชาหลังจากมีการเปลี่ยนแปลงการปกครองจากระบอบสังคมนิยมเป็นระบอบประชาธิปไตย	cambodia economy after political change	2.375820802128554e-05
ไต	kidney	2.3871795634892882e-05
เมืองพิจิตร	phichit	2.5040608164335604e-05
ผดุง	phadung	2.655458955082376e-05
ไก่	chicken	2.704908132742419e-05
ระวิ	rawi	2.9970741109501424e-05
เขียนว่า	wrote	3.1786791515616915e-05
อะนิเมะ	anime	3.416646842438172e-05
พุทธนิกายเถรวาท	theravada buddhism	3.4350771579242075e-05
ดรนิพนธ์	doctor nipon	3.867282365095595e-05
ตามตำราพรหมชาติฉบับหลวง	by royal botanic manual/handbook	4.135045243124538e-05
โดยมีตัวอย่างบทพากย์ฉบัง	background movie in music video	4.289751813342868e-05
ชีวมวล	alternative (natural) power	4.3013515707497725e-05
จิบูตี	ji bu dee event on june 27	4.409834895258791e-05
ลูกอม	candy	4.479045653580861e-05
หลักสี่	luk sri - a location in bangkok	4.563226119405875e-05
ต่อมาในสมัยกรุงธนบุรีและกรุงรัตนโกสินทร์เขมรตกอยู่ภายใต้การควบคุมของจักรวรรดิสยามอย่างเข้มงวด	later in thonburi period and rattanakosin period	4.596106988837621e-05
อุทยานแห่งชาติเขาหลวง	khao luang national park	4.6298193401345357e-05
มหาวิทยาลัยบูรพา	burapha university	4.858540191615509e-05
ด้านอ่าวไทย	gulf of thailand side	5.1537627962754704e-05
เทนโจอิน	tenjoin - a character in a japanese story	5.4132449139797615e-05
นราธิป	naratip - a male's name of a singer	5.4856276353631905e-05
ข้อมูลอื่นๆ	other information	5.5041205954480525e-05
ส่วนต่อขยายบางซื่อท่าพระ	bang sue – tha phra expansion	5.574441577722786e-05
สีน้ำตาล	brown color	5.868359843727406e-05
พงศ์ศิลป์พิพัฒน์	pongsinpipat	5.922014724201291e-05
อัมพาต	paralysis	5.993474492446655e-05
คณะแพทยศาสตร์ศิริราชพยาบาล	faculty of medicine siriraj hospital	5.999748735385204e-05
ปืนพก	handgun	6.199184229902244e-05
หมวดหมู่มหาวิทยาลัยธรรมศาสตร์	thamasat university	6.278948321536335e-05
อำเภอเกาะคา	amphoe ko kha	6.517182153160115e-05
อโลหะ	nonmetal	6.63204858934885e-05
ซึ่งประกอบด้วย	consists of	6.645558756769578e-05
และอำเภอกันทรารมย์	and kanthararom district	6.682269350803222e-05
คิมิฮิโระ	kimihiro	6.711291678800459e-05
บรรณาธิการ	editor	6.940844362365213e-05
เอ็ดดูเทนเมนท์	edutainment	7.007873992542965e-05
เทศบาลเมืองบุรีรัมย์	bureerum public works	7.284639901391253e-05
ประธานาธิบดี	president	7.412083409326927e-05
หลอดอาหาร	esophagus	7.513728539704811e-05
สีน้ำเงิน	blue	7.5981315990137e-05
ธนาคารเพื่อการพัฒนาแห่งเอเชีย	patana asia bank	7.656908318121695e-05
นายยงยุทธ	mr. yongyut - a male's name	8.02605538789738e-05
ประเทศสวีเดน	sweden	8.460632757771189e-05
กมลรัตน์	kamonrat	8.594908284322027e-05
วงเงิน	budget	8.599755041325998e-05
เขี้ยวพิษ	vemon fangs	8.819589969414968e-05
สมเด็จพระนางเจ้ารำไพพรรณี	queen rambhai barni	8.974548307914337e-05
ปัจจุบัน	at present	8.995763725182953e-05
เปิดสอนระดับปริญญาตรี	offer bachelor degree curriculum	9.346344297114773e-05
ความบริสุทธิ์	purity	9.453833063682561e-05
พระประแดง	phra pradaeng	9.523337283077733e-05
ภาคกลาง	central thailand	9.651134124094748e-05
ไฟ	fire	9.658222094635198e-05
ไพรวัลย์	phraiwan	0.00010045265628493012
ประเทศราช	vassal state	0.00010697777674468045
หมวดหมู่ทหารเรือชาวไทย	group of thai navy officers	0.00010712034721672178
วีระยุทธ	werayut - a male's name	0.00010781802906884579
ธงชัย	thongchai	0.00011098372260285517
มหาวิทยาลัยพะเยา	prayao university	0.00011163022628994377
โมลิบดีนัม	molybdenum	0.00011216594355763343
ชื่อเมือง	city's name	0.00011479746993201777
วิดีโอเกม	video game	0.00012055147690164985
อำเภอตะพานหิน	taphan hin district	0.00012097488286851858
เกาหลีใต้	south korea	0.00012117715565398541
มาครอส	macross	0.00013507956513477654
นิรุกติศาสตร์	philology	0.000138200229113607
นกแก้ว	parot	0.00014073577233449946
อาร์โนลด์	arnold	0.00014375337623835782
โดยตรง	directly	0.00014404722365480508
โชอิจิ	shoichi	0.0001470532476778222
คณะศิลปกรรมศาสตร์	faculty of fine arts	0.00015013060407744274
โรงพยาบาลอุตรดิตถ์	uttaradit hospital	0.00015081447679587932
ในระยะหลัง	at the end	0.0001515390845690775
ทวีป	continent	0.00015314499080171942
ประเทศเกาหลีใต้	south korea	0.00015372385512643104
เฉลียว	chaleuw - a male's name	0.00015900649832219937
ศูนย์ค้าส่ง	wholesale center	0.0001642211983956319
การตอบรับ	welcoming	0.00016465661412179902
ฟุตบอล	football	0.00017098674172386688
จนกระทั่งปี	until the year	0.0001718371355536923
สุจาริณี	sujarinee	0.00017299081738434568
เพลงเปิดเรื่อง	opening song	0.00017430928913725143
จอมพลถนอม	field marshal thanom	0.00017730194896645876
จังหวัดเชลลา	chella city	0.00017835500515019204
และรัสเซีย	and russia	0.0001822892796641844
ทีมชาติไทย	thai national team	0.00018449290910398588
พระนารายณ์	narayana	0.00018486499463447615
ลิง	monkey	0.00018486499463447615
ประสิทธิภาพ	efficiency	0.0001901360038239645
กองทัพเรือไทย	thai navy	0.0001909796408212355
จังหวัดพังงา	phang nga province	0.0001986091544992777
ชั้นประทวน	non-commissioned officer	0.00019929797329895326
อิสตันบูล	istanbul	0.0001997413297418697
ไปรษณีย์ร้อยเอ็ด	roi et post office	0.00020896011465065174
ไม้กวาด	broom	0.0002099866319671312
โคนัน	conan	0.00021273130113934634
ชื่อเก่าในวงการ	old stage name	0.00022017282440707478
อาคามัตสึ	akamatsi	0.00022294548070473508
นายประกอบ	mr. prakob - a male's name	0.0002232596963975291
สถาบันเทคโนโลยีพระจอมเกล้า	king mongkut's institute of technology	0.00022897934121782993
โซเดียม	sodium	0.0002325613733876498
มหาวิทยาลัยมหิดล	mahidol university	0.00023657090322115585
งาน	work, job	0.00024584266853041264
จากเว็บไซต์กระทรวงต่างประเทศ	from the foreign government affairs website	0.0002506757700174476
ซึ่งเรียกว่า	called	0.0002510987879043758
มหาวิทยาลัยเทคโนโลยีราชมงคลธัญบุรี	rajamangala university of technology thanyaburi	0.000259162986565174
พญามังราย	mangrai the great	0.0002607212308451583
ประมาณปี	approximately in the year	0.000263480683742742
การปฏิรูประบบจัดเก็บภาษีเงินได้	taxation reform	0.0002639437678918821
ตระกูลปาร์ค	park family (korean last name)	0.00026721886609565245
ราชวงศ์จิ้นตะวันออก	east jin dynasty	0.00026944726938890444
ลายน้ำ	watetmark	0.0002698516709085964
ซิโนไทย	sino-thai	0.0002713929460177883
หลักสูตรการจัดการดุษฏีบัณฑิต	doctor of management program	0.0002730345691928797
อำเภอบัวใหญ่	amphoe buayai (buayai district)	0.000273143182239679
ที่มา	source	0.00027851625194734404
ลพบุรี	lopburi	0.00028637874036367174
การบริหารการศึกษา	educational administration	0.00029151549897438135
แคมเล็ก	vagina fold	0.0002934105041009807
สำนักวิทยบริการ	office of academic services	0.0003006174093483482
ซีเกมส์	southeast asian game	0.0003047017498003164
ดำรงตำแหน่ง	hold the title of	0.0003124444296417518
ชีวสถิติ	biostatistics	0.00032008946047873925
เวิร์คพอยท์สตูดิโอ	workpoint studio	0.00032101746595681664
ภายหลัง	after	0.0003230480076337572
เศรษฐศาสตร์จุลภาค	microeconomics	0.00032869477273835733
บรมนาถบพิตร	borommanatbophit	0.0003338052292443363
เฟอร์นิเจอร์	furniture	0.00034121469552179776
วิหาร	vihara	0.0003480152231350803
เยาวชนอายุ	youth age of ...	0.00034862103544557797
เปียโน	piano	0.0003504681521779284
จังหวัดปัตตานี	pattani state	0.00035497600517859313
วุฒิสภา	senate	0.0003563155911851631
กรมหลวงนราธิวาสราชนครินทร์	krom ma loung naratifatrachanakarin - the name of a royal family member	0.00036139401483182686
ลุงบุญมีระลึกชาติ	uncle boonmee who can recall his past lives	0.0003632100684359862
มหาวิทยาลัยราชภัฏอุตรดิตถ์	uttaradit rajabhat university	0.00036873000935810576
ม้า	horse	0.0003717386673036956
งูอนาคอนดา	anaconda	0.0003851110531823823
ทุกครั้ง	every time	0.00038708531278038494
โคกสำโรง	khok samrong	0.0003879675419046599
ลิปปี	rippi - a surname	0.0003898466568102545
สาธารณรัฐอินโดนีเซีย	republic of indonesia	0.00039206463171561007
คาราคุระ	karakura	0.00039635196443187434
แหล่งโบราณคดีบ้านเชียง	ban chiang archaeological site	0.0003968614778242443
วิทยาลัยดุริยางคศิลป์	college of music	0.0003988378651601477
ศรชัย	sornchai - a male's name	0.000403255543867196
กัมพูชาเป็นอาณานิคมของฝรั่งเศสมาตั้งแต่พศ	cambodia was a france colony from year	0.000405436977814158
ความกว้าง	width	0.00040904538333681864
อำเภอเมืองพิจิตร	mueang phichit district	0.00041346143385615527
ธรรมเมกขสถูป	dhamek stupa	0.00041604285327398997
สถาบันบัณฑิตพัฒนบริหารศาสตร์	satabunbunthitpakanabarihansart - a university in thailand, as known as nida	0.00041632209772436035
มาลากุล	malakul	0.00041798521367202333
ในหนังสือ	in book	0.0004207855314920688
พยาบาล	nurse	0.0004278368912691308
เทศบาลเมืองหนองคาย	nong khai municipality	0.00043239730268091977
ทางทิศเหนือติดกับประเทศไทยและลาว	borders thailand and laos to the north	0.0004408481942380305
กันดั้ม	gundam - a cartoon	0.0004448372150329025
เปลวไฟ	flame	0.00044749876961591294
สาขามนุษยศาสตร์	humanities	0.0004499445989809294
และเรียกว่า	and call	0.00045342356152607634
ศรายุทธ	sarayut - a male's name	0.00046872640737929277
การจูบ	kissing	0.00047004469683884815
เกิดจากการรวมตัวของ	combination of	0.00047126537413571417
อุทยานแห่งชาติภูสวนทราย	pusuansai national preserve	0.00047876598913173445
กอล์ฟไมค์	golf-mike	0.0004804458270442952
หมวดหมู่บุคคลจากจุฬาลงกรณ์มหาวิทยาลัย	category:chulalongkorn university alumni	0.00048620747422744594
พระพุทธศาสนา	buddhism	0.0004893116430153769
อุทยานแห่งชาติคลองตรอน	khlong tron national park	0.0004908636839144817
การระบาดของไข้หวัดใหญ่สายพันธุ์ใหม่	flu pandemic	0.000492022757923571
มะริด	myeik	0.0004927643688469298
เมทะนี	metanee - the surname of a famous actor	0.0004953633824240247
ฮาตาเกะ	hatake	0.0004983276451310828
อัลบัส	albus in harry potter stories	0.0005001961443705417
พระมงกุฏเกล้าเจ้าอยู่หัว	phra mongkut klao chao yu hua	0.0005088289229149306
ภาพยนตร์ตอน	version of the movie	0.000512205633674513
พวกสัตว์ลำตัวกลม	animals with no backbones	0.0005212111852916983
กาฬสินธุ์	kalasin	0.0005232843920925841
ริน	rin	0.0005285421451916776
แห่งสหประชาชาติ	united nations	0.000534743758558555
พารามีเซียม	paramecium	0.0005449687284549458
แคมใหญ่	labia	0.0005493393526361203
ฟูจิ	fuji	0.000561692429132859
ทหาร	soldier	0.0005736457996602051
เคมีไฟฟ้า	electrochemistry	0.0005797979404045483
มหาวิทยาลัยเทคโนโลยีราชมงคลตะวันออก	the eastern university of teachnology	0.000583020318735331
โรงเรียนสาธิต	demonstration school	0.0005863526410748635
วิทยาลัยพยาบาลบรมราชชนนี	nursing university of barom raj chonnani	0.0006049248999998625
เรืองรุ่ง	rueangrung	0.0006057724223252057
สุจริตกุล	sucharitkul	0.0006102384554310152
พระที่นั่งจักรพรรดิพิมาน	chakraput piman hall	0.0006156164577052564
อำเภอพลับพลาชัย	plubplachai province in thailand	0.0006250623608866185
เรือใบ	sailboat	0.0006384608529448105
สิงโต	lion	0.0006450019502112865
มธรรมศาสตร์	thammasat university	0.0006537144581054289
วันที่ขึ้นเครื่องหมาย	excluding dividend day	0.0006549258080044352
หรือที่เรียกกันว่า	also known as	0.0006559391366186796
กระทรวงอุตสาหกรรม	ministry of industry	0.0006626137174513579
ทรัพยากรน้ำ	water resources	0.0006688017933330121
นักพากย์	voice actor	0.000675526550733006
ครุฑ	garuda	0.000677838570690049
มณฑลหูหนาน	hunan in china	0.0006791274385438153
มีพรมแดนทางทิศใต้จรดกับอ่าวไทย	having boundaries adjacent to the gulf of thailand	0.0006801100759621993
จากการพิสูจน์อายุโดยคาร์บอน	from the forensic carbon dating	0.0006883234032128558
วิทยาเขตสารสนเทศเพชรบุรี	information technology college of petchaburi	0.0007081646760288908
อำเภอสระโบสถ์	sa bot district	0.0007235172862163121
โครงสร้างภายใน	internal structure	0.0007270402068702592
ฟอสฟอรัส	phosphorus	0.0007280938120369197
ศรีเมือง	srimuang	0.0007486630971473246
สมาคมประชาชาติแห่งเอเชียตะวันออกเฉียงใต้	association of south east asian nations (asean)	0.0007588841332701506
มหาวิทยาลัยเทคโนโลยีพระจอมเกล้าพระนครเหนือ	king mongkut's university of technology.	0.0007648887538547746
โกรกพระ	krok-phra	0.0007718971725512807
มีประวัติศาสตร์ยาวนาน	having a long history	0.0007799367713131506
ตะกร้อ	takraw	0.0007940703253258377
เมืองปทุมธานี	pathum thani	0.0007990939672882793
สมเด็จพระนางเจ้าสิริกิติ์	queen sirikit	0.0008081936264724769
ดาวศุกร์	venus	0.0008321857685722636
สเปน	spain	0.0008371904167982186
กองคลัง	division of finance	0.0008374693856220224
ออนไลน์	online	0.0008444697238912027
กรุงธนบุรี	thonburi city	0.0008456650672376326
ศาลชั้นต้น	curcuit court	0.0008505245794912594
ฟง	fong - a chinese name	0.0008767423127569662
สมเด็จพระบรมโอรสาธิราช	his highness, royal crowned prince	0.0008783425576404147
หัวใจ	heart	0.0008789636493062887
ของมหาวิทยาลัย	of university	0.0008829657389503894
อำเภอเมืองพิษณุโลก	ampore maung pisanulok	0.0008870282641939003
แยกจากคลองชักพระฝั่งซ้าย	forks from khlong chak phra	0.0008893875749749129
หม่อมหลวงปิ่น	mom luang pin	0.0008918827231870959
พรรคประชาธรรม	prachatam political party	0.0009036571089104137
ในเดือนมีนาคม	in march	0.0009181771437056197
นายชาญชัย	chanchai	0.0009248621703923691
ค้างคาว	bat	0.0009309593795226235
สุทัศนะจินดา	sututnajinda - surname of a tv host	0.0009399030294734434
โรงพยาบาลจุฬาลงกรณ์	king chulalongkorn memorial hospital	0.0009539452139447011
เสน่ห์	sanea	0.0009571675741936896
โดยปกติ	normally	0.0009608405790330871
วิชาการคอม	vcharkarn.com	0.0009611906090669576
ร้องโดย	sung by	0.0009651296507292025
เจ็ดเทพโจรสลัด	seven warlords of the sea	0.0009712021322678526
คำนาม	noun	0.00097197102060084
ชุมพลบุรี	chumphon buri	0.0009768282155473223
ภาษาโคบอล	cobol programming language	0.0009775446884176696
โลก	world	0.0009900902022921727
มหาวิทยาลัย	university	0.0009933695120117598
นที	natee - a male's name	0.000994592711227851
อุทยานแห่งชาติธารโบกขรณี	tarabokorani national preserve area	0.0010044008346453781
เพื่อเป็นการเผยแผ่พระพุทธศาสนาและประชาสัมพันธ์กิจกรรมทางพระพุทธศาสนาต่าง	passing knowledge about buddhism	0.0010126211127990889
มหาวิทยาลัยรังสิต	rangsit university	0.001023712212949653
นครพนม	nakhon phanom	0.001030962794677095
ภายใต้ความช่วยเหลือจากกองทุนการเงินระหว่างประเทศ	with the financial help, sponsored by	0.001047619993023863
นาคหิรัญกนก	nakhirunkanok	0.0010627318765404467
สถานีโทรทัศน์ไทยพีบีเอส	thai public broadcasting service	0.0010632545035201759
แบ่งประเทศไทยออกเป็น	dividing thailand into 6 areas	0.0010908156372009409
วิทยาเขตหนองคาย	nong khai campus	0.0010925554451721151
สหรัฐอเมริกา	america, usa	0.0010938364464985954
ยางามิ	yangami	0.0011040550863983965
โรงเรียนดาราวิทยาลัย	dara academy	0.0011070501046497776
นกกระเต็น	kingfisher	0.0011183783055499646
เมืองนครราชสีมา	nakhon ratchasima	0.0011277603420071123
ประเทศเปรู	peru	0.001128073751499396
และครอบครัว	and family	0.0011304412851333794
คำถามข้อที่	the question number_________	0.0011420468529749696
ยอดเขาสูงที่สุดของกัมพูชาคือ	highest mountain in cambodia	0.0011512926568356915
ระยะเวลาการดำรงตำแหน่ง	the term in the office	0.0011751056261918302
มนเรศวร	naresuan university	0.0011836454804826785
วังสระปทุม	srapathum palace	0.0011979430218049644
เหล่าสุนทร	soontorn group	0.001199450031458923
ไข้รากสาดใหญ่	typhus	0.0012071631799127165
รูปสามเหลี่ยมมุมป้าน	obtuse	0.0012105428229853925
อยู่วิทยา	yoovidhya	0.0012160653906735381
นำกลับมาสร้างใหม่อีกครั้ง	remake (of an old movie)	0.001217106317709122
ห้องสมุด	library	0.0012274344437193006
ดูเร็กซ์	durex	0.0012283941364636915
โรคปอดบวม	pneumonia	0.0012354245629211014
มหาวิทยาลัยภูมินทร์พนมเปญ	university of phnom penh	0.0012512843566936049
สมจิตร	somjit	0.0012603947797928214
คอสตาริกา	costa rica	0.0012784104423988899
ธนาคารอิสลามแห่งประเทศไทย	islamic bank of thailand	0.0012793973681147267
ธกส	bank for agriculture and agriculture	0.0012933158851621462
